," 作者:Chellappa, Rama",,,,,,,,,,,,,,,,,,,,,,,,,,,,,,,,,,,,,,,,,,,,,,,,,,,,,,,,,,,
2003,A Factorization Approach for Activity Recognition,"Chowdhury A.K.R., Chellappa R.",21607508,IEEE Computer Society Conference on Computer Vision and Pattern Recognition Workshops,4, ,0,0,0,0,0,0,0,0,0,0,0,0,0,0,0,0,0,0,0,0,0,0,0,0,0,0,0,0,0,0,0,0,0,0,0,1,3,0,1,5,1,1,0,0,2,1,3,1,0,0,0,0,0,19
1990,Relaxation Algorithms for MAP Estimation of Gray-Level Images with Multiplicative Noise,"Simchony T., Chellappa R., Eeev Lichtenstein Z.",189448,IEEE Transactions on Information Theory,36,3,0,0,0,0,0,0,0,0,0,0,0,0,0,0,0,0,0,0,0,0,0,0,2,1,2,1,2,0,0,0,0,1,0,1,1,1,0,0,0,0,1,1,2,0,1,1,0,1,0,0,0,0,0,19
2013,Low-resolution face tracker robust to illumination variations.,"Zou W.W., Yuen P.C., Chellappa R.",19410042,IEEE transactions on image processing : a publication of the IEEE Signal Processing Society,22,5,0,0,0,0,0,0,0,0,0,0,0,0,0,0,0,0,0,0,0,0,0,0,0,0,0,0,0,0,0,0,0,0,0,0,0,0,0,0,0,0,0,0,0,0,2,3,4,1,3,1,3,1,0,18
2011,Synthesis-based recognition of low resolution faces,"Shekhar S., Patel V.M., Chellappa R.",,"2011 International Joint Conference on Biometrics, IJCB 2011",, ,0,0,0,0,0,0,0,0,0,0,0,0,0,0,0,0,0,0,0,0,0,0,0,0,0,0,0,0,0,0,0,0,0,0,0,0,0,0,0,0,0,0,0,1,1,6,0,2,4,0,3,1,0,18
2003,Adaptive visual tracking and recognition using particle filters,"Zhou S., Chellappa R., Moghaddam B.",19457871,Proceedings - IEEE International Conference on Multimedia and Expo,2, ,0,0,0,0,0,0,0,0,0,0,0,0,0,0,0,0,0,0,0,0,0,0,0,0,0,0,0,0,0,0,0,0,0,0,0,2,0,2,0,1,1,0,3,1,2,0,2,3,1,0,0,0,0,18
2015,Coupled Projections for Adaptation of Dictionaries,"Shekhar S., Patel V.M., Van Nguyen H., Chellappa R.",10577149,IEEE Transactions on Image Processing,24,10,0,0,0,0,0,0,0,0,0,0,0,0,0,0,0,0,0,0,0,0,0,0,0,0,0,0,0,0,0,0,0,0,0,0,0,0,0,0,0,0,0,0,0,0,0,0,2,2,5,3,5,0,0,17
2015,Robust multimodal recognition via multitask multivariate low-rank representations,"Zhang H., Patel V.M., Chellappa R.",,"2015 11th IEEE International Conference and Workshops on Automatic Face and Gesture Recognition, FG 2015",, ,0,0,0,0,0,0,0,0,0,0,0,0,0,0,0,0,0,0,0,0,0,0,0,0,0,0,0,0,0,0,0,0,0,0,0,0,0,0,0,0,0,0,0,0,0,0,1,3,4,5,3,1,0,17
2011,Example-driven manifold priors for image deconvolution,"Ni J., Turaga P., Patel V.M., Chellappa R.",10577149,IEEE Transactions on Image Processing,20,11,0,0,0,0,0,0,0,0,0,0,0,0,0,0,0,0,0,0,0,0,0,0,0,0,0,0,0,0,0,0,0,0,0,0,0,0,0,0,0,0,0,0,0,1,5,4,0,2,1,2,2,0,0,17
2003,Statistical Error Propagation in 3D Modeling From Monocular Video,"Chowdhury A.R., Chellappa R.",21607508,IEEE Computer Society Conference on Computer Vision and Pattern Recognition Workshops,8, ,0,0,0,0,0,0,0,0,0,0,0,0,0,0,0,0,0,0,0,0,0,0,0,0,0,0,0,0,0,0,0,0,0,0,1,1,3,0,3,0,1,0,1,1,0,1,2,1,0,2,0,0,0,17
1990,Generalized graduated non-convexity algorithm for maximum a posteriori image estimation,"Rangarajan A., Chellappa R.",10514651,Proceedings - International Conference on Pattern Recognition,2, ,0,0,0,0,0,0,0,0,0,0,0,0,0,0,0,0,0,0,0,0,0,0,2,2,1,0,1,2,1,0,1,0,0,0,0,0,0,1,0,0,0,0,0,0,0,1,2,0,2,0,1,0,0,17
2017,The do's and don'ts for CNN-Based face verification,"Bansal A., Castillo C., Ranjan R., Chellappa R.",,"Proceedings - 2017 IEEE International Conference on Computer Vision Workshops, ICCVW 2017",2018-, ,0,0,0,0,0,0,0,0,0,0,0,0,0,0,0,0,0,0,0,0,0,0,0,0,0,0,0,0,0,0,0,0,0,0,0,0,0,0,0,0,0,0,0,0,0,0,0,0,0,4,9,3,0,16
2015,Compositional Dictionaries for Domain Adaptive Face Recognition,"Qiu Q., Chellappa R.",10577149,IEEE Transactions on Image Processing,24,12,0,0,0,0,0,0,0,0,0,0,0,0,0,0,0,0,0,0,0,0,0,0,0,0,0,0,0,0,0,0,0,0,0,0,0,0,0,0,0,0,0,0,0,0,0,0,0,3,5,4,3,1,0,16
2015,Non-linear dictionary learning with partially labeled data,"Shrivastava A., Patel V.M., Chellappa R.",313203,Pattern Recognition,48,11,0,0,0,0,0,0,0,0,0,0,0,0,0,0,0,0,0,0,0,0,0,0,0,0,0,0,0,0,0,0,0,0,0,0,0,0,0,0,0,0,0,0,0,0,0,0,0,2,8,3,2,1,0,16
2001,Chilaiditi's syndrome. Successful surgical correction by colopexy,"Zhou S., Krueger V., Chellappa R.",11236337,Techniques in Coloproctology,5,3,0,0,0,0,0,0,0,0,0,0,0,0,0,0,0,0,0,0,0,0,0,0,0,0,0,0,0,0,0,0,0,0,0,0,0,0,1,2,3,1,1,0,4,0,0,0,2,0,1,1,0,0,0,16
1991,A computational approach to boundary detection,"Manjunath B.S., Chellappa R.",,,, ,0,0,0,0,0,0,0,0,0,0,0,0,0,0,0,0,0,0,0,0,0,0,0,5,1,1,2,0,0,0,2,0,1,1,0,0,1,1,0,0,1,0,0,0,0,0,0,0,0,0,0,0,0,16
1988,New algorithms from reconstruction of a 3-D depth map from one or more images.,"Shao M., Simchony T., Chellappa R.",,,, ,0,0,0,0,0,0,0,0,0,0,0,0,0,0,0,0,0,0,0,0,0,1,0,1,1,2,0,0,0,0,0,0,0,0,0,3,2,0,0,0,0,0,2,1,0,0,2,0,0,0,1,0,0,16
2017,Robust local features for remote face recognition,"Chen J., Liu L., Kellokumpu V., Zhao G., Pietikainen M., Patel V.M., Chellappa R.",2628856,Image and Vision Computing,64, ,0,0,0,0,0,0,0,0,0,0,0,0,0,0,0,0,0,0,0,0,0,0,0,0,0,0,0,0,0,0,0,0,0,0,0,0,0,0,0,0,0,0,0,0,0,0,0,0,0,3,7,5,0,15
2016,Convolutional neural networks for attribute-based active authentication on mobile devices,"Samangouei P., Chellappa R.",,"2016 IEEE 8th International Conference on Biometrics Theory, Applications and Systems, BTAS 2016",, ,0,0,0,0,0,0,0,0,0,0,0,0,0,0,0,0,0,0,0,0,0,0,0,0,0,0,0,0,0,0,0,0,0,0,0,0,0,0,0,0,0,0,0,0,0,0,0,0,3,3,9,0,0,15
2016,Deep feature-based face detection on mobile devices,"Sarkar S., Patel V.M., Chellappa R.",,"ISBA 2016 - IEEE International Conference on Identity, Security and Behavior Analysis",, ,0,0,0,0,0,0,0,0,0,0,0,0,0,0,0,0,0,0,0,0,0,0,0,0,0,0,0,0,0,0,0,0,0,0,0,0,0,0,0,0,0,0,0,0,0,0,0,2,5,3,4,1,0,15
2013,Motion deblurring: Algorithms and systems,"Rajagopalan A.N., Chellappa R.",,Motion Deblurring: Algorithms and Systems,9.78111E+12, ,0,0,0,0,0,0,0,0,0,0,0,0,0,0,0,0,0,0,0,0,0,0,0,0,0,0,0,0,0,0,0,0,0,0,0,0,0,0,0,0,0,0,0,0,0,0,2,7,1,1,3,1,0,15
2012,Rotation invariant simultaneous clustering and dictionary learning,"Chen Y.-C., Sastry C.S., Patel V.M., Phillips P.J., Chellappa R.",15206149,"ICASSP, IEEE International Conference on Acoustics, Speech and Signal Processing - Proceedings",, ,0,0,0,0,0,0,0,0,0,0,0,0,0,0,0,0,0,0,0,0,0,0,0,0,0,0,0,0,0,0,0,0,0,0,0,0,0,0,0,0,0,0,0,0,4,5,3,2,1,0,0,0,0,15
2011,Illumination robust dictionary-based face recognition,"Patel V.M., Wu T., Biswas S., Phillips P.J., Chellappa R.",15224880,"Proceedings - International Conference on Image Processing, ICIP",, ,0,0,0,0,0,0,0,0,0,0,0,0,0,0,0,0,0,0,0,0,0,0,0,0,0,0,0,0,0,0,0,0,0,0,0,0,0,0,0,0,0,0,1,4,2,3,2,0,2,1,0,0,0,15
1996,Electronic image stabilization using multiple visual cues,"Yao Y.S., Burlina P., Chellappa R., Wu T.H.",,IEEE International Conference on Image Processing,1, ,0,0,0,0,0,0,0,0,0,0,0,0,0,0,0,0,0,0,0,0,0,0,0,0,0,0,0,3,1,2,0,1,0,1,1,0,2,1,0,0,1,0,1,1,0,0,0,0,0,0,0,0,0,15
1994,Site model supported monitoring of aerial images,"Lin C.L., Zheng Q., Chellappa R., Davis L.S., Zhang X.",10636919,Proceedings of the IEEE Computer Society Conference on Computer Vision and Pattern Recognition,, ,0,0,0,0,0,0,0,0,0,0,0,0,0,0,0,0,0,0,0,0,0,0,0,0,0,0,2,0,2,1,0,2,1,1,1,1,0,0,0,0,1,1,0,1,0,0,0,1,0,0,0,0,0,15
1983,Correction to “Estimation and Choice of Neighbors in Spatial-Interaction Models of Images”,"Kashyap R.L., Chellappa R.",189448,IEEE Transactions on Information Theory,29,4,0,0,0,0,0,0,0,0,0,0,0,0,0,0,0,1,0,0,0,0,0,0,2,4,1,0,0,0,0,1,1,1,1,0,1,0,0,0,0,0,0,0,0,0,0,0,0,0,2,0,0,0,0,15
2018,Disguised faces in the wild,"Kushwaha V., Singh M., Singh R., Vatsa M., Ratha N., Chellappa R.",21607508,IEEE Computer Society Conference on Computer Vision and Pattern Recognition Workshops,2018-, ,0,0,0,0,0,0,0,0,0,0,0,0,0,0,0,0,0,0,0,0,0,0,0,0,0,0,0,0,0,0,0,0,0,0,0,0,0,0,0,0,0,0,0,0,0,0,0,0,0,2,10,2,0,14
2015,Introduction: Domain adaptation for visual recognition,"Gopalan R., Li R., Patel V.M., Chellappa R.",15722740,Foundations and Trends in Computer Graphics and Vision,8,4,0,0,0,0,0,0,0,0,0,0,0,0,0,0,0,0,0,0,0,0,0,0,0,0,0,0,0,0,0,0,0,0,0,0,0,0,0,0,0,0,0,0,0,0,0,0,0,6,2,5,1,0,0,14
2014,Dictionary-based domain adaptation methods for the re-identification of faces,"Qiu Q., Ni J., Chellappa R.",21916586,Advances in Computer Vision and Pattern Recognition,56, ,0,0,0,0,0,0,0,0,0,0,0,0,0,0,0,0,0,0,0,0,0,0,0,0,0,0,0,0,0,0,0,0,0,0,0,0,0,0,0,0,0,0,0,0,0,0,0,3,5,3,2,1,0,14
2014,Submodular attribute selection for action recognition in video,"Zheng J., Jiang Z., Chellappa R., Phillips P.J.",10495258,Advances in Neural Information Processing Systems,2, January,0,0,0,0,0,0,0,0,0,0,0,0,0,0,0,0,0,0,0,0,0,0,0,0,0,0,0,0,0,0,0,0,0,0,0,0,0,0,0,0,0,0,0,0,0,0,2,2,3,4,3,0,0,14
2013,Recognizing interactive group activities using temporal interaction matrices and their riemannian statistics,"Li R., Chellappa R., Zhou S.K.",9205691,International Journal of Computer Vision,101,2,0,0,0,0,0,0,0,0,0,0,0,0,0,0,0,0,0,0,0,0,0,0,0,0,0,0,0,0,0,0,0,0,0,0,0,0,0,0,0,0,0,0,0,0,0,2,1,4,3,1,2,1,0,14
1992,A robust method for detecting image features with Application to face recognition and motion correspondence,"Manjunath B.S., Chellappa R., Shekhar C., Von Der Malsburg C.",10514651,Proceedings - International Conference on Pattern Recognition,2, ,0,0,0,0,0,0,0,0,0,0,0,0,0,0,0,0,0,0,0,0,0,0,0,1,1,1,1,1,2,1,0,0,2,2,1,0,0,0,0,0,0,1,0,0,0,0,0,0,0,0,0,0,0,14
1990,A framework for interpretation of aerial images,"Venkateswar V., Chellappa R.",,Proceedings - International Conference on Pattern Recognition,1, ,0,0,0,0,0,0,0,0,0,0,0,0,0,0,0,0,0,0,0,0,0,0,0,1,2,1,0,0,0,2,2,0,0,0,2,1,2,1,0,0,0,0,0,0,0,0,0,0,0,0,0,0,0,14
2015,Dictionary-Based Face and Person Recognition from Unconstrained Video,"Chen Y.-C., Patel V.M., Phillips P.J., Chellappa R.",21693536,IEEE Access,3, ,0,0,0,0,0,0,0,0,0,0,0,0,0,0,0,0,0,0,0,0,0,0,0,0,0,0,0,0,0,0,0,0,0,0,0,0,0,0,0,0,0,0,0,0,0,0,0,2,5,3,2,1,0,13
2013,Dictionary learning from ambiguously labeled data,"Chen Y.-C., Patel V.M., Pillai J.K., Chellappa R., Phillips P.J.",10636919,Proceedings of the IEEE Computer Society Conference on Computer Vision and Pattern Recognition,, ,0,0,0,0,0,0,0,0,0,0,0,0,0,0,0,0,0,0,0,0,0,0,0,0,0,0,0,0,0,0,0,0,0,0,0,0,0,0,0,0,0,0,0,0,0,2,4,2,1,3,0,1,0,13
1998,Biometric image processing and recognition,"Jonathon Phillips P., Michael McCabe R., Chellappa R.",22195491,European Signal Processing Conference,1998-, ,0,0,0,0,0,0,0,0,0,0,0,0,0,0,0,0,0,0,0,0,0,0,0,0,0,0,0,0,0,0,0,0,0,0,1,0,3,0,0,1,1,0,2,0,1,0,0,1,2,0,1,0,0,13
1991,Texture analysis via unsupervised and supervised learning,"Greenspan H., Goodman R., Chellappa R.",,Proceedings. IJCNN-91-Seattle: International Joint Conference on Neural Networks,, ,0,0,0,0,0,0,0,0,0,0,0,0,0,0,0,0,0,0,0,0,0,0,0,0,0,1,4,1,3,1,1,0,0,0,0,0,0,1,1,0,0,0,0,0,0,0,0,0,0,0,0,0,0,13
2018,Face Space Representations in Deep Convolutional Neural Networks,"O'Toole A.J., Castillo C.D., Parde C.J., Hill M.Q., Chellappa R.",13646613,Trends in Cognitive Sciences,22,9,0,0,0,0,0,0,0,0,0,0,0,0,0,0,0,0,0,0,0,0,0,0,0,0,0,0,0,0,0,0,0,0,0,0,0,0,0,0,0,0,0,0,0,0,0,0,0,0,0,0,10,2,0,12
2016,PATH: Person authentication using trace histories,"Mahbub U., Chellappa R.",,"2016 IEEE 7th Annual Ubiquitous Computing, Electronics and Mobile Communication Conference, UEMCON 2016",, ,0,0,0,0,0,0,0,0,0,0,0,0,0,0,0,0,0,0,0,0,0,0,0,0,0,0,0,0,0,0,0,0,0,0,0,0,0,0,0,0,0,0,0,0,0,0,0,0,1,5,6,0,0,12
2015,Unconstrained face verification using fisher vectors computed from frontalized faces,"Chen J.-C., Sankaranarayanan S., Patel V.M., Chellappa R.",,"2015 IEEE 7th International Conference on Biometrics Theory, Applications and Systems, BTAS 2015",, ,0,0,0,0,0,0,0,0,0,0,0,0,0,0,0,0,0,0,0,0,0,0,0,0,0,0,0,0,0,0,0,0,0,0,0,0,0,0,0,0,0,0,0,0,0,0,0,8,2,2,0,0,0,12
2011,Blurring-invariant Riemannian metrics for comparing signals and images,"Zhang Z., Klassen E., Srivastava A., Turaga P., Chellappa R.",,Proceedings of the IEEE International Conference on Computer Vision,, ,0,0,0,0,0,0,0,0,0,0,0,0,0,0,0,0,0,0,0,0,0,0,0,0,0,0,0,0,0,0,0,0,0,0,0,0,0,0,0,0,0,0,0,0,2,3,2,3,0,0,1,1,0,12
2008,3D Shape-encoded particle filter for object tracking and its application to human body tracking,"Moon H., Chellappa R.",16875176,Eurasip Journal on Image and Video Processing,2008, ,0,0,0,0,0,0,0,0,0,0,0,0,0,0,0,0,0,0,0,0,0,0,0,0,0,0,0,0,0,0,0,0,0,0,0,0,0,0,0,0,4,2,2,2,0,1,0,0,1,0,0,0,0,12
1990,A Model-Based Approach for Filtering and Edge Detection in Noisy Images,"Rangarajan A., Chellappa R., Zhou Y.T.",984094,IEEE Transactions on Circuits and Systems,37,1,0,0,0,0,0,0,0,0,0,0,0,0,0,0,0,0,0,0,0,0,0,0,0,0,0,0,0,1,0,1,0,3,1,0,2,0,0,1,0,0,1,0,0,1,1,0,0,0,0,0,0,0,0,12
1989,Pyramid Implementation of Optimal-Step Conjugate-Search Algorithms for Some Low-Level Vision Problems,"Simchony T., Chellappa R., Lichtenstein Z.",189472,"IEEE Transactions on Systems, Man and Cybernetics",19,6,0,0,0,0,0,0,0,0,0,0,0,0,0,0,0,0,0,0,0,0,0,0,2,1,2,2,0,1,0,0,1,0,0,1,0,0,0,1,0,0,0,0,0,0,0,0,0,0,1,0,0,0,0,12
1983,CLASSIFICATION OF BOUNDARIES ON THE PLANE USING STOCHASTIC MODELS.,"Singer P.F., Chellappa R.",,,, ,0,0,0,0,0,0,0,0,0,0,0,0,0,0,0,1,1,0,2,1,0,1,0,1,1,3,0,0,1,0,0,0,0,0,0,0,0,0,0,0,0,0,0,0,0,0,0,0,0,0,0,0,0,12
2018,The 2018 NVIDIA AI city challenge,"Naphade M., Chang M.-C., Sharma A., Anastasiu D.C., Jagarlamudi V., Chakraborty P., Huang T., Wang S., Liu M.-Y., Chellappa R., Hwang J.-N., Lyu S.",21607508,IEEE Computer Society Conference on Computer Vision and Pattern Recognition Workshops,2018-, ,0,0,0,0,0,0,0,0,0,0,0,0,0,0,0,0,0,0,0,0,0,0,0,0,0,0,0,0,0,0,0,0,0,0,0,0,0,0,0,0,0,0,0,0,0,0,0,0,0,0,10,1,0,11
2016,Segmentation of Nuclei from 3D Microscopy Images of Tissue via Graphcut Optimization,"Nandy K., Chellappa R., Kumar A., Lockett S.J.",19324553,IEEE Journal on Selected Topics in Signal Processing,10,1,0,0,0,0,0,0,0,0,0,0,0,0,0,0,0,0,0,0,0,0,0,0,0,0,0,0,0,0,0,0,0,0,0,0,0,0,0,0,0,0,0,0,0,0,0,0,0,1,2,4,4,0,0,11
2014,Dictionaries for image and video-based face recognition [Invited],"Patel V.M., Chen Y.-C., Chellappa R., Phillips P.J.",10847529,"Journal of the Optical Society of America A: Optics and Image Science, and Vision",31,5,0,0,0,0,0,0,0,0,0,0,0,0,0,0,0,0,0,0,0,0,0,0,0,0,0,0,0,0,0,0,0,0,0,0,0,0,0,0,0,0,0,0,0,0,0,3,2,2,2,2,0,0,0,11
2013,Assessment of facial wrinkles as a soft biometrics,"Batool N., Taheri S., Chellappa R.",,"2013 10th IEEE International Conference and Workshops on Automatic Face and Gesture Recognition, FG 2013",, ,0,0,0,0,0,0,0,0,0,0,0,0,0,0,0,0,0,0,0,0,0,0,0,0,0,0,0,0,0,0,0,0,0,0,0,0,0,0,0,0,0,0,0,0,0,1,4,3,0,1,2,0,0,11
2012,Joint sparsity-based robust multimodal biometrics recognition,"Shekhar S., Patel V.M., Nasrabadi N.M., Chellappa R.",3029743,Lecture Notes in Computer Science (including subseries Lecture Notes in Artificial Intelligence and Lecture Notes in Bioinformatics),7585,3,0,0,0,0,0,0,0,0,0,0,0,0,0,0,0,0,0,0,0,0,0,0,0,0,0,0,0,0,0,0,0,0,0,0,0,0,0,0,0,0,0,0,0,0,2,2,3,4,0,0,0,0,0,11
1998,Optical flow using overlapped basis functions for solving global motion problems,"Srinivasan S., Chellappa R.",3029743,Lecture Notes in Computer Science (including subseries Lecture Notes in Artificial Intelligence and Lecture Notes in Bioinformatics),1407, ,0,0,0,0,0,0,0,0,0,0,0,0,0,0,0,0,0,0,0,0,0,0,0,0,0,0,0,0,0,0,1,1,2,2,0,0,0,0,1,1,0,1,0,0,2,0,0,0,0,0,0,0,0,11
1989,Neural network algorithms for motion stereo,"Zhou Y.T., Chellappa R.",,IJCNN Int Jt Conf Neural Network,, ,0,0,0,0,0,0,0,0,0,0,0,0,0,0,0,0,0,0,0,0,0,1,0,4,0,0,0,1,1,0,0,0,1,0,0,0,0,1,2,0,0,0,0,0,0,0,0,0,0,0,0,0,0,11
2018,Unconstrained Still/Video-Based Face Verification with Deep Convolutional Neural Networks,"Chen J.-C., Ranjan R., Sankaranarayanan S., Kumar A., Chen C.-H., Patel V.M., Castillo C.D., Chellappa R.",9205691,International Journal of Computer Vision,126, 2-4,0,0,0,0,0,0,0,0,0,0,0,0,0,0,0,0,0,0,0,0,0,0,0,0,0,0,0,0,0,0,0,0,0,0,0,0,0,0,0,0,0,0,0,0,0,0,0,0,0,2,6,2,0,10
2018,Regularizing deep networks using efficient layerwise adversarial training,"Sankaranarayanan S., Chellappa R., Jain A., Lim S.N.",,"32nd AAAI Conference on Artificial Intelligence, AAAI 2018",, ,0,0,0,0,0,0,0,0,0,0,0,0,0,0,0,0,0,0,0,0,0,0,0,0,0,0,0,0,0,0,0,0,0,0,0,0,0,0,0,0,0,0,0,0,0,0,0,0,0,2,7,1,0,10
2018,Doing the best we can with what we have: Multi-label balancing with selective learning for attribute prediction,"Hand E.M., Castillo C., Chellappa R.",,"32nd AAAI Conference on Artificial Intelligence, AAAI 2018",, ,0,0,0,0,0,0,0,0,0,0,0,0,0,0,0,0,0,0,0,0,0,0,0,0,0,0,0,0,0,0,0,0,0,0,0,0,0,0,0,0,0,0,0,0,0,0,0,0,0,1,8,1,0,10
2015,Matrix completion for resolving label ambiguity,"Chen C.-H., Patel V.M., Chellappa R.",10636919,Proceedings of the IEEE Computer Society Conference on Computer Vision and Pattern Recognition,07-12-, ,0,0,0,0,0,0,0,0,0,0,0,0,0,0,0,0,0,0,0,0,0,0,0,0,0,0,0,0,0,0,0,0,0,0,0,0,0,0,0,0,0,0,0,0,0,0,0,4,2,3,0,1,0,10
2013,Non-uniform deblurring in hdr image reconstruction,"Vijay C.S., Paramanand C., Rajagopalan A.N., Chellappa R.",10577149,IEEE Transactions on Image Processing,22,10,0,0,0,0,0,0,0,0,0,0,0,0,0,0,0,0,0,0,0,0,0,0,0,0,0,0,0,0,0,0,0,0,0,0,0,0,0,0,0,0,0,0,0,0,1,1,2,2,1,1,2,0,0,10
1989,Graduated nonconvexity algorithm for image estimation using compound Gauss Markov field models,"Simchony T., Chellappa R., Lichtenstein Z.",7367791,"ICASSP, IEEE International Conference on Acoustics, Speech and Signal Processing - Proceedings",3, ,0,0,0,0,0,0,0,0,0,0,0,0,0,0,0,0,0,0,0,0,1,0,0,1,1,1,0,0,1,1,1,0,1,0,0,0,1,1,0,0,0,0,0,0,0,0,0,0,0,0,0,0,0,10
2018,Stacked U-nets for ground material segmentation in remote sensing imagery,"Ghosh A., Ehrlich M., Shah S., Davis L., Chellappa R.",21607508,IEEE Computer Society Conference on Computer Vision and Pattern Recognition Workshops,2018-, ,0,0,0,0,0,0,0,0,0,0,0,0,0,0,0,0,0,0,0,0,0,0,0,0,0,0,0,0,0,0,0,0,0,0,0,0,0,0,0,0,0,0,0,0,0,0,0,0,0,0,6,3,0,9
2018,A deep cascade network for unaligned face attribute classification,"Ding H., Zhou H., Zhou S.K., Chellappa R.",,"32nd AAAI Conference on Artificial Intelligence, AAAI 2018",, ,0,0,0,0,0,0,0,0,0,0,0,0,0,0,0,0,0,0,0,0,0,0,0,0,0,0,0,0,0,0,0,0,0,0,0,0,0,0,0,0,0,0,0,0,0,0,0,0,0,0,7,2,0,9
2014,Dictionary-based multiple instance learning,"Shrivastava A., Pillai J.K., Patel V.M., Chellappa R.",,"2014 IEEE International Conference on Image Processing, ICIP 2014",, ,0,0,0,0,0,0,0,0,0,0,0,0,0,0,0,0,0,0,0,0,0,0,0,0,0,0,0,0,0,0,0,0,0,0,0,0,0,0,0,0,0,0,0,0,0,0,0,1,4,3,1,0,0,9
2014,Sparse localized facial motion dictionary learning for facial expression recognition,"Lee C.-S., Chellappa R.",15206149,"ICASSP, IEEE International Conference on Acoustics, Speech and Signal Processing - Proceedings",, ,0,0,0,0,0,0,0,0,0,0,0,0,0,0,0,0,0,0,0,0,0,0,0,0,0,0,0,0,0,0,0,0,0,0,0,0,0,0,0,0,0,0,0,0,0,0,2,2,4,1,0,0,0,9
2012,Age invariant face verification with relative craniofacial growth model,"Wu T., Chellappa R.",3029743,Lecture Notes in Computer Science (including subseries Lecture Notes in Artificial Intelligence and Lecture Notes in Bioinformatics),7577,6,0,0,0,0,0,0,0,0,0,0,0,0,0,0,0,0,0,0,0,0,0,0,0,0,0,0,0,0,0,0,0,0,0,0,0,0,0,0,0,0,0,0,0,0,0,0,2,2,2,1,1,1,0,9
2012,Variable focus video: Reconstructing depth and video for dynamic scenes,"Shroff N., Veeraraghavan A., Taguchi Y., Tuzel O., Agrawal A., Chellappa R.",,"2012 IEEE International Conference on Computational Photography, ICCP 2012",, ,0,0,0,0,0,0,0,0,0,0,0,0,0,0,0,0,0,0,0,0,0,0,0,0,0,0,0,0,0,0,0,0,0,0,0,0,0,0,0,0,0,0,0,0,1,2,3,2,1,0,0,0,0,9
2012,Computational modeling of skin reflectance spectra for biological parameter estimation through machine learning,"Vyas S., Van Nguyen H., Burlina P., Banerjee A., Garza L., Chellappa R.",0277786X,Proceedings of SPIE - The International Society for Optical Engineering,8390, ,0,0,0,0,0,0,0,0,0,0,0,0,0,0,0,0,0,0,0,0,0,0,0,0,0,0,0,0,0,0,0,0,0,0,0,0,0,0,0,0,0,0,0,0,4,1,2,1,0,0,1,0,0,9
2010,Sparse representations and random projections for robust and cancelable biometrics,"Patel V.M., Chellappa R., Tistarelli M.",,"11th International Conference on Control, Automation, Robotics and Vision, ICARCV 2010",, ,0,0,0,0,0,0,0,0,0,0,0,0,0,0,0,0,0,0,0,0,0,0,0,0,0,0,0,0,0,0,0,0,0,0,0,0,0,0,0,0,0,0,0,2,0,3,1,1,0,0,1,1,0,9
2007,Signal processing for biometric systems,"Jain A.K., Chellappa R., Draper S.C., Memon N., Phillips P.J., Vetro A.",10535888,IEEE Signal Processing Magazine,24,6,0,0,0,0,0,0,0,0,0,0,0,0,0,0,0,0,0,0,0,0,0,0,0,0,0,0,0,0,0,0,0,0,0,0,0,0,0,0,0,1,2,2,0,0,1,0,1,0,1,0,1,0,0,9
2000,3D model enhanced face recognition,"Zhao W.Y., Chellappa R.",,IEEE International Conference on Image Processing,3, ,0,0,0,0,0,0,0,0,0,0,0,0,0,0,0,0,0,0,0,0,0,0,0,0,0,0,0,0,0,0,0,0,0,1,0,3,0,1,0,0,0,0,0,1,0,1,0,0,0,2,0,0,0,9
1992,A Bayes classifier for change detection in synthetic aperture radar imagery,"Rignot E., Chellappa R.",15206149,"ICASSP, IEEE International Conference on Acoustics, Speech and Signal Processing - Proceedings",3, ,0,0,0,0,0,0,0,0,0,0,0,0,0,0,0,0,0,0,0,0,0,0,0,0,1,0,0,0,0,1,1,0,0,0,0,2,1,1,1,1,0,0,0,0,0,0,0,0,0,0,0,0,0,9
2017,Hierarchical multimodal metric learning for multimodal classification,"Zhang H., Patel V.M., Chellappa R.",,"Proceedings - 30th IEEE Conference on Computer Vision and Pattern Recognition, CVPR 2017",2017-, ,0,0,0,0,0,0,0,0,0,0,0,0,0,0,0,0,0,0,0,0,0,0,0,0,0,0,0,0,0,0,0,0,0,0,0,0,0,0,0,0,0,0,0,0,0,0,0,0,0,5,3,0,0,8
2016,Learning a structured dictionary for video-based face recognition,"Xu H., Zheng J., Alavi A., Chellappa R.",,"2016 IEEE Winter Conference on Applications of Computer Vision, WACV 2016",, ,0,0,0,0,0,0,0,0,0,0,0,0,0,0,0,0,0,0,0,0,0,0,0,0,0,0,0,0,0,0,0,0,0,0,0,0,0,0,0,0,0,0,0,0,0,0,0,2,3,0,2,1,0,8
2016,An End-to-End System for Unconstrained Face Verification with Deep Convolutional Neural Networks,"Chen J.-C., Ranjan R., Kumar A., Chen C.-H., Patel V.M., Chellappa R.",15505499,Proceedings of the IEEE International Conference on Computer Vision,2016-, ,0,0,0,0,0,0,0,0,0,0,0,0,0,0,0,0,0,0,0,0,0,0,0,0,0,0,0,0,0,0,0,0,0,0,0,0,0,0,0,0,0,0,0,0,0,0,0,0,1,3,3,1,0,8
2014,"Toward a non-intrusive, physio-behavioral biometric for smartphones","Vasiete E., Patel V., Chen Y., Davis L., Char I., Chellappa R., Yeh T.",,MobileHCI 2014 - Proceedings of the 16th ACM International Conference on Human-Computer Interaction with Mobile Devices and Services,, ,0,0,0,0,0,0,0,0,0,0,0,0,0,0,0,0,0,0,0,0,0,0,0,0,0,0,0,0,0,0,0,0,0,0,0,0,0,0,0,0,0,0,0,0,0,0,2,2,1,2,1,0,0,8
2013,Design of non-linear discriminative dictionaries for image classification,"Shrivastava A., Nguyen H.V., Patel V.M., Chellappa R.",3029743,Lecture Notes in Computer Science (including subseries Lecture Notes in Artificial Intelligence and Lecture Notes in Bioinformatics),7724,1,0,0,0,0,0,0,0,0,0,0,0,0,0,0,0,0,0,0,0,0,0,0,0,0,0,0,0,0,0,0,0,0,0,0,0,0,0,0,0,0,0,0,0,0,0,2,1,1,3,0,1,0,0,8
2011,Manifold Précis: An annealing technique for diverse sampling of manifolds,"Shroff N., Turaga P., Chellappa R.",,"Advances in Neural Information Processing Systems 24: 25th Annual Conference on Neural Information Processing Systems 2011, NIPS 2011",, ,0,0,0,0,0,0,0,0,0,0,0,0,0,0,0,0,0,0,0,0,0,0,0,0,0,0,0,0,0,0,0,0,0,0,0,0,0,0,0,0,0,0,0,0,1,2,3,0,2,0,0,0,0,8
2010,Advances in Video-Based Human Activity Analysis: Challenges and Approaches,"Turaga P., Chellappa R., Veeraraghavan A.",652458,Advances in Computers,80, C,0,0,0,0,0,0,0,0,0,0,0,0,0,0,0,0,0,0,0,0,0,0,0,0,0,0,0,0,0,0,0,0,0,0,0,0,0,0,0,0,0,0,0,0,1,0,1,3,1,1,0,1,0,8
2001,Tracking of human activities using shape-encoded particle propagation,"Moon H., Chellappa R., Rosenfeld A.",,IEEE International Conference on Image Processing,1, ,0,0,0,0,0,0,0,0,0,0,0,0,0,0,0,0,0,0,0,0,0,0,0,0,0,0,0,0,0,0,0,0,0,0,0,0,3,0,0,0,0,1,0,2,1,0,0,0,1,0,0,0,0,8
1998,Motion-model-based boundary extraction and a real-time implementation,"Liu H., Hong T.-H., Herman M., Chellappa R.",10773142,Computer Vision and Image Understanding,70,1,0,0,0,0,0,0,0,0,0,0,0,0,0,0,0,0,0,0,0,0,0,0,0,0,0,0,0,0,0,1,2,1,0,0,0,0,3,1,0,0,0,0,0,0,0,0,0,0,0,0,0,0,0,8
1997,Performance analysis and learning approaches for vehicle detection and counting in aerial images,"Parameswaran V., Burlina P., Chellappa R.",7367791,"ICASSP, IEEE International Conference on Acoustics, Speech and Signal Processing - Proceedings",4, ,0,0,0,0,0,0,0,0,0,0,0,0,0,0,0,0,0,0,0,0,0,0,0,0,0,0,0,0,0,0,0,1,0,0,1,1,1,1,0,0,0,0,1,0,0,0,1,1,0,0,0,0,0,8
1995,SAR/IR sensor image fusion and real-time implementation,"Li H., Zhou Y.T., Chellappa R.",10586393,"Conference Record - Asilomar Conference on Signals, Systems and Computers",2, ,0,0,0,0,0,0,0,0,0,0,0,0,0,0,0,0,0,0,0,0,0,0,0,0,0,0,0,0,0,0,1,0,1,0,0,0,1,1,1,0,0,0,0,0,0,0,0,0,1,2,0,0,0,8
1991,Passive navigation in a partially known environment,"Chandrashekhar S., Chellappa R.",,Proceedings of the IEEE Workshop on Visual Motion,, ,0,0,0,0,0,0,0,0,0,0,0,0,0,0,0,0,0,0,0,0,0,0,0,4,0,0,0,2,0,0,0,1,0,1,0,0,0,0,0,0,0,0,0,0,0,0,0,0,0,0,0,0,0,8
2018,Learning from Ambiguously Labeled Face Images,"Chen C.-H., Patel V.M., Chellappa R.",1628828,IEEE Transactions on Pattern Analysis and Machine Intelligence,40,7,0,0,0,0,0,0,0,0,0,0,0,0,0,0,0,0,0,0,0,0,0,0,0,0,0,0,0,0,0,0,0,0,0,0,0,0,0,0,0,0,0,0,0,0,0,0,0,0,0,0,5,2,0,7
2017,An analysis of the robustness of deep face recognition networks to noisy training labels,"Reale C., Nasrabadi N.M., Chellappa R.",,"2016 IEEE Global Conference on Signal and Information Processing, GlobalSIP 2016 - Proceedings",, ,0,0,0,0,0,0,0,0,0,0,0,0,0,0,0,0,0,0,0,0,0,0,0,0,0,0,0,0,0,0,0,0,0,0,0,0,0,0,0,0,0,0,0,0,0,0,0,0,0,3,4,0,0,7
2016,Face Association for Videos Using Conditional Random Fields and Max-Margin Markov Networks,"Du M., Chellappa R.",1628828,IEEE Transactions on Pattern Analysis and Machine Intelligence,38,9,0,0,0,0,0,0,0,0,0,0,0,0,0,0,0,0,0,0,0,0,0,0,0,0,0,0,0,0,0,0,0,0,0,0,0,0,0,0,0,0,0,0,0,0,0,0,0,0,3,2,1,1,0,7
2014,Coupled dictionaries for thermal to visible face recognition,"Reale C., Nasrabadi N.M., Chellappa R.",,"2014 IEEE International Conference on Image Processing, ICIP 2014",, ,0,0,0,0,0,0,0,0,0,0,0,0,0,0,0,0,0,0,0,0,0,0,0,0,0,0,0,0,0,0,0,0,0,0,0,0,0,0,0,0,0,0,0,0,0,0,1,1,1,0,3,1,0,7
