," 作者:Chen, Guanrong",,,,,,,,,,,,,,,,,,,,,,,,,,,,,,,,,,,,,,,,,,,,,,,,,,,,,,,,,,,
2018,A physical SBT-memristor-based Chua's circuit and its complex dynamics,"Zhang Y., Guo M., Dou G., Li Y., Chen G.",10541500,Chaos,28,8,0,0,0,0,0,0,0,0,0,0,0,0,0,0,0,0,0,0,0,0,0,0,0,0,0,0,0,0,0,0,0,0,0,0,0,0,0,0,0,0,0,0,0,0,0,0,0,0,0,0,2,2,0,4
2018,Avoiding congestion in cluster consensus of the second-order nonlinear multiagent systems,"Wang Y., Ma Z., Chen G.",2162237X,IEEE Transactions on Neural Networks and Learning Systems,29,8,0,0,0,0,0,0,0,0,0,0,0,0,0,0,0,0,0,0,0,0,0,0,0,0,0,0,0,0,0,0,0,0,0,0,0,0,0,0,0,0,0,0,0,0,0,0,0,0,0,1,3,0,0,4
2018,Evolving benchmark functions using kruskal-wallis test,"Lou Y., Yin Yuen S., Chen G.",,GECCO 2018 Companion - Proceedings of the 2018 Genetic and Evolutionary Computation Conference Companion,, ,0,0,0,0,0,0,0,0,0,0,0,0,0,0,0,0,0,0,0,0,0,0,0,0,0,0,0,0,0,0,0,0,0,0,0,0,0,0,0,0,0,0,0,0,0,0,0,0,0,0,3,1,0,4
2018,Designing Protograph-Based LDPC Codes for Iterative Receivers on M-ary DCSK Systems,"Chen Q., Wang L., Lyu Y., Chen G.",15497747,IEEE Transactions on Circuits and Systems II: Express Briefs,65,4,0,0,0,0,0,0,0,0,0,0,0,0,0,0,0,0,0,0,0,0,0,0,0,0,0,0,0,0,0,0,0,0,0,0,0,0,0,0,0,0,0,0,0,0,0,0,0,0,0,1,3,0,0,4
2018,Cluster Lag Consensus for Second-Order Multiagent Systems with Nonlinear Dynamics and Switching Topologies,"Wang Y., Li Y., Ma Z., Cai G., Chen G.",21682216,"IEEE Transactions on Systems, Man, and Cybernetics: Systems",, ,0,0,0,0,0,0,0,0,0,0,0,0,0,0,0,0,0,0,0,0,0,0,0,0,0,0,0,0,0,0,0,0,0,0,0,0,0,0,0,0,0,0,0,0,0,0,0,0,0,0,4,0,0,4
2018,Approximating hidden chaotic attractors via parameter switching,"Danca M.-F., Kuznetsov N.V., Chen G.",10541500,Chaos,28,1,0,0,0,0,0,0,0,0,0,0,0,0,0,0,0,0,0,0,0,0,0,0,0,0,0,0,0,0,0,0,0,0,0,0,0,0,0,0,0,0,0,0,0,0,0,0,0,0,0,0,2,2,0,4
2017,A novel Trellis-Coded Differential Chaotic Modulation system,"He Y., Wang L., Zhou C., Chen G.",19345070,Wireless Telecommunications Symposium,, ,0,0,0,0,0,0,0,0,0,0,0,0,0,0,0,0,0,0,0,0,0,0,0,0,0,0,0,0,0,0,0,0,0,0,0,0,0,0,0,0,0,0,0,0,0,0,0,0,0,3,1,0,0,4
2016,Spectral analysis of Chinese language: Co-occurrence networks from four literary genres,"Liang W., Chen G.",3784371,Physica A: Statistical Mechanics and its Applications,450, ,0,0,0,0,0,0,0,0,0,0,0,0,0,0,0,0,0,0,0,0,0,0,0,0,0,0,0,0,0,0,0,0,0,0,0,0,0,0,0,0,0,0,0,0,0,0,0,0,1,2,1,0,0,4
2015,Characterizing general scale-free networks by vertex-degree sequences,"Xiao W., Lai Z., Chen G.",10541500,Chaos,25,11,0,0,0,0,0,0,0,0,0,0,0,0,0,0,0,0,0,0,0,0,0,0,0,0,0,0,0,0,0,0,0,0,0,0,0,0,0,0,0,0,0,0,0,0,0,0,0,0,3,1,0,0,0,4
2014,Central limit theorem and chaoticity,"Wu X., Chen G.",1677152,Statistics and Probability Letters,92, ,0,0,0,0,0,0,0,0,0,0,0,0,0,0,0,0,0,0,0,0,0,0,0,0,0,0,0,0,0,0,0,0,0,0,0,0,0,0,0,0,0,0,0,0,0,0,0,1,1,1,0,1,0,4
2013,On the invariance of maximal distributional chaos under an annihilation operator,"Wu X., Chen G.",8939659,Applied Mathematics Letters,26,12,0,0,0,0,0,0,0,0,0,0,0,0,0,0,0,0,0,0,0,0,0,0,0,0,0,0,0,0,0,0,0,0,0,0,0,0,0,0,0,0,0,0,0,0,0,2,2,0,0,0,0,0,0,4
2013,Preface,"Adamatzky A., Chen G.",,"Chaos, CNN, Memristors and Beyond: A Festschrift for Leon Chua",, ,0,0,0,0,0,0,0,0,0,0,0,0,0,0,0,0,0,0,0,0,0,0,0,0,0,0,0,0,0,0,0,0,0,0,0,0,0,0,0,0,0,0,0,0,0,1,0,0,2,0,0,1,0,4
2012,"Author's reply to: Comment on ""Existence of heteroclinic orbits of the Shil'nikov type in a 3D quadratic autonomous chaotic system"" [J. Math. Anal. Appl. 315 (2006) 106-119]","Zheng Z.-H., Chen G.",0022247X,Journal of Mathematical Analysis and Applications,392,1,0,0,0,0,0,0,0,0,0,0,0,0,0,0,0,0,0,0,0,0,0,0,0,0,0,0,0,0,0,0,0,0,0,0,0,0,0,0,0,0,0,0,0,0,2,2,0,0,0,0,0,0,0,4
2012,Exact traveling wave solutions and their bifurcations for the generalized pochhammerchree equationsxs,"Li J., Chen G.",2181274,International Journal of Bifurcation and Chaos,22,9,0,0,0,0,0,0,0,0,0,0,0,0,0,0,0,0,0,0,0,0,0,0,0,0,0,0,0,0,0,0,0,0,0,0,0,0,0,0,0,0,0,0,0,0,1,1,1,0,0,0,0,1,0,4
2012,RED-f routing protocol for complex networks,"Thong W.W.-K., Chen G., Trajkovic L.",,ISCAS 2012 - 2012 IEEE International Symposium on Circuits and Systems,, ,0,0,0,0,0,0,0,0,0,0,0,0,0,0,0,0,0,0,0,0,0,0,0,0,0,0,0,0,0,0,0,0,0,0,0,0,0,0,0,0,0,0,0,0,1,1,1,1,0,0,0,0,0,4
2010,Monitoring the topology of growing dynamical networks,"Wu Z., Fu X., Chen G.",1291831,International Journal of Modern Physics C,21,8,0,0,0,0,0,0,0,0,0,0,0,0,0,0,0,0,0,0,0,0,0,0,0,0,0,0,0,0,0,0,0,0,0,0,0,0,0,0,0,0,0,0,0,0,1,1,0,0,2,0,0,0,0,4
2010,Chaos synthesis by evolutionary algorithms,"Zelinka I., Chen G., Celikovsky S.",1860949X,Studies in Computational Intelligence,267, ,0,0,0,0,0,0,0,0,0,0,0,0,0,0,0,0,0,0,0,0,0,0,0,0,0,0,0,0,0,0,0,0,0,0,0,0,0,0,0,0,0,0,0,1,1,1,0,1,0,0,0,0,0,4
2010,New construction of mixed-mode chaotic circuits,"Klomkarn K., Sooraksa P., Chen G.",2181274,International Journal of Bifurcation and Chaos,20,5,0,0,0,0,0,0,0,0,0,0,0,0,0,0,0,0,0,0,0,0,0,0,0,0,0,0,0,0,0,0,0,0,0,0,0,0,0,0,0,0,0,0,1,1,0,0,1,0,0,1,0,0,0,4
2009,Flocking with multiple virtual leaders based on position measurements,"Su H., Wang X., Dong H., Chen G.",,"Proceedings of 2009 7th Asian Control Conference, ASCC 2009",, ,0,0,0,0,0,0,0,0,0,0,0,0,0,0,0,0,0,0,0,0,0,0,0,0,0,0,0,0,0,0,0,0,0,0,0,0,0,0,0,0,0,1,0,0,2,0,0,0,1,0,0,0,0,4
2009,Degree-distribution stability of growing networks,"Hou Z., Kong X., Shi D., Chen G., Zhao Q.",18678211,"Lecture Notes of the Institute for Computer Sciences, Social-Informatics and Telecommunications Engineering",5,2,0,0,0,0,0,0,0,0,0,0,0,0,0,0,0,0,0,0,0,0,0,0,0,0,0,0,0,0,0,0,0,0,0,0,0,0,0,0,0,0,0,0,0,2,1,0,1,0,0,0,0,0,0,4
2009,Chaos-EP-based digital redesign of uncertain hybrid time-delay systems with state and input constraints,"Chang Y.-P., Malki H.A., Tsai S.-H., Shieh L.-S., Chen G.",189456,IEEE Transactions on Instrumentation and Measurement,58,12,0,0,0,0,0,0,0,0,0,0,0,0,0,0,0,0,0,0,0,0,0,0,0,0,0,0,0,0,0,0,0,0,0,0,0,0,0,0,0,0,0,0,1,2,0,0,1,0,0,0,0,0,0,4
2009,Some nonrobust bernoulli-shift rules,"Chen L., Chen F., Jin W., Chen F., Chen G.",2181274,International Journal of Bifurcation and Chaos,19,10,0,0,0,0,0,0,0,0,0,0,0,0,0,0,0,0,0,0,0,0,0,0,0,0,0,0,0,0,0,0,0,0,0,0,0,0,0,0,0,0,0,1,0,1,0,1,1,0,0,0,0,0,0,4
2008,A brief overview of some recent advances in complex dynamical networks control and synchronization,"Lu J., Chen G.",2714310,Proceedings - IEEE International Symposium on Circuits and Systems,, ,0,0,0,0,0,0,0,0,0,0,0,0,0,0,0,0,0,0,0,0,0,0,0,0,0,0,0,0,0,0,0,0,0,0,0,0,0,0,0,0,0,1,0,1,1,0,1,0,0,0,0,0,0,4
2007,Anti-phase synchronization of inhibitorily coupled neurons,"Shi X., Lu Q., Chen G.",2181274,International Journal of Bifurcation and Chaos,17,12,0,0,0,0,0,0,0,0,0,0,0,0,0,0,0,0,0,0,0,0,0,0,0,0,0,0,0,0,0,0,0,0,0,0,0,0,0,0,0,0,1,1,1,0,0,1,0,0,0,0,0,0,0,4
2007,Harmonic distortion analysis based on HOPF bifurcation theorem and fast fourier transform,"Robbio F.I., Paolini E.E., Moiola J.L., Chen G.",2181274,International Journal of Bifurcation and Chaos,17,5,0,0,0,0,0,0,0,0,0,0,0,0,0,0,0,0,0,0,0,0,0,0,0,0,0,0,0,0,0,0,0,0,0,0,0,0,0,0,0,0,0,1,0,1,2,0,0,0,0,0,0,0,0,4
2006,Anticontrol of chaos for Takagi-Sugeno fuzzy systems,"Li Z., Halang W.A., Chen G.",14349922,Studies in Fuzziness and Soft Computing,187, ,0,0,0,0,0,0,0,0,0,0,0,0,0,0,0,0,0,0,0,0,0,0,0,0,0,0,0,0,0,0,0,0,0,0,0,0,0,0,1,1,0,0,0,1,0,0,0,0,0,1,0,0,0,4
2006,On estimates of Lyapunov exponents of synchronized coupled systems,"Zhou T., Chen G., Lu Q., Xiong X.",10541500,Chaos,16,3,0,0,0,0,0,0,0,0,0,0,0,0,0,0,0,0,0,0,0,0,0,0,0,0,0,0,0,0,0,0,0,0,0,0,0,0,0,0,0,1,1,2,0,0,0,0,0,0,0,0,0,0,0,4
2005,An algorithm for computing heteroclinic orbits and its application to chaos synthesis in the generalized Lorenz system,"Zhou T., Chen G., Celikovsky S.",14746670,IFAC Proceedings Volumes (IFAC-PapersOnline),16, ,0,0,0,0,0,0,0,0,0,0,0,0,0,0,0,0,0,0,0,0,0,0,0,0,0,0,0,0,0,0,0,0,0,0,0,0,0,0,0,1,0,1,0,0,1,1,0,0,0,0,0,0,0,4
2005,Integral observer approach for chaos synchronizationn with transmission disturbances,"Jiang G.-P., Zheng W.X., Tang W.K.-S., Chen G.",2714310,Proceedings - IEEE International Symposium on Circuits and Systems,, ,0,0,0,0,0,0,0,0,0,0,0,0,0,0,0,0,0,0,0,0,0,0,0,0,0,0,0,0,0,0,0,0,0,0,0,0,0,0,0,1,0,2,0,1,0,0,0,0,0,0,0,0,0,4
2005,Adaptability between FM-DCSK and channel coding over fading channels,"Xia Y., Wang L., Chen G.",,"MAPE2005: IEEE 2005 International Symposium on Microwave, Antenna, Propagation and EMC Technologies for Wireless Communications, Proceedings",2, ,0,0,0,0,0,0,0,0,0,0,0,0,0,0,0,0,0,0,0,0,0,0,0,0,0,0,0,0,0,0,0,0,0,0,0,0,0,0,0,2,0,0,0,0,0,0,0,1,0,1,0,0,0,4
2005,On pinning control of scale-free networks,"Fan Z., Chen G.",,"2005 International Conference on Physics and Control, PhysCon 2005, Proceedings",2005, ,0,0,0,0,0,0,0,0,0,0,0,0,0,0,0,0,0,0,0,0,0,0,0,0,0,0,0,0,0,0,0,0,0,0,0,0,0,0,1,1,0,0,2,0,0,0,0,0,0,0,0,0,0,4
2005,"Bifurcation, exact solutions and nonsmooth behavior of solitary waves in the generalized nonlinear Schrödinger equation","Wang W., Sun J., Chen G.",2181274,International Journal of Bifurcation and Chaos in Applied Sciences and Engineering,15,10,0,0,0,0,0,0,0,0,0,0,0,0,0,0,0,0,0,0,0,0,0,0,0,0,0,0,0,0,0,0,0,0,0,0,0,0,0,0,1,0,2,1,0,0,0,0,0,0,0,0,0,0,0,4
2004,Stability for delayed generalized 2D discrete logistic systems,"Tian C.J., Chen G.",16871839,Advances in Difference Equations,2004,4,0,0,0,0,0,0,0,0,0,0,0,0,0,0,0,0,0,0,0,0,0,0,0,0,0,0,0,0,0,0,0,0,0,0,0,0,0,0,0,1,1,0,0,0,0,0,0,0,1,1,0,0,0,4
2004,Density evolution method and threshold decision for irregular LDPC codes,"Lin W., Juan X., Chen G.",,"2004 International Conference on Communications, Circuits and Systems",1, ,0,0,0,0,0,0,0,0,0,0,0,0,0,0,0,0,0,0,0,0,0,0,0,0,0,0,0,0,0,0,0,0,0,0,0,0,1,0,1,0,1,0,1,0,0,0,0,0,0,0,0,0,0,4
2004,"Erratum: An improved version of the Marotto theorem (Chaos, Solitons and Fractals (2003) 18 (69-77) PII: S096007790200605)","Li C., Chen G.",9600779,"Chaos, Solitons and Fractals",20,3,0,0,0,0,0,0,0,0,0,0,0,0,0,0,0,0,0,0,0,0,0,0,0,0,0,0,0,0,0,0,0,0,0,0,0,1,1,0,0,1,0,1,0,0,0,0,0,0,0,0,0,0,0,4
2003,"Linearization, stability, and oscillation of the discrete delayed logistic system","Chen G., Liu S.T.",10577122,IEEE Transactions on Circuits and Systems I: Fundamental Theory and Applications,50,6,0,0,0,0,0,0,0,0,0,0,0,0,0,0,0,0,0,0,0,0,0,0,0,0,0,0,0,0,0,0,0,0,0,0,0,0,0,1,1,0,0,0,0,1,0,0,1,0,0,0,0,0,0,4
2002,Synchronization in unidirectionally coupled hyperchaotic oscillators with a single variable and its realization of circuit experimental simulations,"Jiang P.-Q., Luo X.-S., Wang B.-H., Fang J.-Q., Chen G.-R., Zou Y.-L.",10003290,Wuli Xuebao/Acta Physica Sinica,51,9,0,0,0,0,0,0,0,0,0,0,0,0,0,0,0,0,0,0,0,0,0,0,0,0,0,0,0,0,0,0,0,0,0,0,0,0,1,0,0,0,0,1,0,1,0,0,0,0,0,0,1,0,0,4
2002,Hyperbolic-type generalized lorenz chaotic system and its canonical form,"Celikovsky S., Chen G.",14746670,IFAC Proceedings Volumes (IFAC-PapersOnline),15,1,0,0,0,0,0,0,0,0,0,0,0,0,0,0,0,0,0,0,0,0,0,0,0,0,0,0,0,0,0,0,0,0,0,0,0,0,0,0,0,0,4,0,0,0,0,0,0,0,0,0,0,0,0,4
2001,A quasi-analytical method for period-doubling bifurcation,"Berns D.W., Moiola J.L., Chen G.",,"ISCAS 2001 - 2001 IEEE International Symposium on Circuits and Systems, Conference Proceedings",3, ,0,0,0,0,0,0,0,0,0,0,0,0,0,0,0,0,0,0,0,0,0,0,0,0,0,0,0,0,0,0,0,0,1,0,0,0,0,0,0,0,0,0,0,0,1,0,1,0,1,0,0,0,0,4
2001,Controlling bifurcations of discrete maps,"Yap K.C., Chen G., Ueta T.",3270793,Latin American Applied Research,31,3,0,0,0,0,0,0,0,0,0,0,0,0,0,0,0,0,0,0,0,0,0,0,0,0,0,0,0,0,0,0,0,0,0,0,0,0,2,1,0,0,1,0,0,0,0,0,0,0,0,0,0,0,0,4
2001,A simple approach to calculation and control of unstable periodic orbits in chaotic piecewise-linear systems,"Ueta T., Chen G., Kawabe T.",2181274,International Journal of Bifurcation and Chaos in Applied Sciences and Engineering,11,1,0,0,0,0,0,0,0,0,0,0,0,0,0,0,0,0,0,0,0,0,0,0,0,0,0,0,0,0,0,0,0,0,0,0,1,1,1,0,0,0,0,0,0,0,0,0,1,0,0,0,0,0,0,4
2000,Distribution of controlled Lyapunov exponents: A statistical simulation study,"Lai D., Chen G.",1679473,Computational Statistics and Data Analysis,33,1,0,0,0,0,0,0,0,0,0,0,0,0,0,0,0,0,0,0,0,0,0,0,0,0,0,0,0,0,0,0,0,0,0,0,1,1,1,1,0,0,0,0,0,0,0,0,0,0,0,0,0,0,0,4
2000,Predictive fuzzy PID control for complex processes,"Lu Jialiang, Ranganathan Rayanallur S., Chen Guanrong, Malki Heidar A.",,IEEE International Conference on Fuzzy Systems,2, ,0,0,0,0,0,0,0,0,0,0,0,0,0,0,0,0,0,0,0,0,0,0,0,0,0,0,0,0,0,0,0,0,1,1,0,0,0,0,0,0,1,0,0,1,0,0,0,0,0,0,0,0,0,4
1999,Distribution of the Lyapunov exponent of the chaotic skew tent map,"Lai D., Chen G., Hasler M.",2181274,International Journal of Bifurcation and Chaos in Applied Sciences and Engineering,9,10,0,0,0,0,0,0,0,0,0,0,0,0,0,0,0,0,0,0,0,0,0,0,0,0,0,0,0,0,0,0,0,0,0,1,0,0,0,0,0,0,0,0,0,0,0,0,0,1,1,0,1,0,0,4
1997,Feedback control of pathological rhythms in two models of cardiac activity,"Brandt Michael E., Chen Guanrong",,"International Conference on Control of Oscillations and Chaos, Proceedings",2, ,0,0,0,0,0,0,0,0,0,0,0,0,0,0,0,0,0,0,0,0,0,0,0,0,0,0,0,0,0,0,0,0,0,0,0,0,1,1,1,0,0,0,0,1,0,0,0,0,0,0,0,0,0,4
1993,A fast algorithm for scalar Nevanlinna-Pick interpolation,"Kaya Koc C., Chen G.",0029599X,Numerische Mathematik,64,1,0,0,0,0,0,0,0,0,0,0,0,0,0,0,0,0,0,0,0,0,0,0,0,0,0,1,0,0,0,0,0,0,0,0,0,0,1,0,0,0,0,0,0,0,1,1,0,0,0,0,0,0,0,4
1992,Analytic Closed-Form Solutions for Suboptimal Trajectory Planning of Single-Link Flexible-Joint Robot Arms,Chen G.,1042296X,IEEE Transactions on Robotics and Automation,8,5,0,0,0,0,0,0,0,0,0,0,0,0,0,0,0,0,0,0,0,0,0,0,0,0,0,0,0,0,1,1,0,0,0,0,0,1,0,0,0,0,0,0,0,0,0,0,0,0,0,0,1,0,0,4
1992,Mathematical modeling for kinematics and dynamics of certain single flexible-link robot arms,"Qi X., Chen G.",,"Proceedings of the 1st IEEE Conference on Control Applications, CCA 1992",, ,0,0,0,0,0,0,0,0,0,0,0,0,0,0,0,0,0,0,0,0,0,0,0,0,0,0,0,0,0,1,0,0,0,0,0,0,0,0,2,0,0,0,0,0,1,0,0,0,0,0,0,0,0,4
1991,Closed-Form Solutions of a General Inequality-Constrained LQ Optimal Control Problem,Chen G.,36811,Applicable Analysis,41, 1-4,0,0,0,0,0,0,0,0,0,0,0,0,0,0,0,0,0,0,0,0,0,0,0,0,0,0,0,0,0,0,0,0,0,0,0,0,0,1,2,0,0,0,1,0,0,0,0,0,0,0,0,0,0,4
1986,Design of near-optimal linear digital tracking filters with colored input,"Chen G., Chui C.K.",3770427,Journal of Computational and Applied Mathematics,15,3,0,0,0,0,0,0,0,0,0,0,0,0,0,0,0,0,0,0,0,0,0,0,0,0,0,0,0,0,0,0,0,0,0,0,0,0,0,0,0,0,1,1,0,0,0,0,0,0,2,0,0,0,0,4
2019,Backwards square completion MPC solution for real-time economic dispatch in power networks,"Zhang H.-T., Sun W., Chen Z., Meng H., Chen G.",17518644,IET Control Theory and Applications,13,17,0,0,0,0,0,0,0,0,0,0,0,0,0,0,0,0,0,0,0,0,0,0,0,0,0,0,0,0,0,0,0,0,0,0,0,0,0,0,0,0,0,0,0,0,0,0,0,0,0,0,2,1,0,3
2019,A Distributed Hybrid Event-Time-Driven Scheme for Optimization over Sensor Networks,"Hu B., Guan Z.-H., Chen G., Shen X.",2780046,IEEE Transactions on Industrial Electronics,66,9,0,0,0,0,0,0,0,0,0,0,0,0,0,0,0,0,0,0,0,0,0,0,0,0,0,0,0,0,0,0,0,0,0,0,0,0,0,0,0,0,0,0,0,0,0,0,0,0,0,0,3,0,0,3
2019,Optimization of Component Elements in Integrated Coding Systems for Green Communications: A Survey,"Chen Q., Wang L., Chen P., Chen G.",1553877X,IEEE Communications Surveys and Tutorials,21,3,0,0,0,0,0,0,0,0,0,0,0,0,0,0,0,0,0,0,0,0,0,0,0,0,0,0,0,0,0,0,0,0,0,0,0,0,0,0,0,0,0,0,0,0,0,0,0,0,0,0,0,3,0,3
2019,Unstable limit cycles and singular attractors in a two-dimensional memristor-based dynamic system,"Chang H., Song Q., Li Y., Wang Z., Chen G.",10994300,Entropy,21,4,0,0,0,0,0,0,0,0,0,0,0,0,0,0,0,0,0,0,0,0,0,0,0,0,0,0,0,0,0,0,0,0,0,0,0,0,0,0,0,0,0,0,0,0,0,0,0,0,0,0,1,2,0,3
2018,The Roles of Input Matrix and Nodal Dynamics in Network Controllability,"Hou B., Li X., Chen G.",23255870,IEEE Transactions on Control of Network Systems,5,4,0,0,0,0,0,0,0,0,0,0,0,0,0,0,0,0,0,0,0,0,0,0,0,0,0,0,0,0,0,0,0,0,0,0,0,0,0,0,0,0,0,0,0,0,0,0,0,0,0,1,1,1,0,3
2018,Stochastic Consensus Control of Second-Order Nonlinear Multiagent Systems with External Disturbances,"Ji H., Zhang H.-T., Ye Z., Zhang H., Xu B., Chen G.",23255870,IEEE Transactions on Control of Network Systems,5,4,0,0,0,0,0,0,0,0,0,0,0,0,0,0,0,0,0,0,0,0,0,0,0,0,0,0,0,0,0,0,0,0,0,0,0,0,0,0,0,0,0,0,0,0,0,0,0,0,0,0,2,1,0,3
2018,Synchronization in a fractional-order model of pancreatic β-cells,"Zambrano-Serrano E., Munoz-Pacheco J.M., Gomez-Pavon L.C., Luis-Ramos A., Chen G.",19516355,European Physical Journal: Special Topics,227, 7-9,0,0,0,0,0,0,0,0,0,0,0,0,0,0,0,0,0,0,0,0,0,0,0,0,0,0,0,0,0,0,0,0,0,0,0,0,0,0,0,0,0,0,0,0,0,0,0,0,0,1,1,1,0,3
2018,Decentralised fixed modes of networked MIMO systems,"Hao Y., Duan Z., Chen G.",207179,International Journal of Control,91,4,0,0,0,0,0,0,0,0,0,0,0,0,0,0,0,0,0,0,0,0,0,0,0,0,0,0,0,0,0,0,0,0,0,0,0,0,0,0,0,0,0,0,0,0,0,0,0,0,0,2,1,0,0,3
2018,Local communities obstruct global consensus: Naming game on multi-local-world networks,"Lou Y., Chen G., Fan Z., Xiang L.",3784371,Physica A: Statistical Mechanics and its Applications,492, ,0,0,0,0,0,0,0,0,0,0,0,0,0,0,0,0,0,0,0,0,0,0,0,0,0,0,0,0,0,0,0,0,0,0,0,0,0,0,0,0,0,0,0,0,0,0,0,0,0,1,0,2,0,3
2018,Communicating with sentences: A multi-word naming game model,"Lou Y., Chen G., Hu J.",3784371,Physica A: Statistical Mechanics and its Applications,490, ,0,0,0,0,0,0,0,0,0,0,0,0,0,0,0,0,0,0,0,0,0,0,0,0,0,0,0,0,0,0,0,0,0,0,0,0,0,0,0,0,0,0,0,0,0,0,0,0,0,2,0,1,0,3
2017,Realization of a transfer function as a passive two-port RC ladder network with a specified gain,"Wang K., Chen M.Z.Q., Chen G.",989886,International Journal of Circuit Theory and Applications,45,11,0,0,0,0,0,0,0,0,0,0,0,0,0,0,0,0,0,0,0,0,0,0,0,0,0,0,0,0,0,0,0,0,0,0,0,0,0,0,0,0,0,0,0,0,0,0,0,0,0,0,3,0,0,3
2017,Small-world features of real-world networks,"Xiao W., Li M., Chen G.",12292370,Journal of Communications and Networks,19,3,0,0,0,0,0,0,0,0,0,0,0,0,0,0,0,0,0,0,0,0,0,0,0,0,0,0,0,0,0,0,0,0,0,0,0,0,0,0,0,0,0,0,0,0,0,0,0,0,0,2,0,1,0,3
2016,Nonnegative edge consensus of networked linear systems,"Wang X., Su H., Wang X., Chen G.",19341768,"Chinese Control Conference, CCC",2016-, ,0,0,0,0,0,0,0,0,0,0,0,0,0,0,0,0,0,0,0,0,0,0,0,0,0,0,0,0,0,0,0,0,0,0,0,0,0,0,0,0,0,0,0,0,0,0,0,0,1,1,1,0,0,3
2016,Dynamics of the Zeraoulia-Sprott map revisited,"Chen G., Kudryashova E.V., Kuznetsov N.V., Leonov G.A.",2181274,International Journal of Bifurcation and Chaos,26,7,0,0,0,0,0,0,0,0,0,0,0,0,0,0,0,0,0,0,0,0,0,0,0,0,0,0,0,0,0,0,0,0,0,0,0,0,0,0,0,0,0,0,0,0,0,0,0,0,1,0,2,0,0,3
2016,Scrambled sets of shift operators,"Wu X., Chen G.",20081898,Journal of Nonlinear Science and Applications,9,5,0,0,0,0,0,0,0,0,0,0,0,0,0,0,0,0,0,0,0,0,0,0,0,0,0,0,0,0,0,0,0,0,0,0,0,0,0,0,0,0,0,0,0,0,0,0,0,0,1,0,2,0,0,3
2015,Unfavorable Individuals in Social Gaming Networks,"Zhang Y., Chen G., Guan J., Zhang Z., Zhou S.",20452322,Scientific Reports,5, ,0,0,0,0,0,0,0,0,0,0,0,0,0,0,0,0,0,0,0,0,0,0,0,0,0,0,0,0,0,0,0,0,0,0,0,0,0,0,0,0,0,0,0,0,0,0,0,0,1,0,2,0,0,3
2015,Pinning synchronization of networked multi-agent systems: spectral analysis,"Xiang L., Chen F., Chen G.",20956983,Control Theory and Technology,13,1,0,0,0,0,0,0,0,0,0,0,0,0,0,0,0,0,0,0,0,0,0,0,0,0,0,0,0,0,0,0,0,0,0,0,0,0,0,0,0,0,0,0,0,0,0,0,0,0,2,1,0,0,0,3
2014,Network science research: Some recent progress in China and beyond,Chen G.,20955138,National Science Review,1,3,0,0,0,0,0,0,0,0,0,0,0,0,0,0,0,0,0,0,0,0,0,0,0,0,0,0,0,0,0,0,0,0,0,0,0,0,0,0,0,0,0,0,0,0,0,0,0,2,1,0,0,0,0,3
2014,Glider implies Li-Yorke chaos for one-dimensional cellular automata,"Jin W., Chen F., Jin W., Chen F., Chen G.",15575969,Journal of Cellular Automata,9,4,0,0,0,0,0,0,0,0,0,0,0,0,0,0,0,0,0,0,0,0,0,0,0,0,0,0,0,0,0,0,0,0,0,0,0,0,0,0,0,0,0,0,0,0,0,0,0,2,1,0,0,0,0,3
2014,"Mixing property and (<sup>1</sup>, <sup>2</sup>) -everywhere chaos of inverse limit dynamical systems","Wu X., Wang X., Chen G.",0362546X,"Nonlinear Analysis, Theory, Methods and Applications",104, ,0,0,0,0,0,0,0,0,0,0,0,0,0,0,0,0,0,0,0,0,0,0,0,0,0,0,0,0,0,0,0,0,0,0,0,0,0,0,0,0,0,0,0,0,0,0,0,1,1,0,0,1,0,3
2013,Jittering performance of random deflection routing in packet networks,"Thong W.W.K., Chen G.",10075704,Communications in Nonlinear Science and Numerical Simulation,18,3,0,0,0,0,0,0,0,0,0,0,0,0,0,0,0,0,0,0,0,0,0,0,0,0,0,0,0,0,0,0,0,0,0,0,0,0,0,0,0,0,0,0,0,0,0,0,2,1,0,0,0,0,0,3
2012,On the uniform distribution of a class of discrete spatiotemporal systems,"Tian C., Chen G.",10236198,Journal of Difference Equations and Applications,18,9,0,0,0,0,0,0,0,0,0,0,0,0,0,0,0,0,0,0,0,0,0,0,0,0,0,0,0,0,0,0,0,0,0,0,0,0,0,0,0,0,0,0,0,0,0,1,0,0,1,0,0,1,0,3
2012,Differentiating complex network models: An engineering perspective,"Fan Z., Chen G., Zhang Y.",8981221,Computers and Mathematics with Applications,64,5,0,0,0,0,0,0,0,0,0,0,0,0,0,0,0,0,0,0,0,0,0,0,0,0,0,0,0,0,0,0,0,0,0,0,0,0,0,0,0,0,0,0,0,0,0,0,2,0,1,0,0,0,0,3
2012,Chaos and gliders in periodic cellular automaton rule 62,"Chen F., Shi L., Chen G., Jin W.",15575969,Journal of Cellular Automata,7,4,0,0,0,0,0,0,0,0,0,0,0,0,0,0,0,0,0,0,0,0,0,0,0,0,0,0,0,0,0,0,0,0,0,0,0,0,0,0,0,0,0,0,0,0,1,1,1,0,0,0,0,0,0,3
2012,On the fractional mean-value theorem,"Guo P., Li C., Chen G.",2181274,International Journal of Bifurcation and Chaos,22,5,0,0,0,0,0,0,0,0,0,0,0,0,0,0,0,0,0,0,0,0,0,0,0,0,0,0,0,0,0,0,0,0,0,0,0,0,0,0,0,0,0,0,0,0,0,0,0,1,1,0,1,0,0,3
2011,Designing delay lines based on the SD/DE algorithm for transmitted- reference ultra-wideband systems,"Xu Z., Wang L., Chen G.",0278081X,"Circuits, Systems, and Signal Processing",30,6,0,0,0,0,0,0,0,0,0,0,0,0,0,0,0,0,0,0,0,0,0,0,0,0,0,0,0,0,0,0,0,0,0,0,0,0,0,0,0,0,0,0,0,0,3,0,0,0,0,0,0,0,0,3
2011,Undetermination of the relation between network synchronizability and betweenness centrality,"Wang S.-J., Wu Z.-X., Dong H.-R., Chen G.-R.",16741056,Chinese Physics B,20,4,0,0,0,0,0,0,0,0,0,0,0,0,0,0,0,0,0,0,0,0,0,0,0,0,0,0,0,0,0,0,0,0,0,0,0,0,0,0,0,0,0,0,0,2,0,0,0,0,0,1,0,0,0,3
2011,Correlative peak interval prediction and analysis of chaotic sequences,"Ding Q., Wang L., Chen G.",17962056,Journal of Networks,6,7,0,0,0,0,0,0,0,0,0,0,0,0,0,0,0,0,0,0,0,0,0,0,0,0,0,0,0,0,0,0,0,0,0,0,0,0,0,0,0,0,0,0,0,0,2,0,1,0,0,0,0,0,0,3
2010,Complex symbolic dynamics of Chua's period-2 rule 37,"Jin W., Chen F., Chen G., Chen L., Chen F.",15575969,Journal of Cellular Automata,5, 4-5,0,0,0,0,0,0,0,0,0,0,0,0,0,0,0,0,0,0,0,0,0,0,0,0,0,0,0,0,0,0,0,0,0,0,0,0,0,0,0,0,0,0,0,2,0,0,1,0,0,0,0,0,0,3
2009,An efficient encryption algorithm based on image reconstruction,"Yu H., Zhu Z., Chen G.",,"2009 International Workshop on Chaos-Fractals Theories and Applications, IWCFTA 2009",, ,0,0,0,0,0,0,0,0,0,0,0,0,0,0,0,0,0,0,0,0,0,0,0,0,0,0,0,0,0,0,0,0,0,0,0,0,0,0,0,0,0,0,0,0,0,0,0,2,0,0,1,0,0,3
2009,"Analysis, control and applications of complex networks: A brief overview","Lu J., Chen G.",2714310,Proceedings - IEEE International Symposium on Circuits and Systems,, ,0,0,0,0,0,0,0,0,0,0,0,0,0,0,0,0,0,0,0,0,0,0,0,0,0,0,0,0,0,0,0,0,0,0,0,0,0,0,0,0,0,0,1,1,0,1,0,0,0,0,0,0,0,3
2009,DNA-like learning algorithm of CNN template implementing Boolean functions,"Chen F., Chen G., He Q.",2714310,Proceedings - IEEE International Symposium on Circuits and Systems,, ,0,0,0,0,0,0,0,0,0,0,0,0,0,0,0,0,0,0,0,0,0,0,0,0,0,0,0,0,0,0,0,0,0,0,0,0,0,0,0,0,0,1,0,0,1,0,0,0,0,0,1,0,0,3
2009,Controlling Neimark-Sacker bifurcations in discrete-time multivariable systems,"D'Amico M.B., Chen G., Paolini E.E., Moiola J.L.",1676911,Systems and Control Letters,58,5,0,0,0,0,0,0,0,0,0,0,0,0,0,0,0,0,0,0,0,0,0,0,0,0,0,0,0,0,0,0,0,0,0,0,0,0,0,0,0,0,0,0,0,0,1,0,0,0,0,1,1,0,0,3
2009,On the security of an MPEG-video encryption scheme based on secret huffman tables,"Li S., Chen G., Cheung A., Lo K.-T., Kankanhalli M.",3029743,Lecture Notes in Computer Science (including subseries Lecture Notes in Artificial Intelligence and Lecture Notes in Bioinformatics),5414, ,0,0,0,0,0,0,0,0,0,0,0,0,0,0,0,0,0,0,0,0,0,0,0,0,0,0,0,0,0,0,0,0,0,0,0,0,0,0,0,0,0,1,2,0,0,0,0,0,0,0,0,0,0,3
2009,Karhunen-Loève decomposition approach to analyzing complex network synchronization,"Jin T., Jin X., Chen G., Huang Z.",17518113,Journal of Physics A: Mathematical and Theoretical,42,32,0,0,0,0,0,0,0,0,0,0,0,0,0,0,0,0,0,0,0,0,0,0,0,0,0,0,0,0,0,0,0,0,0,0,0,0,0,0,0,0,0,0,1,1,1,0,0,0,0,0,0,0,0,3
2008,Stability and chaos in a class of finite-dimensional discrete spatiotemporal systems,"Tian C., Chen G., Xie S.",8981221,Computers and Mathematics with Applications,56,10,0,0,0,0,0,0,0,0,0,0,0,0,0,0,0,0,0,0,0,0,0,0,0,0,0,0,0,0,0,0,0,0,0,0,0,0,0,0,0,0,0,0,0,0,0,2,0,0,1,0,0,0,0,3
2008,A novel multiscroll chaotic system and its realization,"Yu S., Lu J., Chen G.",2714310,Proceedings - IEEE International Symposium on Circuits and Systems,, ,0,0,0,0,0,0,0,0,0,0,0,0,0,0,0,0,0,0,0,0,0,0,0,0,0,0,0,0,0,0,0,0,0,0,0,0,0,0,0,0,0,1,0,0,2,0,0,0,0,0,0,0,0,3
2008,Consensus on de Bruijn graphs,"Yan G., Fu Z.-Q., Chen G.",14346028,European Physical Journal B,63,4,0,0,0,0,0,0,0,0,0,0,0,0,0,0,0,0,0,0,0,0,0,0,0,0,0,0,0,0,0,0,0,0,0,0,0,0,0,0,0,0,2,0,0,0,0,0,0,1,0,0,0,0,0,3
2008,A new topology for artificial higher order neural networks: Polynomial kernel networks,"Lu Z., Shieh L.-S., Chen G.",,Artificial Higher Order Neural Networks for Economics and Business,, ,0,0,0,0,0,0,0,0,0,0,0,0,0,0,0,0,0,0,0,0,0,0,0,0,0,0,0,0,0,0,0,0,0,0,0,0,0,0,0,0,0,1,0,1,0,0,0,0,0,1,0,0,0,3
2007,Stability of piecewise affine systems with application to chaos stabilization,"Li C., Chen G., Liao X.",10541500,Chaos,17,2,0,0,0,0,0,0,0,0,0,0,0,0,0,0,0,0,0,0,0,0,0,0,0,0,0,0,0,0,0,0,0,0,0,0,0,0,0,0,0,0,2,0,0,0,0,0,0,0,0,1,0,0,0,3
2007,Dynamical analysis of a networked control system,"Zhang G., Chen G., Chen T., D'Amico M.B.",2181274,International Journal of Bifurcation and Chaos,17,1,0,0,0,0,0,0,0,0,0,0,0,0,0,0,0,0,0,0,0,0,0,0,0,0,0,0,0,0,0,0,0,0,0,0,0,0,0,0,0,1,1,0,1,0,0,0,0,0,0,0,0,0,0,3
2006,Design and implementation of multi-directional grid multi-torus chaotic attractors,"Yu S., Lu J., Chen G.",2714310,Proceedings - IEEE International Symposium on Circuits and Systems,, ,0,0,0,0,0,0,0,0,0,0,0,0,0,0,0,0,0,0,0,0,0,0,0,0,0,0,0,0,0,0,0,0,0,0,0,0,0,0,0,1,0,0,0,1,0,0,0,0,0,0,0,1,0,3
