," 作者:Cohen, Laurent D.",,,,,,,,,,,,,,,,,,,,,,,,,,,,,,,,,,,,,,,,,,,,,,,,,,,,,,,,,,,
,,,,,,,,,,,,,,,,,,,,,,,,,,,,,,,,,,,,,,,,,,,,,,,,,,,,,,,,,,,,
,h-index = 31 (在纳入 h-Index 的 190 文献中，有 31 篇已被至少引用 31 次。),,,,,,,,,,,,,,,,,,,,,,,,,,,,,,,,,,,,,,,,,,,,,,,,,,,,,,,,,,,
,,,,,,,,,,,,,,,,,,,,,,,,,,,,,,,,,,,,,,,,,,,,,,,,,,,,,,,,,,,,
,,,,,,,,,,,,,,,,,,,,,,,,,,,,,,,,,,,,,,,,,,,,,,,,,,,,,,,,,,,,
,,,,,,,<1970,1970,1971,1972,1973,1974,1975,1976,1977,1978,1979,1980,1981,1982,1983,1984,1985,1986,1987,1988,1989,1990,1991,1992,1993,1994,1995,1996,1997,1998,1999,2000,2001,2002,2003,2004,2005,2006,2007,2008,2009,2010,2011,2012,2013,2014,2015,2016,2017,2018,2019,2020,>2020,总计
出版年份,文献标题,作者,ISSN,期刊标题,卷,期,0,0,0,0,0,0,0,0,0,0,0,0,0,0,0,0,0,0,0,0,0,0,0,22,24,33,54,98,132,137,102,131,202,179,243,237,301,327,295,269,402,376,338,333,399,349,343,378,267,310,259,69,0,6609
1991,On active contour models and balloons,Cohen L.D.,10499660,CVGIP: Image Understanding,53,2,0,0,0,0,0,0,0,0,0,0,0,0,0,0,0,0,0,0,0,0,0,0,0,5,8,8,23,30,36,34,35,44,81,70,72,82,103,117,93,86,108,113,70,64,97,69,50,64,39,38,39,10,0,1688
1993,Finite-Element Methods for Active Contour Models and Balloons for 2-D and 3-D Images,"Cohen L.D., Cohen I.",1628828,IEEE Transactions on Pattern Analysis and Machine Intelligence,15,11,0,0,0,0,0,0,0,0,0,0,0,0,0,0,0,0,0,0,0,0,0,0,0,0,0,7,9,23,35,50,29,35,49,43,55,56,58,59,64,53,76,77,61,44,54,42,35,38,24,15,14,2,0,1107
1997,Global minimum for active contour models: A minimal path approach,"Cohen L.D., Kimmel R.",9205691,International Journal of Computer Vision,24,1,0,0,0,0,0,0,0,0,0,0,0,0,0,0,0,0,0,0,0,0,0,0,0,0,0,0,0,0,1,2,1,4,15,9,18,17,20,22,24,28,39,32,39,34,33,26,33,24,16,18,16,4,0,475
2001,Fast extraction of minimal paths in 3D images and applications to virtual endoscopy,"Deschamps T., Cohen L.D.",13618415,Medical Image Analysis,5,4,0,0,0,0,0,0,0,0,0,0,0,0,0,0,0,0,0,0,0,0,0,0,0,0,0,0,0,0,0,0,0,0,0,6,14,9,18,18,16,15,20,18,21,17,15,14,20,16,7,9,5,4,0,262
1992,Using deformable surfaces to segment 3-D images and infer differential structures,"Cohen I., Cohen L.D., Ayache N.",10499660,CVGIP: Image Understanding,56,2,0,0,0,0,0,0,0,0,0,0,0,0,0,0,0,0,0,0,0,0,0,0,0,3,6,10,13,12,21,9,9,10,7,9,9,6,7,3,3,3,7,0,2,2,4,3,0,1,0,0,0,0,0,159
2008,Non-local regularization of inverse problems,"Peyre G., Bougleux S., Cohen L.",3029743,Lecture Notes in Computer Science (including subseries Lecture Notes in Artificial Intelligence and Lecture Notes in Bioinformatics),5304,3,0,0,0,0,0,0,0,0,0,0,0,0,0,0,0,0,0,0,0,0,0,0,0,0,0,0,0,0,0,0,0,0,0,0,0,0,0,0,0,0,6,14,17,11,16,16,18,19,11,12,9,3,0,152
2006,Geodesic remeshing using front propagation,"Peyre G., Cohen L.D.",9205691,International Journal of Computer Vision,69,1,0,0,0,0,0,0,0,0,0,0,0,0,0,0,0,0,0,0,0,0,0,0,0,0,0,0,0,0,0,0,0,0,0,0,0,0,0,0,6,4,11,7,9,16,11,12,10,12,9,9,3,2,0,121
2011,Tubular structure segmentation based on minimal path method and anisotropic enhancement,"Benmansour F., Cohen L.D.",9205691,International Journal of Computer Vision,92,2,0,0,0,0,0,0,0,0,0,0,0,0,0,0,0,0,0,0,0,0,0,0,0,0,0,0,0,0,0,0,0,0,0,0,0,0,0,0,0,0,0,0,3,8,19,11,20,16,12,13,14,4,0,120
1996,Tracking and motion analysis of the left ventricle with deformable superquadrics,"Bardinet E., Cohen L.D., Ayache N.",13618415,Medical Image Analysis,1,2,0,0,0,0,0,0,0,0,0,0,0,0,0,0,0,0,0,0,0,0,0,0,0,0,0,0,0,0,4,4,6,3,5,5,4,6,10,8,2,6,6,6,6,7,5,6,4,4,5,2,4,0,0,118
2005,Single quantum dot tracking based on perceptual grouping using minimal paths in a spatiotemporal volume,"Bonneau S., Dahan M., Cohen L.D.",10577149,IEEE Transactions on Image Processing,14,9,0,0,0,0,0,0,0,0,0,0,0,0,0,0,0,0,0,0,0,0,0,0,0,0,0,0,0,0,0,0,0,0,0,0,0,0,0,8,8,12,16,5,12,10,8,4,10,7,8,1,3,2,0,114
2012,Automatic detection and segmentation of kidneys in 3D CT images using random forests,"Cuingnet R., Prevost R., Lesage D., Cohen L.D., Mory B., Ardon R.",3029743,Lecture Notes in Computer Science (including subseries Lecture Notes in Artificial Intelligence and Lecture Notes in Bioinformatics),7512, ,0,0,0,0,0,0,0,0,0,0,0,0,0,0,0,0,0,0,0,0,0,0,0,0,0,0,0,0,0,0,0,0,0,0,0,0,0,0,0,0,0,0,0,0,9,9,11,19,14,22,9,5,0,98
1998,A Parametric Deformable Model to Fit Unstructured 3D Data,"Bardinet E., Cohen L.D., Ayache N.",10773142,Computer Vision and Image Understanding,71,1,0,0,0,0,0,0,0,0,0,0,0,0,0,0,0,0,0,0,0,0,0,0,0,0,0,0,0,0,0,0,4,4,5,1,10,10,10,7,2,9,4,3,0,0,7,3,1,6,1,3,3,2,0,95
1990,A finite element method applied to new active contour models and 3D reconstruction from cross sections,"Cohen Laurent D., Cohen Issac",,,, ,0,0,0,0,0,0,0,0,0,0,0,0,0,0,0,0,0,0,0,0,0,0,0,10,5,2,3,7,5,12,6,7,5,3,5,3,4,1,1,1,2,1,1,1,0,0,1,0,0,3,1,0,0,90
2010,Geodesic methods in computer vision and graphics,"Peyre G., Pechaud M., Keriven R., Cohen L.D.",15722740,Foundations and Trends in Computer Graphics and Vision,5, 3-4,0,0,0,0,0,0,0,0,0,0,0,0,0,0,0,0,0,0,0,0,0,0,0,0,0,0,0,0,0,0,0,0,0,0,0,0,0,0,0,0,0,0,1,2,5,12,17,8,15,10,12,2,0,84
2011,Non-local regularization of inverse problems,"Peyre G., Bougleux S., Cohen L.",19308337,Inverse Problems and Imaging,5,2,0,0,0,0,0,0,0,0,0,0,0,0,0,0,0,0,0,0,0,0,0,0,0,0,0,0,0,0,0,0,0,0,0,0,0,0,0,0,0,0,0,0,1,7,6,7,10,13,8,12,5,2,0,71
2001,A new approach of geodesic reconstruction for drusen segmentation in eye fundus images,"Sbeh Z.B., Cohen L.D., Mimoun G., Coscas G.",2780062,IEEE Transactions on Medical Imaging,20,12,0,0,0,0,0,0,0,0,0,0,0,0,0,0,0,0,0,0,0,0,0,0,0,0,0,0,0,0,0,0,0,0,0,0,2,0,3,3,6,6,3,2,9,3,3,11,5,1,2,3,1,0,0,63
2002,Fast extraction of tubular and tree 3D surfaces with front propagation methods,"Deschamps T., Cohen L.D.",10514651,Proceedings - International Conference on Pattern Recognition,16,1,0,0,0,0,0,0,0,0,0,0,0,0,0,0,0,0,0,0,0,0,0,0,0,0,0,0,0,0,0,0,0,0,0,0,1,3,4,11,9,4,6,4,5,4,2,0,1,2,2,2,0,0,0,60
2001,Multiple contour finding and perceptual grouping using minimal paths,Cohen L.D.,9249907,Journal of Mathematical Imaging and Vision,14,3,0,0,0,0,0,0,0,0,0,0,0,0,0,0,0,0,0,0,0,0,0,0,0,0,0,0,0,0,0,0,0,0,5,0,2,4,5,8,5,3,4,4,1,5,2,1,3,2,2,3,0,0,0,59
1992,Deformable models for 3-D medical images using finite elements and balloons,"Cohen L.D., Cohen I.",10636919,Proceedings of the IEEE Computer Society Conference on Computer Vision and Pattern Recognition,1992-, ,0,0,0,0,0,0,0,0,0,0,0,0,0,0,0,0,0,0,0,0,0,0,0,0,1,3,1,7,4,4,0,4,2,0,1,0,4,2,7,2,1,2,0,0,1,1,3,0,1,4,0,0,0,55
2009,Fast object segmentation by growing minimal paths from a single point on 2D or 3D images,"Benmansour F., Cohen L.D.",9249907,Journal of Mathematical Imaging and Vision,33,2,0,0,0,0,0,0,0,0,0,0,0,0,0,0,0,0,0,0,0,0,0,0,0,0,0,0,0,0,0,0,0,0,0,0,0,0,0,0,0,0,2,3,5,4,6,4,6,6,1,10,3,1,0,51
1996,Global minimum for active contour models: a minimal path approach,"Cohen Laurent D., Kimmel Ron",10636919,Proceedings of the IEEE Computer Society Conference on Computer Vision and Pattern Recognition,, ,0,0,0,0,0,0,0,0,0,0,0,0,0,0,0,0,0,0,0,0,0,0,0,0,0,0,0,0,5,4,2,0,4,1,2,5,2,6,4,0,2,7,2,0,3,1,0,0,0,1,0,0,0,51
2008,Constrained image segmentation from hierarchical boundaries,"Arbelaez P., Cohen L.",,"26th IEEE Conference on Computer Vision and Pattern Recognition, CVPR",, ,0,0,0,0,0,0,0,0,0,0,0,0,0,0,0,0,0,0,0,0,0,0,0,0,0,0,0,0,0,0,0,0,0,0,0,0,0,0,0,0,4,8,5,8,5,2,1,5,4,3,4,0,0,49
2007,Segmentation of 3D tubular objects with adaptive front propagation and minimal tree extraction for 3D medical imaging,"Cohen L.D., Deschamps T.",10255842,Computer Methods in Biomechanics and Biomedical Engineering,10,4,0,0,0,0,0,0,0,0,0,0,0,0,0,0,0,0,0,0,0,0,0,0,0,0,0,0,0,0,0,0,0,0,0,0,0,0,0,0,0,2,6,5,4,5,5,3,0,6,1,4,3,1,0,45
2003,A new image registration technique with free boundary constraints: Application to mammography,"Richard F.J.P., Cohen L.D.",10773142,Computer Vision and Image Understanding,89, 2-3,0,0,0,0,0,0,0,0,0,0,0,0,0,0,0,0,0,0,0,0,0,0,0,0,0,0,0,0,0,0,0,0,0,0,2,2,4,9,1,3,3,6,2,2,2,1,3,1,1,2,1,0,0,45
1997,Preejectional left ventricular wall motion in normal subjects using Doppler tissue imaging and correlation with ejection fraction,"Pellerin D., Cohen L., Larrazet F., Pajany F., Witchitz S., Veyrat C.",29149,American Journal of Cardiology,80,5,0,0,0,0,0,0,0,0,0,0,0,0,0,0,0,0,0,0,0,0,0,0,0,0,0,0,0,0,0,4,5,4,2,3,9,5,4,2,1,1,1,0,1,1,0,1,0,0,0,1,0,0,0,45
1989,Hierarchical region based stereo matching,"Cohen Laurent, Vinet Laurent, Sander Peter T., Gagalowicz Andre",,,, ,0,0,0,0,0,0,0,0,0,0,0,0,0,0,0,0,0,0,0,0,0,0,0,2,0,3,0,1,1,0,1,2,2,4,2,4,0,1,1,3,1,1,0,4,1,2,0,2,0,3,0,0,0,41
2012,Nonlocal active contours,"Jung M., Peyre G., Cohen L.D.",19364954,SIAM Journal on Imaging Sciences,5,3,0,0,0,0,0,0,0,0,0,0,0,0,0,0,0,0,0,0,0,0,0,0,0,0,0,0,0,0,0,0,0,0,0,0,0,0,0,0,0,0,0,0,0,0,1,4,8,9,7,9,2,0,0,40
2004,Surface segmentation using geodesic centroidal tesselation,"Peyre G., Cohen L.",,"Proceedings - 2nd International Symposium on 3D Data Processing, Visualization, and Transmission. 3DPVT 2004",, ,0,0,0,0,0,0,0,0,0,0,0,0,0,0,0,0,0,0,0,0,0,0,0,0,0,0,0,0,0,0,0,0,0,0,0,0,2,3,3,1,3,4,3,2,4,2,4,1,4,2,0,1,0,39
1994,Fitting of iso-surfaces using superquadrics and free-form deformations,"Bardinet E., Ayache N., Cohen L.D.",,,, ,0,0,0,0,0,0,0,0,0,0,0,0,0,0,0,0,0,0,0,0,0,0,0,0,0,0,2,7,4,4,0,2,1,1,0,0,0,4,1,0,1,1,2,0,0,0,1,0,0,1,1,0,0,33
2009,3D multi-branch tubular surface and centerline extraction with 4D iterative key points,"Li H., Yezzi A., Cohen L.",3029743,Lecture Notes in Computer Science (including subseries Lecture Notes in Artificial Intelligence and Lecture Notes in Bioinformatics),5762,2,0,0,0,0,0,0,0,0,0,0,0,0,0,0,0,0,0,0,0,0,0,0,0,0,0,0,0,0,0,0,0,0,0,0,0,0,0,0,0,0,0,3,5,7,1,4,1,3,0,5,2,0,0,31
2000,Fingerprint image matching by minimization of a thin-plate energy using a two-step algorithm with auxiliary variables,"Almansa A., Cohen L.",21583978,Proceedings of IEEE Workshop on Applications of Computer Vision,2000-, ,0,0,0,0,0,0,0,0,0,0,0,0,0,0,0,0,0,0,0,0,0,0,0,0,0,0,0,0,0,0,0,0,0,0,1,5,6,5,0,2,1,2,1,1,2,2,1,0,0,1,0,1,0,31
2006,A metric approach to vector-valued image segmentation,"Arbelaez P.A., Cohen L.D.",9205691,International Journal of Computer Vision,69,1,0,0,0,0,0,0,0,0,0,0,0,0,0,0,0,0,0,0,0,0,0,0,0,0,0,0,0,0,0,0,0,0,0,0,0,0,0,0,1,0,5,2,6,3,5,2,1,2,1,1,1,0,0,30
1996,Auxiliary variables and two-step iterative algorithms in computer vision problems,Cohen L.D.,9249907,Journal of Mathematical Imaging and Vision,6,1,0,0,0,0,0,0,0,0,0,0,0,0,0,0,0,0,0,0,0,0,0,0,0,0,0,0,0,1,4,1,2,3,5,3,1,0,1,1,2,0,1,0,0,1,0,0,0,1,2,0,1,0,0,30
2011,Matching 2D and 3D articulated shapes using the eccentricity transform,"Ion A., Artner N.M., Peyre G., Kropatsch W.G., Cohen L.D.",10773142,Computer Vision and Image Understanding,115,6,0,0,0,0,0,0,0,0,0,0,0,0,0,0,0,0,0,0,0,0,0,0,0,0,0,0,0,0,0,0,0,0,0,0,0,0,0,0,0,0,0,0,1,2,4,2,5,4,3,5,1,0,0,27
2005,Geodesic computations for fast and accurate surface remeshing and parameterization,"Peyre G., Cohen L.",14211750,Progress in Nonlinear Differential Equations and Their Application,63, ,0,0,0,0,0,0,0,0,0,0,0,0,0,0,0,0,0,0,0,0,0,0,0,0,0,0,0,0,0,0,0,0,0,0,0,0,1,1,1,2,3,3,0,3,3,2,1,2,3,0,1,1,0,27
2001,"Image registration, optical flow and local rigidity","Lefebure M., Cohen L.D.",9249907,Journal of Mathematical Imaging and Vision,14,2,0,0,0,0,0,0,0,0,0,0,0,0,0,0,0,0,0,0,0,0,0,0,0,0,0,0,0,0,0,0,0,0,1,1,1,2,4,1,6,1,3,0,1,3,1,1,0,1,0,0,0,0,0,27
1998,Pre-ejectional left ventricular wall motions studied on conscious dogs using Doppler myocardial imaging: Relationships with indices of left ventricular function,"Pellerin D., Berdeaux A., Cohen L., Giudicelli J.-F., Witchitz S., Veyrat C.",3015629,Ultrasound in Medicine and Biology,24,9,0,0,0,0,0,0,0,0,0,0,0,0,0,0,0,0,0,0,0,0,0,0,0,0,0,0,0,0,0,0,0,0,1,1,5,4,6,2,3,0,2,0,0,1,1,0,0,0,1,0,0,0,0,27
2010,Geodesic shape retrieval via optimal mass transport,"Rabin J., Peyre G., Cohen L.D.",3029743,Lecture Notes in Computer Science (including subseries Lecture Notes in Artificial Intelligence and Lecture Notes in Bioinformatics),6315,5,0,0,0,0,0,0,0,0,0,0,0,0,0,0,0,0,0,0,0,0,0,0,0,0,0,0,0,0,0,0,0,0,0,0,0,0,0,0,0,0,0,0,2,2,3,4,2,2,4,1,4,0,0,24
2006,Fast constrained surface extraction by minimal paths,"Ardon R., Cohen L.D.",9205691,International Journal of Computer Vision,69,1,0,0,0,0,0,0,0,0,0,0,0,0,0,0,0,0,0,0,0,0,0,0,0,0,0,0,0,0,0,0,0,0,0,0,0,0,0,1,2,2,4,2,3,0,2,0,0,1,3,2,1,0,0,23
2017,Global Minimum for a Finsler Elastica Minimal Path Approach,"Chen D., Mirebeau J.-M., Cohen L.D.",9205691,International Journal of Computer Vision,122,3,0,0,0,0,0,0,0,0,0,0,0,0,0,0,0,0,0,0,0,0,0,0,0,0,0,0,0,0,0,0,0,0,0,0,0,0,0,0,0,0,0,0,0,0,0,0,0,0,1,10,10,1,0,22
2008,Image segmentation by geodesic voting. Application to the extraction of tree structures from confocal microscope images,"Rouchdy Y., Cohen L.D.",10514651,Proceedings - International Conference on Pattern Recognition,, ,0,0,0,0,0,0,0,0,0,0,0,0,0,0,0,0,0,0,0,0,0,0,0,0,0,0,0,0,0,0,0,0,0,0,0,0,0,0,0,0,4,0,1,5,3,4,0,4,0,1,0,0,0,22
1995,Superquadrics and free-form deformations: A global model to fit and track 3D medical data,"Bardinet E., Cohen L.D., Ayache N.",3029743,Lecture Notes in Computer Science (including subseries Lecture Notes in Artificial Intelligence and Lecture Notes in Bioinformatics),905, ,0,0,0,0,0,0,0,0,0,0,0,0,0,0,0,0,0,0,0,0,0,0,0,0,0,0,1,2,4,1,0,3,2,1,0,1,3,0,1,0,1,1,1,0,0,0,0,0,0,0,0,0,0,22
2013,Geodesic voting for the automatic extraction of tree structures. Methods and applications,"Rouchdy Y., Cohen L.D.",10773142,Computer Vision and Image Understanding,117,10,0,0,0,0,0,0,0,0,0,0,0,0,0,0,0,0,0,0,0,0,0,0,0,0,0,0,0,0,0,0,0,0,0,0,0,0,0,0,0,0,0,0,0,0,0,1,5,4,2,2,6,1,0,21
2004,Energy Partitions and Image Segmentation,"Arbelaez P.A., Cohen L.D.",9249907,Journal of Mathematical Imaging and Vision,20, 1-2,0,0,0,0,0,0,0,0,0,0,0,0,0,0,0,0,0,0,0,0,0,0,0,0,0,0,0,0,0,0,0,0,0,0,0,0,1,1,3,1,3,2,2,2,0,1,1,0,0,3,1,0,0,21
2001,Grouping connected components using minimal path techniques. Application to reconstruction of vessels in 2D and 3D images,"Cohen L.D., Deschamps T.",10636919,Proceedings of the IEEE Computer Society Conference on Computer Vision and Pattern Recognition,2, ,0,0,0,0,0,0,0,0,0,0,0,0,0,0,0,0,0,0,0,0,0,0,0,0,0,0,0,0,0,0,0,0,0,0,0,0,0,4,1,1,2,4,1,1,1,2,2,0,0,1,1,0,0,21
1996,A Hybrid Hyperquadric Model for 2-D and 3-D Data Fitting,"Cohen I., Cohen L.D.",10773142,Computer Vision and Image Understanding,63,3,0,0,0,0,0,0,0,0,0,0,0,0,0,0,0,0,0,0,0,0,0,0,0,0,0,0,0,0,1,3,1,1,3,1,1,0,1,1,0,1,0,0,0,2,0,1,0,1,2,0,1,0,0,21
2006,Minimal paths and fast marching methods for image analysis,Cohen L.,,Handbook of Mathematical Models in Computer Vision,, ,0,0,0,0,0,0,0,0,0,0,0,0,0,0,0,0,0,0,0,0,0,0,0,0,0,0,0,0,0,0,0,0,0,0,0,0,0,0,0,2,4,1,1,2,1,3,2,1,1,1,1,0,0,20
2008,How to use SIFT vectors to analyze an image with database templates,"Auclair A., Cohen L.D., Vincent N.",3029743,Lecture Notes in Computer Science (including subseries Lecture Notes in Artificial Intelligence and Lecture Notes in Bioinformatics),4918, ,0,0,0,0,0,0,0,0,0,0,0,0,0,0,0,0,0,0,0,0,0,0,0,0,0,0,0,0,0,0,0,0,0,0,0,0,0,0,0,0,0,1,1,2,2,3,2,3,1,3,1,0,0,19
1999,Comparison of 2 myocardial velocity gradient assessment methods during dobutamine infusion with Doppler myocardial imaging,"Pellerin D., Berdeaux A., Cohen L., Giudicelli J.F., Witchitz S., Veyrat C.",8947317,Journal of the American Society of Echocardiography,12,1,0,0,0,0,0,0,0,0,0,0,0,0,0,0,0,0,0,0,0,0,0,0,0,0,0,0,0,0,0,0,0,1,3,4,7,1,1,0,0,0,2,0,0,0,0,0,0,0,0,0,0,0,0,19
2015,Combination of Piecewise-Geodesic Paths for Interactive Segmentation,"Mille J., Bougleux S., Cohen L.D.",9205691,International Journal of Computer Vision,112,1,0,0,0,0,0,0,0,0,0,0,0,0,0,0,0,0,0,0,0,0,0,0,0,0,0,0,0,0,0,0,0,0,0,0,0,0,0,0,0,0,0,0,0,0,0,0,0,5,4,4,4,0,0,17
2012,Kidney detection and real-time segmentation in 3D contrast-enhanced ultrasound images,"Prevost R., Mory B., Correas J.-M., Cohen L.D., Ardon R.",19457928,Proceedings - International Symposium on Biomedical Imaging,, ,0,0,0,0,0,0,0,0,0,0,0,0,0,0,0,0,0,0,0,0,0,0,0,0,0,0,0,0,0,0,0,0,0,0,0,0,0,0,0,0,0,0,0,0,3,5,2,2,1,3,1,0,0,17
2009,Image compression with anisotropic triangulations,"Bougleux S., Peyre G., Cohen L.D.",15505499,Proceedings of the IEEE International Conference on Computer Vision,, ,0,0,0,0,0,0,0,0,0,0,0,0,0,0,0,0,0,0,0,0,0,0,0,0,0,0,0,0,0,0,0,0,0,0,0,0,0,0,0,0,0,1,3,0,1,2,2,2,0,2,3,1,0,17
2008,Anisotropic geodesics for perceptual grouping and domain meshing,"Bougleux S., Peyre G., Cohen L.",3029743,Lecture Notes in Computer Science (including subseries Lecture Notes in Artificial Intelligence and Lecture Notes in Bioinformatics),5303,2,0,0,0,0,0,0,0,0,0,0,0,0,0,0,0,0,0,0,0,0,0,0,0,0,0,0,0,0,0,0,0,0,0,0,0,0,0,0,0,0,1,3,0,0,4,1,1,2,2,2,1,0,0,17
2005,Fast 3D brain segmentation using dual-front active contours with optional user-interaction,"Li H., Yezzi A., Cohen L.D.",3029743,Lecture Notes in Computer Science (including subseries Lecture Notes in Artificial Intelligence and Lecture Notes in Bioinformatics),3765, ,0,0,0,0,0,0,0,0,0,0,0,0,0,0,0,0,0,0,0,0,0,0,0,0,0,0,0,0,0,0,0,0,0,0,0,0,0,0,3,0,2,1,3,2,1,2,0,0,1,0,2,0,0,17
2004,A multiple target approach for single quantum dot tracking,"Bonneau S., Cohen L., Dahan M.",,2004 2nd IEEE International Symposium on Biomedical Imaging: Macro to Nano,1, ,0,0,0,0,0,0,0,0,0,0,0,0,0,0,0,0,0,0,0,0,0,0,0,0,0,0,0,0,0,0,0,0,0,0,0,0,1,5,3,1,1,0,0,3,0,0,1,0,1,0,0,0,0,16
2001,Quantitative analysis of hibernating myocardium by dobutamine tissue Doppler echocardiography,"Larrazet F., Pellerin D., Prigent A., Daou D., Cohen L., Veyrat C.",29149,American Journal of Cardiology,88,4,0,0,0,0,0,0,0,0,0,0,0,0,0,0,0,0,0,0,0,0,0,0,0,0,0,0,0,0,0,0,0,0,0,2,7,1,3,1,0,0,1,0,0,0,0,0,0,0,1,0,0,0,0,16
1991,Introducing new deformable surfaces to segment 3D images,"Cohen Isaac, Cohen Laurent D., Ayache Nicholas",,,, ,0,0,0,0,0,0,0,0,0,0,0,0,0,0,0,0,0,0,0,0,0,0,0,2,1,0,2,2,1,2,0,0,1,1,2,0,0,1,0,0,0,0,0,0,0,0,0,0,0,1,0,0,0,16
2008,Region-based 2D deformable generalized cylinder for narrow structures segmentation,"Mille J., Bone R., Cohen L.D.",3029743,Lecture Notes in Computer Science (including subseries Lecture Notes in Artificial Intelligence and Lecture Notes in Bioinformatics),5303,2,0,0,0,0,0,0,0,0,0,0,0,0,0,0,0,0,0,0,0,0,0,0,0,0,0,0,0,0,0,0,0,0,0,0,0,0,0,0,0,0,3,1,3,1,2,1,1,2,0,0,1,0,0,15
1996,Fast marching the global minimum of active contours,"Cohen Laurent D., Kimmel Ron",,IEEE International Conference on Image Processing,1, ,0,0,0,0,0,0,0,0,0,0,0,0,0,0,0,0,0,0,0,0,0,0,0,0,0,0,0,0,1,0,0,0,1,1,0,0,1,2,0,0,2,3,0,1,1,1,0,1,0,0,0,0,0,15
2014,"Longitudinal deformation models, spatial regularizations and learning strategies to quantify Alzheimer's disease progression","Fiot J.-B., Raguet H., Risser L., Cohen L.D., Fripp J., Vialard F.-X.",22131582,NeuroImage: Clinical,4, ,0,0,0,0,0,0,0,0,0,0,0,0,0,0,0,0,0,0,0,0,0,0,0,0,0,0,0,0,0,0,0,0,0,0,0,0,0,0,0,0,0,0,0,0,0,0,2,2,5,1,3,1,0,14
2009,Geodesic methods for shape and surface processing,"Peyre G., Cohen L.D.",18713033,Computational Methods in Applied Sciences,13, ,0,0,0,0,0,0,0,0,0,0,0,0,0,0,0,0,0,0,0,0,0,0,0,0,0,0,0,0,0,0,0,0,0,0,0,0,0,0,0,0,0,2,2,1,0,4,2,1,0,1,0,1,0,14
2006,3D brain segmentation using dual-front active contours with optional user interaction,"Li H., Yezzi A., Cohen L.D.",16874188,International Journal of Biomedical Imaging,2006, ,0,0,0,0,0,0,0,0,0,0,0,0,0,0,0,0,0,0,0,0,0,0,0,0,0,0,0,0,0,0,0,0,0,0,0,0,0,0,2,4,2,4,1,0,1,0,0,0,0,0,0,0,0,14
2002,A new image registration technique with free boundary constraints: Application to mammography,"Richard F., Cohen L.",3029743,Lecture Notes in Computer Science (including subseries Lecture Notes in Artificial Intelligence and Lecture Notes in Bioinformatics),2353, ,0,0,0,0,0,0,0,0,0,0,0,0,0,0,0,0,0,0,0,0,0,0,0,0,0,0,0,0,0,0,0,0,0,0,3,0,3,3,1,1,0,1,0,0,1,1,0,0,0,0,0,0,0,14
2014,Vessel extraction using anisotropic minimal paths and path score,"Chen D., Cohen L.D., Mirebeau J.-M.",,"2014 IEEE International Conference on Image Processing, ICIP 2014",, ,0,0,0,0,0,0,0,0,0,0,0,0,0,0,0,0,0,0,0,0,0,0,0,0,0,0,0,0,0,0,0,0,0,0,0,0,0,0,0,0,0,0,0,0,0,0,1,3,1,3,3,2,0,13
2009,Tubular anisotropy for 2D vessel segmentation,"Benmansour F., Cohen L.D., Law M.W.K., Chung A.C.S.",,"2009 IEEE Computer Society Conference on Computer Vision and Pattern Recognition Workshops, CVPR Workshops 2009",2009, ,0,0,0,0,0,0,0,0,0,0,0,0,0,0,0,0,0,0,0,0,0,0,0,0,0,0,0,0,0,0,0,0,0,0,0,0,0,0,0,0,1,2,2,1,5,0,1,0,1,0,0,0,0,13
2009,Deformable tree models for 2D and 3D branching structures extraction,"Mille J., Cohen L.D.",,"2009 IEEE Conference on Computer Vision and Pattern Recognition, CVPR 2009",, ,0,0,0,0,0,0,0,0,0,0,0,0,0,0,0,0,0,0,0,0,0,0,0,0,0,0,0,0,0,0,0,0,0,0,0,0,0,0,0,0,0,0,1,2,1,2,1,0,1,2,3,0,0,13
2005,Heuristically driven front propagation for geodesic paths extraction,"Peyre G., Cohen L.",3029743,Lecture Notes in Computer Science (including subseries Lecture Notes in Artificial Intelligence and Lecture Notes in Bioinformatics),3752, ,0,0,0,0,0,0,0,0,0,0,0,0,0,0,0,0,0,0,0,0,0,0,0,0,0,0,0,0,0,0,0,0,0,0,0,0,0,1,2,2,1,0,0,0,0,2,0,3,1,0,1,0,0,13
1997,Adaptive contrast method for segmentation of drusen,"Sbeh Zakaria Ben, Cohen Laurent D., Mimoun Gerard, Coscas Gabriel",,IEEE International Conference on Image Processing,1, ,0,0,0,0,0,0,0,0,0,0,0,0,0,0,0,0,0,0,0,0,0,0,0,0,0,0,0,0,0,0,0,0,0,0,0,0,0,0,1,1,2,0,1,0,4,1,0,0,1,1,0,0,0,12
2013,Global minimum for a variant Mumford-Shah model with application to medical image segmentation,"Chen D., Yang M., Cohen L.D.",21681163,Computer Methods in Biomechanics and Biomedical Engineering: Imaging and Visualization,1,1,0,0,0,0,0,0,0,0,0,0,0,0,0,0,0,0,0,0,0,0,0,0,0,0,0,0,0,0,0,0,0,0,0,0,0,0,0,0,0,0,0,0,0,0,0,3,1,3,0,0,4,0,0,11
2011,Texture segmentation via non-local non-parametric active contours,"Jung M., Peyre G., Cohen L.D.",3029743,Lecture Notes in Computer Science (including subseries Lecture Notes in Artificial Intelligence and Lecture Notes in Bioinformatics),6819, ,0,0,0,0,0,0,0,0,0,0,0,0,0,0,0,0,0,0,0,0,0,0,0,0,0,0,0,0,0,0,0,0,0,0,0,0,0,0,0,0,0,0,0,2,1,3,1,1,1,1,1,0,0,11
2005,A new implicit method for surface segmentation by minimal paths: Applications in 3D medical images,"Ardon R., Cohen L.D., Yezzi A.",3029743,Lecture Notes in Computer Science (including subseries Lecture Notes in Artificial Intelligence and Lecture Notes in Bioinformatics),3757, ,0,0,0,0,0,0,0,0,0,0,0,0,0,0,0,0,0,0,0,0,0,0,0,0,0,0,0,0,0,0,0,0,0,0,0,0,0,0,1,1,1,1,2,1,1,0,0,1,1,0,1,0,0,11
2016,Vessel tree extraction using radius-lifted keypoints searching scheme and anisotropic fast marching method,"Chen D., Mirebeau J.-M., Cohen L.D.",17483018,Journal of Algorithms and Computational Technology,10,4,0,0,0,0,0,0,0,0,0,0,0,0,0,0,0,0,0,0,0,0,0,0,0,0,0,0,0,0,0,0,0,0,0,0,0,0,0,0,0,0,0,0,0,0,0,0,0,0,0,6,2,2,0,10
2013,Efficient brain lesion segmentation using multi-modality tissue-based feature selection and support vector machines,"Fiot J.-B., Cohen L.D., Raniga P., Fripp J.",20407939,International Journal for Numerical Methods in Biomedical Engineering,29,9,0,0,0,0,0,0,0,0,0,0,0,0,0,0,0,0,0,0,0,0,0,0,0,0,0,0,0,0,0,0,0,0,0,0,0,0,0,0,0,0,0,0,0,0,1,0,2,3,1,1,2,0,0,10
2006,Landmark-based geodesic computation for heuristically driven path planning,"Peyre G., Cohen L.D.",,"Proceedings - 2006 IEEE Computer Society Conference on Computer Vision and Pattern Recognition, CVPR 2006",2, ,0,0,0,0,0,0,0,0,0,0,0,0,0,0,0,0,0,0,0,0,0,0,0,0,0,0,0,0,0,0,0,0,0,0,0,0,0,0,1,1,0,2,0,0,1,3,1,0,1,0,0,0,0,10
2008,3D shape matching by geodesic eccentricity,"Ton A., Peyre G., Kropatsch W.G., Artner N.M., Marmol S.B.L., Cohen L.",,"2008 IEEE Computer Society Conference on Computer Vision and Pattern Recognition Workshops, CVPR Workshops",, ,0,0,0,0,0,0,0,0,0,0,0,0,0,0,0,0,0,0,0,0,0,0,0,0,0,0,0,0,0,0,0,0,0,0,0,0,0,0,0,0,1,0,1,1,0,1,2,2,0,0,1,0,0,9
2006,Fast surface segmentation guided by user input using implicit extension of minimal paths,"Ardon R., Cohen L.D., Yezzi A.",9249907,Journal of Mathematical Imaging and Vision,25,3,0,0,0,0,0,0,0,0,0,0,0,0,0,0,0,0,0,0,0,0,0,0,0,0,0,0,0,0,0,0,0,0,0,0,0,0,0,0,0,0,2,1,3,1,0,0,0,1,0,0,1,0,0,9
2018,A variational-based fusion model for non-uniform illumination image enhancement via contrast optimization and color correction,"Tian Q.-C., Cohen L.D.",1651684,Signal Processing,153, ,0,0,0,0,0,0,0,0,0,0,0,0,0,0,0,0,0,0,0,0,0,0,0,0,0,0,0,0,0,0,0,0,0,0,0,0,0,0,0,0,0,0,0,0,0,0,0,0,0,0,4,4,0,8
2013,"Geodesic voting methods: Overview, extensions and application to blood vessel segmentation","Rouchdy Y., Cohen L.D.",21681163,Computer Methods in Biomechanics and Biomedical Engineering: Imaging and Visualization,1,2,0,0,0,0,0,0,0,0,0,0,0,0,0,0,0,0,0,0,0,0,0,0,0,0,0,0,0,0,0,0,0,0,0,0,0,0,0,0,0,0,0,0,0,0,0,3,2,1,1,0,1,0,0,8
2011,A geodesic voting method for the segmentation of tubular tree and centerlines,"Rouchdy Y., Cohen L.D.",19457928,Proceedings - International Symposium on Biomedical Imaging,, ,0,0,0,0,0,0,0,0,0,0,0,0,0,0,0,0,0,0,0,0,0,0,0,0,0,0,0,0,0,0,0,0,0,0,0,0,0,0,0,0,0,0,0,1,3,2,1,1,0,0,0,0,0,8
2007,A new implicit method for surface segmentation by minimal paths in 3D images,"Ardon R., Cohen L.D., Yezzi A.",954616,Applied Mathematics and Optimization,55,2,0,0,0,0,0,0,0,0,0,0,0,0,0,0,0,0,0,0,0,0,0,0,0,0,0,0,0,0,0,0,0,0,0,0,0,0,0,0,1,0,2,1,1,1,0,0,0,0,0,0,2,0,0,8
1996,Cardiac wall tracking using Doppler tissue imaging (DTI),"Cohen Laurent D., Pajany Floris, Pellerin Denis, Veyrat Colette",,IEEE International Conference on Image Processing,3, ,0,0,0,0,0,0,0,0,0,0,0,0,0,0,0,0,0,0,0,0,0,0,0,0,0,0,0,0,1,1,1,0,1,2,1,0,0,0,0,0,0,0,0,0,0,0,0,0,0,1,0,0,0,8
1992,Using deformable surfaces to segment 3-D images and infer differential structures,"Cohen I., Cohen L.D., Ayache N.",3029743,Lecture Notes in Computer Science (including subseries Lecture Notes in Artificial Intelligence and Lecture Notes in Bioinformatics),588, ,0,0,0,0,0,0,0,0,0,0,0,0,0,0,0,0,0,0,0,0,0,0,0,0,3,0,0,0,0,0,0,0,0,2,0,1,0,0,0,0,0,0,0,0,0,1,1,0,0,0,0,0,0,8
