," 作者:Cohen, Laurent D.",,,,,,,,,,,,,,,,,,,,,,,,,,,,,,,,,,,,,,,,,,,,,,,,,,,,,,,,,,,
2005,Geodesic computation for adaptive remeshing,"Peyre G., Cohen L.",,"Proceedings - 2005 IEEE Computer Society Conference on Computer Vision and Pattern Recognition, CVPR 2005",II, ,0,0,0,0,0,0,0,0,0,0,0,0,0,0,0,0,0,0,0,0,0,0,0,0,0,0,0,0,0,0,0,0,0,0,0,0,0,0,0,0,1,0,0,0,0,0,0,0,0,0,0,0,0,1
2004,A new Doppler tissue ratio to revisit systole: The pre-ejectional isovolumic to ejectional velocity ratio-application to aging,"Veyrat C., Larrazet F., Cohen L., Laborde F., Pellerin D.",8947317,Journal of the American Society of Echocardiography,17,12,0,0,0,0,0,0,0,0,0,0,0,0,0,0,0,0,0,0,0,0,0,0,0,0,0,0,0,0,0,0,0,0,0,0,0,0,1,0,0,0,0,0,0,0,0,0,0,0,0,0,0,0,0,1
2001,Multiple contour finding and perceptual grouping using minimal paths,Cohen L.D.,,"Proceedings - IEEE Workshop on Variational and Level Set Methods in Computer Vision, VLSM 2001",, ,0,0,0,0,0,0,0,0,0,0,0,0,0,0,0,0,0,0,0,0,0,0,0,0,0,0,0,0,0,0,0,0,0,0,0,0,0,0,0,0,0,0,0,1,0,0,0,0,0,0,0,0,0,1
2019,Vessel extraction using crossing-adaptive minimal path model with anisotropic enhancement and curvature constraint,"Liu L., Chen D., Cohen L.D., Shu H., Paques M.",19457928,Proceedings - International Symposium on Biomedical Imaging,2019-, ,0,0,0,0,0,0,0,0,0,0,0,0,0,0,0,0,0,0,0,0,0,0,0,0,0,0,0,0,0,0,0,0,0,0,0,0,0,0,0,0,0,0,0,0,0,0,0,0,0,0,0,0,0,0
2019,Shape Part Transfer via Semantic Latent Space Factorization,"Groscot R., Cohen L., Guibas L.",3029743,Lecture Notes in Computer Science (including subseries Lecture Notes in Artificial Intelligence and Lecture Notes in Bioinformatics),11712, ,0,0,0,0,0,0,0,0,0,0,0,0,0,0,0,0,0,0,0,0,0,0,0,0,0,0,0,0,0,0,0,0,0,0,0,0,0,0,0,0,0,0,0,0,0,0,0,0,0,0,0,0,0,0
2019,Asymmetric geodesic distance propagation for active contours,"Chen D., Spencer J., Mirebeau J.-M., Chen K., Cohen L.D.",,"British Machine Vision Conference 2018, BMVC 2018",, ,0,0,0,0,0,0,0,0,0,0,0,0,0,0,0,0,0,0,0,0,0,0,0,0,0,0,0,0,0,0,0,0,0,0,0,0,0,0,0,0,0,0,0,0,0,0,0,0,0,0,0,0,0,0
2019,From active contours to minimal geodesic paths: New solutions to active contours problems by Eikonal equations,"Chen D., Cohen L.D.",15708659,Handbook of Numerical Analysis,20, ,0,0,0,0,0,0,0,0,0,0,0,0,0,0,0,0,0,0,0,0,0,0,0,0,0,0,0,0,0,0,0,0,0,0,0,0,0,0,0,0,0,0,0,0,0,0,0,0,0,0,0,0,0,0
2019,Geodesic via Asymmetric Heat Diffusion Based on Finsler Metric,"Yang F., Chai L., Chen D., Cohen L.",3029743,Lecture Notes in Computer Science (including subseries Lecture Notes in Artificial Intelligence and Lecture Notes in Bioinformatics),11365, ,0,0,0,0,0,0,0,0,0,0,0,0,0,0,0,0,0,0,0,0,0,0,0,0,0,0,0,0,0,0,0,0,0,0,0,0,0,0,0,0,0,0,0,0,0,0,0,0,0,0,0,0,0,0
2018,A New Dynamic Minimal Path Model for Tubular Structure Centerline Delineation,"Chen D., Cohen L.D.",10514651,Proceedings - International Conference on Pattern Recognition,2018-, ,0,0,0,0,0,0,0,0,0,0,0,0,0,0,0,0,0,0,0,0,0,0,0,0,0,0,0,0,0,0,0,0,0,0,0,0,0,0,0,0,0,0,0,0,0,0,0,0,0,0,0,0,0,0
2018,Vehicle X-ray images registration,"Marciano A., Cohen L.D., Gadi N.",3029743,Lecture Notes in Computer Science (including subseries Lecture Notes in Artificial Intelligence and Lecture Notes in Bioinformatics),10746, ,0,0,0,0,0,0,0,0,0,0,0,0,0,0,0,0,0,0,0,0,0,0,0,0,0,0,0,0,0,0,0,0,0,0,0,0,0,0,0,0,0,0,0,0,0,0,0,0,0,0,0,0,0,0
2018,Fast asymmetric fronts propagation for voronoi region partitioning and image segmentation,"Chen D., Cohen L.D.",3029743,Lecture Notes in Computer Science (including subseries Lecture Notes in Artificial Intelligence and Lecture Notes in Bioinformatics),10746, ,0,0,0,0,0,0,0,0,0,0,0,0,0,0,0,0,0,0,0,0,0,0,0,0,0,0,0,0,0,0,0,0,0,0,0,0,0,0,0,0,0,0,0,0,0,0,0,0,0,0,0,0,0,0
2016,Incorporating shape variability in implicit template deformation for image segmentation,"Prevost R., Cuingnet R., Mory B., Cohen L.D., Ardon R.",,Biomedical Image Segmentation: Advances and Trends,, ,0,0,0,0,0,0,0,0,0,0,0,0,0,0,0,0,0,0,0,0,0,0,0,0,0,0,0,0,0,0,0,0,0,0,0,0,0,0,0,0,0,0,0,0,0,0,0,0,0,0,0,0,0,0
2015,Combination of piecewise-geodesic curves for interactive image segmentation,"Mille J., Bougleux S., Cohen L.D.",3029743,Lecture Notes in Computer Science (including subseries Lecture Notes in Artificial Intelligence and Lecture Notes in Bioinformatics),9213, ,0,0,0,0,0,0,0,0,0,0,0,0,0,0,0,0,0,0,0,0,0,0,0,0,0,0,0,0,0,0,0,0,0,0,0,0,0,0,0,0,0,0,0,0,0,0,0,0,0,0,0,0,0,0
2014,JMIV special issue mathematics and image analysis,"Peyre G., Fadili J., Aujol J.-F., Cohen L.D.",9249907,Journal of Mathematical Imaging and Vision,48,2,0,0,0,0,0,0,0,0,0,0,0,0,0,0,0,0,0,0,0,0,0,0,0,0,0,0,0,0,0,0,0,0,0,0,0,0,0,0,0,0,0,0,0,0,0,0,0,0,0,0,0,0,0,0
2014,Special Issue on biomedical image segmentation using variational and statistical approaches,"Cohen L.D., Djemal K., Ruan S., Toumoulin C.",19590318,IRBM,35,1,0,0,0,0,0,0,0,0,0,0,0,0,0,0,0,0,0,0,0,0,0,0,0,0,0,0,0,0,0,0,0,0,0,0,0,0,0,0,0,0,0,0,0,0,0,0,0,0,0,0,0,0,0,0
2012,Automatic detection and segmentation of renal lesions in 3D contrast-enhanced ultrasound images,"Prevost R., Cohen L.D., Correas J.-M., Ardon R.",16057422,Progress in Biomedical Optics and Imaging - Proceedings of SPIE,8314, ,0,0,0,0,0,0,0,0,0,0,0,0,0,0,0,0,0,0,0,0,0,0,0,0,0,0,0,0,0,0,0,0,0,0,0,0,0,0,0,0,0,0,0,0,0,0,0,0,0,0,0,0,0,0
2012,Multimodality imaging population analysis using manifold learning,"Fiot J.-B., Cohen L.D., Bourgeat P., Raniga P., Acosta O., Villemagne V., Salvado O., Fripp J.",,"Computational Vision and Medical Image Processing, Proceedings of VipIMAGE 2011 - 3rd ECCOMAS Thematic Conference on Computational Vision and Medical Image Processing",, ,0,0,0,0,0,0,0,0,0,0,0,0,0,0,0,0,0,0,0,0,0,0,0,0,0,0,0,0,0,0,0,0,0,0,0,0,0,0,0,0,0,0,0,0,0,0,0,0,0,0,0,0,0,0
2012,Efficient lesion segmentation using support vector machines,"Fiot J.-B., Cohen L.D., Raniga P., Fripp J.",,"Computational Vision and Medical Image Processing, Proceedings of VipIMAGE 2011 - 3rd ECCOMAS Thematic Conference on Computational Vision and Medical Image Processing",, ,0,0,0,0,0,0,0,0,0,0,0,0,0,0,0,0,0,0,0,0,0,0,0,0,0,0,0,0,0,0,0,0,0,0,0,0,0,0,0,0,0,0,0,0,0,0,0,0,0,0,0,0,0,0
2011,JMIV special issue : Mathematics and image analysis,"Peyre G., Cohen L.D., Weickert J.",9249907,Journal of Mathematical Imaging and Vision,41, 1-2,0,0,0,0,0,0,0,0,0,0,0,0,0,0,0,0,0,0,0,0,0,0,0,0,0,0,0,0,0,0,0,0,0,0,0,0,0,0,0,0,0,0,0,0,0,0,0,0,0,0,0,0,0,0
2009,An implicit method for interpolating two digital closed curves on parallel planes,"Gabrielides N., Cohen L.",3029743,Lecture Notes in Computer Science (including subseries Lecture Notes in Artificial Intelligence and Lecture Notes in Bioinformatics),5567, ,0,0,0,0,0,0,0,0,0,0,0,0,0,0,0,0,0,0,0,0,0,0,0,0,0,0,0,0,0,0,0,0,0,0,0,0,0,0,0,0,0,0,0,0,0,0,0,0,0,0,0,0,0,0
2009,Journal of Mathematical Imaging and Vision: Guest editorial,"Cohen L.D., Sochen N., Vese L.A.",9249907,Journal of Mathematical Imaging and Vision,33,2,0,0,0,0,0,0,0,0,0,0,0,0,0,0,0,0,0,0,0,0,0,0,0,0,0,0,0,0,0,0,0,0,0,0,0,0,0,0,0,0,0,0,0,0,0,0,0,0,0,0,0,0,0,0
2008,Finding a closed boundary by growing minimal paths from a single point,"Benmansour F., Bonneau S., Cohen L.",,Proceedings of VIPIMAGE 2007 - 1st ECCOMAS Thematic Conference on Computational Vision and Medical Image Processing,, ,0,0,0,0,0,0,0,0,0,0,0,0,0,0,0,0,0,0,0,0,0,0,0,0,0,0,0,0,0,0,0,0,0,0,0,0,0,0,0,0,0,0,0,0,0,0,0,0,0,0,0,0,0,0
2006,Journal of Mathematical Imaging and Vision: Guest editorial,Cohen L.D.,9249907,Journal of Mathematical Imaging and Vision,25,3,0,0,0,0,0,0,0,0,0,0,0,0,0,0,0,0,0,0,0,0,0,0,0,0,0,0,0,0,0,0,0,0,0,0,0,0,0,0,0,0,0,0,0,0,0,0,0,0,0,0,0,0,0,0
2005,"Implicit surface segmentation by minimal paths, applications in 3D medical images","Ardon R., Cohen L.D., Yezzi A.",15224880,"Proceedings - International Conference on Image Processing, ICIP",1, ,0,0,0,0,0,0,0,0,0,0,0,0,0,0,0,0,0,0,0,0,0,0,0,0,0,0,0,0,0,0,0,0,0,0,0,0,0,0,0,0,0,0,0,0,0,0,0,0,0,0,0,0,0,0
2004,"Efficient Initialization for Constrained Active Surfaces, Applications in 3D Medical Images","Ardon R., Cohen L.D.",3029743,Lecture Notes in Computer Science (including subseries Lecture Notes in Artificial Intelligence and Lecture Notes in Bioinformatics),3117, ,0,0,0,0,0,0,0,0,0,0,0,0,0,0,0,0,0,0,0,0,0,0,0,0,0,0,0,0,0,0,0,0,0,0,0,0,0,0,0,0,0,0,0,0,0,0,0,0,0,0,0,0,0,0
2004,Journal of Mathematical Imaging and Vision: Guest Editorial,Cohen L.D.,9249907,Journal of Mathematical Imaging and Vision,20, 1-2,0,0,0,0,0,0,0,0,0,0,0,0,0,0,0,0,0,0,0,0,0,0,0,0,0,0,0,0,0,0,0,0,0,0,0,0,0,0,0,0,0,0,0,0,0,0,0,0,0,0,0,0,0,0
2001,Guest editor's introduction,Cohen L.D.,9249907,Journal of Mathematical Imaging and Vision,14,3,0,0,0,0,0,0,0,0,0,0,0,0,0,0,0,0,0,0,0,0,0,0,0,0,0,0,0,0,0,0,0,0,0,0,0,0,0,0,0,0,0,0,0,0,0,0,0,0,0,0,0,0,0,0
2001,Optical flow and image registration: A new local rigidity approach for global minimization,"Lefebure M., Cohen L.D.",3029743,Lecture Notes in Computer Science (including subseries Lecture Notes in Artificial Intelligence and Lecture Notes in Bioinformatics),2134, ,0,0,0,0,0,0,0,0,0,0,0,0,0,0,0,0,0,0,0,0,0,0,0,0,0,0,0,0,0,0,0,0,0,0,0,0,0,0,0,0,0,0,0,0,0,0,0,0,0,0,0,0,0,0
2001,"Image registration, optical flow, and local rigidity","Lefebure M., Cohen L.D.",3029743,Lecture Notes in Computer Science (including subseries Lecture Notes in Artificial Intelligence and Lecture Notes in Bioinformatics),2106, ,0,0,0,0,0,0,0,0,0,0,0,0,0,0,0,0,0,0,0,0,0,0,0,0,0,0,0,0,0,0,0,0,0,0,0,0,0,0,0,0,0,0,0,0,0,0,0,0,0,0,0,0,0,0
2000,An as-built on-line modeling tehnique: AOMS,"Dumont A., Jallon F., Monnerie J.B., Naudet S., Viala M., Sayd P., Cohen L.",16821750,"International Archives of the Photogrammetry, Remote Sensing and Spatial Information Sciences - ISPRS Archives",33, ,0,0,0,0,0,0,0,0,0,0,0,0,0,0,0,0,0,0,0,0,0,0,0,0,0,0,0,0,0,0,0,0,0,0,0,0,0,0,0,0,0,0,0,0,0,0,0,0,0,0,0,0,0,0
1991,"Segmenting, visualizing and characterizing 3D anatomical structures with deformable surfaces","Cohen Isaac, Ayache Nicholas, Cohen Laurent",5891019,Proceedings of the Annual Conference on Engineering in Medicine and Biology,13,3,0,0,0,0,0,0,0,0,0,0,0,0,0,0,0,0,0,0,0,0,0,0,0,0,0,0,0,0,0,0,0,0,0,0,0,0,0,0,0,0,0,0,0,0,0,0,0,0,0,0,0,0,0,0
