," 作者:Jordan, Michael I.",,,,,,,,,,,,,,,,,,,,,,,,,,,,,,,,,,,,,,,,,,,,,,,,,,,,,,,,,,,
2013,Efficient ranking from pairwise comparisons,"Wauthier F.L., Jordan M.I., Jojic N.",,"30th International Conference on Machine Learning, ICML 2013",,2,0,0,0,0,0,0,0,0,0,0,0,0,0,0,0,0,0,0,0,0,0,0,0,0,0,0,0,0,0,0,0,0,0,0,0,0,0,0,0,0,0,0,0,0,0,5,6,13,7,6,4,0,0,41
1997,Hidden Markov decision trees,"Jordan M.I., Ghahramanit Z., Saul L.K.",10495258,Advances in Neural Information Processing Systems,, ,0,0,0,0,0,0,0,0,0,0,0,0,0,0,0,0,0,0,0,0,0,0,0,0,0,0,0,0,1,1,3,3,2,4,6,2,1,3,1,0,0,1,0,2,0,3,2,4,0,1,1,0,0,41
2014,Joint modeling of multiple time series via the beta process with application to motion capture segmentation,"Fox E.B., Hughes M.C., Sudderth E.B., Jordan M.I.",19326157,Annals of Applied Statistics,8,3,0,0,0,0,0,0,0,0,0,0,0,0,0,0,0,0,0,0,0,0,0,0,0,0,0,0,0,0,0,0,0,0,0,0,0,0,0,0,0,0,0,0,0,0,0,3,4,3,5,11,13,1,0,40
2009,Spectral clustering with perturbed data,"Huang L., Yan D., Jordan M.I., Taft N.",,Advances in Neural Information Processing Systems 21 - Proceedings of the 2008 Conference,, ,0,0,0,0,0,0,0,0,0,0,0,0,0,0,0,0,0,0,0,0,0,0,0,0,0,0,0,0,0,0,0,0,0,0,0,0,0,0,0,0,2,5,6,5,3,6,0,4,4,2,3,0,0,40
1994,A model of the learning of arm trajectories from spatial deviations,"Jordan M.I., Flash T., Arnon Y.",0898929X,Journal of Cognitive Neuroscience,6,4,0,0,0,0,0,0,0,0,0,0,0,0,0,0,0,0,0,0,0,0,0,0,0,0,0,0,2,3,4,2,4,2,2,2,2,4,1,1,2,0,1,2,2,2,1,1,0,0,0,0,0,0,0,40
2011,Genome-scale phylogenetic function annotation of large and diverse protein families,"Engelhardt B.E., Jordan M.I., Srouji J.R., Brenner S.E.",10889051,Genome Research,21,11,0,0,0,0,0,0,0,0,0,0,0,0,0,0,0,0,0,0,0,0,0,0,0,0,0,0,0,0,0,0,0,0,0,0,0,0,0,0,0,0,0,0,0,4,5,8,7,4,5,4,2,0,0,39
2003,Robust novelty detection with single-class MPM,"Lanckriet G.R.G., El Ghaoui L., Jordan M.I.",10495258,Advances in Neural Information Processing Systems,, ,0,0,0,0,0,0,0,0,0,0,0,0,0,0,0,0,0,0,0,0,0,0,0,0,0,0,0,0,0,0,0,0,0,0,0,1,1,1,3,2,6,4,0,1,2,7,4,2,0,0,4,1,0,39
2015,Adding vs. averaging in distributed primal-dual optimization,"Ma C., Smith V., Jaggi M., Jordan M.I., Richtarik P., Takac M.",,"32nd International Conference on Machine Learning, ICML 2015",3, ,0,0,0,0,0,0,0,0,0,0,0,0,0,0,0,0,0,0,0,0,0,0,0,0,0,0,0,0,0,0,0,0,0,0,0,0,0,0,0,0,0,0,0,0,0,0,2,5,12,9,6,4,0,38
2013,Bayesian semiparametric Wiener system identification,"Lindsten F., Schon T.B., Jordan M.I.",51098,Automatica,49,7,0,0,0,0,0,0,0,0,0,0,0,0,0,0,0,0,0,0,0,0,0,0,0,0,0,0,0,0,0,0,0,0,0,0,0,0,0,0,0,0,0,0,0,0,1,4,4,2,9,7,9,1,0,37
2007,A randomization test for controlling population stratification in whole-genome association studies,"Kimmel G., Jordan M.I., Halperin E., Shamir R., Karp R.M.",29297,American Journal of Human Genetics,81,5,0,0,0,0,0,0,0,0,0,0,0,0,0,0,0,0,0,0,0,0,0,0,0,0,0,0,0,0,0,0,0,0,0,0,0,0,0,0,0,9,4,7,9,2,1,1,2,0,0,1,1,0,0,37
2003,A minimal intervention principle for coordinated movement,"Todorov E., Jordan M.I.",10495258,Advances in Neural Information Processing Systems,, ,0,0,0,0,0,0,0,0,0,0,0,0,0,0,0,0,0,0,0,0,0,0,0,0,0,0,0,0,0,0,0,0,0,0,0,1,0,0,2,3,2,3,3,0,1,1,4,4,2,4,4,3,0,37
2007,Regression on manifolds using kernel dimension reduction,"Nilsson J., Sha F., Jordan M.I.",,ACM International Conference Proceeding Series,227, ,0,0,0,0,0,0,0,0,0,0,0,0,0,0,0,0,0,0,0,0,0,0,0,0,0,0,0,0,0,0,0,0,0,0,0,0,0,0,0,1,4,2,4,1,4,2,3,3,4,3,4,1,0,36
2006,Word alignment via quadratic assignment,"Lacoste-Julien S., Ben T., Klein D., Jordan M.I.",,"HLT-NAACL 2006 - Human Language Technology Conference of the North American Chapter of the Association of Computational Linguistics, Proceedings of the Main Conference",, ,0,0,0,0,0,0,0,0,0,0,0,0,0,0,0,0,0,0,0,0,0,0,0,0,0,0,0,0,0,0,0,0,0,0,0,0,0,2,6,0,3,7,4,2,4,2,2,0,1,0,2,1,0,36
2004,Multiple-sequence functional annotation and the generalized hidden Markov phylogeny,"McAuliffe J.D., Pachter L., Jordan M.I.",13674803,Bioinformatics,20,12,0,0,0,0,0,0,0,0,0,0,0,0,0,0,0,0,0,0,0,0,0,0,0,0,0,0,0,0,0,0,0,0,0,0,0,1,7,3,9,6,3,1,0,2,1,1,0,1,0,0,1,0,0,36
1992,Constrained supervised learning,Jordan M.I.,222496,Journal of Mathematical Psychology,36,3,0,0,0,0,0,0,0,0,0,0,0,0,0,0,0,0,0,0,0,0,0,0,0,1,2,5,3,2,3,1,2,3,0,1,1,0,0,2,0,1,1,2,2,1,2,0,0,0,1,0,0,0,0,36
2013,Local privacy and minimax bounds: Sharp rates for probability estimation,"Duchi J.C., Jordan M.I., Wainwright M.J.",10495258,Advances in Neural Information Processing Systems,, ,0,0,0,0,0,0,0,0,0,0,0,0,0,0,0,0,0,0,0,0,0,0,0,0,0,0,0,0,0,0,0,0,0,0,0,0,0,0,0,0,0,0,0,0,0,4,3,5,4,10,7,2,0,35
2012,Phylogenetic inference via sequential monte carlo,"Bouchard-Cote A., Sankararaman S., Jordan M.I.",10635157,Systematic Biology,61,4,0,0,0,0,0,0,0,0,0,0,0,0,0,0,0,0,0,0,0,0,0,0,0,0,0,0,0,0,0,0,0,0,0,0,0,0,0,0,0,0,0,0,0,2,6,4,4,4,5,5,4,1,0,35
2002,Thin junction trees,"Bach F.R., Jordan M.I.",10495258,Advances in Neural Information Processing Systems,, ,0,0,0,0,0,0,0,0,0,0,0,0,0,0,0,0,0,0,0,0,0,0,0,0,0,0,0,0,0,0,0,0,0,0,0,1,4,4,4,5,3,1,1,4,3,1,0,0,1,2,1,0,0,35
2017,Non-convex finite-sum optimization via SCSG methods,"Lei L., Ju C., Chen J., Jordan M.I.",10495258,Advances in Neural Information Processing Systems,2017-, ,0,0,0,0,0,0,0,0,0,0,0,0,0,0,0,0,0,0,0,0,0,0,0,0,0,0,0,0,0,0,0,0,0,0,0,0,0,0,0,0,0,0,0,0,0,0,0,0,0,20,12,2,0,34
2008,On the inference of ancestries in admixed populations,"Sankararaman S., Kimmel G., Halperin E., Jordan M.I.",10889051,Genome Research,18,4,0,0,0,0,0,0,0,0,0,0,0,0,0,0,0,0,0,0,0,0,0,0,0,0,0,0,0,0,0,0,0,0,0,0,0,0,0,0,0,1,5,3,3,4,4,5,5,0,2,1,1,0,0,34
2014,Privacy aware learning,"Duchi J.C., Jordan M.I., Wainwright M.J.",45411,Journal of the ACM,61,6,0,0,0,0,0,0,0,0,0,0,0,0,0,0,0,0,0,0,0,0,0,0,0,0,0,0,0,0,0,0,0,0,0,0,0,0,0,0,0,0,0,0,0,0,0,0,1,7,8,3,11,3,0,33
2010,An analysis of the convergence of graph Laplacians,"Ting D., Huang L., Jordan M.I.",,"ICML 2010 - Proceedings, 27th International Conference on Machine Learning",, ,0,0,0,0,0,0,0,0,0,0,0,0,0,0,0,0,0,0,0,0,0,0,0,0,0,0,0,0,0,0,0,0,0,0,0,0,0,0,0,0,0,0,1,1,2,1,5,7,4,4,5,3,0,33
2009,Estimating divergence functionals and the likelihood ratio by penalized convex risk minimization,"Nguyen X.L., Wainwright M.J., Jordan M.I.",,Advances in Neural Information Processing Systems 20 - Proceedings of the 2007 Conference,, ,0,0,0,0,0,0,0,0,0,0,0,0,0,0,0,0,0,0,0,0,0,0,0,0,0,0,0,0,0,0,0,0,0,0,0,0,0,0,0,2,6,9,3,2,3,5,1,0,2,0,0,0,0,33
2014,Matrix concentration inequalities via the method of exchangeable pairs,"Mackey L., Jordan M.I., Chen R.Y., Farrell B., Tropp J.A.",911798,Annals of Probability,42,3,0,0,0,0,0,0,0,0,0,0,0,0,0,0,0,0,0,0,0,0,0,0,0,0,0,0,0,0,0,0,0,0,0,0,0,0,0,0,0,0,0,0,0,0,0,1,2,7,8,7,5,2,0,32
2012,Small-variance asymptotics for exponential family Dirichlet process mixture models,"Jiang K., Kulis B., Jordan M.I.",10495258,Advances in Neural Information Processing Systems,4, ,0,0,0,0,0,0,0,0,0,0,0,0,0,0,0,0,0,0,0,0,0,0,0,0,0,0,0,0,0,0,0,0,0,0,0,0,0,0,0,0,0,0,0,0,1,4,8,8,3,3,4,1,0,32
2012,Active spectral clustering via iterative uncertainty reduction,"Wauthier F.L., Jojic N., Jordan M.I.",,Proceedings of the ACM SIGKDD International Conference on Knowledge Discovery and Data Mining,, ,0,0,0,0,0,0,0,0,0,0,0,0,0,0,0,0,0,0,0,0,0,0,0,0,0,0,0,0,0,0,0,0,0,0,0,0,0,0,0,0,0,0,0,0,3,4,7,5,8,4,1,0,0,32
2010,Mixed membership matrix factorization,"Mackey L., Weiss D., Jordan M.I.",,"ICML 2010 - Proceedings, 27th International Conference on Machine Learning",, ,0,0,0,0,0,0,0,0,0,0,0,0,0,0,0,0,0,0,0,0,0,0,0,0,0,0,0,0,0,0,0,0,0,0,0,0,0,0,0,0,0,0,2,6,4,8,5,5,1,1,0,0,0,32
1999,Are Reaching Movements Planned to be Straight and Invariant in the Extrinsic Space? Kinematic Comparison between Compliant and Unconstrained Motions,"Desmurget M., Prablanc C., Jordan M., Jeannerod M.",2724987,Quarterly Journal of Experimental Psychology Section A: Human Experimental Psychology,52,4,0,0,0,0,0,0,0,0,0,0,0,0,0,0,0,0,0,0,0,0,0,0,0,0,0,0,0,0,0,0,0,1,2,1,1,2,3,2,2,1,2,5,1,2,1,3,1,1,0,0,1,0,0,32
2005,Computing regularization paths for learning multiple kernels,"Bach F.R., Thibaux R., Jordan M.I.",10495258,Advances in Neural Information Processing Systems,, ,0,0,0,0,0,0,0,0,0,0,0,0,0,0,0,0,0,0,0,0,0,0,0,0,0,0,0,0,0,0,0,0,0,0,0,0,2,1,7,1,1,2,3,0,3,3,2,1,3,0,2,0,0,31
2017,How to escape saddle points efficiently,"Jin C., Ge R., Netrapalli P., Kakade S.M., Jordan M.I.",,"34th International Conference on Machine Learning, ICML 2017",4, ,0,0,0,0,0,0,0,0,0,0,0,0,0,0,0,0,0,0,0,0,0,0,0,0,0,0,0,0,0,0,0,0,0,0,0,0,0,0,0,0,0,0,0,0,0,0,0,0,1,10,17,2,0,30
2014,Iterative discovery of multiple alternativeclustering views,"Niu D., Dy J.G., Jordan M.I.",1628828,IEEE Transactions on Pattern Analysis and Machine Intelligence,36,7,0,0,0,0,0,0,0,0,0,0,0,0,0,0,0,0,0,0,0,0,0,0,0,0,0,0,0,0,0,0,0,0,0,0,0,0,0,0,0,0,0,0,0,0,0,0,4,5,5,9,2,5,0,30
2012,"Beta processes, stick-breaking and power laws","Broderick T., Jordan M.I., Pitman J.",19360975,Bayesian Analysis,7,2,0,0,0,0,0,0,0,0,0,0,0,0,0,0,0,0,0,0,0,0,0,0,0,0,0,0,0,0,0,0,0,0,0,0,0,0,0,0,0,0,0,0,0,1,4,1,5,4,0,8,6,1,0,30
2011,Nonparametric Bayesian co-clustering ensembles,"Wang P., Laskey K.B., Domeniconi C., Jordan M.I.",,"Proceedings of the 11th SIAM International Conference on Data Mining, SDM 2011",, ,0,0,0,0,0,0,0,0,0,0,0,0,0,0,0,0,0,0,0,0,0,0,0,0,0,0,0,0,0,0,0,0,0,0,0,0,0,0,0,0,0,0,0,1,6,3,6,5,3,3,2,1,0,30
2010,Detecting large-scale system problems by mining console logs,"Xu W., Huang L., Fox A., Patterson D., Jordan M.I.",,"ICML 2010 - Proceedings, 27th International Conference on Machine Learning",, ,0,0,0,0,0,0,0,0,0,0,0,0,0,0,0,0,0,0,0,0,0,0,0,0,0,0,0,0,0,0,0,0,0,0,0,0,0,0,0,0,0,1,1,2,4,1,1,7,4,3,4,2,0,30
1998,Approximating posterior distributions in belief networks using mixtures,"Bishop C.M., Lawrence N., Jaakkola T., Jordan M.I.",10495258,Advances in Neural Information Processing Systems,, ,0,0,0,0,0,0,0,0,0,0,0,0,0,0,0,0,0,0,0,0,0,0,0,0,0,0,0,0,0,0,3,1,0,0,1,1,0,3,1,3,3,1,1,2,2,0,0,2,2,2,2,0,0,30
2016,Spectral methods meet EM: A provably optimal algorithm for crowdsourcing,"Zhang Y., Chen X., Zhou D., Jordan M.I.",15324435,Journal of Machine Learning Research,17, ,0,0,0,0,0,0,0,0,0,0,0,0,0,0,0,0,0,0,0,0,0,0,0,0,0,0,0,0,0,0,0,0,0,0,0,0,0,0,0,0,0,0,0,0,0,0,0,1,7,7,11,3,0,29
2013,"Estimation, optimization, and parallelism when data is sparse","Duchi J.C., Jordan M.I., McMahan H.B.",10495258,Advances in Neural Information Processing Systems,, ,0,0,0,0,0,0,0,0,0,0,0,0,0,0,0,0,0,0,0,0,0,0,0,0,0,0,0,0,0,0,0,0,0,0,0,0,0,0,0,0,0,0,0,0,0,2,4,10,5,4,3,1,0,29
2008,Multiway spectral clustering: A maragin-based persoective,"Zhang Z., Jordan M.I.",8834237,Statistical Science,23,3,0,0,0,0,0,0,0,0,0,0,0,0,0,0,0,0,0,0,0,0,0,0,0,0,0,0,0,0,0,0,0,0,0,0,0,0,0,0,0,0,2,1,2,3,5,5,3,1,3,3,1,0,0,29
2005,Discriminative training of hidden Markov models for multiple pitch tracking,"Bach F.R., Jordan M.I.",15206149,"ICASSP, IEEE International Conference on Acoustics, Speech and Signal Processing - Proceedings",V, ,0,0,0,0,0,0,0,0,0,0,0,0,0,0,0,0,0,0,0,0,0,0,0,0,0,0,0,0,0,0,0,0,0,0,0,0,2,3,0,0,1,3,5,4,4,3,1,0,2,1,0,0,0,29
2004,Logos: A modular Bayesian model for de novo motif detection,"Xing E.P., Wu W., Jordan M.I., Karp R.M.",2197200,Journal of Bioinformatics and Computational Biology,2,1,0,0,0,0,0,0,0,0,0,0,0,0,0,0,0,0,0,0,0,0,0,0,0,0,0,0,0,0,0,0,0,0,0,0,0,1,2,8,2,9,0,1,2,0,1,0,0,0,1,0,2,0,0,29
1993,The cascade neural network model and a speed-accuracy trade-off of arm movement,"Hirayama M., Kawato M., Jordan M.I.",222895,Journal of Motor Behavior,25,3,0,0,0,0,0,0,0,0,0,0,0,0,0,0,0,0,0,0,0,0,0,0,0,0,0,0,2,1,4,1,1,1,0,1,1,1,2,2,2,0,1,1,4,1,1,1,1,0,0,0,0,0,0,29
1991,A more biologically plausible learning rule than backpropagation applied to a network model of cortical area 7a,"Mazzoni P., Andersen R.A., Jordan M.I.",10473211,Cerebral Cortex,1,4,0,0,0,0,0,0,0,0,0,0,0,0,0,0,0,0,0,0,0,0,0,0,0,3,1,4,2,1,0,1,2,0,0,0,1,1,1,0,0,2,1,2,3,2,0,0,1,0,1,0,0,0,0,29
2013,Distributed low-rank subspace segmentation,"Talwalkar A., MacKey L., Mu Y., Chang S.-F., Jordan M.I.",,Proceedings of the IEEE International Conference on Computer Vision,, ,0,0,0,0,0,0,0,0,0,0,0,0,0,0,0,0,0,0,0,0,0,0,0,0,0,0,0,0,0,0,0,0,0,0,0,0,0,0,0,0,0,0,0,0,0,2,5,8,7,2,3,1,0,28
2011,A unified probabilistic model for global and local unsupervised feature selection,"Guan Y., Dy J.G., Jordan M.I.",,"Proceedings of the 28th International Conference on Machine Learning, ICML 2011",, ,0,0,0,0,0,0,0,0,0,0,0,0,0,0,0,0,0,0,0,0,0,0,0,0,0,0,0,0,0,0,0,0,0,0,0,0,0,0,0,0,0,0,0,3,5,3,8,2,3,0,4,0,0,28
2009,High-dimensional support union recovery in multivariate regression,"Obozinski G., Wainwright M.J., Jordan M.I.",,Advances in Neural Information Processing Systems 21 - Proceedings of the 2008 Conference,, ,0,0,0,0,0,0,0,0,0,0,0,0,0,0,0,0,0,0,0,0,0,0,0,0,0,0,0,0,0,0,0,0,0,0,0,0,0,0,0,0,6,3,1,5,2,3,1,1,3,2,0,1,0,28
2007,Bayesian haplotype inference via the dirichlet process,"Xing E.P., Jordan M.I., Sharan R.",10665277,Journal of Computational Biology,14,3,0,0,0,0,0,0,0,0,0,0,0,0,0,0,0,0,0,0,0,0,0,0,0,0,0,0,0,0,0,0,0,0,0,0,0,0,0,0,0,2,5,7,3,2,1,0,1,4,0,2,1,0,0,28
2005,Lessons from Escherichia coli genes similarly regulated in response to nitrogen and sulfur limitation,"Gyaneshwar P., Paliy O., McAuliffe J., Jones A., Jordan M.I., Kustu S.",278424,Proceedings of the National Academy of Sciences of the United States of America,102,9,0,0,0,0,0,0,0,0,0,0,0,0,0,0,0,0,0,0,0,0,0,0,0,0,0,0,0,0,0,0,0,0,0,0,0,0,1,3,2,4,1,0,1,2,2,3,4,0,2,2,1,0,0,28
2005,A direct formulation for sparse PCA using semidefinite programming,"D'Aspremont A., El Ghaoui L., Jordan M.I., Lanckriet G.R.G.",10495258,Advances in Neural Information Processing Systems,, ,0,0,0,0,0,0,0,0,0,0,0,0,0,0,0,0,0,0,0,0,0,0,0,0,0,0,0,0,0,0,0,0,0,0,0,0,1,1,5,1,0,1,2,2,1,0,0,1,0,3,7,3,0,28
2004,Bayesian haplotype inference via the dirichlet process,"Xing E., Sharan R., Jordan M.I.",,"Proceedings, Twenty-First International Conference on Machine Learning, ICML 2004",, ,0,0,0,0,0,0,0,0,0,0,0,0,0,0,0,0,0,0,0,0,0,0,0,0,0,0,0,0,0,0,0,0,0,0,0,0,1,4,9,2,4,1,5,0,1,1,0,0,0,0,0,0,0,28
2018,Partial Transfer Learning with Selective Adversarial Networks,"Cao Z., Long M., Wang J., Jordan M.I.",10636919,Proceedings of the IEEE Computer Society Conference on Computer Vision and Pattern Recognition,, ,0,0,0,0,0,0,0,0,0,0,0,0,0,0,0,0,0,0,0,0,0,0,0,0,0,0,0,0,0,0,0,0,0,0,0,0,0,0,0,0,0,0,0,0,0,0,0,0,0,0,20,7,0,27
2010,Unsupervised kernel dimension reduction,"Wang M., Sha F., Jordan M.I.",,"Advances in Neural Information Processing Systems 23: 24th Annual Conference on Neural Information Processing Systems 2010, NIPS 2010",, ,0,0,0,0,0,0,0,0,0,0,0,0,0,0,0,0,0,0,0,0,0,0,0,0,0,0,0,0,0,0,0,0,0,0,0,0,0,0,0,0,0,0,0,3,1,2,7,6,5,1,1,1,0,27
2006,Statistical debugging: Simultaneous identification of multiple bugs,"Zheng A.X., Jordan M.I., Liblit B., Naik M., Aiken A.",,ACM International Conference Proceeding Series,148, ,0,0,0,0,0,0,0,0,0,0,0,0,0,0,0,0,0,0,0,0,0,0,0,0,0,0,0,0,0,0,0,0,0,0,0,0,0,0,1,3,1,6,2,1,0,0,0,1,3,3,4,2,0,27
2011,Dimensionality reduction for spectral clustering,"Niu D., Dy J.G., Jordan M.I.",15324435,Journal of Machine Learning Research,15, ,0,0,0,0,0,0,0,0,0,0,0,0,0,0,0,0,0,0,0,0,0,0,0,0,0,0,0,0,0,0,0,0,0,0,0,0,0,0,0,0,0,0,0,0,2,2,4,2,4,7,4,1,0,26
2009,Automatic exploration of datacenter performance regimes,"Bodik P., Griffith R., Sutton C., Fox A., Jordan M.I., Patterson D.A.",,"Proceedings of the 1st Workshop on Automated Control for Datacenters and Clouds, ACDC '09",, ,0,0,0,0,0,0,0,0,0,0,0,0,0,0,0,0,0,0,0,0,0,0,0,0,0,0,0,0,0,0,0,0,0,0,0,0,0,0,0,0,0,2,1,4,3,1,1,3,3,3,4,1,0,26
2008,A dual receptor crosstalk model of G-protein-coupled signal transduction,"Flaherty P., Radhakrishnan M.L., Dinh T., Rebres R.A., Roach T.I., Jordan M.I., Arkin A.P.",1553734X,PLoS Computational Biology,4,9,0,0,0,0,0,0,0,0,0,0,0,0,0,0,0,0,0,0,0,0,0,0,0,0,0,0,0,0,0,0,0,0,0,0,0,0,0,0,0,0,4,6,2,2,3,3,1,3,0,1,0,1,0,26
2005,Structured prediction via the extragradient method,"Taskar B., Lacoste-Julien S., Jordan M.I.",10495258,Advances in Neural Information Processing Systems,, ,0,0,0,0,0,0,0,0,0,0,0,0,0,0,0,0,0,0,0,0,0,0,0,0,0,0,0,0,0,0,0,0,0,0,0,0,1,2,1,5,9,2,0,2,2,0,0,1,0,0,0,0,0,25
2004,Robust sparse hyperplane classifiers: Application to uncertain molecular profiling data,"Bhattacharyya C., Grate L.R., Jordan M.I., El Ghaoui L., Mian I.S.",10665277,Journal of Computational Biology,11,6,0,0,0,0,0,0,0,0,0,0,0,0,0,0,0,0,0,0,0,0,0,0,0,0,0,0,0,0,0,0,0,0,0,0,0,0,1,3,1,3,2,1,1,1,1,2,2,1,4,1,1,0,0,25
1998,Estimating dependency structure as a hidden variable,"Meila M., Jordan M.I.",10495258,Advances in Neural Information Processing Systems,, ,0,0,0,0,0,0,0,0,0,0,0,0,0,0,0,0,0,0,0,0,0,0,0,0,0,0,0,0,0,0,2,4,3,2,1,0,1,1,0,1,3,1,1,0,1,1,0,2,1,0,0,0,0,25
2015,Combinatorial clustering and the beta negative binomial process,"Broderick T., Mackey L., Paisley J., Jordan M.I.",1628828,IEEE Transactions on Pattern Analysis and Machine Intelligence,37,2,0,0,0,0,0,0,0,0,0,0,0,0,0,0,0,0,0,0,0,0,0,0,0,0,0,0,0,0,0,0,0,0,0,0,0,0,0,0,0,0,0,0,0,0,0,0,2,4,6,6,5,0,0,23
2013,Cluster forests,"Yan D., Chen A., Jordan M.I.",1679473,Computational Statistics and Data Analysis,66, ,0,0,0,0,0,0,0,0,0,0,0,0,0,0,0,0,0,0,0,0,0,0,0,0,0,0,0,0,0,0,0,0,0,0,0,0,0,0,0,0,0,0,0,0,0,1,3,1,5,5,8,0,0,23
2005,Extensions of the informative vector machine,"Lawrence N.D., Platt J.C., Jordan M.I.",3029743,Lecture Notes in Computer Science (including subseries Lecture Notes in Artificial Intelligence and Lecture Notes in Bioinformatics),3635, ,0,0,0,0,0,0,0,0,0,0,0,0,0,0,0,0,0,0,0,0,0,0,0,0,0,0,0,0,0,0,0,0,0,0,0,0,0,0,0,0,2,3,3,3,1,5,3,3,0,0,0,0,0,23
1996,Neural networks,"Jordan M.I., Bishop C.M.",3600300,ACM Computing Surveys,28,1,0,0,0,0,0,0,0,0,0,0,0,0,0,0,0,0,0,0,0,0,0,0,0,0,0,0,0,0,0,1,0,0,0,0,0,0,0,3,2,5,2,0,2,0,2,0,0,2,2,2,0,0,0,23
2016,L<inf>1</inf>-regularized neural networks are improperly learnable in polynomial time,"Zhang Y., Lee J.D., Jordan M.I.",,"33rd International Conference on Machine Learning, ICML 2016",3, ,0,0,0,0,0,0,0,0,0,0,0,0,0,0,0,0,0,0,0,0,0,0,0,0,0,0,0,0,0,0,0,0,0,0,0,0,0,0,0,0,0,0,0,0,0,0,0,0,6,8,7,1,0,22
2014,SMaSH: A benchmarking toolkit for human genome variant calling,"Talwalkar A., Liptrap J., Newcomb J., Hartl C., Terhorst J., Curtis K., Bresler M., Song Y.S., Jordan M.I., Patterson D.",13674803,Bioinformatics,30,19,0,0,0,0,0,0,0,0,0,0,0,0,0,0,0,0,0,0,0,0,0,0,0,0,0,0,0,0,0,0,0,0,0,0,0,0,0,0,0,0,0,0,0,0,0,1,8,5,2,3,3,0,0,22
2013,MAD-Bayes: MAP-based asymptotic derivations from Bayes,"Broderick T., Kulis B., Jordan M.I.",,"30th International Conference on Machine Learning, ICML 2013",,2,0,0,0,0,0,0,0,0,0,0,0,0,0,0,0,0,0,0,0,0,0,0,0,0,0,0,0,0,0,0,0,0,0,0,0,0,0,0,0,0,0,0,0,0,3,2,7,2,2,4,2,0,0,22
2011,Bayesian generalized kernel mixed models,"Zhang Z., Dai G., Jordan M.I.",15324435,Journal of Machine Learning Research,12, ,0,0,0,0,0,0,0,0,0,0,0,0,0,0,0,0,0,0,0,0,0,0,0,0,0,0,0,0,0,0,0,0,0,0,0,0,0,0,0,0,0,0,0,4,1,5,2,2,2,3,2,1,0,22
2008,The phylogenetic Indian buffet process: A non-exchangeable nonparametric prior for latent features,"Miller K.T., Griffiths T.L., Jordan M.I.",,"Proceedings of the 24th Conference on Uncertainty in Artificial Intelligence, UAI 2008",, ,0,0,0,0,0,0,0,0,0,0,0,0,0,0,0,0,0,0,0,0,0,0,0,0,0,0,0,0,0,0,0,0,0,0,0,0,0,0,0,0,1,2,8,0,1,2,2,0,2,3,1,0,0,22
2004,Statistical debugging of sampled programs,"Zheng A.X., Jordan M.I., Liblit B., Aiken A.",10495258,Advances in Neural Information Processing Systems,, ,0,0,0,0,0,0,0,0,0,0,0,0,0,0,0,0,0,0,0,0,0,0,0,0,0,0,0,0,0,0,0,0,0,0,0,2,3,4,3,0,0,1,0,3,0,2,2,0,2,0,0,0,0,22
2016,On the computational complexity of high-dimensional Bayesian variable selection,"Yang Y., Wainwright M.J., Jordan M.I.",905364,Annals of Statistics,44,6,0,0,0,0,0,0,0,0,0,0,0,0,0,0,0,0,0,0,0,0,0,0,0,0,0,0,0,0,0,0,0,0,0,0,0,0,0,0,0,0,0,0,0,0,0,0,0,1,2,4,10,4,0,21
2012,Ergodic mirror descent,"Duchi J.C., Agarwal A., Johansson M., Jordan M.I.",10526234,SIAM Journal on Optimization,22,4,0,0,0,0,0,0,0,0,0,0,0,0,0,0,0,0,0,0,0,0,0,0,0,0,0,0,0,0,0,0,0,0,0,0,0,0,0,0,0,0,0,0,0,0,2,1,2,6,4,5,1,0,0,21
2010,Sufficient dimension reduction for visual sequence classification,"Shyr A., Urtasun R., Jordan M.I.",10636919,Proceedings of the IEEE Computer Society Conference on Computer Vision and Pattern Recognition,, ,0,0,0,0,0,0,0,0,0,0,0,0,0,0,0,0,0,0,0,0,0,0,0,0,0,0,0,0,0,0,0,0,0,0,0,0,0,0,0,0,0,1,2,3,4,2,2,0,1,4,2,0,0,21
2006,Statistical modeling of biomedical corpora: Mining the Caenorhabditis Genetic Center Bibliography for genes related to life span,"Blei D.M., Franks K., Jordan M.I., Mian I.S.",14712105,BMC Bioinformatics,7, ,0,0,0,0,0,0,0,0,0,0,0,0,0,0,0,0,0,0,0,0,0,0,0,0,0,0,0,0,0,0,0,0,0,0,0,0,0,1,1,3,0,0,6,3,0,1,3,0,1,2,0,0,0,21
2019,Transferable Representation Learning with Deep Adaptation Networks,"Long M., Cao Y., Cao Z., Wang J., Jordan M.I.",1628828,IEEE Transactions on Pattern Analysis and Machine Intelligence,41,12,0,0,0,0,0,0,0,0,0,0,0,0,0,0,0,0,0,0,0,0,0,0,0,0,0,0,0,0,0,0,0,0,0,0,0,0,0,0,0,0,0,0,0,0,0,0,0,0,0,0,12,8,0,20
2015,Linear response methods for accurate covariance estimates from mean field variational bayes,"Giordano R., Broderick T., Jordan M.",10495258,Advances in Neural Information Processing Systems,2015-, ,0,0,0,0,0,0,0,0,0,0,0,0,0,0,0,0,0,0,0,0,0,0,0,0,0,0,0,0,0,0,0,0,0,0,0,0,0,0,0,0,0,0,0,0,0,0,1,3,4,3,7,2,0,20
2015,Parallel correlation clustering on big graphs,"Pan X., Papailiopoulos D., Oymak S., Recht B., Ramchandran K., Jordan M.I.",10495258,Advances in Neural Information Processing Systems,2015-, ,0,0,0,0,0,0,0,0,0,0,0,0,0,0,0,0,0,0,0,0,0,0,0,0,0,0,0,0,0,0,0,0,0,0,0,0,0,0,0,0,0,0,0,0,0,0,0,6,7,3,3,1,0,20
2012,EP-GIG priors and applications in bayesian sparse learning,"Zhang Z., Wang S., Liu D., Jordan M.I.",15324435,Journal of Machine Learning Research,13, ,0,0,0,0,0,0,0,0,0,0,0,0,0,0,0,0,0,0,0,0,0,0,0,0,0,0,0,0,0,0,0,0,0,0,0,0,0,0,0,0,0,0,0,1,4,5,4,1,3,2,0,0,0,20
2011,Bayesian inference for queueing networks and modeling of internet services,"Sutton C., Jordan M.I.",19326157,Annals of Applied Statistics,5,1,0,0,0,0,0,0,0,0,0,0,0,0,0,0,0,0,0,0,0,0,0,0,0,0,0,0,0,0,0,0,0,0,0,0,0,0,0,0,0,0,0,0,0,2,1,0,3,4,4,6,0,0,0,20
2011,Learning low-dimensional signal models,"Carin L., Baraniuk R., Cevher V., Dunson D., Jordan M., Sapiro G., Wakin M.",10535888,IEEE Signal Processing Magazine,28,2,0,0,0,0,0,0,0,0,0,0,0,0,0,0,0,0,0,0,0,0,0,0,0,0,0,0,0,0,0,0,0,0,0,0,0,0,0,0,0,0,0,0,0,3,5,2,5,1,2,1,1,0,0,20
2015,Distributed matrix completion and robust factorization,"Mackey L., Talwalkar A., Jordan M.I.",15324435,Journal of Machine Learning Research,16, ,0,0,0,0,0,0,0,0,0,0,0,0,0,0,0,0,0,0,0,0,0,0,0,0,0,0,0,0,0,0,0,0,0,0,0,0,0,0,0,0,0,0,0,0,0,0,0,2,4,7,5,1,0,19
2004,"Large margin classifiers: Convex loss, low noise, and convergence rates","Bartlett P.L., Jordan M.I., McAuliffe J.D.",10495258,Advances in Neural Information Processing Systems,, ,0,0,0,0,0,0,0,0,0,0,0,0,0,0,0,0,0,0,0,0,0,0,0,0,0,0,0,0,0,0,0,0,0,0,0,1,2,1,3,1,1,1,0,0,1,1,2,2,0,0,3,0,0,19
2018,Minimax Optimal Procedures for Locally Private Estimation,"Duchi J.C., Jordan M.I., Wainwright M.J.",1621459,Journal of the American Statistical Association,113,521,0,0,0,0,0,0,0,0,0,0,0,0,0,0,0,0,0,0,0,0,0,0,0,0,0,0,0,0,0,0,0,0,0,0,0,0,0,0,0,0,0,0,0,0,0,0,0,0,0,3,10,5,0,18
2017,Perturbed iterate analysis for asynchronous stochastic optimization,"Mania H., Pan X., Papailiopoulos D., Recht B., Ramchandran K., Jordan M.I.",10526234,SIAM Journal on Optimization,27,4,0,0,0,0,0,0,0,0,0,0,0,0,0,0,0,0,0,0,0,0,0,0,0,0,0,0,0,0,0,0,0,0,0,0,0,0,0,0,0,0,0,0,0,0,0,0,0,0,1,7,7,3,0,18
2014,Parallel double greedy submodular maximization,"Pan X., Jegelka S., Gonzalez J., Bradley J., Jordan M.I.",10495258,Advances in Neural Information Processing Systems,1, January,0,0,0,0,0,0,0,0,0,0,0,0,0,0,0,0,0,0,0,0,0,0,0,0,0,0,0,0,0,0,0,0,0,0,0,0,0,0,0,0,0,0,0,0,0,0,1,3,7,3,4,0,0,18
2013,"Feature allocations, probability functions, and paintboxes","Broderick T., Pitman J., Jordan M.I.",19360975,Bayesian Analysis,8,4,0,0,0,0,0,0,0,0,0,0,0,0,0,0,0,0,0,0,0,0,0,0,0,0,0,0,0,0,0,0,0,0,0,0,0,0,0,0,0,0,0,0,0,0,1,1,2,4,3,3,3,1,0,18
2017,Gradient descent can take exponential time to Escape saddle points,"Du S.S., Jin C., Lee J.D., Jordan M.I., Poczos B., Singh A.",10495258,Advances in Neural Information Processing Systems,2017-, ,0,0,0,0,0,0,0,0,0,0,0,0,0,0,0,0,0,0,0,0,0,0,0,0,0,0,0,0,0,0,0,0,0,0,0,0,0,0,0,0,0,0,0,0,0,0,0,0,0,1,15,1,0,17
2014,Bayesian nonnegative matrix factorization with stochastic variational inference,"Paisley J., Blei D.M., Jordan M.I.",,Handbook of Mixed Membership Models and Their Applications,, ,0,0,0,0,0,0,0,0,0,0,0,0,0,0,0,0,0,0,0,0,0,0,0,0,0,0,0,0,0,0,0,0,0,0,0,0,0,0,0,0,0,0,0,0,0,0,1,0,7,3,5,1,0,17
2014,On the convergence rate of decomposable submodular function minimization,"Nishihara R., Jegelka S., Jordan M.I.",10495258,Advances in Neural Information Processing Systems,1, January,0,0,0,0,0,0,0,0,0,0,0,0,0,0,0,0,0,0,0,0,0,0,0,0,0,0,0,0,0,0,0,0,0,0,0,0,0,0,0,0,0,0,0,0,0,0,2,3,3,8,1,0,0,17
1994,A statistical approach to decision tree modeling,Jordan M.I.,,Proceedings of the Annual ACM Conference on Computational Learning Theory,129415, ,0,0,0,0,0,0,0,0,0,0,0,0,0,0,0,0,0,0,0,0,0,0,0,0,0,0,0,0,0,0,1,1,0,0,2,0,1,0,0,1,0,2,0,1,1,1,0,3,1,0,1,1,0,17
2016,CYCLADES: Conflict-free asynchronous machine learning,"Pan X., Lam M., Tu S., Papailiopoulos D., Zhang C., Jordan M.I., Ramchandran K., Re C., Recht B.",10495258,Advances in Neural Information Processing Systems,, ,0,0,0,0,0,0,0,0,0,0,0,0,0,0,0,0,0,0,0,0,0,0,0,0,0,0,0,0,0,0,0,0,0,0,0,0,0,0,0,0,0,0,0,0,0,0,0,0,2,8,5,1,0,16
2013,Cluster and feature modeling from combinatorial stochastic processes,"Broderick T., Jordan M.I., Pitman J.",8834237,Statistical Science,28,3,0,0,0,0,0,0,0,0,0,0,0,0,0,0,0,0,0,0,0,0,0,0,0,0,0,0,0,0,0,0,0,0,0,0,0,0,0,0,0,0,0,0,0,0,1,0,2,3,3,2,3,2,0,16
