," 作者:Jordan, Michael I.",,,,,,,,,,,,,,,,,,,,,,,,,,,,,,,,,,,,,,,,,,,,,,,,,,,,,,,,,,,
2009,Learning semantic correspondences with less supervision,"Liang P., Jordan M.I., Klein D.",,"ACL-IJCNLP 2009 - Joint Conf. of the 47th Annual Meeting of the Association for Computational Linguistics and 4th Int. Joint Conf. on Natural Language Processing of the AFNLP, Proceedings of the Conf.",, ,0,0,0,0,0,0,0,0,0,0,0,0,0,0,0,0,0,0,0,0,0,0,0,0,0,0,0,0,0,0,0,0,0,0,0,0,0,0,0,0,2,13,10,15,15,14,7,6,9,12,7,5,0,115
1997,Chapter 25 Serial order: A parallel distributed processing approach,Jordan M.I.,1664115,Advances in Psychology,121, C,0,0,0,0,0,0,0,0,0,0,0,0,0,0,0,0,0,0,0,0,0,0,0,0,0,0,0,0,0,0,0,0,0,0,0,0,0,0,0,0,0,0,2,3,1,4,10,11,16,27,27,14,0,115
2013,Streaming variational bayes,"Broderick T., Boyd N., Wibisono A., Wilson A.C., Jordan M.I.",10495258,Advances in Neural Information Processing Systems,, ,0,0,0,0,0,0,0,0,0,0,0,0,0,0,0,0,0,0,0,0,0,0,0,0,0,0,0,0,0,0,0,0,0,0,0,0,0,0,0,0,0,0,0,0,0,15,23,14,21,17,20,3,0,113
2011,Divide-and-conquer matrix factorization,"MacKey L., Talwalkar A., Jordan M.I.",,"Advances in Neural Information Processing Systems 24: 25th Annual Conference on Neural Information Processing Systems 2011, NIPS 2011",, ,0,0,0,0,0,0,0,0,0,0,0,0,0,0,0,0,0,0,0,0,0,0,0,0,0,0,0,0,0,0,0,0,0,0,0,0,0,0,0,0,0,0,0,4,14,9,15,20,19,13,11,8,0,113
2007,Hierarchical beta processes and the Indian buffet process,"Thibaux R., Jordan M.I.",15324435,Journal of Machine Learning Research,2, ,0,0,0,0,0,0,0,0,0,0,0,0,0,0,0,0,0,0,0,0,0,0,0,0,0,0,0,0,0,0,0,0,0,0,0,0,0,0,0,0,1,1,2,6,10,11,11,15,24,14,15,3,0,113
2010,"Characterizing, modeling, and generating workload spikes for stateful services","Bodik P., Fox A., Franklin M.J., Jordan M.I., Patterson D.A.",,"Proceedings of the 1st ACM Symposium on Cloud Computing, SoCC '10",, ,0,0,0,0,0,0,0,0,0,0,0,0,0,0,0,0,0,0,0,0,0,0,0,0,0,0,0,0,0,0,0,0,0,0,0,0,0,0,0,0,0,0,9,16,12,20,16,16,8,5,9,1,0,112
1994,Perceptual distortion contributes to the curvature of human reaching movements,"Wolpert D.M., Ghahramani Z., Jordan M.I.",144819,Experimental Brain Research,98,1,0,0,0,0,0,0,0,0,0,0,0,0,0,0,0,0,0,0,0,0,0,0,0,0,0,0,4,7,9,8,7,5,7,2,2,5,6,2,3,3,7,4,3,4,4,5,3,3,2,2,2,0,0,109
2011,Bayesian nonparametric inference of switching dynamic linear models,"Fox E., Sudderth E.B., Jordan M.I., Willsky A.S.",1053587X,IEEE Transactions on Signal Processing,59,4,0,0,0,0,0,0,0,0,0,0,0,0,0,0,0,0,0,0,0,0,0,0,0,0,0,0,0,0,0,0,0,0,0,0,0,0,0,0,0,0,0,0,2,8,9,17,10,14,10,12,19,7,0,108
2007,The infinite PCFG using hierarchical dirichlet processes,"Liang P., Petrov S., Jordan M.I., Klein D.",,EMNLP-CoNLL 2007 - Proceedings of the 2007 Joint Conference on Empirical Methods in Natural Language Processing and Computational Natural Language Learning,, ,0,0,0,0,0,0,0,0,0,0,0,0,0,0,0,0,0,0,0,0,0,0,0,0,0,0,0,0,0,0,0,0,0,0,0,0,0,0,0,5,17,16,12,10,6,10,9,9,4,4,5,1,0,108
1993,Learning Piecewise Control Strategies in a Modular Neural Network Architecture,"Jacobs R.A., Jordan M.I.",189472,"IEEE Transactions on Systems, Man and Cybernetics",23,2,0,0,0,0,0,0,0,0,0,0,0,0,0,0,0,0,0,0,0,0,0,0,0,0,0,0,2,2,13,18,7,8,10,6,6,4,5,3,1,4,5,1,2,0,1,2,2,0,1,2,1,0,0,106
2009,Shared segmentation of natural scenes using dependent Pitman-Yor processes,"Sudderth E.B., Jordan M.I.",,Advances in Neural Information Processing Systems 21 - Proceedings of the 2008 Conference,, ,0,0,0,0,0,0,0,0,0,0,0,0,0,0,0,0,0,0,0,0,0,0,0,0,0,0,0,0,0,0,0,0,0,0,0,0,0,0,0,0,7,11,12,10,13,9,10,6,10,5,11,1,0,105
1993,Trading relations between tongue-body raising and lip rounding in production of the vowel /u/: A pilot “motor equivalence” study,"Perkell J.S., Matthies M.L., Svirsky M.A., Jordan M.I., Perkell J.S., Jordan M.I.",14966,Journal of the Acoustical Society of America,93,5,0,0,0,0,0,0,0,0,0,0,0,0,0,0,0,0,0,0,0,0,0,0,0,0,0,2,2,8,7,3,4,3,0,2,5,0,2,3,4,5,4,3,5,9,6,4,3,6,3,5,5,2,0,105
2010,Neighbor-dependent Ramachandran probability distributions of amino acids developed from a hierarchical dirichlet process model,"Ting D., Wang G., Shapovalov M., Mitra R., Jordan M.I., Dunbrack Jr. R.L.",1553734X,PLoS Computational Biology,6,4,0,0,0,0,0,0,0,0,0,0,0,0,0,0,0,0,0,0,0,0,0,0,0,0,0,0,0,0,0,0,0,0,0,0,0,0,0,0,0,0,0,1,8,11,7,9,10,12,14,18,10,4,0,104
2012,Variational Bayesian inference with stochastic search,"Paisley J., Blei D.M., Jordan M.I.",,"Proceedings of the 29th International Conference on Machine Learning, ICML 2012",2, ,0,0,0,0,0,0,0,0,0,0,0,0,0,0,0,0,0,0,0,0,0,0,0,0,0,0,0,0,0,0,0,0,0,0,0,0,0,0,0,0,0,0,0,0,6,6,10,15,18,20,24,2,0,101
2009,Nonparametric Bayesian learning of switching linear dynamical systems,"Fox E.B., Sudderth E.B., Jordan M.I., Willsky A.S.",,Advances in Neural Information Processing Systems 21 - Proceedings of the 2008 Conference,, ,0,0,0,0,0,0,0,0,0,0,0,0,0,0,0,0,0,0,0,0,0,0,0,0,0,0,0,0,0,0,0,0,0,0,0,0,0,0,0,0,2,5,10,7,6,9,10,2,11,20,15,2,0,99
2007,Communication-efficient online detection of network-wide anomalies,"Huang L., Nguyen X., Garofalakis M., Hellerstein J.M., Jordan M.I., Joseph A.D., Taftt N.",0743166X,Proceedings - IEEE INFOCOM,, ,0,0,0,0,0,0,0,0,0,0,0,0,0,0,0,0,0,0,0,0,0,0,0,0,0,0,0,0,0,0,0,0,0,0,0,0,0,0,1,8,7,9,10,11,5,7,5,8,7,12,3,4,0,97
2002,Latent dirichlet allocation,"Blei D.M., Ng A.Y., Jordan M.T.",10495258,Advances in Neural Information Processing Systems,, ,0,0,0,0,0,0,0,0,0,0,0,0,0,0,0,0,0,0,0,0,0,0,0,0,0,0,0,0,0,0,0,0,0,3,6,2,5,4,0,2,6,4,7,8,3,4,9,5,8,6,11,4,0,97
1999,Mixed memory Markov models: Decomposing complex stochastic processes as mixtures of simpler ones,"Saul L.K., Jordan M.I.",8856125,Machine Learning,37,1,0,0,0,0,0,0,0,0,0,0,0,0,0,0,0,0,0,0,0,0,0,0,0,0,0,0,0,0,0,0,0,3,0,6,2,5,6,9,6,4,6,11,4,6,7,3,4,1,6,2,5,0,0,96
2014,Spectral methods meet EM: A provably optimal algorithm for crowdsourcing,"Zhang Y., Chen X., Zhou D., Jordan M.I.",10495258,Advances in Neural Information Processing Systems,2, January,0,0,0,0,0,0,0,0,0,0,0,0,0,0,0,0,0,0,0,0,0,0,0,0,0,0,0,0,0,0,0,0,0,0,0,0,0,0,0,0,0,0,0,0,0,0,9,20,15,28,19,2,0,93
2013,Computational and statistical tradeoffs via convex relaxation,"Chandrasekaran V., Jordan M.I.",278424,Proceedings of the National Academy of Sciences of the United States of America,110,13,0,0,0,0,0,0,0,0,0,0,0,0,0,0,0,0,0,0,0,0,0,0,0,0,0,0,0,0,0,0,0,0,0,0,0,0,0,0,0,0,0,0,0,0,6,13,14,16,16,19,5,4,0,93
2014,Communication-efficient distributed dual coordinate ascent,"Jaggi M., Smith V., Takac M., Terhorst J., Krishnan S., Hofmann T., Jordan M.I.",10495258,Advances in Neural Information Processing Systems,4, January,0,0,0,0,0,0,0,0,0,0,0,0,0,0,0,0,0,0,0,0,0,0,0,0,0,0,0,0,0,0,0,0,0,0,0,0,0,0,0,0,0,0,0,0,0,0,13,16,24,20,15,4,0,92
1997,Obstacle avoidance and a perturbation sensitivity model for motor planning,"Sabes P.N., Jordan M.I.",2706474,Journal of Neuroscience,17,18,0,0,0,0,0,0,0,0,0,0,0,0,0,0,0,0,0,0,0,0,0,0,0,0,0,0,0,0,1,4,4,7,2,3,6,2,3,3,7,2,8,5,5,8,2,3,3,2,4,3,4,0,0,91
1999,Variational probabilistic inference and the QMR-DT network,"Jaakkola T.S., Jordan M.I.",10769757,Journal of Artificial Intelligence Research,10, ,0,0,0,0,0,0,0,0,0,0,0,0,0,0,0,0,0,0,0,0,0,0,0,0,0,0,0,0,0,0,1,2,3,5,7,5,6,3,9,7,1,7,7,2,10,6,3,0,2,3,1,0,0,90
1996,Chapter 2 Computational aspects of motor control and motor learning,Jordan M.I.,18745822,Handbook of Perception and Action,2, C,0,0,0,0,0,0,0,0,0,0,0,0,0,0,0,0,0,0,0,0,0,0,0,0,0,0,0,0,2,3,5,7,5,3,6,3,1,2,1,3,1,6,4,8,9,2,5,4,2,3,4,0,0,89
2014,Knowing when you're wrong: Building fast and reliable approximate query processing systems,"Agarwal S., Milner H., Kleiner A., Talwalkar A., Jordan M., Madden S., Mozafari B., Stoica I.",7308078,Proceedings of the ACM SIGMOD International Conference on Management of Data,, ,0,0,0,0,0,0,0,0,0,0,0,0,0,0,0,0,0,0,0,0,0,0,0,0,0,0,0,0,0,0,0,0,0,0,0,0,0,0,1,0,0,0,0,0,0,2,17,17,19,15,16,1,0,88
2005,Semiparametric latent factor models,"Teh Y.W., Seeger M., Jordan M.I.",,AISTATS 2005 - Proceedings of the 10th International Workshop on Artificial Intelligence and Statistics,, ,0,0,0,0,0,0,0,0,0,0,0,0,0,0,0,0,0,0,0,0,0,0,0,0,0,0,0,0,0,0,0,0,0,0,0,0,1,0,2,3,13,7,11,10,5,9,4,7,4,5,7,0,0,88
1999,Learning from dyadic data,"Hofmann T., Puzicha J., Jordan M.I.",10495258,Advances in Neural Information Processing Systems,, ,0,0,0,0,0,0,0,0,0,0,0,0,0,0,0,0,0,0,0,0,0,0,0,0,0,0,0,0,0,0,3,3,4,6,2,4,0,2,1,5,9,9,4,4,4,9,3,2,6,2,5,1,0,88
2008,"Nonnegative matrix factorization for combinatorial optimization: Spectral clustering, graph matching, and clique finding","Ding C., Li T., Jordan M.I.",15504786,"Proceedings - IEEE International Conference on Data Mining, ICDM",, ,0,0,0,0,0,0,0,0,0,0,0,0,0,0,0,0,0,0,0,0,0,0,0,0,0,0,0,0,0,0,0,0,0,0,0,0,0,0,0,0,0,3,5,6,9,13,16,5,13,9,7,0,0,86
2013,MLI: An API for distributed machine learning,"Sparks E.R., Talwalkar A., Smith V., Kottalam J., Pan X., Gonzalez J., Franklin M.J., Jordan M.I., Kraska T.",15504786,"Proceedings - IEEE International Conference on Data Mining, ICDM",, ,0,0,0,0,0,0,0,0,0,0,0,0,0,0,0,0,0,0,0,0,0,0,0,0,0,0,0,0,0,0,0,0,0,0,0,0,0,0,0,0,0,0,0,0,0,6,17,20,15,8,16,2,0,84
2009,Genomic privacy and limits of individual detection in a pool,"Sankararaman S., Obozinski G., Jordan M.I., Halperin E.",10614036,Nature Genetics,41,9,0,0,0,0,0,0,0,0,0,0,0,0,0,0,0,0,0,0,0,0,0,0,0,0,0,0,0,0,0,0,0,0,0,0,0,0,0,0,0,0,1,6,6,6,7,11,13,3,13,11,6,1,0,84
2014,Particle gibbs with ancestor sampling,"Lindsten F., Jordan M.I., Schon T.B.",15324435,Journal of Machine Learning Research,15, ,0,0,0,0,0,0,0,0,0,0,0,0,0,0,0,0,0,0,0,0,0,0,0,0,0,0,0,0,0,0,0,0,0,0,0,0,0,0,0,0,0,0,0,0,0,2,15,11,12,13,21,8,0,82
2013,Learning dependency-based compositional semantics,"Liang P., Jordan M.I., Klein D.",8912017,Computational Linguistics,39,2,0,0,0,0,0,0,0,0,0,0,0,0,0,0,0,0,0,0,0,0,0,0,0,0,0,0,0,0,0,0,0,0,0,0,0,0,0,0,0,0,0,0,0,0,1,12,14,18,11,12,10,4,0,82
1989,Generic constraints on underspecified target trajectories,Jordan Michael I.,,,, ,0,0,0,0,0,0,0,0,0,0,0,0,0,0,0,0,0,0,0,0,0,3,4,13,5,9,5,5,3,4,0,0,5,3,1,1,3,1,1,2,1,1,2,2,2,1,0,1,3,0,0,1,0,82
2017,Deep transfer learning with joint adaptation networks,"Long M., Zhu H., Wang J., Jordan M.I.",,"34th International Conference on Machine Learning, ICML 2017",5, ,0,0,0,0,0,0,0,0,0,0,0,0,0,0,0,0,0,0,0,0,0,0,0,0,0,0,0,0,0,0,0,0,0,0,0,0,0,0,0,0,0,0,0,0,0,0,0,0,1,23,47,10,0,81
2010,Multiple non-redundant spectral clustering views,"Niu D., Dy J.G., Jordan M.I.",,"ICML 2010 - Proceedings, 27th International Conference on Machine Learning",, ,0,0,0,0,0,0,0,0,0,0,0,0,0,0,0,0,0,0,0,0,0,0,0,0,0,0,0,0,0,0,0,0,0,0,0,0,0,0,0,0,0,2,7,13,11,6,5,8,12,6,6,3,0,79
2004,Beyond independent components: Trees and clusters,"Bach F.R., Jordan M.I.",15324435,Journal of Machine Learning Research,4, 7-8,0,0,0,0,0,0,0,0,0,0,0,0,0,0,0,0,0,0,0,0,0,0,0,0,0,0,0,0,0,0,0,0,0,0,0,6,8,6,8,4,7,8,5,4,5,4,0,3,3,3,5,0,0,79
2009,Sharing features among dynamical systems with beta processes,"Fox E.B., Sudderth E.B., Jordan M.I., Willsky A.S.",,Advances in Neural Information Processing Systems 22 - Proceedings of the 2009 Conference,, ,0,0,0,0,0,0,0,0,0,0,0,0,0,0,0,0,0,0,0,0,0,0,0,0,0,0,0,0,0,0,0,0,0,0,0,0,0,0,0,0,0,3,4,9,9,13,10,5,9,7,9,0,0,78
2005,Semi-supervised Learning via gaussian processes,"Lawrence N.D., Jordan M.I.",10495258,Advances in Neural Information Processing Systems,, ,0,0,0,0,0,0,0,0,0,0,0,0,0,0,0,0,0,0,0,0,0,0,0,0,0,0,0,0,0,0,0,0,0,0,0,0,1,3,5,1,9,4,11,6,10,8,9,6,1,2,0,2,0,78
2010,Tree-structured stick breaking for hierarchical data,"Adams R.P., Ghahramani Z., Jordan M.I.",,"Advances in Neural Information Processing Systems 23: 24th Annual Conference on Neural Information Processing Systems 2010, NIPS 2010",, ,0,0,0,0,0,0,0,0,0,0,0,0,0,0,0,0,0,0,0,0,0,0,0,0,0,0,0,0,0,0,0,0,0,0,0,0,0,0,0,0,0,0,4,13,9,9,11,9,5,8,8,0,0,76
2009,Online system problem detection by mining patterns of console logs,"Xu W., Huang L., Fox A., Patterson D., Jordan M.",15504786,"Proceedings - IEEE International Conference on Data Mining, ICDM",, ,0,0,0,0,0,0,0,0,0,0,0,0,0,0,0,0,0,0,0,0,0,0,0,0,0,0,0,0,0,0,0,0,0,0,0,0,0,0,0,0,0,2,4,4,5,7,1,10,15,9,14,5,0,76
2007,In-network PCA and anomaly detection,"Huang L., Nguyen X.L., Garofalakis M., Jordan M.I., Joseph A., Taft N.",10495258,Advances in Neural Information Processing Systems,, ,0,0,0,0,0,0,0,0,0,0,0,0,0,0,0,0,0,0,0,0,0,0,0,0,0,0,0,0,0,0,0,0,0,0,0,0,0,0,0,3,7,1,4,9,6,8,2,10,6,8,9,3,0,76
2004,Variational methods for the Dirichlet process,"Blei D.M., Jordan M.I.",,"Proceedings, Twenty-First International Conference on Machine Learning, ICML 2004",, ,0,0,0,0,0,0,0,0,0,0,0,0,0,0,0,0,0,0,0,0,0,0,0,0,0,0,0,0,0,0,0,0,0,0,0,1,2,6,3,5,6,11,6,5,3,2,6,7,4,1,6,0,0,74
2015,Nested hierarchical dirichlet processes,"Paisley J., Wang C., Blei D.M., Jordan M.I.",1628828,IEEE Transactions on Pattern Analysis and Machine Intelligence,37,2,0,0,0,0,0,0,0,0,0,0,0,0,0,0,0,0,0,0,0,0,0,0,0,0,0,0,0,0,0,0,0,0,0,0,0,0,0,0,0,0,0,0,0,0,0,0,6,10,17,19,15,6,0,73
2014,Scaling up crowdsourcing to very large datasets: A case for active learning,"Mozafari B., Sarkar P., Franklin, Jordan M., Madden S.",21508097,Proceedings of the VLDB Endowment,8,2,0,0,0,0,0,0,0,0,0,0,0,0,0,0,0,0,0,0,0,0,0,0,0,0,0,0,0,0,0,0,0,0,0,0,0,0,0,0,0,0,0,0,0,0,0,0,2,13,24,15,13,6,0,73
2003,Support vector machines for analog circuit performance representation,"De Bernardinis F., Jordan M.I., SangiovanniVincentelli A.",0738100X,Proceedings - Design Automation Conference,, ,0,0,0,0,0,0,0,0,0,0,0,0,0,0,0,0,0,0,0,0,0,0,0,0,0,0,0,0,0,0,0,0,0,0,1,5,10,9,8,3,8,5,2,2,3,4,6,3,2,1,0,1,0,73
2006,Statistical debugging: Simultaneous identification of multiple bugs,"Zheng A.X., Jordan M.I., Liblit B., Naik M., Aiken A.",,ICML 2006 - Proceedings of the 23rd International Conference on Machine Learning,2006, ,0,0,0,0,0,0,0,0,0,0,0,0,0,0,0,0,0,0,0,0,0,0,0,0,0,0,0,0,0,0,0,0,0,0,0,0,0,0,7,6,4,8,7,8,6,10,5,7,0,2,2,0,0,72
2008,"An asymptotic analysis of generative, discriminative, and pseudolikelihood estimators","Liang P., Jordan M.I.",,Proceedings of the 25th International Conference on Machine Learning,, ,0,0,0,0,0,0,0,0,0,0,0,0,0,0,0,0,0,0,0,0,0,0,0,0,0,0,0,0,0,0,0,0,0,0,0,0,0,0,0,0,6,13,8,10,5,7,8,2,8,2,0,1,0,70
1997,Viewing the hand prior to movement improves accuracy of pointing performed toward the unseen contralateral hand,"Desmurget M., Rossetti Y., Jordan M., Meckler C., Prablanc C.",144819,Experimental Brain Research,115,1,0,0,0,0,0,0,0,0,0,0,0,0,0,0,0,0,0,0,0,0,0,0,0,0,0,0,0,0,0,3,1,5,4,5,8,7,6,4,3,1,2,3,4,3,1,2,2,1,1,2,1,1,0,70
2011,Bayesian bias mitigation for crowdsourcing,"Wauthier F.L., Jordan M.I.",,"Advances in Neural Information Processing Systems 24: 25th Annual Conference on Neural Information Processing Systems 2011, NIPS 2011",, ,0,0,0,0,0,0,0,0,0,0,0,0,0,0,0,0,0,0,0,0,0,0,0,0,0,0,0,0,0,0,0,0,0,0,0,0,0,0,0,0,0,0,0,4,4,10,9,11,8,11,10,2,0,69
2016,A variational perspective on accelerated methods in optimization,"Wibisono A., Wilson A.C., Jordan M.I.",278424,Proceedings of the National Academy of Sciences of the United States of America,113,47,0,0,0,0,0,0,0,0,0,0,0,0,0,0,0,0,0,0,0,0,0,0,0,0,0,0,0,0,0,0,0,0,0,0,0,0,0,0,0,0,0,0,0,0,0,0,0,0,11,21,24,9,0,65
2005,Sulfur and nitrogen limitation in Escherichia coli K-12: Specific homeostatic responses,"Gyaneshwar P., Paliy O., McAuliffe J., Popham D.L., Jordan M.I., Kustu S.",219193,Journal of Bacteriology,187,3,0,0,0,0,0,0,0,0,0,0,0,0,0,0,0,0,0,0,0,0,0,0,0,0,0,0,0,0,0,0,0,0,0,0,0,0,1,5,7,11,3,5,3,3,4,1,3,1,4,4,5,2,0,62
1995,The organization of action sequences: Evidence from a relearning task,Jordan M.I.,222895,Journal of Motor Behavior,27,2,0,0,0,0,0,0,0,0,0,0,0,0,0,0,0,0,0,0,0,0,0,0,0,0,0,0,0,0,1,4,0,1,2,1,4,2,3,2,1,5,9,4,8,0,6,3,0,2,0,0,1,2,0,61
2002,Minimax probability machine,"Lanckriet Gert.R.G., Bhattacharyya C., El Gliaoui L., Jordan M.I.",10495258,Advances in Neural Information Processing Systems,, ,0,0,0,0,0,0,0,0,0,0,0,0,0,0,0,0,0,0,0,0,0,0,0,0,0,0,0,0,0,0,0,0,0,0,2,5,1,6,4,3,5,6,1,0,1,2,3,1,4,1,8,7,0,60
2008,Consistent probabilistic outputs for protein function prediction,"Obozinski G., Lanckriet G., Grant C., Jordan M.I., Noble W.S.",14747596,Genome Biology,9,1,0,0,0,0,0,0,0,0,0,0,0,0,0,0,0,0,0,0,0,0,0,0,0,0,0,0,0,0,0,0,0,0,0,0,0,0,0,0,0,2,1,7,3,9,10,2,8,5,4,1,5,2,0,59
2006,"Structured prediction, dual extragradient and bregman projections","Taskar B., Lacoste-Julien S., Jordan M.I.",15337928,Journal of Machine Learning Research,7, ,0,0,0,0,0,0,0,0,0,0,0,0,0,0,0,0,0,0,0,0,0,0,0,0,0,0,0,0,0,0,0,0,0,0,0,0,0,1,1,7,9,9,4,4,6,6,1,3,3,2,3,0,0,59
2004,Learning graphical models for stationary time series,"Bach F.R., Jordan M.I.",1053587X,IEEE Transactions on Signal Processing,52,8,0,0,0,0,0,0,0,0,0,0,0,0,0,0,0,0,0,0,0,0,0,0,0,0,0,0,0,0,0,0,0,0,0,0,0,0,2,1,2,1,5,1,4,5,3,5,8,5,6,6,4,1,0,59
2009,Learning from measurements in exponential families,"Liang P., Jordan M.I., Klein D.",,"Proceedings of the 26th International Conference On Machine Learning, ICML 2009",, ,0,0,0,0,0,0,0,0,0,0,0,0,0,0,0,0,0,0,0,0,0,0,0,0,0,0,0,0,0,0,0,0,0,0,0,0,0,0,0,0,3,9,8,9,5,9,6,5,1,2,0,1,0,58
1992,Computational consequences of a bias toward short connections,"Jacobs R.A., Jordan M.I.",0898929X,Journal of Cognitive Neuroscience,4,4,0,0,0,0,0,0,0,0,0,0,0,0,0,0,0,0,0,0,0,0,0,0,0,0,1,5,2,3,4,1,1,2,3,1,1,2,3,3,4,0,1,2,4,4,2,1,3,1,2,0,1,1,0,58
2018,Deep generative modeling for single-cell transcriptomics,"Lopez R., Regier J., Cole M.B., Jordan M.I., Yosef N.",15487091,Nature Methods,15,12,0,0,0,0,0,0,0,0,0,0,0,0,0,0,0,0,0,0,0,0,0,0,0,0,0,0,0,0,0,0,0,0,0,0,0,0,0,0,0,0,0,0,0,0,0,0,0,0,0,1,37,18,0,56
2005,Combining visualization and statistical analysis to improve operator confidence and efficiency for failure detection and localization,"Bodik P., Friedman G., Biewald L., Levine H., Candea G., Patel K., Tolle G., Hui J., Fox A., Jordan M.I., Patterson D.",,"Proceedings - Second International Conference on Autonomic Computing, ICAC 2005",2005, ,0,0,0,0,0,0,0,0,0,0,0,0,0,0,0,0,0,0,0,0,0,0,0,0,0,0,0,0,0,0,0,0,0,0,0,0,0,3,7,10,3,7,4,8,2,3,2,1,2,2,1,1,0,56
2005,Nonparametric decentralized detection using kernel methods,"Nguyen X., Wainwright M.J., Jordan M.I.",1053587X,IEEE Transactions on Signal Processing,53,11,0,0,0,0,0,0,0,0,0,0,0,0,0,0,0,0,0,0,0,0,0,0,0,0,0,0,0,0,0,0,0,0,0,0,0,0,3,5,8,7,6,1,5,3,3,5,1,4,0,3,2,0,0,56
2010,On the consistency of ranking algorithms,"Duchi J.C., Mackey L.W., Jordan M.I.",,"ICML 2010 - Proceedings, 27th International Conference on Machine Learning",, ,0,0,0,0,0,0,0,0,0,0,0,0,0,0,0,0,0,0,0,0,0,0,0,0,0,0,0,0,0,0,0,0,0,0,0,0,0,0,0,0,0,0,5,6,7,7,7,10,7,5,1,0,0,55
2013,Information-theoretic lower bounds for distributed statistical estimation with communication constraints,"Zhang Y., Duchi J.C., Jordan M.I., Wainwright M.J.",10495258,Advances in Neural Information Processing Systems,, ,0,0,0,0,0,0,0,0,0,0,0,0,0,0,0,0,0,0,0,0,0,0,0,0,0,0,0,0,0,0,0,0,0,0,0,0,0,0,0,0,0,0,0,0,0,6,3,12,10,13,8,2,0,54
2010,Bayesian nonparametric methods for learning markov switching processes,"Fox E., Sudderth E., Jordan M., Willsky A.",10535888,IEEE Signal Processing Magazine,27,6,0,0,0,0,0,0,0,0,0,0,0,0,0,0,0,0,0,0,0,0,0,0,0,0,0,0,0,0,0,0,0,0,0,0,0,0,0,0,0,0,0,0,1,3,9,8,9,10,5,4,5,0,0,54
2006,Nonparametric empirical Bayes for the Dirichlet process mixture model,"McAuliffe J.D., Blei D.M., Jordan M.I.",9603174,Statistics and Computing,16,1,0,0,0,0,0,0,0,0,0,0,0,0,0,0,0,0,0,0,0,0,0,0,0,0,0,0,0,0,0,0,0,0,0,0,0,0,0,0,3,3,2,6,2,3,4,2,4,5,9,3,7,1,0,54
2000,Asymptotic convergence rate of the EM algorithm for gaussian mixtures,"Ma J., Xu L., Jordan M.I.",8997667,Neural Computation,12,12,0,0,0,0,0,0,0,0,0,0,0,0,0,0,0,0,0,0,0,0,0,0,0,0,0,0,0,0,0,0,0,0,0,4,5,1,3,1,0,4,5,2,2,5,1,3,4,2,3,4,3,1,0,53
2012,The big data bootstrap,"Kleiner A., Talwalkar A., Sarkar P., Jordan M.I.",,"Proceedings of the 29th International Conference on Machine Learning, ICML 2012",2, ,0,0,0,0,0,0,0,0,0,0,0,0,0,0,0,0,0,0,0,0,0,0,0,0,0,0,0,0,0,0,0,0,0,0,0,0,0,0,0,0,0,0,0,0,3,8,11,9,10,5,3,3,0,52
2010,Active site prediction using evolutionary and structural information,"Sankararaman S., Sha F., Kirsch J.F., Jordan M.I., Sjolander K.",13674803,Bioinformatics,26,5,0,0,0,0,0,0,0,0,0,0,0,0,0,0,0,0,0,0,0,0,0,0,0,0,0,0,0,0,0,0,0,0,0,0,0,0,0,0,0,0,0,8,9,7,7,4,5,3,3,3,3,0,0,52
2015,A general analysis of the convergence of ADMM,"Nishihara R., Lessard L., Recht B., Packard A., Jordan M.I.",,"32nd International Conference on Machine Learning, ICML 2015",1, ,0,0,0,0,0,0,0,0,0,0,0,0,0,0,0,0,0,0,0,0,0,0,0,0,0,0,0,0,0,0,0,0,0,0,0,0,0,0,0,0,0,0,0,0,0,0,0,7,14,13,11,6,0,51
2009,ON surrogate loss functions and f-divergences,"Nguyen X., Wainwright M.J., Jordan M.I.",905364,Annals of Statistics,37,2,0,0,0,0,0,0,0,0,0,0,0,0,0,0,0,0,0,0,0,0,0,0,0,0,0,0,0,0,0,0,0,0,0,0,0,0,0,0,0,1,2,1,5,7,4,4,4,6,1,9,6,1,0,51
1996,Local linear perceptrons for classification,"Alpaydin E., Jordan M.I.",10459227,IEEE Transactions on Neural Networks,7,3,0,0,0,0,0,0,0,0,0,0,0,0,0,0,0,0,0,0,0,0,0,0,0,0,0,0,0,0,0,1,0,1,2,2,0,0,1,3,4,3,6,2,11,1,5,3,1,1,2,1,1,0,0,51
2006,Log-determinant relaxation for approximate inference in discrete Markov random fields,"Wainwright M.J., Jordan M.I.",1053587X,IEEE Transactions on Signal Processing,54, 6 I,0,0,0,0,0,0,0,0,0,0,0,0,0,0,0,0,0,0,0,0,0,0,0,0,0,0,0,0,0,0,0,0,0,0,0,0,0,1,1,4,5,0,0,5,4,5,4,3,11,4,2,1,0,50
2003,Kalman Filtering with Intermittent Observations,"Sinopoli B., Schenato L., Franceschetti M., Poolla K., Jordan M.I., Sastry S.S.",1912216,Proceedings of the IEEE Conference on Decision and Control,1, ,0,0,0,0,0,0,0,0,0,0,0,0,0,0,0,0,0,0,0,0,0,0,0,0,0,0,0,0,0,0,0,0,0,0,1,7,10,4,2,2,6,0,3,3,2,2,0,0,2,2,2,1,0,49
2003,Simultaneous classification and relevant feature identification in high-dimensional spaces: Application to molecular profiling data,"Bhattacharyya C., Grate L.R., Rizki A., Radisky D., Molina F.J., Jordan M.I., Bissell M.J., Mian I.S.",1651684,Signal Processing,83,4,0,0,0,0,0,0,0,0,0,0,0,0,0,0,0,0,0,0,0,0,0,0,0,0,0,0,0,0,0,0,0,0,0,0,0,5,10,6,3,4,2,2,4,1,1,3,2,1,0,0,3,2,0,49
2015,Automating model search for large scale machine learning,"Sparks E.R., Talwalkar A., Haas D., Franklin M.J., Jordan M.I., Kraska T.",,ACM SoCC 2015 - Proceedings of the 6th ACM Symposium on Cloud Computing,, ,0,0,0,0,0,0,0,0,0,0,0,0,0,0,0,0,0,0,0,0,0,0,0,0,0,0,0,0,0,0,0,0,0,0,0,0,0,0,1,0,0,0,0,0,0,0,0,6,9,9,19,4,0,48
2015,Optimal Rates for Zero-Order Convex Optimization: The Power of Two Function Evaluations,"Duchi J.C., Jordan M.I., Wainwright M.J., Wibisono A.",189448,IEEE Transactions on Information Theory,61,5,0,0,0,0,0,0,0,0,0,0,0,0,0,0,0,0,0,0,0,0,0,0,0,0,0,0,0,0,0,0,0,0,0,0,0,0,0,0,0,0,0,0,0,0,0,0,1,9,5,9,22,2,0,48
2010,"Regularized discriminant analysis, ridge regression and beyond","Zhang Z., Dai G., Xu C., Jordan M.I.",15324435,Journal of Machine Learning Research,11, ,0,0,0,0,0,0,0,0,0,0,0,0,0,0,0,0,0,0,0,0,0,0,0,0,0,0,0,0,0,0,0,0,0,0,0,0,0,0,0,0,0,0,1,2,9,10,8,4,3,6,5,0,0,48
2012,Nonparametric link prediction in dynamic networks,"Sarkar P., Chakrabarti D., Jordan M.I.",,"Proceedings of the 29th International Conference on Machine Learning, ICML 2012",2, ,0,0,0,0,0,0,0,0,0,0,0,0,0,0,0,0,0,0,0,0,0,0,0,0,0,0,0,0,0,0,0,0,0,0,0,0,0,0,0,0,0,0,0,0,7,5,6,9,11,6,2,1,0,47
2005,A latent variable model for chemogenomic profiling,"Flaherty P., Giaever G., Kumm J., Jordan M.I., Arkin A.P.",13674803,Bioinformatics,21,15,0,0,0,0,0,0,0,0,0,0,0,0,0,0,0,0,0,0,0,0,0,0,0,0,0,0,0,0,0,0,0,0,0,0,0,0,0,3,2,2,7,3,6,4,4,3,4,3,2,1,3,0,0,47
1995,Goal-based speech motor control: A theoretical framework and some preliminary data,"Perkell J.S., Matthies M.L., Svirsky M.A., Jordan M.I.",954470,Journal of Phonetics,23, 1-2,0,0,0,0,0,0,0,0,0,0,0,0,0,0,0,0,0,0,0,0,0,0,0,0,0,0,1,1,4,3,2,4,1,3,1,2,2,4,2,0,2,3,4,1,0,1,1,0,1,1,3,0,0,47
2005,Robust design of biological experiments,"Flaherty P., Jordan M.I., Arkin A.P.",10495258,Advances in Neural Information Processing Systems,, ,0,0,0,0,0,0,0,0,0,0,0,0,0,0,0,0,0,0,0,0,0,0,0,0,0,0,0,0,0,0,0,0,0,0,0,0,0,1,3,3,3,4,3,7,6,2,1,4,2,5,2,0,0,46
2007,Learning multiscale representations of natural scenes using dirichlet processes,"Kivinen J.J., Sudderth E.B., Jordan M.I.",,Proceedings of the IEEE International Conference on Computer Vision,, ,0,0,0,0,0,0,0,0,0,0,0,0,0,0,0,0,0,0,0,0,0,0,0,0,0,0,0,0,0,0,0,0,0,0,0,0,0,0,0,4,2,6,6,6,5,5,2,4,2,2,1,0,0,45
2010,Learning programs: A hierarchical Bayesian approach,"Liang P., Jordan M.I., Klein D.",,"ICML 2010 - Proceedings, 27th International Conference on Machine Learning",, ,0,0,0,0,0,0,0,0,0,0,0,0,0,0,0,0,0,0,0,0,0,0,0,0,0,0,0,0,0,0,0,0,0,0,0,0,0,0,0,0,0,0,1,3,6,3,6,8,4,6,7,0,0,44
2005,Blind one-microphone speech separation: A spectral learning approach,"Bach F.R., Jordan M.I.",10495258,Advances in Neural Information Processing Systems,, ,0,0,0,0,0,0,0,0,0,0,0,0,0,0,0,0,0,0,0,0,0,0,0,0,0,0,0,0,0,0,0,0,0,0,0,0,1,4,0,5,7,4,6,4,2,2,1,3,2,2,0,0,0,43
1993,Hierarchical mixtures of experts and the EM algorithm,"Jordan Michael I., Jacobs Robert A.",,Proceedings of the International Joint Conference on Neural Networks,2, ,0,0,0,0,0,0,0,0,0,0,0,0,0,0,0,0,0,0,0,0,0,0,0,0,0,0,0,0,2,0,1,4,0,1,2,0,0,0,2,1,2,5,3,2,2,1,5,3,2,1,3,1,0,43
2013,"On statistics, computation and scalability",Jordan M.I.,13507265,Bernoulli,19,4,0,0,0,0,0,0,0,0,0,0,0,0,0,0,0,0,0,0,0,0,0,0,0,0,0,0,0,0,0,0,0,0,0,0,0,0,0,0,0,0,0,0,0,0,0,4,10,8,7,6,5,2,0,42
2012,Privacy aware learning,"Duchi J.C., Jordan M.I., Wainwright M.J.",10495258,Advances in Neural Information Processing Systems,2, ,0,0,0,0,0,0,0,0,0,0,0,0,0,0,0,0,0,0,0,0,0,0,0,0,0,0,0,0,0,0,0,0,0,0,0,0,0,0,0,0,0,0,0,0,2,5,5,2,10,7,11,0,0,42
2010,Modeling events with cascades of Poisson processes,"Simma A., Jordan M.I.",,"Proceedings of the 26th Conference on Uncertainty in Artificial Intelligence, UAI 2010",, ,0,0,0,0,0,0,0,0,0,0,0,0,0,0,0,0,0,0,0,0,0,0,0,0,0,0,0,0,0,0,0,0,0,0,0,0,0,0,0,0,0,0,1,2,3,4,7,8,5,7,2,3,0,42
