," 作者:Sastry, Shankar S.",,,,,,,,,,,,,,,,,,,,,,,,,,,,,,,,,,,,,,,,,,,,,,,,,,,,,,,,,,,
2003,Special issue on modeling and design of embedded software,"Sastry S., Sztipanovits J., Bajcsy R., Gill H.",189219,Proceedings of the IEEE,91,1,0,0,0,0,0,0,0,0,0,0,0,0,0,0,0,0,0,0,0,0,0,0,0,0,0,0,0,0,0,0,0,0,0,0,1,0,4,5,5,3,0,1,0,1,0,0,1,0,0,0,0,0,0,21
2011,On the optimal detection of an underwater intruder in a channel using unmanned underwater vehicles,"Chung H., Polak E., Royset J.O., Sastry S.",0894069X,Naval Research Logistics,58,8,0,0,0,0,0,0,0,0,0,0,0,0,0,0,0,0,0,0,0,0,0,0,0,0,0,0,0,0,0,0,0,0,0,0,0,0,0,0,0,0,0,0,0,2,2,3,0,7,2,3,2,0,0,21
2015,Safe sequential path planning of multi-vehicle systems via double-obstacle Hamilton-Jacobi-Isaacs variational inequality,"Chen M., Fisac J.F., Sastry S., Tomlin C.J.",,"2015 European Control Conference, ECC 2015",, ,0,0,0,0,0,0,0,0,0,0,0,0,0,0,0,0,0,0,0,0,0,0,0,0,0,0,0,0,0,0,0,0,0,0,0,0,0,0,0,0,0,0,0,0,0,0,2,1,4,8,6,0,0,21
1988,Feedback linearization in the presence of uncertainties,"Sastry S.S., Kokotovic P.V.",8906327,International Journal of Adaptive Control and Signal Processing,2,4,0,0,0,0,0,0,0,0,0,0,0,0,0,0,0,0,0,0,0,0,1,0,3,1,1,3,2,0,0,1,0,1,0,0,0,0,1,0,1,0,2,0,0,0,0,0,1,2,0,0,0,0,0,20
1997,Hybrid control models of next generation air traffic management,"Tomlin C., Pappas G., Lygeros J., Godbole D., Sastry S.",3029743,Lecture Notes in Computer Science (including subseries Lecture Notes in Artificial Intelligence and Lecture Notes in Bioinformatics),1273, ,0,0,0,0,0,0,0,0,0,0,0,0,0,0,0,0,0,0,0,0,0,0,0,0,0,0,0,0,0,1,1,0,2,0,0,0,0,0,0,0,0,1,0,3,2,1,1,2,2,2,1,1,0,20
1998,An approach to the verification of the center-tracon automation system,"Lygeros J., Pappas G.J., Sastry S.",3029743,Lecture Notes in Computer Science (including subseries Lecture Notes in Artificial Intelligence and Lecture Notes in Bioinformatics),1386, ,0,0,0,0,0,0,0,0,0,0,0,0,0,0,0,0,0,0,0,0,0,0,0,0,0,0,0,0,0,0,0,0,1,0,2,2,1,1,3,4,2,0,0,0,1,1,1,1,0,0,0,0,0,20
2000,Optimal maneuver for multiple aircraft conflict resolution: A braid point of view,"Hu J., Prandini M., Sastry S.",1912216,Proceedings of the IEEE Conference on Decision and Control,4, ,0,0,0,0,0,0,0,0,0,0,0,0,0,0,0,0,0,0,0,0,0,0,0,0,0,0,0,0,0,0,0,0,4,2,3,0,0,0,0,1,0,1,1,4,0,4,0,0,0,0,0,0,0,20
2005,Deciding to land a UAV safely in real time,"Sprinkle J., Eklund J.M., Sastry S.S.",7431619,Proceedings of the American Control Conference,5, ,0,0,0,0,0,0,0,0,0,0,0,0,0,0,0,0,0,0,0,0,0,0,0,0,0,0,0,0,0,0,0,0,0,0,0,0,0,0,3,0,0,3,3,3,3,1,0,1,0,1,2,0,0,20
2005,LQG control with missing observation and control packets,"Sinopoli B., Schenato L., Franceschetti M., Poolla K., Sastry S.",14746670,IFAC Proceedings Volumes (IFAC-PapersOnline),16, ,0,0,0,0,0,0,0,0,0,0,0,0,0,0,0,0,0,0,0,0,0,0,0,0,0,0,0,0,0,0,0,0,0,0,0,0,3,2,6,2,2,1,0,0,1,0,2,0,1,0,0,0,0,20
2006,Autonomous helicopter formation using model predictive control,"Chung H., Sastry S.S.",,"Collection of Technical Papers - AIAA Guidance, Navigation, and Control Conference 2006",1, ,0,0,0,0,0,0,0,0,0,0,0,0,0,0,0,0,0,0,0,0,0,0,0,0,0,0,0,0,0,0,0,0,0,0,0,0,0,0,0,2,5,2,0,1,1,3,1,1,2,2,0,0,0,20
2014,Social game for building energy efficiency: Incentive design,"Ratliff L.J., Jin M., Konstantakopoulos I.C., Spanos C., Sastry S.S.",,"2014 52nd Annual Allerton Conference on Communication, Control, and Computing, Allerton 2014",, ,0,0,0,0,0,0,0,0,0,0,0,0,0,0,0,0,0,0,0,0,0,0,0,0,0,0,0,0,0,0,0,0,0,0,0,0,0,0,0,0,0,0,0,0,0,0,1,2,4,5,7,1,0,20
1989,Control experiments in planar manipulation and grasping,"Murray Richard M., Sastry S.Shankar",,,, ,0,0,0,0,0,0,0,0,0,0,0,0,0,0,0,0,0,0,0,0,0,0,0,1,2,1,1,1,0,0,0,0,0,0,1,2,1,0,0,1,0,0,1,1,1,1,1,0,1,2,0,0,0,19
1996,Multiagent hybrid system design using game theory and optimal control,"Lygeros John, Godbole Datta N., Sastry Shankar",1912216,Proceedings of the IEEE Conference on Decision and Control,2, ,0,0,0,0,0,0,0,0,0,0,0,0,0,0,0,0,0,0,0,0,0,0,0,0,0,0,0,0,0,3,2,0,0,3,1,0,1,1,1,1,0,0,1,1,0,0,0,2,0,1,1,0,0,19
1997,Multiobjective hybrid controller synthesis,"Lygeros J., Tomlin C., Sastry S.",3029743,Lecture Notes in Computer Science (including subseries Lecture Notes in Artificial Intelligence and Lecture Notes in Bioinformatics),1201, ,0,0,0,0,0,0,0,0,0,0,0,0,0,0,0,0,0,0,0,0,0,0,0,0,0,0,0,0,1,5,0,0,2,0,1,0,1,1,0,0,0,0,0,0,1,0,2,1,3,1,0,0,0,19
1999,Hybrid systems with finite bisimulations,"Lafferriere G., Pappas G.J., Sastry S.",3029743,Lecture Notes in Computer Science (including subseries Lecture Notes in Artificial Intelligence and Lecture Notes in Bioinformatics),1567, ,0,0,0,0,0,0,0,0,0,0,0,0,0,0,0,0,0,0,0,0,0,0,0,0,0,0,0,0,0,0,0,2,1,0,2,0,3,1,0,3,2,0,0,1,2,0,0,1,0,1,0,0,0,19
2004,GiPSi: An open source/open architecture software development framework for surgical simulation,"Cavusoglu M.C., Goktekin T.G., Tendick F., Sastry S.",9269630,Studies in Health Technology and Informatics,98, ,0,0,0,0,0,0,0,0,0,0,0,0,0,0,0,0,0,0,0,0,0,0,0,0,0,0,0,0,0,0,0,0,0,0,0,1,1,1,2,3,3,0,2,3,1,0,1,1,0,0,0,0,0,19
2005,A polynomial-time approximation algorithm for joint probabilistic data association,"Oh S., Sastry S.",7431619,Proceedings of the American Control Conference,2, ,0,0,0,0,0,0,0,0,0,0,0,0,0,0,0,0,0,0,0,0,0,0,0,0,0,0,0,0,0,0,0,0,0,0,0,0,2,0,1,4,3,2,2,3,1,0,0,1,0,0,0,0,0,19
2005,A homology theory for hybrid systems: Hybrid homology,"Ames A.D., Sastry S.",3029743,Lecture Notes in Computer Science,3414, ,0,0,0,0,0,0,0,0,0,0,0,0,0,0,0,0,0,0,0,0,0,0,0,0,0,0,0,0,0,0,0,0,0,0,0,0,3,5,1,0,0,0,2,0,1,3,1,0,1,0,2,0,0,19
2006,Distributed networked control system with lossy links: state estimation and stabilizing communication control,"Oh S., Sastry S.",1912216,Proceedings of the IEEE Conference on Decision and Control,, ,0,0,0,0,0,0,0,0,0,0,0,0,0,0,0,0,0,0,0,0,0,0,0,0,0,0,0,0,0,0,0,0,0,0,0,0,0,0,2,1,0,2,2,4,3,2,1,1,1,0,0,0,0,19
2006,A situation-aware flight control system design using real-time model predictive control for unmanned autonomous helicopters,"Shim D.H., Sastry S.",,"Collection of Technical Papers - AIAA Guidance, Navigation, and Control Conference 2006",2, ,0,0,0,0,0,0,0,0,0,0,0,0,0,0,0,0,0,0,0,0,0,0,0,0,0,0,0,0,0,0,0,0,0,0,0,0,0,0,2,1,1,4,2,2,0,1,0,0,2,2,1,1,0,19
2013,Consistent approximations for the optimal control of constrained switched systems-part 2: An implementable algorithm,"Vasudevan R., Gonzalez H., Bajcsy R., Sastry S.S.",3630129,SIAM Journal on Control and Optimization,51,6,0,0,0,0,0,0,0,0,0,0,0,0,0,0,0,0,0,0,0,0,0,0,0,0,0,0,0,0,0,0,0,0,0,0,0,0,0,0,0,0,0,0,0,0,1,0,0,4,6,6,2,0,0,19
2015,The pursuit-evasion-defense differential game in dynamic constrained environments,"Fisac J.F., Sastry S.S.",7431546,Proceedings of the IEEE Conference on Decision and Control,54, ,0,0,0,0,0,0,0,0,0,0,0,0,0,0,0,0,0,0,0,0,0,0,0,0,0,0,0,0,0,0,0,0,0,0,0,0,0,0,0,0,0,0,0,0,0,0,0,2,3,6,7,1,0,19
2017,Privacy-enhanced architecture for occupancy-based HVAC control,"Jia R., Dong R., Sastry S.S., Spanos C.J.",,"Proceedings - 2017 ACM/IEEE 8th International Conference on Cyber-Physical Systems, ICCPS 2017 (part of CPS Week)",, ,0,0,0,0,0,0,0,0,0,0,0,0,0,0,0,0,0,0,0,0,0,0,0,0,0,0,0,0,0,0,0,0,0,0,0,0,0,0,0,0,0,0,0,0,0,0,0,0,5,5,7,2,0,19
1991,On reorienting linked rigid bodies using internal motions,"Walsh Gregory C., Sastry Shankar",1912216,Proceedings of the IEEE Conference on Decision and Control,2, ,0,0,0,0,0,0,0,0,0,0,0,0,0,0,0,0,0,0,0,0,0,0,0,1,0,3,1,1,2,0,1,0,0,0,0,1,1,1,2,2,0,0,0,0,0,0,1,0,1,0,0,0,0,18
1998,2-1/2 D conflict resolution maneuvers for ATMS,"Kosecka Jana, Tomlin Claire, Pappas George, Sastry Shankar",1912216,Proceedings of the IEEE Conference on Decision and Control,3, ,0,0,0,0,0,0,0,0,0,0,0,0,0,0,0,0,0,0,0,0,0,0,0,0,0,0,0,0,0,0,0,0,0,2,0,0,0,0,1,2,3,2,1,2,0,0,2,1,1,1,0,0,0,18
2006,Compressed domain real-time action recognition,"Yeo C., Ahammad P., Ramchandran K., Sastry S.S.",,"2006 IEEE 8th Workshop on Multimedia Signal Processing, MMSP 2006",, ,0,0,0,0,0,0,0,0,0,0,0,0,0,0,0,0,0,0,0,0,0,0,0,0,0,0,0,0,0,0,0,0,0,0,0,0,0,0,3,1,1,2,2,0,2,1,1,0,1,1,2,1,0,18
2007,Platform design for health-care monitoring applications,"Jafari R., Bajcsy R., Glaser S., Gnade B., Sgroi M., Sastry S.",,"Proceedings - 2007 Joint Workshop on High Confidence Medical Devices, Software, and Systems and Medical Device Plug-and-Play Interoperability, HCMDSS/MDPnP 2007",, ,0,0,0,0,0,0,0,0,0,0,0,0,0,0,0,0,0,0,0,0,0,0,0,0,0,0,0,0,0,0,0,0,0,0,0,0,0,0,0,3,1,2,5,2,4,1,0,0,0,0,0,0,0,18
2012,Reachability calculations for vehicle safety during manned/unmanned vehicle interaction,"Ding J., Sprinkle J., Tomlin C.J., Sastry S.S., Paunicka J.L.",7315090,"Journal of Guidance, Control, and Dynamics",35,1,0,0,0,0,0,0,0,0,0,0,0,0,0,0,0,0,0,0,0,0,0,0,0,0,0,0,0,0,0,0,0,0,0,0,0,0,0,0,0,0,0,0,0,0,1,3,1,4,2,0,6,1,0,18
1983,The Effects of Small Noise on Implicitly Defined Nonlinear Dynamical Systems,Sastry S.S.,984094,IEEE Transactions on Circuits and Systems,30,9,0,0,0,0,0,0,0,0,0,0,0,0,0,0,0,0,0,0,1,0,1,2,0,1,0,0,1,0,0,0,0,0,0,0,1,0,1,0,1,0,1,0,1,1,0,2,1,1,0,0,1,0,0,17
1983,TRACKING CONTROL OF NON-LINEAR SYSTEMS USING SLIDING SURFACES WITH APPLICATION TO ROBOT MANIPULATORS.,"Slotine J.J., Sastry S.S.",7431619,Proceedings of the American Control Conference,1, ,0,0,0,0,0,0,0,0,0,0,0,0,0,0,0,0,0,0,0,0,0,0,0,0,0,0,0,0,0,0,0,0,0,0,0,0,0,0,0,0,0,0,0,2,1,1,2,2,1,5,1,2,0,17
1997,Towards continuous abstractions of dynamical and control systems,"Pappas G.J., Sastry S.",3029743,Lecture Notes in Computer Science (including subseries Lecture Notes in Artificial Intelligence and Lecture Notes in Bioinformatics),1273, ,0,0,0,0,0,0,0,0,0,0,0,0,0,0,0,0,0,0,0,0,0,0,0,0,0,0,0,0,0,4,0,2,3,4,1,1,0,0,0,1,0,0,0,0,0,0,0,0,0,0,0,1,0,17
1999,Randomized algorithms for probabilistic aircraft conflict detection,"Prandini Maria, Lygeros John, Nilim Arnab, Sastry Shankar",1912216,Proceedings of the IEEE Conference on Decision and Control,3, ,0,0,0,0,0,0,0,0,0,0,0,0,0,0,0,0,0,0,0,0,0,0,0,0,0,0,0,0,0,0,0,3,1,0,0,0,0,0,0,0,2,0,1,2,4,0,1,0,0,0,3,0,0,17
2000,Euclidean reconstruction and reprojection up to subgroups,"Ma Y., Soatto S., Kosecka J., Sastry S.",9205691,International Journal of Computer Vision,38,3,0,0,0,0,0,0,0,0,0,0,0,0,0,0,0,0,0,0,0,0,0,0,0,0,0,0,0,0,0,0,0,0,2,2,3,5,2,1,0,0,1,0,1,0,0,0,0,0,0,0,0,0,0,17
2001,Optimal motion estimation from multiview normalized epipolar constraint,"Vidal R., Ma Y., Hsu S., Sastry S.",,Proceedings of the IEEE International Conference on Computer Vision,1, ,0,0,0,0,0,0,0,0,0,0,0,0,0,0,0,0,0,0,0,0,0,0,0,0,0,0,0,0,0,0,0,0,0,1,3,1,1,0,3,2,1,0,1,2,0,0,2,0,0,0,0,0,0,17
2003,Omnidirectional Egomotion Estimation From Back-projection Flow,"Shakernia O., Vidal R., Sastry S.",21607508,IEEE Computer Society Conference on Computer Vision and Pattern Recognition Workshops,7, ,0,0,0,0,0,0,0,0,0,0,0,0,0,0,0,0,0,0,0,0,0,0,0,0,0,0,0,0,0,0,0,0,0,0,1,2,2,1,1,1,1,2,0,0,2,1,1,1,1,0,0,0,0,17
2003,Platform-based embedded software design and system integration for autonomous vehicles,"Horowitz B., Liebman J., Ma C., Koo T.J., Sangiovanni-Vincentelli A., Sastry S.S.",189219,Proceedings of the IEEE,91,1,0,0,0,0,0,0,0,0,0,0,0,0,0,0,0,0,0,0,0,0,0,0,0,0,0,0,0,0,0,0,0,0,0,0,0,2,4,2,1,0,1,2,1,1,0,2,1,0,0,0,0,0,0,17
2003,Aircraft conflict detection in presence of spatially correlated wind perturbations,"Hu J., Prandini M., Sastry S.",,"AIAA Guidance, Navigation, and Control Conference and Exhibit",, ,0,0,0,0,0,0,0,0,0,0,0,0,0,0,0,0,0,0,0,0,0,0,0,0,0,0,0,0,0,0,0,0,0,0,3,0,3,4,1,0,1,0,1,0,0,0,2,0,0,1,1,0,0,17
1983,ROBUSTNESS STUDIES IN ADAPTIVE CONTROL.,"Krause James, Athans Michael, Sastry Shankar S., Valavani Lena",1912216,Proceedings of the IEEE Conference on Decision and Control,2, ,0,0,0,0,0,0,0,0,0,0,0,0,0,0,0,0,5,2,1,2,1,1,2,1,0,0,0,0,0,0,0,0,0,0,0,0,0,0,0,1,0,0,0,0,0,0,0,0,0,0,0,0,0,16
1994,Hierarchical hybrid control: An IVHS case study,"Godbole Datta N., Lygeros John, Sastry Shankar",1912216,Proceedings of the IEEE Conference on Decision and Control,2, ,0,0,0,0,0,0,0,0,0,0,0,0,0,0,0,0,0,0,0,0,0,0,0,0,0,0,0,0,5,0,0,1,1,1,1,1,0,1,1,0,0,0,0,0,2,1,0,0,1,0,0,0,0,16
1997,Switching through singularities,"Tomlin C.J., Sastry S.S.",1912216,Proceedings of the IEEE Conference on Decision and Control,1, ,0,0,0,0,0,0,0,0,0,0,0,0,0,0,0,0,0,0,0,0,0,0,0,0,0,0,0,0,0,0,1,1,1,3,0,0,0,0,0,2,1,0,1,2,1,1,0,1,0,0,1,0,0,16
1999,Behavior based robotics using regularized hybrid automata,"Egerstedt M., Johansson K., Lygeros J., Sastry S.",1912216,Proceedings of the IEEE Conference on Decision and Control,4, ,0,0,0,0,0,0,0,0,0,0,0,0,0,0,0,0,0,0,0,0,0,0,0,0,0,0,0,0,0,0,0,1,1,3,0,0,2,1,0,1,0,1,0,0,1,0,0,3,1,0,1,0,0,16
2000,Kruppa equation revisited: Its renormalization and degeneracy,"Ma Y., Vidal R., Kosecka J., Sastry S.",3029743,Lecture Notes in Computer Science (including subseries Lecture Notes in Artificial Intelligence and Lecture Notes in Bioinformatics),1843, ,0,0,0,0,0,0,0,0,0,0,0,0,0,0,0,0,0,0,0,0,0,0,0,0,0,0,0,0,0,0,0,0,0,1,1,3,2,0,0,3,0,1,2,0,1,0,1,0,0,0,1,0,0,16
2001,Semi-decidable synthesis for triangular hybrid systems,"Shakernia O., Pappas G.J., Sastry S.",3029743,Lecture Notes in Computer Science (including subseries Lecture Notes in Artificial Intelligence and Lecture Notes in Bioinformatics),2034, ,0,0,0,0,0,0,0,0,0,0,0,0,0,0,0,0,0,0,0,0,0,0,0,0,0,0,0,0,0,0,0,0,2,0,1,0,0,0,2,0,4,0,5,2,0,0,0,0,0,0,0,0,0,16
2001,Optimal collision avoidance and formation switching on Riemannian manifolds,"Hu J., Sastry S.",1912216,Proceedings of the IEEE Conference on Decision and Control,2, ,0,0,0,0,0,0,0,0,0,0,0,0,0,0,0,0,0,0,0,0,0,0,0,0,0,0,0,0,0,0,0,0,0,2,3,1,2,2,1,1,0,1,0,1,0,0,0,0,0,2,0,0,0,16
2002,Model Identification and Attitude Control Scheme for a Micromechanical Flying Insect,"Deng X., Schenato L., Sastry S.",,"Proceedings of the 7th International Conference on Control, Automation, Robotics and Vision, ICARCV 2002",, ,0,0,0,0,0,0,0,0,0,0,0,0,0,0,0,0,0,0,0,0,0,0,0,0,0,0,0,0,0,0,0,0,0,0,3,1,0,1,2,2,0,1,1,3,0,0,1,1,0,0,0,0,0,16
2005,A fully automated distributed multiple-target tracking and identity management algorithm,"Oh S., Roy K., Hwang I., Sastry S.",,"Collection of Technical Papers - AIAA Guidance, Navigation, and Control Conference",1, ,0,0,0,0,0,0,0,0,0,0,0,0,0,0,0,0,0,0,0,0,0,0,0,0,0,0,0,0,0,0,0,0,0,0,0,0,0,0,3,1,2,2,3,1,0,1,0,0,0,1,1,1,0,16
2007,Geometric motion estimation and control for robotic-assisted beating-heart surgery,"Duindam V., Sastry S.",,IEEE International Conference on Intelligent Robots and Systems,, ,0,0,0,0,0,0,0,0,0,0,0,0,0,0,0,0,0,0,0,0,0,0,0,0,0,0,0,0,0,0,0,0,0,0,0,0,0,0,0,0,0,1,3,1,4,1,0,0,1,4,1,0,0,16
2007,Multiple aircraft deconflicted path planning with weather avoidance constraints,"Pannequin J.J., Bayen A.M., Mitchell I.M., Hoam C., Sastry S.",,"Collection of Technical Papers - AIAA Guidance, Navigation, and Control Conference 2007",3, ,0,0,0,0,0,0,0,0,0,0,0,0,0,0,0,0,0,0,0,0,0,0,0,0,0,0,0,0,0,0,0,0,0,0,0,0,0,0,1,0,1,1,1,3,3,1,0,1,0,1,1,2,0,16
2014,Incentive mechanisms for internet congestion management: Fixed-budget rebate versus time-of-day pricing,"Loiseau P., Schwartz G., Musacchio J., Amin S., Sastry S.S.",10636692,IEEE/ACM Transactions on Networking,22,2,0,0,0,0,0,0,0,0,0,0,0,0,0,0,0,0,0,0,0,0,0,0,0,0,0,0,0,0,0,0,0,0,0,0,0,0,0,0,0,0,0,0,0,0,0,1,2,4,1,4,3,1,0,16
1997,Path planning for nonholonomic systems with drift,"Godhavn John-Morten, Balluchi Andrea, Crawford Lara, Sastry Shankar",7431619,Proceedings of the American Control Conference,1, ,0,0,0,0,0,0,0,0,0,0,0,0,0,0,0,0,0,0,0,0,0,0,0,0,0,0,0,0,0,0,2,1,1,0,2,0,3,0,1,1,2,0,0,0,0,0,0,0,0,1,1,0,0,15
1997,Hybrid system approach to contact stability and force control in robotic manipulators,"Cavusoglu Murat Cenk, Yan Joseph, Sastry S.Shankar",,IEEE International Symposium on Intelligent Control - Proceedings,, ,0,0,0,0,0,0,0,0,0,0,0,0,0,0,0,0,0,0,0,0,0,0,0,0,0,0,0,0,0,0,1,0,0,1,0,1,1,0,1,3,1,0,0,0,1,2,1,0,1,1,0,0,0,15
2003,Multibody motion estimation and segmentation from multiple central panoramic views,"Shakernia O., Vidal R., Sastry S.",10504729,Proceedings - IEEE International Conference on Robotics and Automation,1, ,0,0,0,0,0,0,0,0,0,0,0,0,0,0,0,0,0,0,0,0,0,0,0,0,0,0,0,0,0,0,0,0,0,0,3,1,2,2,0,1,0,0,0,0,1,1,1,2,0,1,0,0,0,15
2007,Unmanned helicopter formation flight experiment for the study of mesh stability,"Shaw E., Chung H., Hedrick J.K., Sastry S.",758442,Lecture Notes in Economics and Mathematical Systems,588, ,0,0,0,0,0,0,0,0,0,0,0,0,0,0,0,0,0,0,0,0,0,0,0,0,0,0,0,0,0,0,0,0,0,0,0,0,0,0,2,0,1,1,3,1,1,1,1,1,1,1,1,0,0,15
2007,Automatic camera network localization using object image tracks,"Meingast M., Oh S., Sastry S.",,Proceedings of the IEEE International Conference on Computer Vision,, ,0,0,0,0,0,0,0,0,0,0,0,0,0,0,0,0,0,0,0,0,0,0,0,0,0,0,0,0,0,0,0,0,0,0,0,0,0,0,0,3,0,1,1,4,1,0,1,3,0,1,0,0,0,15
2009,Model-based design: A report from the trenches of the DARPA Urban Challenge,"Sprinkle J., Eklund J.M., Gonzalez H., Grotli E.I., Upcroft B., Makarenko A., Uther W., Moser M., Fitch R., Durrant-Whyte H., Sastry S.S.",16191366,Software and Systems Modeling,8,4,0,0,0,0,0,0,0,0,0,0,0,0,0,0,0,0,0,0,0,0,0,0,0,0,0,0,0,0,0,0,0,0,0,0,0,0,0,0,0,0,2,1,1,4,1,2,1,1,2,0,0,0,0,15
2014,Data-driven probabilistic modeling and verification of human driver behavior,"Sadigh D., Driggs-Campbell K., Puggelli A., Li W., Shia V., Bajcsy R., Sangiovanni-Vincentelli A.L., Sastry S.S., Seshia S.A.",,AAAI Spring Symposium - Technical Report,SS-14-02, ,0,0,0,0,0,0,0,0,0,0,0,0,0,0,0,0,0,0,0,0,0,0,0,0,0,0,0,0,0,0,0,0,0,0,0,0,0,0,0,0,0,0,0,0,0,1,1,0,5,2,6,0,0,15
2014,Cyber-insurance framework for large scale interdependent networks,"Schwartz G.A., Sastry S.S.",,HiCoNS 2014 - Proceedings of the 3rd International Conference on High Confidence Networked Systems (Part of CPS Week),, ,0,0,0,0,0,0,0,0,0,0,0,0,0,0,0,0,0,0,0,0,0,0,0,0,0,0,0,0,0,0,0,0,0,0,0,0,0,0,0,0,0,0,0,0,0,0,1,2,2,4,5,1,0,15
2015,Formal methods for semi-autonomous driving,"Seshia S.A., Sadigh D., Sastry S.S.",0738100X,Proceedings - Design Automation Conference,2015-, ,0,0,0,0,0,0,0,0,0,0,0,0,0,0,0,0,0,0,0,0,0,0,0,0,0,0,0,0,0,0,0,0,0,0,0,0,0,0,0,0,0,0,0,0,0,0,0,2,2,4,5,2,0,15
1981,Bifurcation in the presence of small noise,"Sastry S., Hijab O.",1676911,Systems and Control Letters,1,3,0,0,0,0,0,0,0,0,0,0,0,0,0,0,3,2,0,0,0,0,1,3,0,1,0,0,0,0,0,0,0,0,0,0,0,0,0,0,0,1,0,1,0,0,0,0,0,1,0,1,0,0,0,14
1995,The multi‐steering N‐trailer system: A case study of goursat normal forms and prolongations,"Tilbury D., Sastry S.",10498923,International Journal of Robust and Nonlinear Control,5,4,0,0,0,0,0,0,0,0,0,0,0,0,0,0,0,0,0,0,0,0,0,0,0,0,0,0,1,0,0,0,1,1,2,1,0,0,0,0,0,1,0,1,2,0,0,2,1,0,0,0,1,0,0,14
1996,Verified hybrid controller for automated vehicles,"Lygeros John, Godbole Datta N., Sastry Shankar",1912216,Proceedings of the IEEE Conference on Decision and Control,2, ,0,0,0,0,0,0,0,0,0,0,0,0,0,0,0,0,0,0,0,0,0,0,0,0,0,0,0,0,1,3,0,0,0,0,0,1,2,0,0,1,0,2,2,0,0,0,0,1,0,1,0,0,0,14
1999,A probabilistic framework for aircraft conflict detection,"Prandini M., Lygeros J., Nilim A., Sastry S.",,"1999 Guidance, Navigation, and Control Conference and Exhibit",, ,0,0,0,0,0,0,0,0,0,0,0,0,0,0,0,0,0,0,0,0,0,0,0,0,0,0,0,0,0,0,0,2,0,0,1,0,0,0,0,0,0,1,0,3,1,2,2,1,0,0,1,0,0,14
2007,On the geometric reduction of controlled three-dimensional bipedal robotic walkers,"Ames A.D., Gregg R.D., Wendel E.D.B., Sastry S.",1708643,Lecture Notes in Control and Information Sciences,366, ,0,0,0,0,0,0,0,0,0,0,0,0,0,0,0,0,0,0,0,0,0,0,0,0,0,0,0,0,0,0,0,0,0,0,0,0,0,0,2,0,1,3,3,1,1,1,0,0,0,0,1,1,0,14
2015,Metrization and Simulation of Controlled Hybrid Systems,"Burden S.A., Gonzalez H., Vasudevan R., Bajcsy R., Sastry S.S.",189286,IEEE Transactions on Automatic Control,60,9,0,0,0,0,0,0,0,0,0,0,0,0,0,0,0,0,0,0,0,0,0,0,0,0,0,0,0,0,0,0,0,0,0,0,0,0,0,0,0,0,0,0,0,0,0,0,1,4,3,2,3,1,0,14
2015,Personalized kinematics for human-robot collaborative manipulation,"Bestick A.M., Burden S.A., Willits G., Naikal N., Sastry S.S., Bajcsy R.",21530858,IEEE International Conference on Intelligent Robots and Systems,2015-, ,0,0,0,0,0,0,0,0,0,0,0,0,0,0,0,0,0,0,0,0,0,0,0,0,0,0,0,0,0,0,0,0,0,0,0,0,0,0,0,0,0,0,0,0,0,0,0,2,4,5,3,0,0,14
1999,Euclidean reconstruction and reprojection up to subgroups,"Ma Yi, Soatto Stefano, Kosecka Jana, Sastry Shankar",,Proceedings of the IEEE International Conference on Computer Vision,2, ,0,0,0,0,0,0,0,0,0,0,0,0,0,0,0,0,0,0,0,0,0,0,0,0,0,0,0,0,0,0,0,1,3,3,2,1,0,0,0,0,0,1,0,0,0,1,1,0,0,0,0,0,0,13
2007,Box invariance for biologically-inspired dynamical systems,"Abate A., Tiwari A., Sastry S.",1912216,Proceedings of the IEEE Conference on Decision and Control,, ,0,0,0,0,0,0,0,0,0,0,0,0,0,0,0,0,0,0,0,0,0,0,0,0,0,0,0,0,0,0,0,0,0,0,0,0,0,0,0,1,5,1,2,1,0,1,1,1,0,0,0,0,0,13
2011,Dimension reduction near periodic orbits of hybrid systems,"Burden S., Revzen S., Sastry S.S.",1912216,Proceedings of the IEEE Conference on Decision and Control,, ,0,0,0,0,0,0,0,0,0,0,0,0,0,0,0,0,0,0,0,0,0,0,0,0,0,0,0,0,0,0,0,0,0,0,0,0,0,0,0,0,0,0,0,1,3,1,4,3,1,0,0,0,0,13
2014,Fundamental limits of nonintrusive load monitoring,"Dong R., Ratliff L., Ohlsson H., Sastry S.S.",,HiCoNS 2014 - Proceedings of the 3rd International Conference on High Confidence Networked Systems (Part of CPS Week),, ,0,0,0,0,0,0,0,0,0,0,0,0,0,0,0,0,0,0,0,0,0,0,0,0,0,0,0,0,0,0,0,0,0,0,0,0,0,0,0,0,0,0,0,0,0,3,1,3,1,3,2,0,0,13
1984,NECESSARY AND SUFFICIENT CONDITIONS FOR PARAMETER CONVERGENCE IN ADAPTIVE CONTROL.,"Boyd Stephen, Sastry S.S.",7431619,Proceedings of the American Control Conference,3, ,0,0,0,0,0,0,0,0,0,0,0,0,0,0,0,0,2,3,4,2,1,0,0,0,0,0,0,0,0,0,0,0,0,0,0,0,0,0,0,0,0,0,0,0,0,0,0,0,0,0,0,0,0,12
1988,ON GRASPING AND COORDINATED MANIPULATION BY A MULTIFINGERED ROBOT HAND.,"Hsu Ping, Li Zexiang, Sastry Shankar",,,, ,0,0,0,0,0,0,0,0,0,0,0,0,0,0,0,0,0,0,0,0,0,0,2,2,1,1,1,1,0,1,1,0,0,0,0,0,0,0,0,0,0,0,0,0,1,0,1,0,0,0,0,0,0,12
1997,Vision guided navigation for a nonholonomic mobile robot,"Ma Yi, Kosecka Jana, Sastry Shankar",1912216,Proceedings of the IEEE Conference on Decision and Control,3, ,0,0,0,0,0,0,0,0,0,0,0,0,0,0,0,0,0,0,0,0,0,0,0,0,0,0,0,0,0,1,0,2,1,0,1,0,1,1,0,0,3,1,0,0,0,1,0,0,0,0,0,0,0,12
1999,Computing controllers for nonlinear hybrid systems,"Tomlin C., Lygeros J., Sastry S.",3029743,Lecture Notes in Computer Science (including subseries Lecture Notes in Artificial Intelligence and Lecture Notes in Bioinformatics),1569, ,0,0,0,0,0,0,0,0,0,0,0,0,0,0,0,0,0,0,0,0,0,0,0,0,0,0,0,0,0,0,0,4,0,0,2,1,0,0,0,0,0,1,1,1,1,0,0,0,0,1,0,0,0,12
2002,Infinitesimal motion estimation from multiple central panoramic views,"Shakernia O., Vidal R., Sastry S.",,"Proceedings - Workshop on Motion and Video Computing, MOTION 2002",, ,0,0,0,0,0,0,0,0,0,0,0,0,0,0,0,0,0,0,0,0,0,0,0,0,0,0,0,0,0,0,0,0,0,0,4,0,3,1,1,1,0,0,1,0,1,0,0,0,0,0,0,0,0,12
2002,Hybrid limit cycles and hybrid poincare-bendixson,"Simic S.N., Johansson K.H., Lygeros J., Sastry S.",14746670,IFAC Proceedings Volumes (IFAC-PapersOnline),15,1,0,0,0,0,0,0,0,0,0,0,0,0,0,0,0,0,0,0,0,0,0,0,0,0,0,0,0,0,0,0,0,0,0,0,2,1,2,1,0,0,0,1,1,0,0,0,0,0,1,1,0,2,0,12
2002,Hovering flight for a Micromechanical Flying Insect: Modeling and Robust control synthesis,"Schenato L., Deng X., Sastry S.",14746670,IFAC Proceedings Volumes (IFAC-PapersOnline),15,1,0,0,0,0,0,0,0,0,0,0,0,0,0,0,0,0,0,0,0,0,0,0,0,0,0,0,0,0,0,0,0,0,0,2,0,2,0,1,3,3,0,0,0,1,0,0,0,0,0,0,0,0,0,12
2002,Attitude Control for a Micromechanical Flying Insect via Sensor Output Feedback,"Schenato L., Wu W.C., Sastry S.S.",,"Proceedings of the 7th International Conference on Control, Automation, Robotics and Vision, ICARCV 2002",, ,0,0,0,0,0,0,0,0,0,0,0,0,0,0,0,0,0,0,0,0,0,0,0,0,0,0,0,0,0,0,0,0,0,0,3,2,1,0,1,0,0,0,0,3,1,0,1,0,0,0,0,0,0,12
2003,Geometric theory of nonlocal two-qubit operations,"Zhang J., Vala J., Sastry S., Whaley K.B.",10502947,"Physical Review A - Atomic, Molecular, and Optical Physics",67,4,0,0,0,0,0,0,0,0,0,0,0,0,0,0,0,0,0,0,0,0,0,0,0,0,0,0,0,0,0,0,0,0,0,0,0,0,0,0,0,0,0,0,0,0,2,0,2,0,0,6,1,1,0,12
2009,Understanding deadlock and livelock behaviors in Hybrid Control Systems,"Abate A., D'Innocenzo A., Di Benedetto M.D., Sastry S.",1751570X,Nonlinear Analysis: Hybrid Systems,3,2,0,0,0,0,0,0,0,0,0,0,0,0,0,0,0,0,0,0,0,0,0,0,0,0,0,0,0,0,0,0,0,0,0,0,0,0,0,0,0,0,0,1,3,1,2,0,1,1,0,1,2,0,0,12
2009,Algebraic approach to recovering topological information in distributed camera networks,"Lobaton E.J., Ahammad P., Sastry S.",,"2009 International Conference on Information Processing in Sensor Networks, IPSN 2009",, ,0,0,0,0,0,0,0,0,0,0,0,0,0,0,0,0,0,0,0,0,0,0,0,0,0,0,0,0,0,0,0,0,0,0,0,0,0,0,0,0,3,2,1,1,4,0,0,0,1,0,0,0,0,12
2010,3D motion planning algorithms for steerable needles using inverse kinematics,"Duindam V., Xu J., Alterovitz R., Sastry S., Goldberg K.",16107438,Springer Tracts in Advanced Robotics,57, ,0,0,0,0,0,0,0,0,0,0,0,0,0,0,0,0,0,0,0,0,0,0,0,0,0,0,0,0,0,0,0,0,0,0,0,0,0,0,0,0,0,2,0,0,1,1,1,1,0,3,2,1,0,12
2011,"Toward robotic sensor webs: Algorithms, systems, and experiments","Chung H., Oh S., Shim D.H., Sastry S.S.",189219,Proceedings of the IEEE,99,9,0,0,0,0,0,0,0,0,0,0,0,0,0,0,0,0,0,0,0,0,0,0,0,0,0,0,0,0,0,0,0,0,0,0,0,0,0,0,0,0,0,0,0,0,2,1,1,5,1,1,1,0,0,12
2013,A dynamical systems approach to energy disaggregation,"Dong R., Ratliff L., Ohlsson H., Sastry S.S.",1912216,Proceedings of the IEEE Conference on Decision and Control,, ,0,0,0,0,0,0,0,0,0,0,0,0,0,0,0,0,0,0,0,0,0,0,0,0,0,0,0,0,0,0,0,0,0,0,0,0,0,0,0,0,0,0,0,0,0,1,2,2,2,2,3,0,0,12
2013,Nonlinear basis pursuit,"Ohlsson H., Yang A.Y., Dong R., Sastry S.S.",10586393,"Conference Record - Asilomar Conference on Signals, Systems and Computers",, ,0,0,0,0,0,0,0,0,0,0,0,0,0,0,0,0,0,0,0,0,0,0,0,0,0,0,0,0,0,0,0,0,0,0,0,0,0,0,0,0,0,0,0,0,0,0,3,1,0,5,3,0,0,12
1986,"Nonlinear averaging theorems, and the determination of parameter convergence rates in adaptive control","Bodson M., Sastry S., Anderson B.D.O., Mareels I., Bitmead R.R.",1676911,Systems and Control Letters,7,3,0,0,0,0,0,0,0,0,0,0,0,0,0,0,0,0,0,0,0,2,1,1,2,0,1,1,0,1,0,0,0,0,0,0,0,0,0,0,0,0,0,0,0,2,0,0,0,0,0,0,0,0,0,11
