," 作者:Sastry, Shankar S.",,,,,,,,,,,,,,,,,,,,,,,,,,,,,,,,,,,,,,,,,,,,,,,,,,,,,,,,,,,
2007,Physical activity monitoring for assisted living at home,"Jafari R., Li W., Bajcsy R., Glaser S., Sastry S.",16800737,IFMBE Proceedings,13, ,0,0,0,0,0,0,0,0,0,0,0,0,0,0,0,0,0,0,0,0,0,0,0,0,0,0,0,0,0,0,0,0,0,0,0,0,0,0,1,2,3,2,7,3,3,3,3,4,3,2,5,0,0,41
2008,High-speed action recognition and localization in compressed domain videos,"Yeo C., Ahammad P., Ramchandran K., Sastry S.S.",10518215,IEEE Transactions on Circuits and Systems for Video Technology,18,8,0,0,0,0,0,0,0,0,0,0,0,0,0,0,0,0,0,0,0,0,0,0,0,0,0,0,0,0,0,0,0,0,0,0,0,0,0,0,0,0,2,5,4,4,5,4,7,5,1,2,2,0,0,41
1980,Hierarchical Stability and Alert State Steering Control of Interconnected Power Systems,"Sastry S., Varaiya P.",984094,IEEE Transactions on Circuits and Systems,27,11,0,0,0,0,0,0,0,0,0,0,0,0,3,2,1,2,1,1,0,0,3,0,1,2,0,1,2,0,0,0,0,2,0,0,3,0,3,0,1,1,0,1,0,4,1,1,1,0,0,0,2,1,0,40
2001,A hierarchical approach to probabilistic pursuit-evasion games with unmanned ground and aerial vehicles,"Kim H.J., Vidal R., Shim D.H., Shakernia O., Sastry S.",1912216,Proceedings of the IEEE Conference on Decision and Control,1, ,0,0,0,0,0,0,0,0,0,0,0,0,0,0,0,0,0,0,0,0,0,0,0,0,0,0,0,0,0,0,0,0,1,4,3,2,2,2,2,1,1,2,3,2,2,2,2,4,2,0,1,1,0,39
2003,Continuous Path Planning with Multiple Constraints,"Mitchell I.M., Sastry S.",1912216,Proceedings of the IEEE Conference on Decision and Control,5, ,0,0,0,0,0,0,0,0,0,0,0,0,0,0,0,0,0,0,0,0,0,0,0,0,0,0,0,0,0,0,0,0,0,0,0,0,0,2,3,1,3,4,2,1,1,5,2,7,1,3,4,0,0,39
2010,Robust algebraic segmentation of mixed rigid-body and planar motions from two views,"Rao S.R., Yang A.Y., Sastry S.S., Ma Y.",9205691,International Journal of Computer Vision,88,3,0,0,0,0,0,0,0,0,0,0,0,0,0,0,0,0,0,0,0,0,0,0,0,0,0,0,0,0,0,0,0,0,0,0,0,0,0,0,0,0,1,2,4,2,6,9,1,4,2,4,3,1,0,39
1989,On motion planning for dexterous manipulation - I: the problem formulation,"Li Zexiang, Canny J.F., Sastry Shankar S.",,,, ,0,0,0,0,0,0,0,0,0,0,0,0,0,0,0,0,0,0,0,0,0,1,0,0,2,2,3,2,1,1,2,0,4,2,0,0,0,1,1,1,0,0,3,0,4,0,0,1,3,2,2,0,0,38
2000,Towards a geometric theory of hybrid systems,"Simic S.N., Johansson K.H., Sastry S., Lygeros J.",3029743,Lecture Notes in Computer Science (including subseries Lecture Notes in Artificial Intelligence and Lecture Notes in Bioinformatics),1790, ,0,0,0,0,0,0,0,0,0,0,0,0,0,0,0,0,0,0,0,0,0,0,0,0,0,0,0,0,0,0,0,1,4,1,1,3,5,3,6,2,0,1,0,2,0,2,2,1,1,1,1,1,0,38
2004,Minimum construction of two-qubit quantum operations,"Zhang J., Vala J., Sastry S., Whaley K.B.",319007,Physical Review Letters,93,2,0,0,0,0,0,0,0,0,0,0,0,0,0,0,0,0,0,0,0,0,0,0,0,0,0,0,0,0,0,0,0,0,0,0,0,2,6,3,2,3,3,2,4,3,6,1,0,0,1,2,0,0,0,38
2005,Towards a geometric theory of hybrid systems,"Simic S.N., Johansson K.H., Lygeros J., Sastry S.",14928760,"Dynamics of Continuous, Discrete and Impulsive Systems Series B: Applications and Algorithms",12, 5-6,0,0,0,0,0,0,0,0,0,0,0,0,0,0,0,0,0,0,0,0,0,0,0,0,0,0,0,0,0,0,0,0,0,0,0,0,0,1,2,2,1,3,7,1,1,5,4,4,2,0,4,1,0,38
2005,Sufficient conditions for the existence of zeno behavior,"Ames A.D., Abate A., Sastry S.",,"Proceedings of the 44th IEEE Conference on Decision and Control, and the European Control Conference, CDC-ECC '05",2005, ,0,0,0,0,0,0,0,0,0,0,0,0,0,0,0,0,0,0,0,0,0,0,0,0,0,0,0,0,0,0,0,0,0,0,0,0,0,7,2,3,3,1,3,2,3,0,1,2,1,6,4,0,0,38
2010,Singularity-free dynamic equations of vehicle-manipulator systems,"From P.J., Duindam V., Pettersen K.Y., Gravdahl J.T., Sastry S.",1569190X,Simulation Modelling Practice and Theory,18,6,0,0,0,0,0,0,0,0,0,0,0,0,0,0,0,0,0,0,0,0,0,0,0,0,0,0,0,0,0,0,0,0,0,0,0,0,0,0,0,0,0,1,2,3,4,9,4,4,6,4,0,1,0,38
2001,Virtual Insect Flight Simulator (VIFS): A software testbed for insect flight,"Schenato L., Deng X., Wu W.C., Sastry S.",10504729,Proceedings - IEEE International Conference on Robotics and Automation,4, ,0,0,0,0,0,0,0,0,0,0,0,0,0,0,0,0,0,0,0,0,0,0,0,0,0,0,0,0,0,0,0,0,2,4,8,2,1,2,2,6,0,4,1,3,0,0,1,0,0,0,1,0,0,37
2003,Optimization-based formation reconfiguration planning for autonomous vehicles,"Zelinski S., Koo T.J., Sastry S.",10504729,Proceedings - IEEE International Conference on Robotics and Automation,3, ,0,0,0,0,0,0,0,0,0,0,0,0,0,0,0,0,0,0,0,0,0,0,0,0,0,0,0,0,0,0,0,0,0,0,1,1,1,4,5,4,4,5,0,2,1,4,1,3,0,0,0,1,0,37
2004,Cyber defense technology networking and evaluation,"Bajcsy R., Benzel T., Bishop M., Braden B., Brodley C., Fahmy S., Floyd S., Hardaker W., Joseph A., Kesidis G., Levitt K., Lindell B., Liu P., Miller D., Mundy R., Neuman C., Ostrenga R., Paxson V., Porras P., Rosenberg C., Tygar J.D., Sastry S., Sterne D., Wu. S.F.",10782,Communications of the ACM,47,3,0,0,0,0,0,0,0,0,0,0,0,0,0,0,0,0,0,0,0,0,0,0,0,0,0,0,0,0,0,0,0,0,0,0,0,1,6,4,3,3,5,0,1,3,0,3,0,1,4,0,2,0,0,36
2004,Time varying optimal control with packet losses,"Sinopoli B., Schenato L., Franceschetti M., Poolla K., Sastry S.S.",1912216,Proceedings of the IEEE Conference on Decision and Control,2, ,0,0,0,0,0,0,0,0,0,0,0,0,0,0,0,0,0,0,0,0,0,0,0,0,0,0,0,0,0,0,0,0,0,0,0,0,2,0,3,7,5,5,2,0,0,1,3,1,4,2,1,0,0,36
2008,Transactional confidentiality in sensor networks,"Pai S., Bermudez S., Wicker S.B., Meingast M., Roosta T., Sastry S., Mulligan D.K.",15407993,IEEE Security and Privacy,6,4,0,0,0,0,0,0,0,0,0,0,0,0,0,0,0,0,0,0,0,0,0,0,0,0,0,0,0,0,0,0,0,0,0,0,0,0,0,0,0,1,3,0,3,2,5,3,2,8,2,5,1,1,0,36
2009,A method for extracting temporal parameters based on hidden markov models in body sensor networks with inertial sensors,"Guenterberg E., Yang A.Y., Ghasemzadeh H., Jafari R., Bajcsy R., Sastry S.S.",10897771,IEEE Transactions on Information Technology in Biomedicine,13,6,0,0,0,0,0,0,0,0,0,0,0,0,0,0,0,0,0,0,0,0,0,0,0,0,0,0,0,0,0,0,0,0,0,0,0,0,0,0,0,0,0,1,4,5,5,3,2,8,3,0,4,1,0,36
2002,"FLYING ROBOTS: Modeling, control and decision making","Kim H.J., Shim D.H., Sastry S.",10504729,Proceedings - IEEE International Conference on Robotics and Automation,1, ,0,0,0,0,0,0,0,0,0,0,0,0,0,0,0,0,0,0,0,0,0,0,0,0,0,0,0,0,0,0,0,0,0,0,1,4,0,6,4,2,4,1,6,3,1,2,1,0,0,0,0,0,0,35
2009,Box invariance in biologically-inspired dynamical systems,"Abate A., Tiwari A., Sastry S.",51098,Automatica,45,7,0,0,0,0,0,0,0,0,0,0,0,0,0,0,0,0,0,0,0,0,0,0,0,0,0,0,0,0,0,0,0,0,0,0,0,0,0,0,0,0,0,0,1,4,4,1,3,3,4,5,7,3,0,35
1999,Aircraft conflict prediction and resolution using Brownian motion,"Hu Jianghai, Lygeros John, Prandini Maria, Sastry Shankar",1912216,Proceedings of the IEEE Conference on Decision and Control,3, ,0,0,0,0,0,0,0,0,0,0,0,0,0,0,0,0,0,0,0,0,0,0,0,0,0,0,0,0,0,0,0,3,2,1,1,0,1,2,0,0,1,1,0,5,3,4,4,2,1,2,1,0,0,34
1999,Hierarchical hybrid system model and its simulation,"Liu Jie, Liu Xiaojun, Koo Tak-Kuen J., Sinopoli Bruno, Sastry Shankar, Lee Edward A.",1912216,Proceedings of the IEEE Conference on Decision and Control,4, ,0,0,0,0,0,0,0,0,0,0,0,0,0,0,0,0,0,0,0,0,0,0,0,0,0,0,0,0,0,0,0,0,5,0,1,1,1,2,0,0,1,2,1,2,1,4,4,6,1,1,1,0,0,34
2003,Hybrid System Design for Formations of Autonomous Vehicles,"Zelinski S., Koo T.J., Sastry S.",1912216,Proceedings of the IEEE Conference on Decision and Control,1, ,0,0,0,0,0,0,0,0,0,0,0,0,0,0,0,0,0,0,0,0,0,0,0,0,0,0,0,0,0,0,0,0,0,0,0,2,0,4,4,4,3,3,1,1,1,2,2,3,1,2,1,0,0,34
2009,Respectful cameras: Detecting visual markers in real-time to address privacy concerns,"Schiff J., Meingast M., Mulligan D.K., Sastry S., Goldberg K.",,Protecting Privacy in Video Surveillance,, ,0,0,0,0,0,0,0,0,0,0,0,0,0,0,0,0,0,0,0,0,0,0,0,0,0,0,0,0,0,0,0,0,0,0,0,0,0,0,0,0,0,0,1,1,1,5,8,5,5,5,2,1,0,34
1982,Global Analysis of Swing Dynamics,"Arapostathis A., Sastry S.S., Varaiya P.",984094,IEEE Transactions on Circuits and Systems,29,10,0,0,0,0,0,0,0,0,0,0,0,0,0,1,1,2,1,2,1,3,1,1,1,1,3,0,2,0,0,0,0,0,0,0,0,3,1,0,0,0,0,1,0,0,1,1,1,2,0,1,1,1,0,33
1997,Noncooperative conflict resolution,"Tomlin Claire, Pappas George J., Sastry Shankar",1912216,Proceedings of the IEEE Conference on Decision and Control,2, ,0,0,0,0,0,0,0,0,0,0,0,0,0,0,0,0,0,0,0,0,0,0,0,0,0,0,0,0,0,0,1,1,5,2,2,2,2,0,1,1,0,4,3,2,1,2,1,1,1,0,1,0,0,33
2000,Controlled invariance of discrete time systems?,"Vidal R., Schaffert S., Lygeros J., Sastry S.",3029743,Lecture Notes in Computer Science (including subseries Lecture Notes in Artificial Intelligence and Lecture Notes in Bioinformatics),1790, ,0,0,0,0,0,0,0,0,0,0,0,0,0,0,0,0,0,0,0,0,0,0,0,0,0,0,0,0,0,0,0,0,3,2,4,3,1,1,2,2,2,1,0,2,0,4,2,0,1,1,2,0,0,33
2003,Probabilistic safety analysis in three dimensional aircraft flight,"Hu J., Prandini M., Sastry S.",1912216,Proceedings of the IEEE Conference on Decision and Control,5, ,0,0,0,0,0,0,0,0,0,0,0,0,0,0,0,0,0,0,0,0,0,0,0,0,0,0,0,0,0,0,0,0,0,0,0,0,3,5,3,2,4,3,0,3,2,1,3,0,2,0,2,0,0,33
2005,Characterization of zeno behavior in hybrid systems using homological methods,"Ames A.D., Sastry S.",7431619,Proceedings of the American Control Conference,2, ,0,0,0,0,0,0,0,0,0,0,0,0,0,0,0,0,0,0,0,0,0,0,0,0,0,0,0,0,0,0,0,0,0,0,0,0,2,2,3,3,1,1,1,0,1,3,4,2,1,2,4,3,0,33
2014,A learning based approach to control synthesis of Markov decision processes for linear temporal logic specifications,"Sadigh D., Kim E.S., Coogan S., Sastry S.S., Seshia S.A.",7431546,Proceedings of the IEEE Conference on Decision and Control,2015-, February,0,0,0,0,0,0,0,0,0,0,0,0,0,0,0,0,0,0,0,0,0,0,0,0,0,0,0,0,0,0,0,0,0,0,0,0,0,0,0,0,0,0,0,0,0,0,4,3,4,8,11,3,0,33
1995,Hybrid control in air traffic management systems,"Sastry S., Meyer G., Tomlin C., Lygeros J., Godbole D., Pappas G.",1912216,Proceedings of the IEEE Conference on Decision and Control,2, ,0,0,0,0,0,0,0,0,0,0,0,0,0,0,0,0,0,0,0,0,0,0,0,0,0,0,0,1,2,1,0,2,2,2,1,0,1,1,0,1,1,3,3,0,3,0,1,4,0,1,2,0,0,32
2006,Reachability analysis for controlled discrete time stochastic hybrid systems,"Amin S., Abate A., Prandini M., Lygeros J., Sastry S.",3029743,Lecture Notes in Computer Science (including subseries Lecture Notes in Artificial Intelligence and Lecture Notes in Bioinformatics),3927, ,0,0,0,0,0,0,0,0,0,0,0,0,0,0,0,0,0,0,0,0,0,0,0,0,0,0,0,0,0,0,0,0,0,0,0,0,0,3,4,3,3,6,2,2,1,1,3,0,0,2,1,1,0,32
2015,Sparse Illumination Learning and Transfer for Single-Sample Face Recognition with Image Corruption and Misalignment,"Zhuang L., Chan T.-H., Yang A.Y., Sastry S.S., Ma Y.",9205691,International Journal of Computer Vision,114, 2-3,0,0,0,0,0,0,0,0,0,0,0,0,0,0,0,0,0,0,0,0,0,0,0,0,0,0,0,0,0,0,0,0,0,0,0,0,0,0,0,0,0,0,0,0,0,0,0,5,10,8,7,2,0,32
1987,EFFECT OF DISCRETIZED FEEDBACK IN A CLOSED LOOP SYSTEM.,"Hsu Ping, Sastry Shankar",1912216,Proceedings of the IEEE Conference on Decision and Control,, ,0,0,0,0,0,0,0,0,0,0,0,0,0,0,0,0,0,0,0,0,1,0,0,2,0,1,0,0,0,0,0,1,2,2,1,1,0,0,1,0,0,0,1,0,1,1,5,3,4,1,2,1,0,31
1988,DYNAMIC CONTROL OF REDUNDANT MANIPULATORS.,"Hsu Ping, Hauser John, Sastry Shankar",,,, ,0,0,0,0,0,0,0,0,0,0,0,0,0,0,0,0,0,0,0,0,3,3,2,2,0,2,0,1,0,2,0,0,0,1,1,1,0,0,1,0,2,0,1,1,1,3,0,1,0,3,0,0,0,31
1993,Trajectory generation for the N-trailer problem using Goursat normal form,"Tilbury D., Murray R.M., Sastry S.",1912216,Proceedings of the IEEE Conference on Decision and Control,2, ,0,0,0,0,0,0,0,0,0,0,0,0,0,0,0,0,0,0,0,0,0,0,0,0,0,0,3,0,2,1,2,1,3,0,1,4,2,2,0,2,0,3,3,0,0,0,0,1,1,0,0,0,0,31
1997,Next generation architecture for Air Traffic Management systems,"Pappas G., Tomlin C., Lygeros J., Godbole D., Sastry S.",1912216,Proceedings of the IEEE Conference on Decision and Control,3, ,0,0,0,0,0,0,0,0,0,0,0,0,0,0,0,0,0,0,0,0,0,0,0,0,0,0,0,0,0,0,0,1,3,5,2,1,0,1,1,2,2,1,2,3,0,2,0,0,3,2,0,0,0,31
2005,Implementing and testing a nonlinear model predictive tracking controller for aerial pursuit/evasion games on a fixed wing aircraft,"Eklund J.M., Sprinkle J., Sastry S.",7431619,Proceedings of the American Control Conference,3, ,0,0,0,0,0,0,0,0,0,0,0,0,0,0,0,0,0,0,0,0,0,0,0,0,0,0,0,0,0,0,0,0,0,0,0,0,0,0,1,2,1,2,4,2,4,2,2,3,1,2,4,1,0,31
2010,Towards an efficient distributed object recognition system in wireless smart camera networks,"Naikal N., Yang A.Y., Sastry S.S.",,"13th Conference on Information Fusion, Fusion 2010",, ,0,0,0,0,0,0,0,0,0,0,0,0,0,0,0,0,0,0,0,0,0,0,0,0,0,0,0,0,0,0,0,0,0,0,0,0,0,0,0,0,1,0,1,0,2,3,6,8,4,3,3,0,0,31
1983,Hierarchical Aggregation of Linear Systems with Multiple Time Scales,"Coderch M., Willsky A.S., Sastry S.S., Castanon D.A.",189286,IEEE Transactions on Automatic Control,28,11,0,0,0,0,0,0,0,0,0,0,0,0,0,0,0,4,4,3,0,3,2,0,1,3,1,0,0,0,0,2,0,1,1,1,0,1,0,0,0,0,0,1,0,0,0,1,1,0,0,0,0,0,0,30
1983,HIERARCHICAL AGGREGATION OF SINGULARLY PERTURBED FINITE STATE MARKOV PROCESSES.,"Coderch M., Willsky A.S., Sastry S.S., Castanon D.A.",909491,Stochastics,8,4,0,0,0,0,0,0,0,0,0,0,0,0,0,0,0,0,0,0,1,4,1,2,1,2,2,0,2,0,0,0,2,0,0,1,1,1,0,1,1,2,2,0,0,1,0,0,1,1,1,0,0,0,0,30
1989,Dynamic regrasping by coordinated control of sliding for a multifingered hand,"Cole Arlene A., Hsu Ping, Sastry Shankar S.",,,, ,0,0,0,0,0,0,0,0,0,0,0,0,0,0,0,0,0,0,0,0,0,1,1,2,3,2,3,1,0,1,0,1,1,2,0,1,0,0,1,0,0,0,1,2,4,1,1,0,0,1,0,0,0,30
1997,Bounded tracking for non-minimum phase nonlinear systems with fast zero dynamics,"Tomlin C.J., Sastry S.S.",207179,International Journal of Control,68,4,0,0,0,0,0,0,0,0,0,0,0,0,0,0,0,0,0,0,0,0,0,0,0,0,0,0,0,0,0,1,0,2,1,1,2,4,2,3,0,2,3,0,1,0,2,2,2,0,2,0,0,0,0,30
2001,Flight control system for a micromechanical flying insect: Architecture and implementation,"Schenato L., Deng X., Sastry S.",10504729,Proceedings - IEEE International Conference on Robotics and Automation,2, ,0,0,0,0,0,0,0,0,0,0,0,0,0,0,0,0,0,0,0,0,0,0,0,0,0,0,0,0,0,0,0,0,3,2,3,3,1,1,2,5,5,1,0,3,1,0,0,0,0,0,0,0,0,30
2003,Optimal segmentation of dynamic scenes from two perspective views,"Vidal R., Sastry S.",10636919,Proceedings of the IEEE Computer Society Conference on Computer Vision and Pattern Recognition,2, ,0,0,0,0,0,0,0,0,0,0,0,0,0,0,0,0,0,0,0,0,0,0,0,0,0,0,0,0,0,0,0,0,0,0,0,2,3,6,3,3,2,1,1,0,1,2,0,1,0,3,2,0,0,30
2006,On the stability of Zeno equilibria,"Ames A.D., Tabuada P., Sastry S.",3029743,Lecture Notes in Computer Science (including subseries Lecture Notes in Artificial Intelligence and Lecture Notes in Bioinformatics),3927, ,0,0,0,0,0,0,0,0,0,0,0,0,0,0,0,0,0,0,0,0,0,0,0,0,0,0,0,0,0,0,0,0,0,0,0,0,0,3,2,4,0,0,2,0,2,4,0,3,1,4,3,2,0,30
2017,Active preference-based learning of reward functions,"Sadigh D., Dragan A.D., Sastry S., Seshia S.A.",2330765X,Robotics: Science and Systems,13, ,0,0,0,0,0,0,0,0,0,0,0,0,0,0,0,0,0,0,0,0,0,0,0,0,0,0,0,0,0,0,0,0,0,0,0,0,0,0,0,0,0,0,0,0,0,0,0,0,1,9,12,8,0,30
2003,Model identification and attitude control for a micromechanical flying insect including thorax and sensor models,"Deng X., Schenato L., Sastry S.S.",10504729,Proceedings - IEEE International Conference on Robotics and Automation,1, ,0,0,0,0,0,0,0,0,0,0,0,0,0,0,0,0,0,0,0,0,0,0,0,0,0,0,0,0,0,0,0,0,0,0,1,1,1,2,3,1,1,2,4,5,2,2,1,3,0,0,0,0,0,29
1987,GLOBAL STABILITY PROOFS FOR CONTINUOUS-TIME INDIRECT ADAPTIVE CONTROL SCHEMES.,"Bai Er-Wei, Sastry Shankar S.",189286,IEEE Transactions on Automatic Control,AC-32,6,0,0,0,0,0,0,0,0,0,0,0,0,0,0,0,0,0,0,0,2,4,3,1,0,1,0,1,3,1,0,1,0,1,0,1,1,0,0,1,0,0,0,1,0,0,0,0,1,1,4,0,0,0,28
1989,Zero dynamics of regularly perturbed systems may be singularly perturbed,"Sastry S., Hauser J., Kokotovic P.",1676911,Systems and Control Letters,13,4,0,0,0,0,0,0,0,0,0,0,0,0,0,0,0,0,0,0,0,0,0,0,1,1,1,1,3,4,2,1,0,0,3,1,0,0,0,0,0,1,2,1,1,1,0,0,4,0,0,0,0,0,0,28
1999,Formal approach to reactive system design: unmanned aerial vehicle flight management system design example,"Koo T.John, Sinopoli Bruno, Sangiovanni-Vincentelli Alberto, Sastry Shankar",,Proceedings of the IEEE International Symposium on Computer-Aided Control System Design,, ,0,0,0,0,0,0,0,0,0,0,0,0,0,0,0,0,0,0,0,0,0,0,0,0,0,0,0,0,0,0,0,0,4,1,0,0,1,0,0,2,2,2,3,2,0,5,1,1,3,1,0,0,0,28
1982,The Robustness of Controllability and Observability of Linear Time-Varying Systems,"Sastry S.S., Desoer C.A.",189286,IEEE Transactions on Automatic Control,27,4,0,0,0,0,0,0,0,0,0,0,0,0,0,0,0,0,0,0,3,0,0,0,0,0,0,1,0,0,1,1,1,0,0,0,0,1,2,0,0,1,5,2,2,2,2,1,0,1,0,1,0,0,0,27
1994,Design and control of a simplified Stewart platform for endoscopy,"Wendlandt Jeff M., Sastry S.Shankar",1912216,Proceedings of the IEEE Conference on Decision and Control,1, ,0,0,0,0,0,0,0,0,0,0,0,0,0,0,0,0,0,0,0,0,0,0,0,0,0,0,1,0,0,2,1,1,1,2,0,0,1,4,1,3,2,1,1,2,0,1,0,0,1,2,0,0,0,27
1994,Orientation control of the dynamic satellite,"Walsh Gregory C., Montgomery Richard, Sastry S.Shankar",7431619,Proceedings of the American Control Conference,1, ,0,0,0,0,0,0,0,0,0,0,0,0,0,0,0,0,0,0,0,0,0,0,0,0,0,0,2,1,4,0,0,3,0,0,0,3,0,1,2,0,1,1,0,0,1,1,0,0,3,3,1,0,0,27
1996,A game-theoretic approach to hybrid system design,"Lygeros J., Godbole D.N., Sastry S.",3029743,Lecture Notes in Computer Science (including subseries Lecture Notes in Artificial Intelligence and Lecture Notes in Bioinformatics),1066, ,0,0,0,0,0,0,0,0,0,0,0,0,0,0,0,0,0,0,0,0,0,0,0,0,0,0,0,0,0,3,3,3,3,2,0,0,3,1,0,2,0,0,2,2,0,2,1,0,0,0,0,0,0,27
2012,Switched and symmetric pursuit/evasion games using online model predictive control with application to autonomous aircraft,"Eklund J.M., Sprinkle J., Sastry S.S.",10636536,IEEE Transactions on Control Systems Technology,20,3,0,0,0,0,0,0,0,0,0,0,0,0,0,0,0,0,0,0,0,0,0,0,0,0,0,0,0,0,0,0,0,0,0,0,0,0,0,0,0,0,0,0,0,2,3,1,3,5,7,4,2,0,0,27
2013,A low-bandwidth camera sensor platform with applications in smart camera networks,"Chen P., Hong K., Naikal N., Sastry S.S., Tygar D., Yan P., Yang A.Y., Chang L.-C., Lin L., Wang S., Lobaton E., Oh S., Ahammad P.",15504859,ACM Transactions on Sensor Networks,9,2,0,0,0,0,0,0,0,0,0,0,0,0,0,0,0,0,0,0,0,0,0,0,0,0,0,0,0,0,0,0,0,0,0,0,0,0,0,0,0,0,0,0,0,0,1,5,5,8,3,2,2,1,0,27
1981,Coherency for Interconnected Power Systems,"Sastry S., Varaiya P.",189286,IEEE Transactions on Automatic Control,26,1,0,0,0,0,0,0,0,0,0,0,0,0,0,2,2,2,1,1,1,0,0,1,0,1,0,0,0,0,0,0,0,0,0,1,0,0,0,0,1,1,0,1,1,2,2,1,0,0,3,0,2,0,0,26
2001,Mode switching synthesis for reachability specifications,"Koo T.J., Pappas G.J., Sastry S.",3029743,Lecture Notes in Computer Science (including subseries Lecture Notes in Artificial Intelligence and Lecture Notes in Bioinformatics),2034, ,0,0,0,0,0,0,0,0,0,0,0,0,0,0,0,0,0,0,0,0,0,0,0,0,0,0,0,0,0,0,0,0,3,3,2,1,2,2,1,1,0,2,2,3,3,0,0,0,0,1,0,0,0,26
2001,Decidable and semi-decidable controller synthesis for classes of discrete time hybrid systems,"Vidal R., Schaffert S., Shakernia O., Lygeros J., Sastry S.",1912216,Proceedings of the IEEE Conference on Decision and Control,2, ,0,0,0,0,0,0,0,0,0,0,0,0,0,0,0,0,0,0,0,0,0,0,0,0,0,0,0,0,0,0,0,0,0,3,4,2,2,5,1,0,0,0,1,3,3,1,0,0,0,0,1,0,0,26
2004,Rank conditions on the multiple-view matrix,"Ma Y., Huang K., Vidal R., Kosecka J., Sastry S.",9205691,International Journal of Computer Vision,59,2,0,0,0,0,0,0,0,0,0,0,0,0,0,0,0,0,0,0,0,0,0,0,0,0,0,0,0,0,0,0,0,0,0,0,0,2,1,4,1,2,1,3,2,3,0,1,2,1,0,2,1,0,0,26
2005,Roadmap based pursuit-evasion and collision avoidance,"Isler V., Sun D., Sastry S.",23307668,Robotics: Science and Systems,1, ,0,0,0,0,0,0,0,0,0,0,0,0,0,0,0,0,0,0,0,0,0,0,0,0,0,0,0,0,0,0,0,0,0,0,0,0,0,0,2,0,1,6,4,1,2,1,0,1,3,2,3,0,0,26
2006,Optimal linear LQG control over lossy networks without packet acknowledgment,"Sinopoli B., Schenato L., Franceschetti M., Poolla K., Sastry S.",1912216,Proceedings of the IEEE Conference on Decision and Control,, ,0,0,0,0,0,0,0,0,0,0,0,0,0,0,0,0,0,0,0,0,0,0,0,0,0,0,0,0,0,0,0,0,0,0,0,0,0,0,3,0,3,2,4,3,2,2,1,1,1,1,3,0,0,26
2010,A distributed topological camera network representation for tracking applications,"Lobaton E., Vasudevan R., Bajcsy R., Sastry S.",10577149,IEEE Transactions on Image Processing,19,10,0,0,0,0,0,0,0,0,0,0,0,0,0,0,0,0,0,0,0,0,0,0,0,0,0,0,0,0,0,0,0,0,0,0,0,0,0,0,0,0,0,0,3,4,6,5,1,2,2,1,1,1,0,26
1993,Stabilization and tracking for nonholonomic control systems using time-varying state feedback,"Murray R.M., Walsh G., Sastry S.S.",9629505,IFAC Symposia Series,,7,0,0,0,0,0,0,0,0,0,0,0,0,0,0,0,0,0,0,0,0,0,0,0,0,0,0,0,0,2,0,1,1,3,0,2,0,3,0,0,1,0,1,1,0,0,0,0,2,5,2,1,0,0,25
2000,Decidable controller synthesis for classes of linear systems,"Shakernia O., Pappas G.J., Sastry S.",3029743,Lecture Notes in Computer Science (including subseries Lecture Notes in Artificial Intelligence and Lecture Notes in Bioinformatics),1790, ,0,0,0,0,0,0,0,0,0,0,0,0,0,0,0,0,0,0,0,0,0,0,0,0,0,0,0,0,0,0,0,3,6,1,3,2,0,3,1,0,0,0,0,1,0,1,0,0,0,2,1,1,0,25
2004,Optimal quantum circuit synthesis from controlled-unitary gates,"Zhang J., Vala J., Sastry S., Birgitta Whaley K.",10502947,"Physical Review A - Atomic, Molecular, and Optical Physics",69,4,0,0,0,0,0,0,0,0,0,0,0,0,0,0,0,0,0,0,0,0,0,0,0,0,0,0,0,0,0,0,0,0,0,0,0,3,4,2,2,2,2,2,1,0,1,0,1,0,1,3,0,1,0,25
2013,Energy management via pricing in LQ dynamic games,"Coogan S., Ratliff L.J., Calderone D., Tomlin C., Sastry S.S.",7431619,Proceedings of the American Control Conference,, ,0,0,0,0,0,0,0,0,0,0,0,0,0,0,0,0,0,0,0,0,0,0,0,0,0,0,0,0,0,0,0,0,0,0,0,0,0,0,0,0,0,0,0,0,0,4,5,5,6,2,3,0,0,25
2013,Consistent approximations for the optimal control of constrained switched systems-part 1: A conceptual algorithm,"Vasudevan R., Gonzalez H., Bajcsy R., Sastry S.S.",3630129,SIAM Journal on Control and Optimization,51,6,0,0,0,0,0,0,0,0,0,0,0,0,0,0,0,0,0,0,0,0,0,0,0,0,0,0,0,0,0,0,0,0,0,0,0,0,0,0,0,0,0,0,0,0,1,1,0,7,7,7,2,0,0,25
2015,Model reduction near periodic orbits of hybrid dynamical systems,"Burden S.A., Revzen S., Sastry S.S.",189286,IEEE Transactions on Automatic Control,60,10,0,0,0,0,0,0,0,0,0,0,0,0,0,0,0,0,0,0,0,0,0,0,0,0,0,0,0,0,0,0,0,0,0,0,0,0,0,0,0,0,0,0,0,0,0,0,1,6,7,5,4,2,0,25
2016,On the Characterization of Local Nash Equilibria in Continuous Games,"Ratliff L.J., Burden S.A., Sastry S.S.",189286,IEEE Transactions on Automatic Control,61,8,0,0,0,0,0,0,0,0,0,0,0,0,0,0,0,0,0,0,0,0,0,0,0,0,0,0,0,0,0,0,0,0,0,0,0,0,0,0,0,0,0,0,0,0,0,0,0,2,3,6,12,2,0,25
1995,Planning motions of rolling surfaces,"Bicchi Antonio, Prattichizzo Domenico, Sastry Shankar S.",1912216,Proceedings of the IEEE Conference on Decision and Control,3, ,0,0,0,0,0,0,0,0,0,0,0,0,0,0,0,0,0,0,0,0,0,0,0,0,0,0,0,0,0,1,0,4,2,3,1,0,1,1,1,0,1,1,1,2,0,3,0,0,1,1,0,0,0,24
2003,Optimal coordinated motions of multiple agents moving on a plane,"Hu J., Prandini M., Sastry S.",3630129,SIAM Journal on Control and Optimization,42,2,0,0,0,0,0,0,0,0,0,0,0,0,0,0,0,0,0,0,0,0,0,0,0,0,0,0,0,0,0,0,0,0,0,0,1,0,4,1,5,2,1,2,2,1,2,1,2,0,0,0,0,0,0,24
2001,Hovering flight control of a micromechanical flying insect,"Deng X., Schenato L., Sastry S.",1912216,Proceedings of the IEEE Conference on Decision and Control,1, ,0,0,0,0,0,0,0,0,0,0,0,0,0,0,0,0,0,0,0,0,0,0,0,0,0,0,0,0,0,0,0,0,0,2,2,0,1,1,1,3,2,1,3,1,0,0,3,0,1,1,1,0,0,23
2005,Radon-based structure from motion without correspondences,"Makadia A., Geyer C., Sastry S., Daniilidis K.",,"Proceedings - 2005 IEEE Computer Society Conference on Computer Vision and Pattern Recognition, CVPR 2005",I, ,0,0,0,0,0,0,0,0,0,0,0,0,0,0,0,0,0,0,0,0,0,0,0,0,0,0,0,0,0,0,0,0,0,0,0,0,0,3,7,4,2,3,1,1,1,0,1,0,0,0,0,0,0,23
2008,Convergence analysis of reweighted sum-product algorithms,"Roosta T.G., Wainwright M.J., Sastry S.S.",1053587X,IEEE Transactions on Signal Processing,56,9,0,0,0,0,0,0,0,0,0,0,0,0,0,0,0,0,0,0,0,0,0,0,0,0,0,0,0,0,0,0,0,0,0,0,0,0,0,0,0,1,0,1,4,2,4,5,3,0,2,1,0,0,0,23
2009,Multiple-view object recognition in band-limited distributed camera networks,"Yang A.Y., Maji S., Christoudias C.M., Darrell T., Malik J., Sastry S.S.",,"2009 3rd ACM/IEEE International Conference on Distributed Smart Cameras, ICDSC 2009",, ,0,0,0,0,0,0,0,0,0,0,0,0,0,0,0,0,0,0,0,0,0,0,0,0,0,0,0,0,0,0,0,0,0,0,0,0,0,0,0,0,0,2,3,6,2,1,2,4,1,1,1,0,0,23
2010,A numerical method for the optimal control of switched systems,"Gonzalez H., Vasudevan R., Kamgarpour M., Sastry S.S., Bajcsy R., Tomlin C.",1912216,Proceedings of the IEEE Conference on Decision and Control,, ,0,0,0,0,0,0,0,0,0,0,0,0,0,0,0,0,0,0,0,0,0,0,0,0,0,0,0,0,0,0,0,0,0,0,0,0,0,0,0,0,0,0,1,4,2,4,1,4,2,3,2,0,0,23
2012,Compressive phase retrieval from squared output measurements via semidefinite programming,"Ohlsson H., Yang A.Y., Dong R., Sastry S.S.",14746670,IFAC Proceedings Volumes (IFAC-PapersOnline),16,1,0,0,0,0,0,0,0,0,0,0,0,0,0,0,0,0,0,0,0,0,0,0,0,0,0,0,0,0,0,0,0,0,0,0,0,0,0,0,0,0,0,0,0,0,1,4,4,2,1,8,2,1,0,23
1992,Stabilization of trajectories for systems with nonholonomic constraints,"Walsh G., Tilbury D., Sastry S., Murray R., Laumond J.-P.",,Proceedings - IEEE International Conference on Robotics and Automation,3, ,0,0,0,0,0,0,0,0,0,0,0,0,0,0,0,0,0,0,0,0,0,0,0,0,1,3,6,1,2,2,0,1,1,0,0,1,0,1,0,0,0,0,1,0,0,0,0,0,0,0,1,1,0,22
1996,Conflict resolution for multi-agent hybrid systems,"Pappas George J., Tomlin Claire, Sastry Shankar",1912216,Proceedings of the IEEE Conference on Decision and Control,2, ,0,0,0,0,0,0,0,0,0,0,0,0,0,0,0,0,0,0,0,0,0,0,0,0,0,0,0,0,1,1,0,1,0,0,0,1,0,0,3,2,2,1,4,3,0,0,0,1,1,0,1,0,0,22
2007,Sufficient conditions for the existence of zeno behavior in a class of nonlinear hybrid systems via constant approximations,"Ames A.D., Abate A., Sastry S.",1912216,Proceedings of the IEEE Conference on Decision and Control,, ,0,0,0,0,0,0,0,0,0,0,0,0,0,0,0,0,0,0,0,0,0,0,0,0,0,0,0,0,0,0,0,0,0,0,0,0,0,0,0,3,1,3,3,2,4,3,0,1,1,1,0,0,0,22
2007,Estimation over wireless sensor networks,"Zhu B., Sinopoli B., Poolla K., Sastry S.",7431619,Proceedings of the American Control Conference,, ,0,0,0,0,0,0,0,0,0,0,0,0,0,0,0,0,0,0,0,0,0,0,0,0,0,0,0,0,0,0,0,0,0,0,0,0,0,0,0,4,2,4,2,4,2,2,1,0,0,1,0,0,0,22
1989,Nonlinear control via approximate input-output linearization: The ball and beam example,"Hauser John, Sastry Shankar, Kokotovic Petar",1912216,Proceedings of the IEEE Conference on Decision and Control,3, ,0,0,0,0,0,0,0,0,0,0,0,0,0,0,0,0,0,0,0,0,0,0,3,5,1,0,0,1,1,1,0,1,1,0,0,0,1,0,0,1,1,0,0,0,0,1,2,0,0,0,1,0,0,21
1995,Biological motor control approaches for a planar diver,"Crawford Lara S., Sastry S.Shankar",1912216,Proceedings of the IEEE Conference on Decision and Control,4, ,0,0,0,0,0,0,0,0,0,0,0,0,0,0,0,0,0,0,0,0,0,0,0,0,0,0,0,0,0,0,1,1,2,1,0,2,1,1,1,1,0,0,0,1,1,3,1,2,0,2,0,0,0,21
