," 作者:Schiele, Bernt",,,,,,,,,,,,,,,,,,,,,,,,,,,,,,,,,,,,,,,,,,,,,,,,,,,,,,,,,,,
2011,Pick your neighborhood - Improving labels and neighborhood structure for label propagation,"Ebert S., Fritz M., Schiele B.",3029743,Lecture Notes in Computer Science (including subseries Lecture Notes in Artificial Intelligence and Lecture Notes in Bioinformatics),6835, ,0,0,0,0,0,0,0,0,0,0,0,0,0,0,0,0,0,0,0,0,0,0,0,0,0,0,0,0,0,0,0,0,0,0,0,0,0,0,0,0,0,0,0,1,0,0,1,1,1,0,0,0,0,4
2004,Towards distributed awareness - An artifact based approach,"Michahelles F., Antifakos S., Schiele B., Schmidt A., Beigl M.",15506193,"Proceedings - IEEE Workshop on Mobile Computing Systems and Applications, WMCSA",, ,0,0,0,0,0,0,0,0,0,0,0,0,0,0,0,0,0,0,0,0,0,0,0,0,0,0,0,0,0,0,0,0,0,0,0,0,0,1,1,0,0,0,0,1,1,0,0,0,0,0,0,0,0,4
2002,The light field oracle,"Lutolf R., Schiele B., Gross M.H.",15504085,Proceedings - Pacific Conference on Computer Graphics and Applications,2002-, ,0,0,0,0,0,0,0,0,0,0,0,0,0,0,0,0,0,0,0,0,0,0,0,0,0,0,0,0,0,0,0,0,0,0,0,2,0,1,1,0,0,0,0,0,0,0,0,0,0,0,0,0,0,4
2020,Motion Segmentation Multiple Object Tracking by Correlation Co-Clustering,"Keuper M., Tang S., Andres B., Brox T., Schiele B.",1628828,IEEE Transactions on Pattern Analysis and Machine Intelligence,42,1,0,0,0,0,0,0,0,0,0,0,0,0,0,0,0,0,0,0,0,0,0,0,0,0,0,0,0,0,0,0,0,0,0,0,0,0,0,0,0,0,0,0,0,0,0,0,0,0,0,0,1,2,0,3
2019,Disentangling adversarial robustness and generalization,"Stutz D., Hein M., Schiele B.",10636919,Proceedings of the IEEE Computer Society Conference on Computer Vision and Pattern Recognition,2019-, ,0,0,0,0,0,0,0,0,0,0,0,0,0,0,0,0,0,0,0,0,0,0,0,0,0,0,0,0,0,0,0,0,0,0,0,0,0,0,0,0,0,0,0,0,0,0,0,0,0,0,1,2,0,3
2019,Semantic projection network for zero-and few-label semantic segmentation,"Xian Y., Choudhury S., He Y., Schiele B., Akata Z.",10636919,Proceedings of the IEEE Computer Society Conference on Computer Vision and Pattern Recognition,2019-, ,0,0,0,0,0,0,0,0,0,0,0,0,0,0,0,0,0,0,0,0,0,0,0,0,0,0,0,0,0,0,0,0,0,0,0,0,0,0,0,0,0,0,0,0,0,0,0,0,0,0,2,1,0,3
2019,Time-conditioned action anticipation in one shot,"Ke Q., Fritz M., Schiele B.",10636919,Proceedings of the IEEE Computer Society Conference on Computer Vision and Pattern Recognition,2019-, ,0,0,0,0,0,0,0,0,0,0,0,0,0,0,0,0,0,0,0,0,0,0,0,0,0,0,0,0,0,0,0,0,0,0,0,0,0,0,0,0,0,0,0,0,0,0,0,0,0,0,2,1,0,3
2018,Long-term image boundary prediction,"Bhattacharyya A., Malinowski M., Schiele B., Fritz M.",,"32nd AAAI Conference on Artificial Intelligence, AAAI 2018",, ,0,0,0,0,0,0,0,0,0,0,0,0,0,0,0,0,0,0,0,0,0,0,0,0,0,0,0,0,0,0,0,0,0,0,0,0,0,0,0,0,0,0,0,0,0,0,0,0,0,0,3,0,0,3
2009,Integrating visual context and object detection within a probabilistic framework,"Perko R., Wojek C., Schiele B., Leonardis A.",3029743,Lecture Notes in Computer Science (including subseries Lecture Notes in Artificial Intelligence and Lecture Notes in Bioinformatics),5395, ,0,0,0,0,0,0,0,0,0,0,0,0,0,0,0,0,0,0,0,0,0,0,0,0,0,0,0,0,0,0,0,0,0,0,0,0,0,0,0,0,2,1,0,0,0,0,0,0,0,0,0,0,0,3
2008,Vision-based detection of mobile smart objects,"Molyneaux D., Gellersen H., Schiele B.",3029743,Lecture Notes in Computer Science (including subseries Lecture Notes in Artificial Intelligence and Lecture Notes in Bioinformatics),5279, ,0,0,0,0,0,0,0,0,0,0,0,0,0,0,0,0,0,0,0,0,0,0,0,0,0,0,0,0,0,0,0,0,0,0,0,0,0,0,0,0,0,0,0,0,1,1,0,1,0,0,0,0,0,3
2003,Multi-object tracking based on a modular knowledge hierarchy,"Spengler M., Schiele B.",3029743,Lecture Notes in Computer Science (including subseries Lecture Notes in Artificial Intelligence and Lecture Notes in Bioinformatics),2626, ,0,0,0,0,0,0,0,0,0,0,0,0,0,0,0,0,0,0,0,0,0,0,0,0,0,0,0,0,0,0,0,0,0,0,0,1,1,0,0,0,0,0,0,1,0,0,0,0,0,0,0,0,0,3
2002,Context-driven model switching for visual tracking,"Kruppa H., Spengler M., Schiele B.",9218890,Robotics and Autonomous Systems,41, 2-3,0,0,0,0,0,0,0,0,0,0,0,0,0,0,0,0,0,0,0,0,0,0,0,0,0,0,0,0,0,0,0,0,0,1,1,0,0,0,0,0,0,1,0,0,0,0,0,0,0,0,0,0,0,3
2019,Bayesian prediction of future street scenes using synthetic likelihoods,"Bhattacharyya A., Fritz M., Schiele B.",,"7th International Conference on Learning Representations, ICLR 2019",, ,0,0,0,0,0,0,0,0,0,0,0,0,0,0,0,0,0,0,0,0,0,0,0,0,0,0,0,0,0,0,0,0,0,0,0,0,0,0,0,0,0,0,0,0,0,0,0,0,0,0,2,0,0,2
2018,A Hybrid Model for Identity Obfuscation by Face Replacement,"Sun Q., Tewari A., Xu W., Fritz M., Theobalt C., Schiele B.",3029743,Lecture Notes in Computer Science (including subseries Lecture Notes in Artificial Intelligence and Lecture Notes in Bioinformatics),11205, ,0,0,0,0,0,0,0,0,0,0,0,0,0,0,0,0,0,0,0,0,0,0,0,0,0,0,0,0,0,0,0,0,0,0,0,0,0,0,0,0,0,0,0,0,0,0,0,0,0,0,1,1,0,2
2010,Towards human motion capturing using gyroscopeless orientation estimation,"Blanke U., Schiele B.",15504816,"Proceedings - International Symposium on Wearable Computers, ISWC",, ,0,0,0,0,0,0,0,0,0,0,0,0,0,0,0,0,0,0,0,0,0,0,0,0,0,0,0,0,0,0,0,0,0,0,0,0,0,0,0,0,0,0,0,1,1,0,0,0,0,0,0,0,0,2
2010,Tutor-based learning of visual categories using different levels of supervision,"Fritz M., Kruijff G.-J.M., Schiele B.",10773142,Computer Vision and Image Understanding,114,5,0,0,0,0,0,0,0,0,0,0,0,0,0,0,0,0,0,0,0,0,0,0,0,0,0,0,0,0,0,0,0,0,0,0,0,0,0,0,0,0,0,0,0,0,0,1,0,1,0,0,0,0,0,2
2007,Browsing patient records during ward rounds with a body worn gyroscope,"Zinnen A., Schiele B., Ziegert T.",15504816,"Proceedings - International Symposium on Wearable Computers, ISWC",, ,0,0,0,0,0,0,0,0,0,0,0,0,0,0,0,0,0,0,0,0,0,0,0,0,0,0,0,0,0,0,0,0,0,0,0,0,0,0,0,2,0,0,0,0,0,0,0,0,0,0,0,0,0,2
2006,Towards unsupervised discovery of visual categories,"Fritz M., Schiele B.",3029743,Lecture Notes in Computer Science (including subseries Lecture Notes in Artificial Intelligence and Lecture Notes in Bioinformatics),4174, ,0,0,0,0,0,0,0,0,0,0,0,0,0,0,0,0,0,0,0,0,0,0,0,0,0,0,0,0,0,0,0,0,0,0,0,0,0,0,0,0,1,0,0,1,0,0,0,0,0,0,0,0,0,2
2002,An information-theoretic approach to combining object models,"Kruppa H., Schiele B.",9218890,Robotics and Autonomous Systems,39, 3-4,0,0,0,0,0,0,0,0,0,0,0,0,0,0,0,0,0,0,0,0,0,0,0,0,0,0,0,0,0,0,0,0,0,1,1,0,0,0,0,0,0,0,0,0,0,0,0,0,0,0,0,0,0,2
2019,Knockoff nets: Stealing functionality of black-box models,"Orekondy T., Schiele B., Fritz M.",10636919,Proceedings of the IEEE Computer Society Conference on Computer Vision and Pattern Recognition,2019-, ,0,0,0,0,0,0,0,0,0,0,0,0,0,0,0,0,0,0,0,0,0,0,0,0,0,0,0,0,0,0,0,0,0,0,0,0,0,0,0,0,0,0,0,0,0,0,0,0,0,0,1,0,0,1
2019,Towards Reverse-Engineering Black-Box Neural Networks,"Oh S.J., Schiele B., Fritz M.",3029743,Lecture Notes in Computer Science (including subseries Lecture Notes in Artificial Intelligence and Lecture Notes in Bioinformatics),11700, ,0,0,0,0,0,0,0,0,0,0,0,0,0,0,0,0,0,0,0,0,0,0,0,0,0,0,0,0,0,0,0,0,0,0,0,0,0,0,0,0,0,0,0,0,0,0,0,0,0,0,0,1,0,1
2019,Video Object Segmentation with Language Referring Expressions,"Khoreva A., Rohrbach A., Schiele B.",3029743,Lecture Notes in Computer Science (including subseries Lecture Notes in Artificial Intelligence and Lecture Notes in Bioinformatics),11364, ,0,0,0,0,0,0,0,0,0,0,0,0,0,0,0,0,0,0,0,0,0,0,0,0,0,0,0,0,0,0,0,0,0,0,0,0,0,0,0,0,0,0,0,0,0,0,0,0,0,0,1,0,0,1
2017,Learning dilation factors for semantic segmentation of street scenes,"He Y., Keuper M., Schiele B., Fritz M.",3029743,Lecture Notes in Computer Science (including subseries Lecture Notes in Artificial Intelligence and Lecture Notes in Bioinformatics),10496, ,0,0,0,0,0,0,0,0,0,0,0,0,0,0,0,0,0,0,0,0,0,0,0,0,0,0,0,0,0,0,0,0,0,0,0,0,0,0,0,0,0,0,0,0,0,0,0,0,0,0,0,1,0,1
2013,"User independent, multi-modal spotting of subtle arm actions with minimal training data","Bauer G., Blanke U., Lukowicz P., Schiele B.",,"2013 IEEE International Conference on Pervasive Computing and Communications Workshops, PerCom Workshops 2013",, ,0,0,0,0,0,0,0,0,0,0,0,0,0,0,0,0,0,0,0,0,0,0,0,0,0,0,0,0,0,0,0,0,0,0,0,0,0,0,0,0,0,0,0,0,0,0,0,1,0,0,0,0,0,1
2009,An exploration of daily routine modeling based on bluetooth and GSM-data,"Steinhoff U., Schiele B.",15504816,"Proceedings - International Symposium on Wearable Computers, ISWC",, ,0,0,0,0,0,0,0,0,0,0,0,0,0,0,0,0,0,0,0,0,0,0,0,0,0,0,0,0,0,0,0,0,0,0,0,0,0,0,0,0,0,0,0,0,0,0,1,0,0,0,0,0,0,1
2002,Query-dependent performance optimization for vocabulary-supported image retrieval,"Vogel J., Schiele B.",3029743,Lecture Notes in Computer Science (including subseries Lecture Notes in Artificial Intelligence and Lecture Notes in Bioinformatics),2449, ,0,0,0,0,0,0,0,0,0,0,0,0,0,0,0,0,0,0,0,0,0,0,0,0,0,0,0,0,0,0,0,0,0,0,0,0,0,1,0,0,0,0,0,0,0,0,0,0,0,0,0,0,0,1
2020,Person Recognition in Personal Photo Collections,"Oh S.J., Benenson R., Fritz M., Schiele B.",1628828,IEEE Transactions on Pattern Analysis and Machine Intelligence,42,1,0,0,0,0,0,0,0,0,0,0,0,0,0,0,0,0,0,0,0,0,0,0,0,0,0,0,0,0,0,0,0,0,0,0,0,0,0,0,0,0,0,0,0,0,0,0,0,0,0,0,0,0,0,0
2019,Not using the car to see the sidewalk-Quantifying and controlling the effects of context in classification and segmentation,"Shetty R., Schiele B., Fritz M.",10636919,Proceedings of the IEEE Computer Society Conference on Computer Vision and Pattern Recognition,2019-, ,0,0,0,0,0,0,0,0,0,0,0,0,0,0,0,0,0,0,0,0,0,0,0,0,0,0,0,0,0,0,0,0,0,0,0,0,0,0,0,0,0,0,0,0,0,0,0,0,0,0,0,0,0,0
2019,NightOwls: A Pedestrians at Night Dataset,"Neumann L., Karg M., Zhang S., Scharfenberger C., Piegert E., Mistr S., Prokofyeva O., Thiel R., Vedaldi A., Zisserman A., Schiele B.",3029743,Lecture Notes in Computer Science (including subseries Lecture Notes in Artificial Intelligence and Lecture Notes in Bioinformatics),11361, ,0,0,0,0,0,0,0,0,0,0,0,0,0,0,0,0,0,0,0,0,0,0,0,0,0,0,0,0,0,0,0,0,0,0,0,0,0,0,0,0,0,0,0,0,0,0,0,0,0,0,0,0,0,0
2019,Video object segmentation with referring expressions,"Khoreva A., Rohrbach A., Schiele B.",3029743,Lecture Notes in Computer Science (including subseries Lecture Notes in Artificial Intelligence and Lecture Notes in Bioinformatics),11132, ,0,0,0,0,0,0,0,0,0,0,0,0,0,0,0,0,0,0,0,0,0,0,0,0,0,0,0,0,0,0,0,0,0,0,0,0,0,0,0,0,0,0,0,0,0,0,0,0,0,0,0,0,0,0
2019,A vision-grounded dataset for predicting typical locations for verbs,"Mukuze N., Rohrbach A., Demberg V., Schiele B.",,LREC 2018 - 11th International Conference on Language Resources and Evaluation,, ,0,0,0,0,0,0,0,0,0,0,0,0,0,0,0,0,0,0,0,0,0,0,0,0,0,0,0,0,0,0,0,0,0,0,0,0,0,0,0,0,0,0,0,0,0,0,0,0,0,0,0,0,0,0
2018,Diverse Conditional Image Generation by Stochastic Regression with Latent Drop-Out Codes,"He Y., Schiele B., Fritz M.",3029743,Lecture Notes in Computer Science (including subseries Lecture Notes in Artificial Intelligence and Lecture Notes in Bioinformatics),11220, ,0,0,0,0,0,0,0,0,0,0,0,0,0,0,0,0,0,0,0,0,0,0,0,0,0,0,0,0,0,0,0,0,0,0,0,0,0,0,0,0,0,0,0,0,0,0,0,0,0,0,0,0,0,0
2016,Demo: I-Pic: A platform for privacy-compliant image capture,"Aditya P., Sen R., Druschel P., Oh S.J., Benenson R., Fritz M., Schiele B., Bhattacharjee B., Wu T.T.",,"MobiSys 2016 Companion - Companion Publication of the 14th Annual International Conference on Mobile Systems, Applications, and Services",, ,0,0,0,0,0,0,0,0,0,0,0,0,0,0,0,0,0,0,0,0,0,0,0,0,0,0,0,0,0,0,0,0,0,0,0,0,0,0,0,0,0,0,0,0,0,0,0,0,0,0,0,0,0,0
2016,Visual object class recognition,"Stark M., Schiele B., Leonardis A.",,Springer Handbook of Robotics,, ,0,0,0,0,0,0,0,0,0,0,0,0,0,0,0,0,0,0,0,0,0,0,0,0,0,0,0,0,0,0,0,0,0,0,0,0,0,0,0,0,0,0,0,0,0,0,0,0,0,0,0,0,0,0
2015,Camera based pedestrian detection,"Schiele B., Wojek C.",,"Handbook of Driver Assistance Systems: Basic Information, Components and Systems for Active Safety and Comfort",, ,0,0,0,0,0,0,0,0,0,0,0,0,0,0,0,0,0,0,0,0,0,0,0,0,0,0,0,0,0,0,0,0,0,0,0,0,0,0,0,0,0,0,0,0,0,0,0,0,0,0,0,0,0,0
2015,Anti collision system PRORETA,"Isermann R., Hohm A., Mannale R., Schiele B., Schmitt K., Winner H., Wojek C.",,"Handbook of Driver Assistance Systems: Basic Information, Components and Systems for Active Safety and Comfort",, ,0,0,0,0,0,0,0,0,0,0,0,0,0,0,0,0,0,0,0,0,0,0,0,0,0,0,0,0,0,0,0,0,0,0,0,0,0,0,0,0,0,0,0,0,0,0,0,0,0,0,0,0,0,0
2015,First international workshop on video segmentation - panel discussion,"Brox T., Galasso F., Li F., Rehg J.M., Schiele B.",3029743,Lecture Notes in Computer Science (including subseries Lecture Notes in Artificial Intelligence and Lecture Notes in Bioinformatics),8928, ,0,0,0,0,0,0,0,0,0,0,0,0,0,0,0,0,0,0,0,0,0,0,0,0,0,0,0,0,0,0,0,0,0,0,0,0,0,0,0,0,0,0,0,0,0,0,0,0,0,0,0,0,0,0
2014,"Computer Vision - ECCV 2014: 13th European Conference Zurich, Switzerland, September 6-12, 2014 Proceedings, Part IV","Fleet D., Pajdla T., Schiele B., Tuytelaars T.",3029743,Lecture Notes in Computer Science (including subseries Lecture Notes in Artificial Intelligence and Lecture Notes in Bioinformatics),8692, ,0,0,0,0,0,0,0,0,0,0,0,0,0,0,0,0,0,0,0,0,0,0,0,0,0,0,0,0,0,0,0,0,0,0,0,0,0,0,0,0,0,0,0,0,0,0,0,0,0,0,0,0,0,0
2014,Preface,"Fleet D., Pajdla T., Schiele B., Tuytelaars T.",3029743,Lecture Notes in Computer Science (including subseries Lecture Notes in Artificial Intelligence and Lecture Notes in Bioinformatics),8692, ,0,0,0,0,0,0,0,0,0,0,0,0,0,0,0,0,0,0,0,0,0,0,0,0,0,0,0,0,0,0,0,0,0,0,0,0,0,0,0,0,0,0,0,0,0,0,0,0,0,0,0,0,0,0
2014,Lecture Notes in Computer Science (including subseries Lecture Notes in Artificial Intelligence and Lecture Notes in Bioinformatics): Preface,"Fleet D., Pajdla T., Schiele B., Tuytelaars T.",3029743,Lecture Notes in Computer Science (including subseries Lecture Notes in Artificial Intelligence and Lecture Notes in Bioinformatics),8694,6,0,0,0,0,0,0,0,0,0,0,0,0,0,0,0,0,0,0,0,0,0,0,0,0,0,0,0,0,0,0,0,0,0,0,0,0,0,0,0,0,0,0,0,0,0,0,0,0,0,0,0,0,0,0
2013,Lecture Notes in Computer Science (including subseries Lecture Notes in Artificial Intelligence and Lecture Notes in Bioinformatics): Preface,"Weickert J., Hein M., Schiele B.",3029743,Lecture Notes in Computer Science (including subseries Lecture Notes in Artificial Intelligence and Lecture Notes in Bioinformatics),8142, ,0,0,0,0,0,0,0,0,0,0,0,0,0,0,0,0,0,0,0,0,0,0,0,0,0,0,0,0,0,0,0,0,0,0,0,0,0,0,0,0,0,0,0,0,0,0,0,0,0,0,0,0,0,0
2011,Message from program chairs,"Lin S., Schiele B., Soatto S., Sturm P.",,Proceedings of the IEEE International Conference on Computer Vision,, ,0,0,0,0,0,0,0,0,0,0,0,0,0,0,0,0,0,0,0,0,0,0,0,0,0,0,0,0,0,0,0,0,0,0,0,0,0,0,0,0,0,0,0,0,0,0,0,0,0,0,0,0,0,0
2009,Lecture Notes in Computer Science (including subseries Lecture Notes in Artificial Intelligence and Lecture Notes in Bioinformatics): Preface,"Fritz M., Schiele B., Piater J.H.",3029743,Lecture Notes in Computer Science (including subseries Lecture Notes in Artificial Intelligence and Lecture Notes in Bioinformatics),5815, ,0,0,0,0,0,0,0,0,0,0,0,0,0,0,0,0,0,0,0,0,0,0,0,0,0,0,0,0,0,0,0,0,0,0,0,0,0,0,0,0,0,0,0,0,0,0,0,0,0,0,0,0,0,0
2009,Shading cues for object class detection,"Stark M., Goesele M., Schiele B.",,"2009 IEEE 12th International Conference on Computer Vision Workshops, ICCV Workshops 2009",, ,0,0,0,0,0,0,0,0,0,0,0,0,0,0,0,0,0,0,0,0,0,0,0,0,0,0,0,0,0,0,0,0,0,0,0,0,0,0,0,0,0,0,0,0,0,0,0,0,0,0,0,0,0,0
2009,Demo abstract: Whac-A-Bee - A sensor network game,"Berlin E., Van Laerhoven K., Schiele B., Guerrero P., Herzog A., Jacobi D., Buchmann A.",,"Proceedings of the 7th ACM Conference on Embedded Networked Sensor Systems, SenSys 2009",, ,0,0,0,0,0,0,0,0,0,0,0,0,0,0,0,0,0,0,0,0,0,0,0,0,0,0,0,0,0,0,0,0,0,0,0,0,0,0,0,0,0,0,0,0,0,0,0,0,0,0,0,0,0,0
2009,Preface,"Dickinson S.J., Leonardis A., Schiele B., Tarr M.J.",,Object Categorization: Computer and Human Vision Perspectives,9.78052E+12, ,0,0,0,0,0,0,0,0,0,0,0,0,0,0,0,0,0,0,0,0,0,0,0,0,0,0,0,0,0,0,0,0,0,0,0,0,0,0,0,0,0,0,0,0,0,0,0,0,0,0,0,0,0,0
2009,"Towards integration of different paradigms in modeling, representation, and learning of visual categories","Fritz M., Schiele B.",,Object Categorization: Computer and Human Vision Perspectives,9.78052E+12, ,0,0,0,0,0,0,0,0,0,0,0,0,0,0,0,0,0,0,0,0,0,0,0,0,0,0,0,0,0,0,0,0,0,0,0,0,0,0,0,0,0,0,0,0,0,0,0,0,0,0,0,0,0,0
2008,2007'S wearable computing advances,Schiele B.,15361268,IEEE Pervasive Computing,7,1,0,0,0,0,0,0,0,0,0,0,0,0,0,0,0,0,0,0,0,0,0,0,0,0,0,0,0,0,0,0,0,0,0,0,0,0,0,0,0,0,0,0,0,0,0,0,0,0,0,0,0,0,0,0
2007,Message from the program chairs,"Schiele B., Ryhanen T.",15504816,"Proceedings - International Symposium on Wearable Computers, ISWC",, ,0,0,0,0,0,0,0,0,0,0,0,0,0,0,0,0,0,0,0,0,0,0,0,0,0,0,0,0,0,0,0,0,0,0,0,0,0,0,0,0,0,0,0,0,0,0,0,0,0,0,0,0,0,0
2007,Message from the program chairs research papers,"Dey A.K., Gellersen H., Schiele B.",3029743,Lecture Notes in Computer Science (including subseries Lecture Notes in Artificial Intelligence and Lecture Notes in Bioinformatics),4794, ,0,0,0,0,0,0,0,0,0,0,0,0,0,0,0,0,0,0,0,0,0,0,0,0,0,0,0,0,0,0,0,0,0,0,0,0,0,0,0,0,0,0,0,0,0,0,0,0,0,0,0,0,0,0
2007,Lecture Notes in Computer Science (including subseries Lecture Notes in Artificial Intelligence and Lecture Notes in Bioinformatics: Preface,"Hightower J., Schiele B., Strang T.",3029743,Lecture Notes in Computer Science (including subseries Lecture Notes in Artificial Intelligence and Lecture Notes in Bioinformatics),4718, ,0,0,0,0,0,0,0,0,0,0,0,0,0,0,0,0,0,0,0,0,0,0,0,0,0,0,0,0,0,0,0,0,0,0,0,0,0,0,0,0,0,0,0,0,0,0,0,0,0,0,0,0,0,0
2007,Towards systematic research of multimodal interfaces for non-desktop work scenarios,"Carlsson V., Schiele B.",,Conference on Human Factors in Computing Systems - Proceedings,, ,0,0,0,0,0,0,0,0,0,0,0,0,0,0,0,0,0,0,0,0,0,0,0,0,0,0,0,0,0,0,0,0,0,0,0,0,0,0,0,0,0,0,0,0,0,0,0,0,0,0,0,0,0,0
2006,Sensory augmented computing,Schiele B.,,True Visions: The Emergence of Ambient Intelligence,, ,0,0,0,0,0,0,0,0,0,0,0,0,0,0,0,0,0,0,0,0,0,0,0,0,0,0,0,0,0,0,0,0,0,0,0,0,0,0,0,0,0,0,0,0,0,0,0,0,0,0,0,0,0,0
2006,Lecture Notes in Computer Science (including subseries Lecture Notes in Artificial Intelligence and Lecture Notes in Bioinformatics): Preface,"Fishkin K., Schiele B., Nixon P., Quigley A.",3029743,Lecture Notes in Computer Science (including subseries Lecture Notes in Artificial Intelligence and Lecture Notes in Bioinformatics),3968, ,0,0,0,0,0,0,0,0,0,0,0,0,0,0,0,0,0,0,0,0,0,0,0,0,0,0,0,0,0,0,0,0,0,0,0,0,0,0,0,0,0,0,0,0,0,0,0,0,0,0,0,0,0,0
2002,Towards robust perception and model integration,"Schiele B., Spengler M., Kruppa H.",3029743,Lecture Notes in Computer Science (including subseries Lecture Notes in Artificial Intelligence and Lecture Notes in Bioinformatics),2238, ,0,0,0,0,0,0,0,0,0,0,0,0,0,0,0,0,0,0,0,0,0,0,0,0,0,0,0,0,0,0,0,0,0,0,0,0,0,0,0,0,0,0,0,0,0,0,0,0,0,0,0,0,0,0
2001,Preface,"Schiele B., Sagerer G.",3029743,Lecture Notes in Computer Science (including subseries Lecture Notes in Artificial Intelligence and Lecture Notes in Bioinformatics),2095, ,0,0,0,0,0,0,0,0,0,0,0,0,0,0,0,0,0,0,0,0,0,0,0,0,0,0,0,0,0,0,0,0,0,0,0,0,0,0,0,0,0,0,0,0,0,0,0,0,0,0,0,0,0,0
