," 作者:Shah, Mubarak A.",,,,,,,,,,,,,,,,,,,,,,,,,,,,,,,,,,,,,,,,,,,,,,,,,,,,,,,,,,,
2008,Trajectory association across multiple airborne cameras,"Sheikh Y.A., Shah M.",1628828,IEEE Transactions on Pattern Analysis and Machine Intelligence,30,2,0,0,0,0,0,0,0,0,0,0,0,0,0,0,0,0,0,0,0,0,0,0,0,0,0,0,0,0,0,0,0,0,0,0,0,0,0,0,0,3,2,2,4,2,2,2,5,1,4,0,0,0,0,27
1986,Pulse and staircase edge models.,"Shah M., Sood A., Jain R.",,"Computer Vision, Graphics, &amp; Image Processing",34,3,0,0,0,0,0,0,0,0,0,0,0,0,0,0,0,0,0,0,1,2,0,1,0,6,0,2,2,0,0,1,1,1,0,1,1,0,0,0,0,0,0,0,1,2,3,0,0,1,1,0,0,0,0,27
2006,Computer vision for nanoscale imaging,"Ribeiro E., Shah M.",9328092,Machine Vision and Applications,17,3,0,0,0,0,0,0,0,0,0,0,0,0,0,0,0,0,0,0,0,0,0,0,0,0,0,0,0,0,0,0,0,0,0,0,0,0,0,0,1,1,1,2,0,4,3,2,7,2,0,3,0,0,0,26
2004,Tri-view morphing,"Xiao J., Shah M.",10773142,Computer Vision and Image Understanding,96,3,0,0,0,0,0,0,0,0,0,0,0,0,0,0,0,0,0,0,0,0,0,0,0,0,0,0,0,0,0,0,0,0,0,0,0,1,2,2,2,3,1,2,2,2,1,2,1,0,1,3,1,0,0,26
1984,Detecting time-varying corners.,"Shah M.A., Jain R.",,"Computer Vision, Graphics, &amp; Image Processing",28,3,0,0,0,0,0,0,0,0,0,0,0,0,0,0,0,0,1,0,2,5,2,0,0,2,1,1,1,1,2,0,2,1,0,0,0,0,2,0,1,0,0,0,0,1,0,0,0,0,1,0,0,0,0,26
2012,Complex events detection using data-driven concepts,"Yang Y., Shah M.",3029743,Lecture Notes in Computer Science (including subseries Lecture Notes in Artificial Intelligence and Lecture Notes in Bioinformatics),7574,3,0,0,0,0,0,0,0,0,0,0,0,0,0,0,0,0,0,0,0,0,0,0,0,0,0,0,0,0,0,0,0,0,0,0,0,0,0,0,0,0,0,0,0,0,1,5,5,5,2,4,1,2,0,25
2011,A probabilistic representation for efficient large scale visual recognition tasks,"Bhattacharya S., Sukthankar R., Jin R., Shah M.",10636919,Proceedings of the IEEE Computer Society Conference on Computer Vision and Pattern Recognition,, ,0,0,0,0,0,0,0,0,0,0,0,0,0,0,0,0,0,0,0,0,0,0,0,0,0,0,0,0,0,0,0,0,0,0,0,0,0,0,0,0,0,0,0,3,6,5,2,2,2,2,2,1,0,25
1993,Matching motion trajectories using scale-space,"Rangarajan K., Allen W., Shah M.",313203,Pattern Recognition,26,4,0,0,0,0,0,0,0,0,0,0,0,0,0,0,0,0,0,0,0,0,0,0,0,0,0,2,1,0,2,0,1,1,1,1,2,4,1,4,0,0,2,0,1,1,0,0,0,0,1,0,0,0,0,25
1989,Trajectory primal sketch: a multi-scale scheme for representing motion characteristics,"Gould Kristine, Shah Mubarak",,,, ,0,0,0,0,0,0,0,0,0,0,0,0,0,0,0,0,0,0,0,0,0,0,1,0,2,0,1,1,3,1,1,1,0,5,1,1,1,0,0,0,1,0,1,0,4,0,0,0,0,0,0,0,0,25
2014,Tracking in dense crowds using prominence and neighborhood motion concurrence,"Idrees H., Warner N., Shah M.",2628856,Image and Vision Computing,32,1,0,0,0,0,0,0,0,0,0,0,0,0,0,0,0,0,0,0,0,0,0,0,0,0,0,0,0,0,0,0,0,0,0,0,0,0,0,0,0,0,0,0,0,0,0,3,3,3,3,8,4,0,0,24
2011,BBN VISER TRECVID 2011 multimedia Event Detection System,"Natarajan P., Natarajan P., Manohar V., Wu S., Tsakalidis S., Vitaladevuni S.N., Zhuang X., Prasad R., Ye G., Liu D., Jhuo I., Chang S.-F., Izadinia H., Saleemi I., Shah M., White B., Yeh T., Davis L.",,2011 TREC Video Retrieval Evaluation Notebook Papers,, ,0,0,0,0,0,0,0,0,0,0,0,0,0,0,0,0,0,0,0,0,0,0,0,0,0,0,0,0,0,0,0,0,0,0,0,0,0,0,0,0,0,0,0,7,6,8,1,0,0,2,0,0,0,24
2008,Visual surveillance in maritime port facilities,"Sullivan M.D.R., Shah M.",0277786X,Proceedings of SPIE - The International Society for Optical Engineering,6978, ,0,0,0,0,0,0,0,0,0,0,0,0,0,0,0,0,0,0,0,0,0,0,0,0,0,0,0,0,0,0,0,0,0,0,0,0,0,0,0,0,4,1,2,4,4,1,3,1,3,1,0,0,0,24
1991,Establishing motion correspondence,"Rangarajan Krishnan, Shah Mubarak",,,, ,0,0,0,0,0,0,0,0,0,0,0,0,0,0,0,0,0,0,0,0,0,0,0,0,0,1,4,0,0,1,1,1,0,0,0,1,1,1,0,0,5,1,1,0,0,0,0,4,2,0,0,0,0,24
2015,Human pose estimation in videos,"Zhang D., Shah M.",15505499,Proceedings of the IEEE International Conference on Computer Vision,2015, ,0,0,0,0,0,0,0,0,0,0,0,0,0,0,0,0,0,0,0,0,0,0,0,0,0,0,0,0,0,0,0,0,0,0,0,0,0,0,0,0,0,0,0,0,0,0,0,4,3,9,6,1,0,23
2011,A holistic approach to aesthetic enhancement of photographs,"Bhattacharya S., Sukthankar R., Shah M.",15516857,"ACM Transactions on Multimedia Computing, Communications and Applications",7,1,0,0,0,0,0,0,0,0,0,0,0,0,0,0,0,0,0,0,0,0,0,0,0,0,0,0,0,0,0,0,0,0,0,0,0,0,0,0,0,0,0,0,0,0,4,2,3,1,5,3,5,0,0,23
2009,"Matching trajectories of anatomical landmarks under viewpoint, anthropometric and temporal transforms","Gritai A., Sheikh Y., Rao C., Shah M.",9205691,International Journal of Computer Vision,84,3,0,0,0,0,0,0,0,0,0,0,0,0,0,0,0,0,0,0,0,0,0,0,0,0,0,0,0,0,0,0,0,0,0,0,0,0,0,0,0,0,1,0,4,7,2,2,0,2,3,0,2,0,0,23
2006,Self-calibration from turn-table sequences in presence of zoom and focus,"Cao X., Xiao J., Foroosh H., Shah M.",10773142,Computer Vision and Image Understanding,102,3,0,0,0,0,0,0,0,0,0,0,0,0,0,0,0,0,0,0,0,0,0,0,0,0,0,0,0,0,0,0,0,0,0,0,0,0,0,1,2,2,3,1,0,2,4,1,3,1,2,1,0,0,0,23
1998,Recognizing human actions in a static room,"Ayers D., Shah M.",,"Proceedings - 4th IEEE Workshop on Applications of Computer Vision, WACV 1998",1998-, ,0,0,0,0,0,0,0,0,0,0,0,0,0,0,0,0,0,0,0,0,0,0,0,0,0,0,0,0,0,0,1,1,3,2,0,4,2,2,1,2,2,1,0,0,0,1,0,0,1,0,0,0,0,23
2014,Video classification using semantic concept co-occurrences,"Assari S.M., Zamir A.R., Shah M.",10636919,Proceedings of the IEEE Computer Society Conference on Computer Vision and Pattern Recognition,, ,0,0,0,0,0,0,0,0,0,0,0,0,0,0,0,0,0,0,0,0,0,0,0,0,0,0,0,0,0,0,0,0,0,0,0,0,0,0,0,0,0,0,0,0,0,0,3,6,4,7,1,1,0,22
2008,Person tracking in UAV video,"Miller A., Babenko P., Hu M., Shah M.",3029743,Lecture Notes in Computer Science (including subseries Lecture Notes in Artificial Intelligence and Lecture Notes in Bioinformatics),4625, ,0,0,0,0,0,0,0,0,0,0,0,0,0,0,0,0,0,0,0,0,0,0,0,0,0,0,0,0,0,0,0,0,0,0,0,0,0,0,0,0,0,1,3,1,3,2,3,2,2,4,1,0,0,22
2004,Estimation of the Radiometric Response Functions of a color Camera from differently illuminated images,"Shafique K., Shah M.",15224880,"Proceedings - International Conference on Image Processing, ICIP",4, ,0,0,0,0,0,0,0,0,0,0,0,0,0,0,0,0,0,0,0,0,0,0,0,0,0,0,0,0,0,0,0,0,0,0,0,0,3,2,2,3,1,0,2,2,3,1,1,0,1,1,0,0,0,22
2003,Understanding human behavior from motion imagery,Shah M.,9328092,Machine Vision and Applications,14,4,0,0,0,0,0,0,0,0,0,0,0,0,0,0,0,0,0,0,0,0,0,0,0,0,0,0,0,0,0,0,0,0,0,0,0,0,3,1,3,3,3,2,1,1,0,0,0,0,2,0,3,0,0,22
1993,Motion Trajectories,"Shah M., Rangarajan K., Tsai P.-S.",189472,"IEEE Transactions on Systems, Man and Cybernetics",23,4,0,0,0,0,0,0,0,0,0,0,0,0,0,0,0,0,0,0,0,0,0,0,0,0,0,2,0,0,0,0,3,2,1,2,1,2,1,2,1,1,2,0,0,0,0,0,0,1,1,0,0,0,0,22
2005,Camera calibration and light source estimation from images with shadows,"Cao X., Shah M.",,"Proceedings - 2005 IEEE Computer Society Conference on Computer Vision and Pattern Recognition, CVPR 2005",II, ,0,0,0,0,0,0,0,0,0,0,0,0,0,0,0,0,0,0,0,0,0,0,0,0,0,0,0,0,0,0,0,0,0,0,0,0,1,3,1,4,0,1,2,0,1,1,2,0,2,1,1,1,0,21
2016,What if we do not have multiple videos of the same action? - Video action localization using web images,"Sultani W., Shah M.",10636919,Proceedings of the IEEE Computer Society Conference on Computer Vision and Pattern Recognition,2016-, ,0,0,0,0,0,0,0,0,0,0,0,0,0,0,0,0,0,0,0,0,0,0,0,0,0,0,0,0,0,0,0,0,0,0,0,0,0,0,0,0,0,0,0,0,0,0,0,0,6,8,4,2,0,20
2014,GPS-tag refinement using random walks with an adaptive damping factor,"Zamir A.R., Ardeshir S., Shah M.",10636919,Proceedings of the IEEE Computer Society Conference on Computer Vision and Pattern Recognition,, ,0,0,0,0,0,0,0,0,0,0,0,0,0,0,0,0,0,0,0,0,0,0,0,0,0,0,0,0,0,0,0,0,0,0,0,0,0,0,0,0,0,0,0,0,0,1,7,2,6,2,2,0,0,20
2014,GIS-assisted object detection and geospatial localization,"Ardeshir S., Zamir A.R., Torroella A., Shah M.",3029743,Lecture Notes in Computer Science (including subseries Lecture Notes in Artificial Intelligence and Lecture Notes in Bioinformatics),8694,6,0,0,0,0,0,0,0,0,0,0,0,0,0,0,0,0,0,0,0,0,0,0,0,0,0,0,0,0,0,0,0,0,0,0,0,0,0,0,0,0,0,0,0,0,0,0,2,5,2,5,5,1,0,20
2012,Exploiting the brain's network structure in identifying ADHD subjects,"Dey S., Ravishankar Rao A., Shah M.",16625137,Frontiers in Systems Neuroscience,,2012,0,0,0,0,0,0,0,0,0,0,0,0,0,0,0,0,0,0,0,0,0,0,0,0,0,0,0,0,0,0,0,0,0,0,0,0,0,0,0,0,0,0,0,0,1,2,4,3,4,2,2,2,0,20
2007,Improving semantic concept detection and retrieval using contextual estimates,"Aytar Y., Orhan O.B., Shah M.",,"Proceedings of the 2007 IEEE International Conference on Multimedia and Expo, ICME 2007",, ,0,0,0,0,0,0,0,0,0,0,0,0,0,0,0,0,0,0,0,0,0,0,0,0,0,0,0,0,0,0,0,0,0,0,0,0,0,0,0,4,3,1,0,5,1,3,1,1,0,0,1,0,0,20
2005,Story segmentation in news videos using visual and text cues,"Zhai Y., Yilmaz A., Shah M.",3029743,Lecture Notes in Computer Science,3568, ,0,0,0,0,0,0,0,0,0,0,0,0,0,0,0,0,0,0,0,0,0,0,0,0,0,0,0,0,0,0,0,0,0,0,0,0,0,0,1,2,1,1,1,3,4,1,1,2,0,0,2,1,0,20
1996,Motion estimation and segmentation,"Tian T.Y., Shah M.",9328092,Machine Vision and Applications,9,1,0,0,0,0,0,0,0,0,0,0,0,0,0,0,0,0,0,0,0,0,0,0,0,0,0,0,0,0,1,0,0,0,3,1,0,3,4,1,0,0,1,1,2,1,0,0,0,1,0,1,0,0,0,20
2013,Shadow casting out of plane (SCOOP) candidates for human and vehicle detection in aerial imagery,"Reilly V., Solmaz B., Shah M.",9205691,International Journal of Computer Vision,101,2,0,0,0,0,0,0,0,0,0,0,0,0,0,0,0,0,0,0,0,0,0,0,0,0,0,0,0,0,0,0,0,0,0,0,0,0,0,0,0,0,0,0,0,0,1,4,2,3,5,4,0,0,0,19
2005,Multiple agent event detection and representation in videos,"Hakeem A., Shah M.",,Proceedings of the National Conference on Artificial Intelligence,1, ,0,0,0,0,0,0,0,0,0,0,0,0,0,0,0,0,0,0,0,0,0,0,0,0,0,0,0,0,0,0,0,0,0,0,0,0,0,1,3,1,1,1,3,0,1,2,2,2,0,1,0,1,0,19
1998,Three-dimensional reconstruction of the coronary arteries using a priori knowledge,"Windyga P., Garreau M., Shah M., Le Breton H., Coatrieux J.L.",1400118,Medical and Biological Engineering and Computing,36,2,0,0,0,0,0,0,0,0,0,0,0,0,0,0,0,0,0,0,0,0,0,0,0,0,0,0,0,0,0,1,1,1,3,2,2,2,2,0,0,0,3,0,0,0,1,0,0,0,0,0,1,0,0,19
2012,Confidence guided enhancing brain tumor segmentation in multi-parametric MRI,"Reddy K.K., Solmaz B., Yan P., Avgeropoulos N.G., Rippe D.J., Shah M.",19457928,Proceedings - International Symposium on Biomedical Imaging,, ,0,0,0,0,0,0,0,0,0,0,0,0,0,0,0,0,0,0,0,0,0,0,0,0,0,0,0,0,0,0,0,0,0,0,0,0,0,0,0,0,0,0,0,0,0,1,6,3,4,2,0,2,0,18
2006,Estimating geospatial trajectory of a moving camera,"Hakeem A., Vezzani R., Shah M., Cucchiara R.",10514651,Proceedings - International Conference on Pattern Recognition,2, ,0,0,0,0,0,0,0,0,0,0,0,0,0,0,0,0,0,0,0,0,0,0,0,0,0,0,0,0,0,0,0,0,0,0,0,0,0,0,0,0,0,3,2,2,0,5,0,0,2,2,2,0,0,18
1998,Shape from shading with variable albedo,"Tsai P.-S., Shah M.",913286,Optical Engineering,37,4,0,0,0,0,0,0,0,0,0,0,0,0,0,0,0,0,0,0,0,0,0,0,0,0,0,0,0,0,0,0,0,2,0,0,0,1,2,2,1,2,0,1,2,2,0,0,0,0,1,2,0,0,0,18
1993,Edge Characterization Using Normalized Edge Detector,"Williams D.J., Shah M.",10499652,CVGIP: Graphical Models and Image Processing,55,4,0,0,0,0,0,0,0,0,0,0,0,0,0,0,0,0,0,0,0,0,0,0,0,0,0,2,1,2,1,0,0,0,0,1,0,0,1,0,2,3,1,0,1,1,0,0,1,0,0,1,0,0,0,18
2017,Generative Adversarial Networks Conditioned by Brain Signals,"Palazzo S., Spampinato C., Kavasidis I., Giordano D., Shah M.",15505499,Proceedings of the IEEE International Conference on Computer Vision,2017-, ,0,0,0,0,0,0,0,0,0,0,0,0,0,0,0,0,0,0,0,0,0,0,0,0,0,0,0,0,0,0,0,0,0,0,0,0,0,0,0,0,0,0,0,0,0,0,0,0,0,6,9,2,0,17
2010,Geometric constraints for human detection in aerial imagery,"Reilly V., Solmaz B., Shah M.",3029743,Lecture Notes in Computer Science (including subseries Lecture Notes in Artificial Intelligence and Lecture Notes in Bioinformatics),6316,6,0,0,0,0,0,0,0,0,0,0,0,0,0,0,0,0,0,0,0,0,0,0,0,0,0,0,0,0,0,0,0,0,0,0,0,0,0,0,0,0,0,0,4,0,3,2,0,1,2,4,1,0,0,17
2009,Event recognition from photo collections via PageRank,"Imran N., Liu J., Luo J., Shah M.",,"MM'09 - Proceedings of the 2009 ACM Multimedia Conference, with Co-located Workshops and Symposiums",, ,0,0,0,0,0,0,0,0,0,0,0,0,0,0,0,0,0,0,0,0,0,0,0,0,0,0,0,0,0,0,0,0,0,0,0,0,0,0,0,0,0,0,4,1,1,1,3,5,0,1,1,0,0,17
2007,Spatio-temporal regularity flow (SPREF): Its estimation and applications,"Alatas O., Yan P., Shah M.",10518215,IEEE Transactions on Circuits and Systems for Video Technology,17,5,0,0,0,0,0,0,0,0,0,0,0,0,0,0,0,0,0,0,0,0,0,0,0,0,0,0,0,0,0,0,0,0,0,0,0,0,0,0,0,3,0,0,1,2,0,3,2,1,2,1,1,1,0,17
2000,Autonomous video registration using sensor model parameter adjustments,"Cannata R.W., Shah M., Blask S.G., Van Workum J.A.",21642516,Proceedings - Applied Imagery Pattern Recognition Workshop,2000-, ,0,0,0,0,0,0,0,0,0,0,0,0,0,0,0,0,0,0,0,0,0,0,0,0,0,0,0,0,0,0,0,0,1,1,1,1,1,1,3,2,0,1,2,0,1,0,1,1,0,0,0,0,0,17
2017,Unsupervised Action Discovery and Localization in Videos,"Soomro K., Shah M.",15505499,Proceedings of the IEEE International Conference on Computer Vision,2017-, ,0,0,0,0,0,0,0,0,0,0,0,0,0,0,0,0,0,0,0,0,0,0,0,0,0,0,0,0,0,0,0,0,0,0,0,0,0,0,0,0,0,0,0,0,0,0,0,0,0,3,9,4,0,16
2017,Improving facial attribute prediction using semantic segmentation,"Kalayeh M.M., Gong B., Shah M.",,"Proceedings - 30th IEEE Conference on Computer Vision and Pattern Recognition, CVPR 2017",2017-, ,0,0,0,0,0,0,0,0,0,0,0,0,0,0,0,0,0,0,0,0,0,0,0,0,0,0,0,0,0,0,0,0,0,0,0,0,0,0,0,0,0,0,0,0,0,0,0,0,0,3,11,2,0,16
2009,Automatic tracking of escherichia coli in phase-contrast microscopy video,"Xie J., Khan S., Shah M.",189294,IEEE Transactions on Biomedical Engineering,56,2,0,0,0,0,0,0,0,0,0,0,0,0,0,0,0,0,0,0,0,0,0,0,0,0,0,0,0,0,0,0,0,0,0,0,0,0,0,0,0,0,1,4,1,3,3,2,0,1,0,0,1,0,0,16
2018,"Composition Loss for Counting, Density Map Estimation and Localization in Dense Crowds","Idrees H., Tayyab M., Athrey K., Zhang D., Al-Maadeed S., Rajpoot N., Shah M.",3029743,Lecture Notes in Computer Science (including subseries Lecture Notes in Artificial Intelligence and Lecture Notes in Bioinformatics),11206, ,0,0,0,0,0,0,0,0,0,0,0,0,0,0,0,0,0,0,0,0,0,0,0,0,0,0,0,0,0,0,0,0,0,0,0,0,0,0,0,0,0,0,0,0,0,0,0,0,0,0,8,7,0,15
2017,Brain2Image: Converting brain signals into images,"Kavasidis I., Palazzo S., Spampinato C., Giordano D., Shah M.",,MM 2017 - Proceedings of the 2017 ACM Multimedia Conference,, ,0,0,0,0,0,0,0,0,0,0,0,0,0,0,0,0,0,0,0,0,0,0,0,0,0,0,0,0,0,0,0,0,0,0,0,0,0,0,0,0,0,0,0,0,0,0,0,0,0,3,9,3,0,15
2012,SRI-Sarnoff AURORA system at TRECVID 2012: Multimedia event detection and recounting,"Cheng H., Liu J., Ali S., Javed O., Yu Q., Tamrakar A., Divakaran A., Sawhney H.S., Manmatha R., Allan J., Hauptmann A., Shah M., Bhattacharya S., Dehghan A., Friedland G., Elizalde B.M., Darrell T., Witbrock M., Curtis J.",,2012 TREC Video Retrieval Evaluation Notebook Papers,, ,0,0,0,0,0,0,0,0,0,0,0,0,0,0,0,0,0,0,0,0,0,0,0,0,0,0,0,0,0,0,0,0,0,0,0,0,0,0,0,0,0,0,0,0,4,5,4,1,0,1,0,0,0,15
2007,Resolving hand over face occlusion,"Smith P., da Vitoria Lobo N., Shah M.",2628856,Image and Vision Computing,25,9,0,0,0,0,0,0,0,0,0,0,0,0,0,0,0,0,0,0,0,0,0,0,0,0,0,0,0,0,0,0,0,0,0,0,0,0,0,0,0,0,2,1,2,4,1,3,1,1,0,0,0,0,0,15
1999,Shape from intensity gradient,"Zhang R., Shah M.",10834427,"IEEE Transactions on Systems, Man, and Cybernetics Part A:Systems and Humans.",29,3,0,0,0,0,0,0,0,0,0,0,0,0,0,0,0,0,0,0,0,0,0,0,0,0,0,0,0,0,0,0,0,2,0,2,1,1,0,0,3,5,1,0,0,0,0,0,0,0,0,0,0,0,0,15
2016,Visual Saliency Detection Using Group Lasso Regularization in Videos of Natural Scenes,"Souly N., Shah M.",9205691,International Journal of Computer Vision,117,1,0,0,0,0,0,0,0,0,0,0,0,0,0,0,0,0,0,0,0,0,0,0,0,0,0,0,0,0,0,0,0,0,0,0,0,0,0,0,0,0,0,0,0,0,0,0,0,2,4,5,2,1,0,14
2012,Macro-class selection for hierarchical k-nn classification of inertial sensor data,"McCall C., Reddy K., Shah M.",,PECCS 2012 - Proceedings of the 2nd International Conference on Pervasive Embedded Computing and Communication Systems,, ,0,0,0,0,0,0,0,0,0,0,0,0,0,0,0,0,0,0,0,0,0,0,0,0,0,0,0,0,0,0,0,0,0,0,0,0,0,0,0,0,0,0,0,0,2,1,3,6,0,2,0,0,0,14
2011,Street view challenge: Identification of commercial entities in street view imagery,"Zamir A.R., Darino A., Shah M.",,"Proceedings - 10th International Conference on Machine Learning and Applications, ICMLA 2011",2, ,0,0,0,0,0,0,0,0,0,0,0,0,0,0,0,0,0,0,0,0,0,0,0,0,0,0,0,0,0,0,0,0,0,0,0,0,0,0,0,0,0,0,0,1,1,2,3,1,3,1,2,0,0,14
2005,Segmentation of neighboring organs in medical image with model competition,"Yan P., Shen W., Kassim A.A., Shah M.",3029743,Lecture Notes in Computer Science (including subseries Lecture Notes in Artificial Intelligence and Lecture Notes in Bioinformatics),3749, ,0,0,0,0,0,0,0,0,0,0,0,0,0,0,0,0,0,0,0,0,0,0,0,0,0,0,0,0,0,0,0,0,0,0,0,0,0,2,2,1,4,1,1,1,0,1,0,0,1,0,0,0,0,14
2005,Video understanding and content-based retrieval,"Zhai Y., Liu J., Cao X., Basharat A., Hakeem A., Ali S., Shah M., Grana C., Cucchiara R.",,2005 TREC Video Retrieval Evaluation Notebook Papers,, ,0,0,0,0,0,0,0,0,0,0,0,0,0,0,0,0,0,0,0,0,0,0,0,0,0,0,0,0,0,0,0,0,0,0,0,0,0,3,3,1,1,1,3,1,0,1,0,0,0,0,0,0,0,14
2001,A framework for segmentation of talk &amp; game shows,"Javed O., Rasheed Z., Shah M.",,Proceedings of the IEEE International Conference on Computer Vision,2, ,0,0,0,0,0,0,0,0,0,0,0,0,0,0,0,0,0,0,0,0,0,0,0,0,0,0,0,0,0,0,0,0,1,0,0,1,2,0,1,0,4,2,0,0,2,0,0,0,0,0,1,0,0,14
1999,Toward 3-D gesture recognition,"Davis J., Shah M.",2180014,International Journal of Pattern Recognition and Artificial Intelligence,13,3,0,0,0,0,0,0,0,0,0,0,0,0,0,0,0,0,0,0,0,0,0,0,0,0,0,0,0,0,0,0,0,1,1,2,0,1,1,2,1,1,1,0,1,0,0,0,0,2,0,0,0,0,0,14
1988,Optimal corner detector,"Rangarajan Krishnan, Shah Mubarak, Van Brackle David",,,, ,0,0,0,0,0,0,0,0,0,0,0,0,0,0,0,0,0,0,0,0,0,1,1,1,2,1,0,1,1,1,0,0,0,0,1,0,0,0,0,0,1,3,0,0,0,0,0,0,0,0,0,0,0,14
2018,ClusterNet: Detecting Small Objects in Large Scenes by Exploiting Spatio-Temporal Information,"Lalonde R., Zhang D., Shah M.",10636919,Proceedings of the IEEE Computer Society Conference on Computer Vision and Pattern Recognition,, ,0,0,0,0,0,0,0,0,0,0,0,0,0,0,0,0,0,0,0,0,0,0,0,0,0,0,0,0,0,0,0,0,0,0,0,0,0,0,0,0,0,0,0,0,0,0,0,0,0,3,10,0,0,13
2011,Horizon constraint for unambiguous UAV navigation in planar scenes,"Oreifej O., Lobo N., Shah M.",10504729,Proceedings - IEEE International Conference on Robotics and Automation,, ,0,0,0,0,0,0,0,0,0,0,0,0,0,0,0,0,0,0,0,0,0,0,0,0,0,0,0,0,0,0,0,0,0,0,0,0,0,0,0,0,0,0,0,1,0,1,3,1,4,1,2,0,0,13
2006,Model generation for video-based object recognition,"Noor H., Mirza S.H., Sheikh Y., Jain A., Shah M.",,"Proceedings of the 14th Annual ACM International Conference on Multimedia, MM 2006",, ,0,0,0,0,0,0,0,0,0,0,0,0,0,0,0,0,0,0,0,0,0,0,0,0,0,0,0,0,0,0,0,0,0,0,0,0,0,0,0,1,3,1,0,1,1,1,1,1,2,1,0,0,0,13
2005,A computer vision system for monitoring medication intake,"Batz D., Batz M., Da Vitoria Lobo N., Shah M.",,"Proceedings - 2nd Canadian Conference on Computer and Robot Vision, CRV 2005",, ,0,0,0,0,0,0,0,0,0,0,0,0,0,0,0,0,0,0,0,0,0,0,0,0,0,0,0,0,0,0,0,0,0,0,0,0,0,1,0,1,2,1,2,2,0,0,0,0,2,0,2,0,0,13
2012,ADHD classification using bag of words approach on network features,"Solmaz B., Dey S., Rao A.R., Shah M.",16057422,Progress in Biomedical Optics and Imaging - Proceedings of SPIE,8314, ,0,0,0,0,0,0,0,0,0,0,0,0,0,0,0,0,0,0,0,0,0,0,0,0,0,0,0,0,0,0,0,0,0,0,0,0,0,0,0,0,0,0,0,1,1,1,1,2,1,1,4,0,0,12
2006,Determining scale and sea state from water video,"Spencer L., Shah M., Guha R.K.",10577149,IEEE Transactions on Image Processing,15,6,0,0,0,0,0,0,0,0,0,0,0,0,0,0,0,0,0,0,0,0,0,0,0,0,0,0,0,0,0,0,0,0,0,0,0,0,0,0,0,2,1,0,1,0,3,0,1,1,0,1,2,0,0,12
2005,Object tracking across multiple independently moving airborne cameras,"Sheikh Y., Shah M.",,Proceedings of the IEEE International Conference on Computer Vision,II, ,0,0,0,0,0,0,0,0,0,0,0,0,0,0,0,0,0,0,0,0,0,0,0,0,0,0,0,0,0,0,0,0,0,0,0,0,0,2,1,1,2,1,1,1,2,0,0,0,1,0,0,0,0,12
2005,Single view compositing with shadows,"Cao X., Shen Y., Shah M., Foroosh H.",1782789,Visual Computer,21, 8-10,0,0,0,0,0,0,0,0,0,0,0,0,0,0,0,0,0,0,0,0,0,0,0,0,0,0,0,0,0,0,0,0,0,0,0,0,0,2,1,1,2,2,2,0,1,0,1,0,0,0,0,0,0,12
2003,Invariance in motion analysis of videos,"Rao C., Shah M., Syeda-Mahmood T.",,Proceedings of the ACM International Multimedia Conference and Exhibition,, ,0,0,0,0,0,0,0,0,0,0,0,0,0,0,0,0,0,0,0,0,0,0,0,0,0,0,0,0,0,0,0,0,0,0,0,0,0,0,1,3,0,0,1,0,2,2,2,0,0,0,0,1,0,12
1996,Photomotion,"Zhang R., Tsai P.-S., Shah M.",10773142,Computer Vision and Image Understanding,63,2,0,0,0,0,0,0,0,0,0,0,0,0,0,0,0,0,0,0,0,0,0,0,0,0,0,0,0,0,2,2,0,1,1,0,1,0,0,0,2,0,0,1,0,0,0,0,1,1,0,0,0,0,0,12
2016,"Human re-identification in crowd videos using personal, social and environmental constraints","Assari S.M., Idrees H., Shah M.",3029743,Lecture Notes in Computer Science (including subseries Lecture Notes in Artificial Intelligence and Lecture Notes in Bioinformatics),9906, ,0,0,0,0,0,0,0,0,0,0,0,0,0,0,0,0,0,0,0,0,0,0,0,0,0,0,0,0,0,0,0,0,0,0,0,0,0,0,0,0,0,0,0,0,0,0,0,0,3,2,6,0,0,11
2009,Modeling interaction for segmentation of neighboring structures,"Yan P., Kassim A.A., Shen W., Shah M.",10897771,IEEE Transactions on Information Technology in Biomedicine,13,2,0,0,0,0,0,0,0,0,0,0,0,0,0,0,0,0,0,0,0,0,0,0,0,0,0,0,0,0,0,0,0,0,0,0,0,0,0,0,0,0,1,2,1,2,0,2,0,0,0,1,2,0,0,11
2008,Image diffusion using saliency bilateral filter,"Xie J., Heng P.-A., Shah M.",10897771,IEEE Transactions on Information Technology in Biomedicine,12,6,0,0,0,0,0,0,0,0,0,0,0,0,0,0,0,0,0,0,0,0,0,0,0,0,0,0,0,0,0,0,0,0,0,0,0,0,0,0,0,0,0,1,2,1,1,1,0,1,0,0,4,0,0,11
2007,Trajectory association across non-overlapping moving cameras in planar scenes,"Sheikh Y., Xin L., Shah M.",10636919,Proceedings of the IEEE Computer Society Conference on Computer Vision and Pattern Recognition,, ,0,0,0,0,0,0,0,0,0,0,0,0,0,0,0,0,0,0,0,0,0,0,0,0,0,0,0,0,0,0,0,0,0,0,0,0,0,0,0,0,2,3,1,2,1,0,2,0,0,0,0,0,0,11
2004,A Framework for Semantic Classification of Scenes Using Finite State Machines,"Zhai Y., Rasheed Z., Shah M.",3029743,Lecture Notes in Computer Science (including subseries Lecture Notes in Artificial Intelligence and Lecture Notes in Bioinformatics),3115, ,0,0,0,0,0,0,0,0,0,0,0,0,0,0,0,0,0,0,0,0,0,0,0,0,0,0,0,0,0,0,0,0,0,0,0,0,0,1,1,0,0,1,2,1,0,1,2,2,0,0,0,0,0,11
2002,Automatic visual recognition of armed robbery,"Dever J., Da Vitoria Lobo N., Shah M.",10514651,Proceedings - International Conference on Pattern Recognition,16,1,0,0,0,0,0,0,0,0,0,0,0,0,0,0,0,0,0,0,0,0,0,0,0,0,0,0,0,0,0,0,0,0,0,0,0,3,1,0,0,0,1,1,0,0,2,0,0,1,0,1,1,0,0,11
2001,View-invariant representation and learning of human action,"Rao C., Shah M.",,"Proceedings - IEEE Workshop on Detection and Recognition of Events in Video, EVENT 2001",, ,0,0,0,0,0,0,0,0,0,0,0,0,0,0,0,0,0,0,0,0,0,0,0,0,0,0,0,0,0,0,0,0,0,1,3,1,0,1,1,1,1,1,1,0,0,0,0,0,0,0,0,0,0,11
1997,Iterative shape recovery from multiple images,"Zhang R., Shah M.",2628856,Image and Vision Computing,15,11,0,0,0,0,0,0,0,0,0,0,0,0,0,0,0,0,0,0,0,0,0,0,0,0,0,0,0,0,0,1,0,0,1,2,2,1,3,0,1,0,0,0,0,0,0,0,0,0,0,0,0,0,0,11
1996,Learning affine transformations of the plane for model-based object recognition,"Bebis G., Georgiopoulos M., Da Vitoria Lobo N., Shah M.",10514651,Proceedings - International Conference on Pattern Recognition,4, ,0,0,0,0,0,0,0,0,0,0,0,0,0,0,0,0,0,0,0,0,0,0,0,0,0,0,0,0,1,2,1,0,1,2,0,2,0,1,0,1,0,0,0,0,0,0,0,0,0,0,0,0,0,11
1993,Integration of shape from X modules: combining stereo and shading,"Cryer James Edwin, Tsai Ping-Sing, Shah Mubarak",,IEEE Computer Vision and Pattern Recognition,, ,0,0,0,0,0,0,0,0,0,0,0,0,0,0,0,0,0,0,0,0,0,0,0,0,0,1,1,0,0,0,2,0,0,0,0,0,0,1,1,0,0,0,0,0,1,1,0,0,1,1,0,1,0,11
1992,Interpretation of Motion Trajectories Using Focus of Expansion,"Rangarajan K., Shah M.",1628828,IEEE Transactions on Pattern Analysis and Machine Intelligence,14,12,0,0,0,0,0,0,0,0,0,0,0,0,0,0,0,0,0,0,0,0,0,0,0,0,1,0,0,2,0,1,0,1,0,0,0,1,0,1,1,0,1,2,0,0,0,0,0,0,0,0,0,0,0,11
2015,How to take a good selfie?,"Kalayeh M.M., Seifu M., LaLanne W., Shah M.",,MM 2015 - Proceedings of the 2015 ACM Multimedia Conference,, ,0,0,0,0,0,0,0,0,0,0,0,0,0,0,0,0,0,0,0,0,0,0,0,0,0,0,0,0,0,0,0,0,0,0,0,0,0,0,0,0,0,0,0,0,0,0,0,0,7,2,1,0,0,10
2013,Visual business recognition - A multimodal approach,"Zamir A.R., Dehghan A., Shah M.",,MM 2013 - Proceedings of the 2013 ACM Multimedia Conference,, ,0,0,0,0,0,0,0,0,0,0,0,0,0,0,0,0,0,0,0,0,0,0,0,0,0,0,0,0,0,0,0,0,0,0,0,0,0,0,0,0,0,0,0,0,0,0,4,1,3,2,0,0,0,10
2009,Action recognition in unconstrained amateur videos,"Liu J., Luo J., Shah M.",15206149,"ICASSP, IEEE International Conference on Acoustics, Speech and Signal Processing - Proceedings",, ,0,0,0,0,0,0,0,0,0,0,0,0,0,0,0,0,0,0,0,0,0,0,0,0,0,0,0,0,0,0,0,0,0,0,0,0,0,0,0,0,0,1,1,2,3,2,1,0,0,0,0,0,0,10
2005,Semantic classification of movie scenes using finite state machines,"Zhai Y., Rasheed Z., Shah M.",1350245X,"IEE Proceedings: Vision, Image and Signal Processing",152,6,0,0,0,0,0,0,0,0,0,0,0,0,0,0,0,0,0,0,0,0,0,0,0,0,0,0,0,0,0,0,0,0,0,0,0,0,0,0,3,0,1,1,1,0,0,0,1,1,2,0,0,0,0,10
2001,Mentoring undergraduates in computer vision research,"Shah M., Bowyer K.",189359,IEEE Transactions on Education,44,3,0,0,0,0,0,0,0,0,0,0,0,0,0,0,0,0,0,0,0,0,0,0,0,0,0,0,0,0,0,0,0,0,0,0,3,0,2,0,0,1,1,1,0,0,0,0,0,0,1,0,1,0,0,10
1994,Determining 3-D hand motion,"Davis J., Shah M.",10586393,"Conference Record - Asilomar Conference on Signals, Systems and Computers",2, ,0,0,0,0,0,0,0,0,0,0,0,0,0,0,0,0,0,0,0,0,0,0,0,0,0,0,0,1,0,1,1,0,1,1,1,1,1,0,1,0,0,0,1,0,0,0,0,0,0,0,0,0,0,10
1984,DETECTING TIME-VARYING CORNERS.,"Shah Mubarak A., Jain Ramesh",,Proceedings - International Conference on Pattern Recognition,, ,0,0,0,0,0,0,0,0,0,0,0,0,0,0,0,0,0,0,0,1,1,2,0,0,1,1,1,0,0,0,0,1,0,0,0,0,0,0,0,0,1,0,0,1,0,0,0,0,0,0,0,0,0,10
2015,Geo-semantic segmentation,"Ardeshir S., Collins-Sibley K.M., Shah M.",10636919,Proceedings of the IEEE Computer Society Conference on Computer Vision and Pattern Recognition,07-12-, ,0,0,0,0,0,0,0,0,0,0,0,0,0,0,0,0,0,0,0,0,0,0,0,0,0,0,0,0,0,0,0,0,0,0,0,0,0,0,0,0,0,0,0,0,0,0,0,5,0,3,1,0,0,9
2014,Classification of cinematographic shots using lie algebra and its application to complex event recognition,"Bhattacharya S., Mehran R., Sukthankar R., Shah M.",15209210,IEEE Transactions on Multimedia,16,3,0,0,0,0,0,0,0,0,0,0,0,0,0,0,0,0,0,0,0,0,0,0,0,0,0,0,0,0,0,0,0,0,0,0,0,0,0,0,0,0,0,0,0,0,0,0,2,1,3,2,0,1,0,9
