," 作者:Shah, Mubarak A.",,,,,,,,,,,,,,,,,,,,,,,,,,,,,,,,,,,,,,,,,,,,,,,,,,,,,,,,,,,
2008,Automatic tracking of Escherichia coli bacteria,"Xie J., Khan S., Shah M.",3029743,Lecture Notes in Computer Science (including subseries Lecture Notes in Artificial Intelligence and Lecture Notes in Bioinformatics),5241,1,0,0,0,0,0,0,0,0,0,0,0,0,0,0,0,0,0,0,0,0,0,0,0,0,0,0,0,0,0,0,0,0,0,0,0,0,0,0,0,0,2,1,1,1,0,1,0,2,0,0,1,0,0,9
2006,Where was the picture taken: Image localization in route panoramas using epipolar geometry,"Khan S.M., Rafi F., Shah M.",,"2006 IEEE International Conference on Multimedia and Expo, ICME 2006 - Proceedings",2006, ,0,0,0,0,0,0,0,0,0,0,0,0,0,0,0,0,0,0,0,0,0,0,0,0,0,0,0,0,0,0,0,0,0,0,0,0,0,0,1,3,1,1,3,0,0,0,0,0,0,0,0,0,0,9
2006,Video compression using spatiotemporal regularity flow,"Alatas O., Javed O., Shah M.",10577149,IEEE Transactions on Image Processing,15,12,0,0,0,0,0,0,0,0,0,0,0,0,0,0,0,0,0,0,0,0,0,0,0,0,0,0,0,0,0,0,0,0,0,0,0,0,0,0,3,1,0,0,0,0,0,0,3,1,0,1,0,0,0,9
2005,Automatic detection of heads in colored images,"Garcia J., Da Vitoria Lobo N., Shah M., Feinstein J.",,"Proceedings - 2nd Canadian Conference on Computer and Robot Vision, CRV 2005",, ,0,0,0,0,0,0,0,0,0,0,0,0,0,0,0,0,0,0,0,0,0,0,0,0,0,0,0,0,0,0,0,0,0,0,0,0,0,1,1,0,3,3,1,0,0,0,0,0,0,0,0,0,0,9
2004,Automatic target recognition using multi-view morphing,"Xiao J., Shah M.",0277786X,Proceedings of SPIE - The International Society for Optical Engineering,5426, ,0,0,0,0,0,0,0,0,0,0,0,0,0,0,0,0,0,0,0,0,0,0,0,0,0,0,0,0,0,0,0,0,0,0,0,0,0,2,0,0,0,1,1,1,1,0,1,1,0,1,0,0,0,9
2004,Visual monitoring of railroad grade crossing,"Sheikh Y., Zhai Y., Shafique K., Shah M.",0277786X,Proceedings of SPIE - The International Society for Optical Engineering,5403,2,0,0,0,0,0,0,0,0,0,0,0,0,0,0,0,0,0,0,0,0,0,0,0,0,0,0,0,0,0,0,0,0,0,0,0,0,0,0,2,1,1,1,1,1,0,1,0,1,0,0,0,0,0,9
2004,A probabilistic framework for object recognition in video,"Laved O., Shah M., Comaniciu D.",15224880,"Proceedings - International Conference on Image Processing, ICIP",4, ,0,0,0,0,0,0,0,0,0,0,0,0,0,0,0,0,0,0,0,0,0,0,0,0,0,0,0,0,0,0,0,0,0,0,0,0,0,1,1,0,0,0,0,0,1,0,1,1,2,1,0,1,0,9
2002,Guest introduction: The changing shape of computer vision in the twenty-first century,Shah M.,9205691,International Journal of Computer Vision,50,2,0,0,0,0,0,0,0,0,0,0,0,0,0,0,0,0,0,0,0,0,0,0,0,0,0,0,0,0,0,0,0,0,0,0,0,0,1,1,3,3,0,0,0,0,0,0,0,0,1,0,0,0,0,9
1998,Indexing Based on Algebraic Functions of Views,"Bebis G., Georgiopoulos M., Shah M., Da Vitoria Lobo N.",10773142,Computer Vision and Image Understanding,72,3,0,0,0,0,0,0,0,0,0,0,0,0,0,0,0,0,0,0,0,0,0,0,0,0,0,0,0,0,0,0,3,0,0,1,0,1,1,0,1,1,0,0,0,0,1,0,0,0,0,0,0,0,0,9
1988,A VLSI architecture for computing scale space,"Ranganathan N., Shah M.",0734189X,"Computer Vision, Graphics and Image Processing",43,2,0,0,0,0,0,0,0,0,0,0,0,0,0,0,0,0,0,0,0,0,0,0,4,2,0,1,0,0,0,0,0,0,0,0,0,0,0,0,0,0,0,0,1,0,0,0,0,0,0,0,1,0,0,9
2019,Large-Scale Image Geo-Localization Using Dominant Sets,"Zemene E., Tesfaye Y.T., Idrees H., Prati A., Pelillo M., Shah M.",1628828,IEEE Transactions on Pattern Analysis and Machine Intelligence,41,1,0,0,0,0,0,0,0,0,0,0,0,0,0,0,0,0,0,0,0,0,0,0,0,0,0,0,0,0,0,0,0,0,0,0,0,0,0,0,0,0,0,0,0,0,0,0,0,0,0,0,7,1,0,8
2018,VideocapsuleNet: A simplified network for action detection,"Duarte K., Rawat Y.S., Shah M.",10495258,Advances in Neural Information Processing Systems,2018-, ,0,0,0,0,0,0,0,0,0,0,0,0,0,0,0,0,0,0,0,0,0,0,0,0,0,0,0,0,0,0,0,0,0,0,0,0,0,0,0,0,0,0,0,0,0,0,0,0,0,0,7,1,0,8
2017,Improved scene identification and object detection on egocentric vision of daily activities,"Vaca-Castano G., Das S., Sousa J.P., Lobo N.D., Shah M.",10773142,Computer Vision and Image Understanding,156, ,0,0,0,0,0,0,0,0,0,0,0,0,0,0,0,0,0,0,0,0,0,0,0,0,0,0,0,0,0,0,0,0,0,0,0,0,0,0,0,0,0,0,0,0,0,0,0,0,2,2,3,1,0,8
2007,On the direct estimation of the fundamental matrix,"Sheikh Y., Hakeem A., Shah M.",10636919,Proceedings of the IEEE Computer Society Conference on Computer Vision and Pattern Recognition,, ,0,0,0,0,0,0,0,0,0,0,0,0,0,0,0,0,0,0,0,0,0,0,0,0,0,0,0,0,0,0,0,0,0,0,0,0,0,0,0,3,0,0,1,2,1,0,0,1,0,0,0,0,0,8
2006,Shape from dynamic texture for planes,"Sheikh Y., Haering N., Shah M.",10636919,Proceedings of the IEEE Computer Society Conference on Computer Vision and Pattern Recognition,2, ,0,0,0,0,0,0,0,0,0,0,0,0,0,0,0,0,0,0,0,0,0,0,0,0,0,0,0,0,0,0,0,0,0,0,0,0,0,0,0,2,0,1,1,2,1,0,0,0,0,0,1,0,0,8
2002,Estimation of rigid and non-rigid facial motion using anatomical face model,"Yilmaz A., Shafique K., Shah M.",10514651,Proceedings - International Conference on Pattern Recognition,16,1,0,0,0,0,0,0,0,0,0,0,0,0,0,0,0,0,0,0,0,0,0,0,0,0,0,0,0,0,0,0,0,0,0,0,0,0,1,3,1,2,1,0,0,0,0,0,0,0,0,0,0,0,0,8
1989,Segmentation using intensity and range data,"Hackett Jay K., Shah Mubarak",913286,Optical Engineering,28,6,0,0,0,0,0,0,0,0,0,0,0,0,0,0,0,0,0,0,0,0,0,0,0,0,1,1,1,1,0,1,0,0,1,0,0,1,0,0,0,1,0,0,0,0,0,0,0,0,0,0,0,0,0,8
2019,Online Localization and Prediction of Actions and Interactions,"Soomro K., Idrees H., Shah M.",1628828,IEEE Transactions on Pattern Analysis and Machine Intelligence,41,2,0,0,0,0,0,0,0,0,0,0,0,0,0,0,0,0,0,0,0,0,0,0,0,0,0,0,0,0,0,0,0,0,0,0,0,0,0,0,0,0,0,0,0,0,0,0,0,0,0,1,5,1,0,7
2018,Binary Quadratic Programing for Online Tracking of Hundreds of People in Extremely Crowded Scenes,"Dehghan A., Shah M.",1628828,IEEE Transactions on Pattern Analysis and Machine Intelligence,40,3,0,0,0,0,0,0,0,0,0,0,0,0,0,0,0,0,0,0,0,0,0,0,0,0,0,0,0,0,0,0,0,0,0,0,0,0,0,0,0,0,0,0,0,0,0,0,0,0,0,1,4,2,0,7
2017,Real-time temporal action localization in untrimmed videos by sub-action discovery,"Hou R., Sukthankar R., Shah M.",,"British Machine Vision Conference 2017, BMVC 2017",, ,0,0,0,0,0,0,0,0,0,0,0,0,0,0,0,0,0,0,0,0,0,0,0,0,0,0,0,0,0,0,0,0,0,0,0,0,0,0,0,0,0,0,0,0,0,0,0,0,0,1,6,0,0,7
2014,DaMN - Discriminative and mutually nearest: Exploiting pairwise category proximity for video action recognition,"Hou R., Roshan Zamir A., Sukthankar R., Shah M.",3029743,Lecture Notes in Computer Science (including subseries Lecture Notes in Artificial Intelligence and Lecture Notes in Bioinformatics),8691,3,0,0,0,0,0,0,0,0,0,0,0,0,0,0,0,0,0,0,0,0,0,0,0,0,0,0,0,0,0,0,0,0,0,0,0,0,0,0,0,0,0,0,0,0,0,0,2,1,1,1,2,0,0,7
2011,Distinctive Left-Sided distribution of Adrenergic-Derived cells in the adult mouse heart,"Osuala K., Telusma K., Khan S.M., Wu S., Shah M., Baker C., Alam S., Abukenda I., Fuentes A., Seifein H.B., Ebert S.N.",19326203,PLoS ONE,6,7,0,0,0,0,0,0,0,0,0,0,0,0,0,0,0,0,0,0,0,0,0,0,0,0,0,0,0,0,0,0,0,0,0,0,0,0,0,0,0,0,0,0,0,1,2,1,0,0,2,0,1,0,0,7
2005,Automatic segmentation of home videos,"Zhai Y., Shah M.",,"IEEE International Conference on Multimedia and Expo, ICME 2005",2005, ,0,0,0,0,0,0,0,0,0,0,0,0,0,0,0,0,0,0,0,0,0,0,0,0,0,0,0,0,0,0,0,0,0,0,0,0,0,0,1,1,0,0,3,0,1,1,0,0,0,0,0,0,0,7
1998,From shape from shading to object recognition,"Ortega A., Shah M.",2180014,International Journal of Pattern Recognition and Artificial Intelligence,12,7,0,0,0,0,0,0,0,0,0,0,0,0,0,0,0,0,0,0,0,0,0,0,0,0,0,0,0,0,0,0,1,0,0,0,0,0,1,0,1,2,0,0,1,0,0,0,0,0,1,0,0,0,0,7
1990,Normalized edge detector,"Williams Donna J., Shah Mubarak",,Proceedings - International Conference on Pattern Recognition,1, ,0,0,0,0,0,0,0,0,0,0,0,0,0,0,0,0,0,0,0,0,0,0,0,0,0,1,1,0,1,1,0,0,0,0,0,0,0,0,0,1,0,0,0,0,0,0,0,0,0,2,0,0,0,7
2018,ThoughtViz: Visualizing human thoughts using generative adversarial network,"Tirupattur P., Spampinato C., Rawat Y.S., Shah M.",,MM 2018 - Proceedings of the 2018 ACM Multimedia Conference,, ,0,0,0,0,0,0,0,0,0,0,0,0,0,0,0,0,0,0,0,0,0,0,0,0,0,0,0,0,0,0,0,0,0,0,0,0,0,0,0,0,0,0,0,0,0,0,0,0,0,0,5,1,0,6
2016,Scene Labeling Using Sparse Precision Matrix,"Souly N., Shah M.",10636919,Proceedings of the IEEE Computer Society Conference on Computer Vision and Pattern Recognition,2016-, ,0,0,0,0,0,0,0,0,0,0,0,0,0,0,0,0,0,0,0,0,0,0,0,0,0,0,0,0,0,0,0,0,0,0,0,0,0,0,0,0,0,0,0,0,0,0,0,0,1,2,3,0,0,6
2014,Improving semantic concept detection through the dictionary of visually-distinct elements,"Dehghan A., Idrees H., Shah M.",10636919,Proceedings of the IEEE Computer Society Conference on Computer Vision and Pattern Recognition,, ,0,0,0,0,0,0,0,0,0,0,0,0,0,0,0,0,0,0,0,0,0,0,0,0,0,0,0,0,0,0,0,0,0,0,0,0,0,0,0,0,0,0,0,0,0,0,1,3,1,0,1,0,0,6
2013,Multi-agent event recognition by preservation of spatiotemporal relationships between probabilistic models,"Khokhar S., Saleemi I., Shah M.",2628856,Image and Vision Computing,31,9,0,0,0,0,0,0,0,0,0,0,0,0,0,0,0,0,0,0,0,0,0,0,0,0,0,0,0,0,0,0,0,0,0,0,0,0,0,0,0,0,0,0,0,0,0,0,3,2,1,0,0,0,0,6
1995,Recovering 3D motion of multiple objects using adaptive Hough transform,"Tian Tina Yu, Shah Mubarak",,IEEE International Conference on Computer Vision,, ,0,0,0,0,0,0,0,0,0,0,0,0,0,0,0,0,0,0,0,0,0,0,0,0,0,0,0,1,0,0,0,0,2,0,1,1,0,0,0,0,1,0,0,0,0,0,0,0,0,0,0,0,0,6
2017,Video Fill in the Blank Using LR/RL LSTMs with Spatial-Temporal Attentions,"Mazaheri A., Zhang D., Shah M.",15505499,Proceedings of the IEEE International Conference on Computer Vision,2017-, ,0,0,0,0,0,0,0,0,0,0,0,0,0,0,0,0,0,0,0,0,0,0,0,0,0,0,0,0,0,0,0,0,0,0,0,0,0,0,0,0,0,0,0,0,0,0,0,0,0,3,2,0,0,5
2011,Similarity invariant classification of events by KL divergence minimization,"Khokhar S., Saleemi I., Shah M.",,Proceedings of the IEEE International Conference on Computer Vision,, ,0,0,0,0,0,0,0,0,0,0,0,0,0,0,0,0,0,0,0,0,0,0,0,0,0,0,0,0,0,0,0,0,0,0,0,0,0,0,0,0,0,0,0,0,2,1,0,0,1,0,1,0,0,5
2008,Automatic video annotation with adaptive number of key words,"Wang F., Lu W., Liu J., Shah M., Xu D.",10514651,Proceedings - International Conference on Pattern Recognition,, ,0,0,0,0,0,0,0,0,0,0,0,0,0,0,0,0,0,0,0,0,0,0,0,0,0,0,0,0,0,0,0,0,0,0,0,0,0,0,0,0,0,1,1,2,0,0,1,0,0,0,0,0,0,5
2008,Action recognition using spatio-temporal regularity based features,"Goodhart T., Yan P., Shah M.",15206149,"ICASSP, IEEE International Conference on Acoustics, Speech and Signal Processing - Proceedings",, ,0,0,0,0,0,0,0,0,0,0,0,0,0,0,0,0,0,0,0,0,0,0,0,0,0,0,0,0,0,0,0,0,0,0,0,0,0,0,0,0,0,1,1,1,1,1,0,0,0,0,0,0,0,5
2008,Person and vehicle tracking in surveillance video,"Miller A., Basharat A., White B., Liu J., Shah M.",3029743,Lecture Notes in Computer Science (including subseries Lecture Notes in Artificial Intelligence and Lecture Notes in Bioinformatics),4625, ,0,0,0,0,0,0,0,0,0,0,0,0,0,0,0,0,0,0,0,0,0,0,0,0,0,0,0,0,0,0,0,0,0,0,0,0,0,0,0,0,0,0,1,1,0,0,1,0,0,1,1,0,0,5
2008,University of Central Florida at TRECVID 2008 content based copy detection and surveillance event detection,"Bilal Orhan O., Liu J., Hochreiter J., Poock J., Chen Q., Chabra A., Shah M.",,2008 TREC Video Retrieval Evaluation Notebook Papers,, ,0,0,0,0,0,0,0,0,0,0,0,0,0,0,0,0,0,0,0,0,0,0,0,0,0,0,0,0,0,0,0,0,0,0,0,0,0,0,0,0,0,1,0,1,1,2,0,0,0,0,0,0,0,5
2005,Resolving hand over face occlusion,"Smith P., Lobo N.D.V., Shah M.",3029743,Lecture Notes in Computer Science (including subseries Lecture Notes in Artificial Intelligence and Lecture Notes in Bioinformatics),3766, ,0,0,0,0,0,0,0,0,0,0,0,0,0,0,0,0,0,0,0,0,0,0,0,0,0,0,0,0,0,0,0,0,0,0,0,0,0,0,1,0,2,1,0,0,0,0,0,1,0,0,0,0,0,5
2005,Layer-based video registration,"Xiao J., Shah M.",9328092,Machine Vision and Applications,16,2,0,0,0,0,0,0,0,0,0,0,0,0,0,0,0,0,0,0,0,0,0,0,0,0,0,0,0,0,0,0,0,0,0,0,0,0,0,0,0,0,0,1,1,2,0,0,1,0,0,0,0,0,0,5
2004,"Network video image processing for security, surveillance, and situational awareness","Mahalanobis A., Cannon J., Stanfill S.R., Muise R., Shah M.",0277786X,Proceedings of SPIE - The International Society for Optical Engineering,5440, ,0,0,0,0,0,0,0,0,0,0,0,0,0,0,0,0,0,0,0,0,0,0,0,0,0,0,0,0,0,0,0,0,0,0,0,1,0,0,1,1,0,0,0,0,0,1,0,0,0,0,1,0,0,5
2003,Automatic Recognition of a Baby Gesture,"Bhatt J., Vitoria Lobo N.D., Shah M., Bebis G.",10636730,Proceedings of the International Conference on Tools with Artificial Intelligence,, ,0,0,0,0,0,0,0,0,0,0,0,0,0,0,0,0,0,0,0,0,0,0,0,0,0,0,0,0,0,0,0,0,0,0,0,0,0,0,0,0,0,1,1,2,0,1,0,0,0,0,0,0,0,5
1994,Motion segmentation and estimation,"Tian T.Y., Shah M.",15224880,"Proceedings - International Conference on Image Processing, ICIP",2, ,0,0,0,0,0,0,0,0,0,0,0,0,0,0,0,0,0,0,0,0,0,0,0,0,0,0,1,0,0,2,0,0,1,0,0,0,0,0,0,0,0,0,1,0,0,0,0,0,0,0,0,0,0,5
1989,Multiple scale edge linking,"Williams D.J., Shah M.",0277786X,Proceedings of SPIE - The International Society for Optical Engineering,1095, ,0,0,0,0,0,0,0,0,0,0,0,0,0,0,0,0,0,0,0,0,0,1,0,1,0,0,0,0,0,0,1,0,0,0,1,0,1,0,0,0,0,0,0,0,0,0,0,0,0,0,0,0,0,5
2018,"On Detection, Data Association and Segmentation for Multi-target Tracking","Tian Y., Dehghan A., Shah M.",1628828,IEEE Transactions on Pattern Analysis and Machine Intelligence,, ,0,0,0,0,0,0,0,0,0,0,0,0,0,0,0,0,0,0,0,0,0,0,0,0,0,0,0,0,0,0,0,0,0,0,0,0,0,0,0,0,0,0,0,0,0,0,0,0,0,0,2,2,0,4
2011,AVSS 2011 demo session: A large-scale benchmark dataset for event recognition in surveillance video,"Oh S., Hoogs A., Perera A., Cuntoor N., Chen C.-C., Lee J.T., Mukherjee S., Aggarwal J.K., Lee H., Davis L., Swears E., Wang X., Ji Q., Reddy K., Shah M., Vondrick C., Pirsiavash H., Ramanan D., Yuen J., Torralba A., Song B., Fong A., Roy-Chowdhury A., Desai M.",,"2011 8th IEEE International Conference on Advanced Video and Signal Based Surveillance, AVSS 2011",, ,0,0,0,0,0,0,0,0,0,0,0,0,0,0,0,0,0,0,0,0,0,0,0,0,0,0,0,0,0,0,0,0,0,0,0,0,0,0,0,0,0,0,0,0,1,1,0,0,0,0,1,1,0,4
2008,Geometric constraints on 2D action models for tracking human body,"Gritai A., Basharat A., Shah M.",10514651,Proceedings - International Conference on Pattern Recognition,, ,0,0,0,0,0,0,0,0,0,0,0,0,0,0,0,0,0,0,0,0,0,0,0,0,0,0,0,0,0,0,0,0,0,0,0,0,0,0,0,0,0,1,1,0,0,0,0,0,0,0,1,1,0,4
2007,Foreground segmentation in surveillance scenes containing a door,"Miller A., Shah M.",,"Proceedings of the 2007 IEEE International Conference on Multimedia and Expo, ICME 2007",, ,0,0,0,0,0,0,0,0,0,0,0,0,0,0,0,0,0,0,0,0,0,0,0,0,0,0,0,0,0,0,0,0,0,0,0,0,0,0,0,1,0,1,1,0,0,1,0,0,0,0,0,0,0,4
2006,Tracking of human body joints using anthropometry,"Gritai A., Shah M.",,"2006 IEEE International Conference on Multimedia and Expo, ICME 2006 - Proceedings",2006, ,0,0,0,0,0,0,0,0,0,0,0,0,0,0,0,0,0,0,0,0,0,0,0,0,0,0,0,0,0,0,0,0,0,0,0,0,0,0,0,0,1,0,0,0,0,1,1,0,0,0,1,0,0,4
2005,Adaptive region-based video registration,"Xiao J., Zhang Y., Shah M.",,"Proceedings - IEEE Workshop on Motion and Video Computing, MOTION 2005",, ,0,0,0,0,0,0,0,0,0,0,0,0,0,0,0,0,0,0,0,0,0,0,0,0,0,0,0,0,0,0,0,0,0,0,0,0,0,1,1,0,0,0,0,1,0,0,0,1,0,0,0,0,0,4
2004,Water video analysis,"Spencer L., Shah M.",15224880,"Proceedings - International Conference on Image Processing, ICIP",4, ,0,0,0,0,0,0,0,0,0,0,0,0,0,0,0,0,0,0,0,0,0,0,0,0,0,0,0,0,0,0,0,0,0,0,0,0,0,0,0,0,1,1,0,0,0,1,0,0,0,0,1,0,0,4
2004,Integrating and employing multiple levels of zoom for activity recognition,"Smith P., Shah M., Da Vitoria Lobo N.",10636919,Proceedings of the IEEE Computer Society Conference on Computer Vision and Pattern Recognition,2, ,0,0,0,0,0,0,0,0,0,0,0,0,0,0,0,0,0,0,0,0,0,0,0,0,0,0,0,0,0,0,0,0,0,0,0,0,1,1,1,1,0,0,0,0,0,0,0,0,0,0,0,0,0,4
2004,Virtual three-dimensional blackboard: Three-dimensional finger tracking with a single camera,"Wu A., Hassan-Shafique K., Shah M., Da Vitoria Lobo N.",1559128X,Applied Optics,43,2,0,0,0,0,0,0,0,0,0,0,0,0,0,0,0,0,0,0,0,0,0,0,0,0,0,0,0,0,0,0,0,0,0,0,0,0,0,0,0,0,1,0,1,0,0,2,0,0,0,0,0,0,0,4
1998,Using algebraic functions of views for indexing-based object recognition,"Bebis George, Georgiopoulos Michael, Shah Mubarak, da Vitoria Lobo Niels",,Proceedings of the IEEE International Conference on Computer Vision,, ,0,0,0,0,0,0,0,0,0,0,0,0,0,0,0,0,0,0,0,0,0,0,0,0,0,0,0,0,0,0,1,0,0,0,0,1,0,0,0,2,0,0,0,0,0,0,0,0,0,0,0,0,0,4
1991,Three-dimensional object recognition using multiple sensors,"Hackett Jay K., Lavoie Matt J., Shah Mubarak",0277786X,Proceedings of SPIE - The International Society for Optical Engineering,1383, ,0,0,0,0,0,0,0,0,0,0,0,0,0,0,0,0,0,0,0,0,0,0,0,0,0,1,0,1,0,0,1,0,0,0,0,0,0,0,0,0,0,0,1,0,0,0,0,0,0,0,0,0,0,4
2019,Multi-target Tracking in Multiple Non-overlapping Cameras Using Fast-Constrained Dominant Sets,"Tesfaye Y.T., Zemene E., Prati A., Pelillo M., Shah M.",9205691,International Journal of Computer Vision,127,9,0,0,0,0,0,0,0,0,0,0,0,0,0,0,0,0,0,0,0,0,0,0,0,0,0,0,0,0,0,0,0,0,0,0,0,0,0,0,0,0,0,0,0,0,0,0,0,0,0,0,1,2,0,3
2018,Enhancing camera surveillance using computer vision: a research note,"Idrees H., Shah M., Surette R.",1363951X,Policing,41,2,0,0,0,0,0,0,0,0,0,0,0,0,0,0,0,0,0,0,0,0,0,0,0,0,0,0,0,0,0,0,0,0,0,0,0,0,0,0,0,0,0,0,0,0,0,0,0,0,0,0,1,2,0,3
2017,Automatic action annotation in weakly labeled videos,"Sultani W., Shah M.",10773142,Computer Vision and Image Understanding,161, ,0,0,0,0,0,0,0,0,0,0,0,0,0,0,0,0,0,0,0,0,0,0,0,0,0,0,0,0,0,0,0,0,0,0,0,0,0,0,0,0,0,0,0,0,0,0,0,0,0,0,1,2,0,3
2015,"An end-to-end system for content-based video retrieval using behavior, actions, and appearance with interactive query refinement","Hoogs A., Perera A.G.A., Collins R., Basharat A., Fieldhouse K., Atkins C., Sherrill L., Boeckel B., Blue R., Woehlke M., Greco C., Sun Z., Swears E., Cuntoor N., Luck J., Drew B., Hanson D., Rowley D., Kopaz J., Rude T., Keefe D., Srivastava A., Khanwalkar S., Kumar A., Chen C.C., Aggarwal J.K., Davis L., Yacoob Y., Jain A., Liu D., Chang S.-F., Song B., Roy-Chowdhury A., Sullivan K., Tesic J., Chandrasekaran S., Manjunath B.S., Wang X., Ji Q., Reddy K., Liu J., Shah M., Chang K., Chen T., Desai M.",,AVSS 2015 - 12th IEEE International Conference on Advanced Video and Signal Based Surveillance,, ,0,0,0,0,0,0,0,0,0,0,0,0,0,0,0,0,0,0,0,0,0,0,0,0,0,0,0,0,0,0,0,0,0,0,0,0,0,0,0,0,0,0,0,0,0,0,0,0,0,0,3,0,0,3
2015,Semantic image search from multiple query images,"Vaca-Castano G., Shah M.",,MM 2015 - Proceedings of the 2015 ACM Multimedia Conference,, ,0,0,0,0,0,0,0,0,0,0,0,0,0,0,0,0,0,0,0,0,0,0,0,0,0,0,0,0,0,0,0,0,0,0,0,0,0,0,0,0,0,0,0,0,0,0,0,2,0,1,0,0,0,3
2014,Complex event recognition by latent temporal models of concepts,"Borzeshi E.Z., Dehghan A., Piccardi M., Shah M.",,"2014 IEEE International Conference on Image Processing, ICIP 2014",, ,0,0,0,0,0,0,0,0,0,0,0,0,0,0,0,0,0,0,0,0,0,0,0,0,0,0,0,0,0,0,0,0,0,0,0,0,0,0,0,0,0,0,0,0,0,0,1,0,0,2,0,0,0,3
2011,Team SRI-Sarnoff's AURORA system @ TRECVID 2011,"Cheng H., Tamrakar A., Ali S., Yu Q., Javed O., Liu J., Divakaran A., Sawhney H.S., Hauptmann A., Shah M., Bhattacharya S., Witbrock M., Curtis J., Friedland G., Mertens R., Darrell T., Manmatha R., Allan J.",,2011 TREC Video Retrieval Evaluation Notebook Papers,, ,0,0,0,0,0,0,0,0,0,0,0,0,0,0,0,0,0,0,0,0,0,0,0,0,0,0,0,0,0,0,0,0,0,0,0,0,0,0,0,0,0,0,0,0,1,0,1,0,0,1,0,0,0,3
2010,Visual crowd surveillance is like hydrodynamics,Shah M.,,MM'10 - Proceedings of the ACM Multimedia 2010 International Conference,, ,0,0,0,0,0,0,0,0,0,0,0,0,0,0,0,0,0,0,0,0,0,0,0,0,0,0,0,0,0,0,0,0,0,0,0,0,0,0,0,0,0,0,1,0,1,0,0,0,1,0,0,0,0,3
2008,Reconstructing non-stationary articulated objects in monocular video using silhouette information,"Khan S.M., Shah M.",,"26th IEEE Conference on Computer Vision and Pattern Recognition, CVPR",, ,0,0,0,0,0,0,0,0,0,0,0,0,0,0,0,0,0,0,0,0,0,0,0,0,0,0,0,0,0,0,0,0,0,0,0,0,0,0,0,0,0,0,1,0,0,0,0,1,0,1,0,0,0,3
2007,Is there a primal face of pain? A methodology answer,"Schiavenato M., Byers J., Scovanner P., Windyga P., Shah M.",5891019,Annual International Conference of the IEEE Engineering in Medicine and Biology - Proceedings,, ,0,0,0,0,0,0,0,0,0,0,0,0,0,0,0,0,0,0,0,0,0,0,0,0,0,0,0,0,0,0,0,0,0,0,0,0,0,0,0,1,0,1,0,0,0,0,1,0,0,0,0,0,0,3
2007,Multiple vehicle tracking in surveillance videos,"Yun Z., Berkowitz P., Miller A., Shafique K., Vartak A., White B., Shah M.",3029743,Lecture Notes in Computer Science (including subseries Lecture Notes in Artificial Intelligence and Lecture Notes in Bioinformatics),4122, ,0,0,0,0,0,0,0,0,0,0,0,0,0,0,0,0,0,0,0,0,0,0,0,0,0,0,0,0,0,0,0,0,0,0,0,0,0,0,0,1,0,0,0,1,1,0,0,0,0,0,0,0,0,3
2007,A vision-based system for a UGV to handle a road intersection,"Ahmed J., Shah M., Miller A., Harper D., Jafri M.N.",,Proceedings of the National Conference on Artificial Intelligence,2, ,0,0,0,0,0,0,0,0,0,0,0,0,0,0,0,0,0,0,0,0,0,0,0,0,0,0,0,0,0,0,0,0,0,0,0,0,0,0,0,0,0,0,0,0,0,0,1,1,1,0,0,0,0,3
2007,On the spacetime geometry of galilean cameras,"Sheikh Y., Gritai A., Shah M.",10636919,Proceedings of the IEEE Computer Society Conference on Computer Vision and Pattern Recognition,, ,0,0,0,0,0,0,0,0,0,0,0,0,0,0,0,0,0,0,0,0,0,0,0,0,0,0,0,0,0,0,0,0,0,0,0,0,0,0,0,0,1,1,0,0,0,0,0,1,0,0,0,0,0,3
2007,University of Central Florida at TRECVID 2007 semantic video classification and automatic search,"Liu J., Aytar Y., Orhan B., Han J., Shah M.",,2007 TREC Video Retrieval Evaluation Notebook Papers,, ,0,0,0,0,0,0,0,0,0,0,0,0,0,0,0,0,0,0,0,0,0,0,0,0,0,0,0,0,0,0,0,0,0,0,0,0,0,0,0,0,1,0,0,0,0,1,0,0,1,0,0,0,0,3
2005,Video compression using structural flow,"Alatas O., Javed O., Shah M.",15224880,"Proceedings - International Conference on Image Processing, ICIP",3, ,0,0,0,0,0,0,0,0,0,0,0,0,0,0,0,0,0,0,0,0,0,0,0,0,0,0,0,0,0,0,0,0,0,0,0,0,0,0,0,0,0,0,0,1,0,0,0,1,0,0,1,0,0,3
1992,Recognition using motion and shape,"Rangarajan K., Allen W., Shah M.",10514651,Proceedings - International Conference on Pattern Recognition,1, ,0,0,0,0,0,0,0,0,0,0,0,0,0,0,0,0,0,0,0,0,0,0,0,0,1,0,1,0,0,0,0,0,0,0,0,0,0,0,0,0,0,0,0,0,0,0,0,0,0,0,1,0,0,3
1992,Generation and segmentation of motion trajectories,"Shah M., Rangarajan K., Tsai P.-S.",10514651,Proceedings - International Conference on Pattern Recognition,1, ,0,0,0,0,0,0,0,0,0,0,0,0,0,0,0,0,0,0,0,0,0,0,0,0,1,0,0,0,0,0,0,0,0,0,0,0,0,1,1,0,0,0,0,0,0,0,0,0,0,0,0,0,0,3
2018,Learning a multi-concept video retrieval model with multiple latent variables,"Mazaheri A., Gong B., Shah M.",15516857,"ACM Transactions on Multimedia Computing, Communications and Applications",14,2,0,0,0,0,0,0,0,0,0,0,0,0,0,0,0,0,0,0,0,0,0,0,0,0,0,0,0,0,0,0,0,0,0,0,0,0,0,0,0,0,0,0,0,0,0,0,0,0,0,0,2,0,0,2
2014,Learning discriminative features and metrics for measuring action similarity,"Yang Y., Shah M.",,"2014 IEEE International Conference on Image Processing, ICIP 2014",, ,0,0,0,0,0,0,0,0,0,0,0,0,0,0,0,0,0,0,0,0,0,0,0,0,0,0,0,0,0,0,0,0,0,0,0,0,0,0,0,0,0,0,0,0,0,0,0,0,0,1,1,0,0,2
2009,Object Association Across Multiple Cameras,"Sheikh Y., Javed O., Shah M.",,Multi-Camera Networks,, ,0,0,0,0,0,0,0,0,0,0,0,0,0,0,0,0,0,0,0,0,0,0,0,0,0,0,0,0,0,0,0,0,0,0,0,0,0,0,0,0,0,1,1,0,0,0,0,0,0,0,0,0,0,2
2007,Creating realistic shadows of composited objects,"Cao X., Shah M.",,"Proceedings - Seventh IEEE Workshop on Applications of Computer Vision, WACV 2005",, ,0,0,0,0,0,0,0,0,0,0,0,0,0,0,0,0,0,0,0,0,0,0,0,0,0,0,0,0,0,0,0,0,0,0,0,0,1,0,0,0,0,0,0,0,0,0,0,1,0,0,0,0,0,2
2006,Integrating multiple levels of zoom to enable activity analysis,"Smith P., Shah M., da Vitoria Lobo N.",10773142,Computer Vision and Image Understanding,103,1,0,0,0,0,0,0,0,0,0,0,0,0,0,0,0,0,0,0,0,0,0,0,0,0,0,0,0,0,0,0,0,0,0,0,0,0,0,1,0,0,1,0,0,0,0,0,0,0,0,0,0,0,0,2
2006,University of Central Florida at TRECVID 2006 high-level feature extraction and video search,"Liu J., Zhai Y., Basharat A., Orhan B., Khan S.M., Noor H., Berkowitz P., Shah M.",,2006 TREC Video Retrieval Evaluation Notebook Papers,, ,0,0,0,0,0,0,0,0,0,0,0,0,0,0,0,0,0,0,0,0,0,0,0,0,0,0,0,0,0,0,0,0,0,0,0,0,0,0,0,1,0,0,0,0,0,1,0,0,0,0,0,0,0,2
2005,An integrated approach for generic object detection using Kernel PCA and boosting,"Ali S., Shah M.",,"IEEE International Conference on Multimedia and Expo, ICME 2005",2005, ,0,0,0,0,0,0,0,0,0,0,0,0,0,0,0,0,0,0,0,0,0,0,0,0,0,0,0,0,0,0,0,0,0,0,0,0,0,0,1,0,0,0,1,0,0,0,0,0,0,0,0,0,0,2
2005,A multi-level framework for video shot structuring,"Zhai Y., Shah M.",3029743,Lecture Notes in Computer Science (including subseries Lecture Notes in Artificial Intelligence and Lecture Notes in Bioinformatics),3656, ,0,0,0,0,0,0,0,0,0,0,0,0,0,0,0,0,0,0,0,0,0,0,0,0,0,0,0,0,0,0,0,0,0,0,0,0,0,0,0,1,0,0,0,0,0,0,0,1,0,0,0,0,0,2
2001,A system for placing videotaped and digital lectures on-line,"Wallick M.N., Lobo N.D.V., Shah M.",,"Proceedings of 2001 International Symposium on Intelligent Multimedia, Video and Speech Processing, ISIMP 2001",, ,0,0,0,0,0,0,0,0,0,0,0,0,0,0,0,0,0,0,0,0,0,0,0,0,0,0,0,0,0,0,0,0,0,1,0,0,1,0,0,0,0,0,0,0,0,0,0,0,0,0,0,0,0,2
1999,Segmentation and tracking of coronary arteries,"Ingrassia Chris, Windyga Piotr, Shah Mubarak",5891019,Annual International Conference of the IEEE Engineering in Medicine and Biology - Proceedings,1, ,0,0,0,0,0,0,0,0,0,0,0,0,0,0,0,0,0,0,0,0,0,0,0,0,0,0,0,0,0,0,0,0,0,0,0,1,0,0,0,0,0,0,0,0,0,0,1,0,0,0,0,0,0,2
1998,Content-based image retrieval using gradient projections,"Rose Jed, Shah Mubarak",7347502,Conference Proceedings - IEEE SOUTHEASTCON,, ,0,0,0,0,0,0,0,0,0,0,0,0,0,0,0,0,0,0,0,0,0,0,0,0,0,0,0,0,0,0,0,0,0,0,0,0,1,0,0,0,0,0,0,0,0,0,0,0,0,1,0,0,0,2
1994,Height recovery from intensity gradient,"Zhang Ruo, Shah Mubarak",10636919,Proceedings of the IEEE Computer Society Conference on Computer Vision and Pattern Recognition,, ,0,0,0,0,0,0,0,0,0,0,0,0,0,0,0,0,0,0,0,0,0,0,0,0,0,0,1,0,0,0,0,0,0,1,0,0,0,0,0,0,0,0,0,0,0,0,0,0,0,0,0,0,0,2
2019,Deep constrained dominant sets for person re-identification,"Alemu L.T., Shah M., Pelillo M.",15505499,Proceedings of the IEEE International Conference on Computer Vision,2019-, ,0,0,0,0,0,0,0,0,0,0,0,0,0,0,0,0,0,0,0,0,0,0,0,0,0,0,0,0,0,0,0,0,0,0,0,0,0,0,0,0,0,0,0,0,0,0,0,0,0,0,0,1,0,1
2019,Pay attention!-Robustifying a deep visuomotor policy through task-focused visual attention,"Abolghasemi P., Mazaheri A., Shah M., Boloni L.",10636919,Proceedings of the IEEE Computer Society Conference on Computer Vision and Pattern Recognition,2019-, ,0,0,0,0,0,0,0,0,0,0,0,0,0,0,0,0,0,0,0,0,0,0,0,0,0,0,0,0,0,0,0,0,0,0,0,0,0,0,0,0,0,0,0,0,0,0,0,0,0,0,0,1,0,1
2019,Holistic object detection and image understanding,"Vaca-Castano G., Lobo N.D., Shah M.",10773142,Computer Vision and Image Understanding,181, ,0,0,0,0,0,0,0,0,0,0,0,0,0,0,0,0,0,0,0,0,0,0,0,0,0,0,0,0,0,0,0,0,0,0,0,0,0,0,0,0,0,0,0,0,0,0,0,0,0,0,0,1,0,1
