," 作者:Stankovic, John A.",,,,,,,,,,,,,,,,,,,,,,,,,,,,,,,,,,,,,,,,,,,,,,,,,,,,,,,,,,,
2007,I/O-aware deadline miss ratio management in real-time embedded databases,"Kang W., Son S.H., Stankovic J.A., Amirijoo M.",10528725,Proceedings - Real-Time Systems Symposium,, ,0,0,0,0,0,0,0,0,0,0,0,0,0,0,0,0,0,0,0,0,0,0,0,0,0,0,0,0,0,0,0,0,0,0,0,0,0,0,0,2,3,0,2,3,0,2,2,4,1,0,4,0,0,23
2007,Robust node localization for wireless sensor networks,"Stoleru R., Stankovic J.A., Son S.H.",,"Proceedings of the 4th Workshop on Embedded Networked Sensors, EmNets 2007",, ,0,0,0,0,0,0,0,0,0,0,0,0,0,0,0,0,0,0,0,0,0,0,0,0,0,0,0,0,0,0,0,0,0,0,0,0,0,0,0,3,8,2,4,1,2,1,1,1,0,0,0,0,0,23
2004,Data dissemination over wireless sensor networks,"Kim S., Son S.H., Stankovic J.A., Choi Y.",10897798,IEEE Communications Letters,8,9,0,0,0,0,0,0,0,0,0,0,0,0,0,0,0,0,0,0,0,0,0,0,0,0,0,0,0,0,0,0,0,0,0,0,0,0,4,3,0,2,1,2,4,3,2,0,1,0,0,1,0,0,0,23
2001,Augmented CPU reservations: Towards predictable execution on general-purpose operating systems,"Regehr J., Stankovic J.A.",10801812,Real-Time Technology and Applications - Proceedings,, ,0,0,0,0,0,0,0,0,0,0,0,0,0,0,0,0,0,0,0,0,0,0,0,0,0,0,0,0,0,0,0,0,0,3,3,3,7,0,0,0,2,1,0,0,1,1,1,0,0,0,0,1,0,23
1996,"Integrating Temporal, Real-Time, and Active Databases","Ramamritham K., Sivasankaran R., Stankovic J.A., Towsley D.T., Xiong M.",1635808,SIGMOD Record (ACM Special Interest Group on Management of Data),25,1,0,0,0,0,0,0,0,0,0,0,0,0,0,0,0,0,0,0,0,0,0,0,0,0,0,0,0,1,1,5,0,2,3,0,2,1,0,0,4,0,0,0,0,0,2,0,0,0,0,0,1,1,0,23
2013,FixtureFinder: Discovering the existence of electrical and water fixtures,"Srinivasan V., Stankovic J., Whitehouse K.",,"IPSN 2013 - Proceedings of the 12th International Conference on Information Processing in Sensor Networks, Part of CPSWeek 2013",, ,0,0,0,0,0,0,0,0,0,0,0,0,0,0,0,0,0,0,0,0,0,0,0,0,0,0,0,0,0,0,0,0,0,0,0,0,0,0,0,0,0,0,0,0,1,7,1,5,3,2,1,1,0,21
2010,Physicalnet: A generic framework for managing and programming across pervasive computing networks,"Vicaire P.A., Xie Z., Hoque E., Stankovic J.A.",10801812,Real-Time Technology and Applications - Proceedings,, ,0,0,0,0,0,0,0,0,0,0,0,0,0,0,0,0,0,0,0,0,0,0,0,0,0,0,0,0,0,0,0,0,0,0,0,0,0,0,0,0,0,1,0,2,1,4,5,3,3,1,0,1,0,21
2007,ANDES: An Analysis-based Design tool for wireless Sensor networks,"Prasad V., Yan T., Jayachandran P., Li Z., Son S.H., Stankovic J.A., Hansson J., Abdelzaher T.",10528725,Proceedings - Real-Time Systems Symposium,, ,0,0,0,0,0,0,0,0,0,0,0,0,0,0,0,0,0,0,0,0,0,0,0,0,0,0,0,0,0,0,0,0,0,0,0,0,0,0,0,0,3,2,3,7,3,1,1,1,0,0,0,0,0,21
2002,MIRROR: A state-conscious concurrency control protocol for replicated real-time databases,"Xiong M., Ramamritham K., Haritsa J.R., Stankovic J.A.",3064379,Information Systems,27,4,0,0,0,0,0,0,0,0,0,0,0,0,0,0,0,0,0,0,0,0,0,0,0,0,0,0,0,0,0,0,0,0,0,0,1,1,1,0,2,2,3,0,1,1,2,1,0,0,0,1,3,2,0,21
2011,WaterSense: Water flow disaggregation using motion sensors,"Srinivasan V., Stankovic J., Whitehouse K.",,"BuildSys 2011 - Proceedings of the 3rd ACM Workshop on Embedded Sensing Systems for Energy-Efficiency in Buildings, Held in Conjunction with ACM SenSys 2011",, ,0,0,0,0,0,0,0,0,0,0,0,0,0,0,0,0,0,0,0,0,0,0,0,0,0,0,0,0,0,0,0,0,0,0,0,0,0,0,0,0,0,0,0,3,3,2,3,3,0,5,0,1,0,20
2004,Efficient TCP connection failover in web server clusters,"Zhang R., Abdelzaher T.F., Stankovic J.A.",0743166X,Proceedings - IEEE INFOCOM,2, ,0,0,0,0,0,0,0,0,0,0,0,0,0,0,0,0,0,0,0,0,0,0,0,0,0,0,0,0,0,0,0,0,0,0,0,0,2,2,0,5,2,0,4,2,1,0,1,0,0,0,0,1,0,20
1999,The spring system: Integrated support for complex real-time systems,"Stankovic J.A., Ramamritham K., Niehaus D., Humphrey M., Wallace G.",9226443,Real-Time Systems,16, 2-3,0,0,0,0,0,0,0,0,0,0,0,0,0,0,0,0,0,0,0,0,0,0,0,0,0,0,0,0,0,0,0,1,3,2,3,2,0,0,1,3,0,3,0,1,0,1,0,0,0,0,0,0,0,20
2015,Toward stable network performance in wireless sensor networks: A multilevel perspective,"Lin S., Zhou G., Al-Hami M., Whitehouse K., Wu Y., Stankovic J.A., He T., Wu X., Liu H.",15504859,ACM Transactions on Sensor Networks,11,3,0,0,0,0,0,0,0,0,0,0,0,0,0,0,0,0,0,0,0,0,0,0,0,0,0,0,0,0,0,0,0,0,0,0,0,0,0,0,0,0,0,0,0,0,0,0,0,4,3,8,3,1,0,19
2014,Dmodel: Online taxicab demand model from big sensor data in a roving sensor network,"Zhang D., He T., Lin S., Munir S., Stankovic J.A.",,"Proceedings - 2014 IEEE International Congress on Big Data, BigData Congress 2014",, ,0,0,0,0,0,0,0,0,0,0,0,0,0,0,0,0,0,0,0,0,0,0,0,0,0,0,0,0,0,0,0,0,0,0,0,0,0,0,0,0,0,0,0,0,0,0,3,5,2,5,3,1,0,19
2012,"Design, implementation, and evaluation of a QoS-aware real-time embedded database","Kang W., Son S.H., Stankovic J.A.",189340,IEEE Transactions on Computers,61,1,0,0,0,0,0,0,0,0,0,0,0,0,0,0,0,0,0,0,0,0,0,0,0,0,0,0,0,0,0,0,0,0,0,0,0,0,0,0,0,0,0,0,0,1,2,1,4,2,5,3,1,0,0,19
2010,Secure walking GPS: A secure localization and key distribution scheme for wireless sensor networks,"Mi Q., Stankovic J.A., Stoleru R.",,WiSec'10 - Proceedings of the 3rd ACM Conference on Wireless Network Security,, ,0,0,0,0,0,0,0,0,0,0,0,0,0,0,0,0,0,0,0,0,0,0,0,0,0,0,0,0,0,0,0,0,0,0,0,0,0,0,0,0,0,0,3,4,2,4,2,0,2,1,0,1,0,19
1986,Using stochastic learning automata for job scheduling in distributed processing systems,"Mirchandaney R., Stankovic J.A.",7437315,Journal of Parallel and Distributed Computing,3,4,0,0,0,0,0,0,0,0,0,0,0,0,0,0,0,0,0,0,0,0,0,0,1,1,5,0,1,2,3,0,0,0,0,0,0,0,0,0,0,0,0,2,0,1,0,0,2,0,1,0,0,0,0,19
2012,Practical and secure localization and key distribution for wireless sensor networks,"Mi Q., Stankovic J.A., Stoleru R.",15708705,Ad Hoc Networks,10,6,0,0,0,0,0,0,0,0,0,0,0,0,0,0,0,0,0,0,0,0,0,0,0,0,0,0,0,0,0,0,0,0,0,0,0,0,0,0,0,0,0,0,0,3,3,1,3,2,2,3,1,0,0,18
2012,Asymmetric event-driven node localization in wireless sensor networks,"Stoleru R., He T., Mathiharan S.S., George S.M., Stankovic J.A.",10459219,IEEE Transactions on Parallel and Distributed Systems,23,4,0,0,0,0,0,0,0,0,0,0,0,0,0,0,0,0,0,0,0,0,0,0,0,0,0,0,0,0,0,0,0,0,0,0,0,0,0,0,0,0,0,0,0,0,1,3,6,1,3,3,1,0,0,18
2009,"Design, implementation, and evaluation of EnviroMic: A storage-centric audio sensor network","Luo L., Cao Q., Huang C., Wang L., Abdelzaher T.F., Stankovic J.A., Ward M.",15504859,ACM Transactions on Sensor Networks,5,3,0,0,0,0,0,0,0,0,0,0,0,0,0,0,0,0,0,0,0,0,0,0,0,0,0,0,0,0,0,0,0,0,0,0,0,0,0,0,0,0,0,6,1,4,1,0,2,0,0,1,2,1,0,18
2014,MultiNets: A system for real-time switching between multiple network interfaces on mobile devices,"Nirjon S., Nicoara A., Hsu C.-H., Singh J.P., Stankovic J.A.",15399087,Transactions on Embedded Computing Systems,13,4,0,0,0,0,0,0,0,0,0,0,0,0,0,0,0,0,0,0,0,0,0,0,0,0,0,0,0,0,0,0,0,0,0,0,0,0,0,0,0,0,0,0,0,0,0,1,1,1,6,3,5,0,0,17
2001,VEST – A toolset for constructing and analyzing component based embedded systems,Stankovic J.A.,3029743,Lecture Notes in Computer Science (including subseries Lecture Notes in Artificial Intelligence and Lecture Notes in Bioinformatics),2211, ,0,0,0,0,0,0,0,0,0,0,0,0,0,0,0,0,0,0,0,0,0,0,0,0,0,0,0,0,0,0,0,0,0,0,1,1,6,2,1,1,1,0,1,0,1,2,0,0,0,0,0,0,0,17
1989,Decentralized Decision Making for Task Reallocation in a Hard Real-Time System,Stankovic J.A.,189340,IEEE Transactions on Computers,38,3,0,0,0,0,0,0,0,0,0,0,0,0,0,0,0,0,0,0,0,0,0,1,1,1,1,2,2,0,2,1,2,0,1,0,1,1,0,1,0,0,0,0,0,0,0,0,0,0,0,0,0,0,0,17
1986,DYNAMIC SCHEDULING OF GROUPS OF TASKS WITH PRECEDENCE CONSTRAINTS IN DISTRIBUTED HARD REAL-TIME SYSTEMS.,"Cheng Shengchang, Stankovic John A., Ramamritham Krithivasan",,,, ,0,0,0,0,0,0,0,0,0,0,0,0,0,0,0,0,0,0,0,0,1,0,1,2,1,0,2,4,1,1,0,0,0,3,0,0,0,0,1,0,0,0,0,0,0,0,0,0,0,0,0,0,0,17
2017,Data-driven distributionally robust vehicle balancing using dynamic region partitions,"Miao F., Han S., Hendawi A.M., Khalefa M.E., Stankovic J.A., Pappas G.J.",,"Proceedings - 2017 ACM/IEEE 8th International Conference on Cyber-Physical Systems, ICCPS 2017 (part of CPS Week)",, ,0,0,0,0,0,0,0,0,0,0,0,0,0,0,0,0,0,0,0,0,0,0,0,0,0,0,0,0,0,0,0,0,0,0,0,0,0,0,0,0,0,0,0,0,0,0,0,0,2,7,5,2,0,16
2014,"Kintense: A robust, accurate, real-time and evolving system for detecting aggressive actions from streaming 3D skeleton data","Nirjon S., Greenwood C., Torres C., Zhou S., Stankovic J.A., Yoon H.J., Ra H.-K., Basaran C., Park T., Son S.H.",,"2014 IEEE International Conference on Pervasive Computing and Communications, PerCom 2014",, ,0,0,0,0,0,0,0,0,0,0,0,0,0,0,0,0,0,0,0,0,0,0,0,0,0,0,0,0,0,0,0,0,0,0,0,0,0,0,0,0,0,0,0,0,0,2,3,4,4,0,3,0,0,16
2011,"Grammar-based, posture- and context-cognitive detection for falls with different activity levels","Li Q., Stankovic J.A.",,"Proceedings - Wireless Health 2011, WH'11",, ,0,0,0,0,0,0,0,0,0,0,0,0,0,0,0,0,0,0,0,0,0,0,0,0,0,0,0,0,0,0,0,0,0,0,0,0,0,0,0,0,0,0,0,1,1,4,1,0,5,0,4,0,0,16
1990,Adaptive load sharing in heterogeneous distributed systems,"Mirchandaney R., Towsley D., Stankovic J.A.",0092640X,Atomic Data and Nuclear Data Tables,9,4,0,0,0,0,0,0,0,0,0,0,0,0,0,0,0,0,0,0,0,0,0,0,0,1,1,0,0,0,0,0,0,1,0,0,0,0,1,0,1,0,1,0,1,2,1,1,2,0,3,0,0,0,0,16
2012,Being SMART about failures: Assessing repairs in smart homes,"Kapitanova K., Hoque E., Stankovic J.A., Whitehouse K., Son S.H.",,UbiComp'12 - Proceedings of the 2012 ACM Conference on Ubiquitous Computing,, ,0,0,0,0,0,0,0,0,0,0,0,0,0,0,0,0,0,0,0,0,0,0,0,0,0,0,0,0,0,0,0,0,0,0,0,0,0,0,0,0,0,0,0,0,0,3,3,2,0,3,3,1,0,15
2012,SEPTIMU - Continuous in-situ human wellness monitoring and feedback using sensors embedded in earphones,"Hong D., Zhang B., Li Q., Nirjon S., Dickerson R., Shen G., Jiang X., Stankovic J.A.",,IPSN'12 - Proceedings of the 11th International Conference on Information Processing in Sensor Networks,, ,0,0,0,0,0,0,0,0,0,0,0,0,0,0,0,0,0,0,0,0,0,0,0,0,0,0,0,0,0,0,0,0,0,0,0,0,0,0,0,0,0,0,0,2,4,2,2,3,0,1,1,0,0,15
2006,SeeMote: In-situ visualization and logging device for wireless sensor networks,"Selavo L., Zhou G., Stankovic J.A.",,"2006 3rd International Conference on Broadband Communications, Networks and Systems, BROADNETS 2006",, ,0,0,0,0,0,0,0,0,0,0,0,0,0,0,0,0,0,0,0,0,0,0,0,0,0,0,0,0,0,0,0,0,0,0,0,0,0,0,3,0,1,5,0,0,0,1,2,3,0,0,0,0,0,15
2006,An overview of data aggregation architecture for real-time tracking with sensor networks,"He T., Gu L., Luo L., Yan T., Stankovic J.A., Son S.H.",,"20th International Parallel and Distributed Processing Symposium, IPDPS 2006",2006, ,0,0,0,0,0,0,0,0,0,0,0,0,0,0,0,0,0,0,0,0,0,0,0,0,0,0,0,0,0,0,0,0,0,0,0,0,0,0,1,0,3,0,1,2,0,1,0,1,3,0,2,1,0,15
1999,The spring scheduling coprocessor: A scheduling accelerator,"Burleson W., Ko J., Niehaus D., Ramamritham K., Stankovic J.A., Wallace G., Weems C.",10638210,IEEE Transactions on Very Large Scale Integration (VLSI) Systems,7,1,0,0,0,0,0,0,0,0,0,0,0,0,0,0,0,0,0,0,0,0,0,0,0,0,0,0,0,0,0,0,0,1,0,0,1,0,0,1,0,1,2,0,1,2,0,3,1,1,1,0,0,0,0,15
2017,Research directions for cyber physical systems in wireless and mobile healthcare,Stankovic J.A.,2378962X,ACM Transactions on Cyber-Physical Systems,1,1,0,0,0,0,0,0,0,0,0,0,0,0,0,0,0,0,0,0,0,0,0,0,0,0,0,0,0,0,0,0,0,0,0,0,0,0,0,0,0,0,0,0,0,0,0,0,0,0,2,6,5,1,0,14
2016,Efficient multichannel communications in wireless sensor networks,"Wu Y., Liu K.S., Stankovic J.A., He T., Lin S.",15504859,ACM Transactions on Sensor Networks,12,1,0,0,0,0,0,0,0,0,0,0,0,0,0,0,0,0,0,0,0,0,0,0,0,0,0,0,0,0,0,0,0,0,0,0,0,0,0,0,0,0,0,0,0,0,0,0,0,0,4,1,9,0,0,14
2015,Online Cruising Mile Reduction in Large-Scale Taxicab Networks,"Zhang D., He T., Lin S., Munir S., Stankovic J.A.",10459219,IEEE Transactions on Parallel and Distributed Systems,26,11,0,0,0,0,0,0,0,0,0,0,0,0,0,0,0,0,0,0,0,0,0,0,0,0,0,0,0,0,0,0,0,0,0,0,0,0,0,0,0,0,0,0,0,0,0,0,0,2,4,1,4,3,0,14
2015,SARRIMA: Smart ADL recognizer and resident identifier in multi-resident accommodations,"Emi I.A., Stankovic J.A.",,"Proceedings - Wireless Health 2015, WH 2015",, ,0,0,0,0,0,0,0,0,0,0,0,0,0,0,0,0,0,0,0,0,0,0,0,0,0,0,0,0,0,0,0,0,0,0,0,0,0,0,0,0,0,0,0,0,0,0,0,2,3,4,4,1,0,14
2015,Taxi Dispatch with Real-Time Sensing Data in Metropolitan Areas - A Receding Horizon Control Approach,"Miao F., Pappas G.J., Lin S., Huang H., Munir S., Stankovic J.A., Zhang D., He T.",,"ACM/IEEE 6th International Conference on Cyber-Physical Systems, ICCPS 2015",, ,0,0,0,0,0,0,0,0,0,0,0,0,0,0,0,0,0,0,0,0,0,0,0,0,0,0,0,0,0,0,0,0,0,0,0,0,0,0,0,0,0,0,0,0,0,0,2,3,4,4,1,0,0,14
2010,ACR: Active collision recovery in dense wireless sensor networks,"Wu Y., Zhou G., Stankovic J.A.",0743166X,Proceedings - IEEE INFOCOM,, ,0,0,0,0,0,0,0,0,0,0,0,0,0,0,0,0,0,0,0,0,0,0,0,0,0,0,0,0,0,0,0,0,0,0,0,0,0,0,0,0,0,1,0,1,1,1,3,3,2,1,1,0,0,14
2007,Feedback control-based dynamic resource management in distributed real-time systems,"He T., Stankovic J.A., Marley M., Lu C., Lu Y., Abdelzaher T., Son S., Tao G.",1641212,Journal of Systems and Software,80,7,0,0,0,0,0,0,0,0,0,0,0,0,0,0,0,0,0,0,0,0,0,0,0,0,0,0,0,0,0,0,0,0,0,0,0,0,0,0,0,0,1,2,2,4,2,0,0,1,1,1,0,0,0,14
2004,Security in wireless sensor networks,Stankovic J.A.,,"Proceedings of the 2004 ACM Workshop on Security of Ad Hoc and Sensor Networks, SASN'04",, ,0,0,0,0,0,0,0,0,0,0,0,0,0,0,0,0,0,0,0,0,0,0,0,0,0,0,0,0,0,0,0,0,0,0,0,0,1,0,0,0,1,1,1,0,2,0,0,3,3,0,2,0,0,14
1993,"Spring scheduling co-processor: Design, use, and performance","Niehaus Douglas, Ramamritham Krithi, Stankovic John A., Wallace Gary, Weems Charles, Burleson Wayne, Ko Jason",,Proceedings - Real-Time Systems Symposium,, ,0,0,0,0,0,0,0,0,0,0,0,0,0,0,0,0,0,0,0,0,0,0,0,0,0,0,0,2,0,1,4,1,2,1,2,0,1,0,0,0,0,0,0,0,0,0,0,0,0,0,0,0,0,14
2012,Kinsight: Localizing and tracking household objects using depth-camera sensors,"Nirjon S., Stankovic J.A.",,"Proceedings - IEEE International Conference on Distributed Computing in Sensor Systems, DCOSS 2012",, ,0,0,0,0,0,0,0,0,0,0,0,0,0,0,0,0,0,0,0,0,0,0,0,0,0,0,0,0,0,0,0,0,0,0,0,0,0,0,0,0,0,0,0,0,1,3,1,2,2,1,3,0,0,13
2012,Energy management in sensor networks,"Stankovic J.A., He T.",1364503X,"Philosophical Transactions of the Royal Society A: Mathematical, Physical and Engineering Sciences",370,1958,0,0,0,0,0,0,0,0,0,0,0,0,0,0,0,0,0,0,0,0,0,0,0,0,0,0,0,0,0,0,0,0,0,0,0,0,0,0,0,0,0,0,0,1,1,0,2,3,1,2,3,0,0,13
2008,"Accurate, fast fall detection using posture and context information","Li Q., Zhou G., Stankovic J.A.",,SenSys'08 - Proceedings of the 6th ACM Conference on Embedded Networked Sensor Systems,, ,0,0,0,0,0,0,0,0,0,0,0,0,0,0,0,0,0,0,0,0,0,0,0,0,0,0,0,0,0,0,0,0,0,0,0,0,0,0,0,0,0,1,1,4,1,0,1,1,2,1,1,0,0,13
2008,On composability of localization protocols for wireless sensor networks,"Stoleru R., Stankovic J.A., Son S.H.",8908044,IEEE Network,22,4,0,0,0,0,0,0,0,0,0,0,0,0,0,0,0,0,0,0,0,0,0,0,0,0,0,0,0,0,0,0,0,0,0,0,0,0,0,0,0,0,2,2,2,1,3,1,1,1,0,0,0,0,0,13
2007,SeeDTV: Deployment-time validation for wireless sensor networks,"Liu H., Selavo L., Stankovic J.",,"Proceedings of the 4th Workshop on Embedded Networked Sensors, EmNets 2007",, ,0,0,0,0,0,0,0,0,0,0,0,0,0,0,0,0,0,0,0,0,0,0,0,0,0,0,0,0,0,0,0,0,0,0,0,0,0,0,1,1,1,3,1,3,0,0,0,2,0,1,0,0,0,13
2006,Poster abstract: AMSecure: Secure link-layer communication in TinyOS for IEEE 802.15.4-based wireless sensor networks,"Wood A.D., Stankovic J.A.",,SenSys'06: Proceedings of the Fourth International Conference on Embedded Networked Sensor Systems,, ,0,0,0,0,0,0,0,0,0,0,0,0,0,0,0,0,0,0,0,0,0,0,0,0,0,0,0,0,0,0,0,0,0,0,0,0,0,0,2,0,2,1,1,2,1,3,0,1,0,0,0,0,0,13
2018,Toward Urban Electric Taxi Systems in Smart Cities: The Battery Swapping Challenge,"Wang Y., Ding W., Huang L., Wei Z., Liu H., Stankovic J.A.",189545,IEEE Transactions on Vehicular Technology,67,3,0,0,0,0,0,0,0,0,0,0,0,0,0,0,0,0,0,0,0,0,0,0,0,0,0,0,0,0,0,0,0,0,0,0,0,0,0,0,0,0,0,0,0,0,0,0,0,0,0,1,7,4,0,12
1998,Dynamic transaction scheduling and reallocation in overloaded real-time database systems,"Hansson J., Son S.H., Stankovic J.A., Andler S.F.",,"Proceedings - 5th International Conference on Real-Time Computing Systems and Applications, RTCSA 1998",1998-, ,0,0,0,0,0,0,0,0,0,0,0,0,0,0,0,0,0,0,0,0,0,0,0,0,0,0,0,0,0,0,2,1,0,0,1,3,1,1,1,0,0,0,0,0,1,0,1,0,0,0,0,0,0,12
2016,Participatory Sensing Meets Opportunistic Sharing: Automatic Phone-to-Phone Communication in Vehicles,"Sun X., Hu S., Su L., Abdelzaher T.F., Hui P., Zheng W., Liu H., Stankovic J.A.",15361233,IEEE Transactions on Mobile Computing,15,10,0,0,0,0,0,0,0,0,0,0,0,0,0,0,0,0,0,0,0,0,0,0,0,0,0,0,0,0,0,0,0,0,0,0,0,0,0,0,0,0,0,0,0,0,0,0,0,1,2,4,3,1,0,11
2015,FailureSense: Detecting sensor failure using electrical appliances in the home,"Munir S., Stankovic J.A.",,"Proceedings - 11th IEEE International Conference on Mobile Ad Hoc and Sensor Systems, MASS 2014",, ,0,0,0,0,0,0,0,0,0,0,0,0,0,0,0,0,0,0,0,0,0,0,0,0,0,0,0,0,0,0,0,0,0,0,0,0,0,0,0,0,0,0,0,0,0,0,0,3,2,3,3,0,0,11
2009,QeDB: A quality-aware embedded real-time database,"Kang W., Son S.H., Stankovic J.A.",15453421,"Proceedings of the IEEE Real-Time and Embedded Technology and Applications Symposium, RTAS",, ,0,0,0,0,0,0,0,0,0,0,0,0,0,0,0,0,0,0,0,0,0,0,0,0,0,0,0,0,0,0,0,0,0,0,0,0,0,0,0,0,0,1,1,4,2,0,0,0,2,1,0,0,0,11
2008,SenQ: An embedded query system for streaming data in heterogeneous interactive wireless sensor networks,"Wood A.D., Selavo L., Stankovic J.A.",3029743,Lecture Notes in Computer Science (including subseries Lecture Notes in Artificial Intelligence and Lecture Notes in Bioinformatics),5067, ,0,0,0,0,0,0,0,0,0,0,0,0,0,0,0,0,0,0,0,0,0,0,0,0,0,0,0,0,0,0,0,0,0,0,0,0,0,0,0,0,0,1,2,3,0,2,1,0,1,1,0,0,0,11
1998,Architecture and object model for distributed object-oriented real-time databases,"Stankovic J.A., Son S.H.",,"Proceedings - 1st International Symposium on Object-Oriented Real-Time Distributed Computing, ISORC 1998",1998-, ,0,0,0,0,0,0,0,0,0,0,0,0,0,0,0,0,0,0,0,0,0,0,0,0,0,0,0,0,0,0,0,1,0,1,1,1,0,0,0,0,1,0,2,1,1,1,0,1,0,0,0,0,0,11
1995,Real-time system description language,"Niehaus Douglas, Stankovic John A., Ramamritham Krithi",10801812,Real-Time Technology and Applications - Proceedings,, ,0,0,0,0,0,0,0,0,0,0,0,0,0,0,0,0,0,0,0,0,0,0,0,0,0,0,0,0,1,1,3,0,3,1,1,1,0,0,0,0,0,0,0,0,0,0,0,0,0,0,0,0,0,11
1993,Spring scheduling co-processor: A scheduling accelerator,"Burleson Wayne, Ko Jason, Niehaus Douglas, Ramamritham Krithi, Stankovic John A., Wallace Gary, Weems Charles",,Proceedings - IEEE International Conference on Computer Design: VLSI in Computers and Processors,, ,0,0,0,0,0,0,0,0,0,0,0,0,0,0,0,0,0,0,0,0,0,0,0,0,0,0,1,1,1,0,1,0,0,0,1,0,1,1,0,0,0,0,0,1,1,1,0,0,0,1,0,0,0,11
1981,The Types and Interactions of Vertical Migrations of Functions in a Multilevel Interpretive System,Stankovic J.A.,189340,IEEE Transactions on Computers,C-30,7,0,0,0,0,0,0,0,0,0,0,0,0,3,0,0,2,1,0,2,0,0,0,2,0,1,0,0,0,0,0,0,0,0,0,0,0,0,0,0,0,0,0,0,0,0,0,0,0,0,0,0,0,0,11
2017,Preclude: Conflict detection in textual health advice,"Preum S.M., Mondol A.S., Ma M., Wang H., Stankovic J.A.",,"2017 IEEE International Conference on Pervasive Computing and Communications, PerCom 2017",, ,0,0,0,0,0,0,0,0,0,0,0,0,0,0,0,0,0,0,0,0,0,0,0,0,0,0,0,0,0,0,0,0,0,0,0,0,0,0,0,0,0,0,0,0,0,0,0,0,5,1,3,1,0,10
2017,CityGuard: A watchdog for safety-aware conflict detection in smart cities,"Ma M., Preum S.M., Stankovic J.A.",,"Proceedings - 2017 IEEE/ACM 2nd International Conference on Internet-of-Things Design and Implementation, IoTDI 2017 (part of CPS Week)",, ,0,0,0,0,0,0,0,0,0,0,0,0,0,0,0,0,0,0,0,0,0,0,0,0,0,0,0,0,0,0,0,0,0,0,0,0,0,0,0,0,0,0,0,0,0,0,0,0,3,1,5,1,0,10
2016,AsthmaGuide: An asthma monitoring and advice ecosystem,"Ra H.-K., Salekin A., Yoon H.J., Kim J., Nirjon S., Stone D.J., Kim S., Lee J.-M., Son S.H., Stankovic J.A.",,"2016 IEEE Wireless Health, WH 2016",, ,0,0,0,0,0,0,0,0,0,0,0,0,0,0,0,0,0,0,0,0,0,0,0,0,0,0,0,0,0,0,0,0,0,0,0,0,0,0,0,0,0,0,0,0,0,0,0,1,0,5,4,0,0,10
2002,STAR: Secure real-time transaction processing with timeliness guarantees,"Kang K.-D., Son S.H., Stankovic J.A.",,Proceedings - Real-Time Systems Symposium,, ,0,0,0,0,0,0,0,0,0,0,0,0,0,0,0,0,0,0,0,0,0,0,0,0,0,0,0,0,0,0,0,0,0,0,0,0,1,1,0,1,1,1,0,0,0,0,0,2,0,1,2,0,0,10
2010,Ḿlange: Supporting heterogeneous QoS requirements in delay tolerant sensor networks,"Liu H., Srinivasan A., Whitehouse K., Stankovic J.A.",,INSS 2010 - 7th International Conference on Networked Sensing Systems,, ,0,0,0,0,0,0,0,0,0,0,0,0,0,0,0,0,0,0,0,0,0,0,0,0,0,0,0,0,0,0,0,0,0,0,0,0,0,0,0,0,0,0,0,0,1,2,1,2,2,1,0,0,0,9
2003,Kernel support for open QoS-aware computing,"Zhang R., Abdelzaher T.F., Stankovic J.A.",10801812,Real-Time Technology and Applications - Proceedings,, ,0,0,0,0,0,0,0,0,0,0,0,0,0,0,0,0,0,0,0,0,0,0,0,0,0,0,0,0,0,0,0,0,0,0,1,2,0,3,1,0,0,0,0,0,1,1,0,0,0,0,0,0,0,9
2017,Smart personalized routing for smart cities,"Hendawi A.M., Rustum A., Ahmadain A.A., Hazel D., Teredesai A., Oliver D., Ali M., Stankovic J.A.",10844627,Proceedings - International Conference on Data Engineering,, ,0,0,0,0,0,0,0,0,0,0,0,0,0,0,0,0,0,0,0,0,0,0,0,0,0,0,0,0,0,0,0,0,0,0,0,0,0,0,0,0,0,0,0,0,0,0,0,0,2,0,5,1,0,8
2013,Improving the dependability of sensornets,"Fairbairn M.L., Bate I., Stankovic J.A.",,"Proceedings - IEEE International Conference on Distributed Computing in Sensor Systems, DCoSS 2013",, ,0,0,0,0,0,0,0,0,0,0,0,0,0,0,0,0,0,0,0,0,0,0,0,0,0,0,0,0,0,0,0,0,0,0,0,0,0,0,0,0,0,0,0,0,0,0,3,1,1,2,1,0,0,8
2011,Efficient and reliable breadcrumb systems via coordination among multiple first responders,"Liu H., Xie Z., Li J., Whitehouse K., Stankovic J., Lin S., Siu D.",,"IEEE International Symposium on Personal, Indoor and Mobile Radio Communications, PIMRC",, ,0,0,0,0,0,0,0,0,0,0,0,0,0,0,0,0,0,0,0,0,0,0,0,0,0,0,0,0,0,0,0,0,0,0,0,0,0,0,0,0,0,0,0,1,0,2,0,1,1,1,2,0,0,8
2010,Bundle: A group based programming abstraction for cyber physical systems,"Vicaire P.A., Hoque E., Xie Z., Stankovic J.A.",,"Proceedings of the 1st ACM/IEEE International Conference on Cyber-Physical Systems, ICCPS '10",, ,0,0,0,0,0,0,0,0,0,0,0,0,0,0,0,0,0,0,0,0,0,0,0,0,0,0,0,0,0,0,0,0,0,0,0,0,0,0,0,0,0,0,1,1,0,3,0,1,2,0,0,0,0,8
2005,Design and comparison of lightweight group management strategies in EnviroSuite,"Luo L., Abdelzaher T., He T., Stankovic J.A.",3029743,Lecture Notes in Computer Science,3560, ,0,0,0,0,0,0,0,0,0,0,0,0,0,0,0,0,0,0,0,0,0,0,0,0,0,0,0,0,0,0,0,0,0,0,0,0,2,0,0,0,1,1,0,0,3,0,1,0,0,0,0,0,0,8
1998,Streaming CBR transmission of VBR stored video,"Sen S., Dey J.K., Kurose J.F., Stankovic J.A., Towsley D.",0277786X,Proceedings of SPIE - The International Society for Optical Engineering,3228, ,0,0,0,0,0,0,0,0,0,0,0,0,0,0,0,0,0,0,0,0,0,0,0,0,0,0,0,0,0,1,0,0,1,1,0,0,1,0,0,0,0,1,0,1,0,0,1,0,0,0,1,0,0,8
1992,Bounds on the performance of heuristic algorithms for multiprocessor scheduling of hard real-time tasks,"Wang F., Ramamritham K., Stankovic J.A.",10528725,Proceedings - Real-Time Systems Symposium,, ,0,0,0,0,0,0,0,0,0,0,0,0,0,0,0,0,0,0,0,0,0,0,0,0,0,0,0,1,0,0,1,0,0,1,1,0,0,0,0,0,0,0,1,0,0,0,2,1,0,0,0,0,0,8
1982,Software Communication Mechanisms: Procedure Calls Versus Messages,Stankovic J.A.,189162,Computer,15,4,0,0,0,0,0,0,0,0,0,0,0,0,0,0,0,2,1,0,1,1,2,0,0,1,0,0,0,0,0,0,0,0,0,0,0,0,0,0,0,0,0,0,0,0,0,0,0,0,0,0,0,0,0,8
2016,Hobbits: Hadoop and Hive based Internet traffic analysis,"Hendawi A.M., Alali F., Wang X., Guan Y., Zhou T., Liu X., Basit N., Stankovic J.A.",,"Proceedings - 2016 IEEE International Conference on Big Data, Big Data 2016",, ,0,0,0,0,0,0,0,0,0,0,0,0,0,0,0,0,0,0,0,0,0,0,0,0,0,0,0,0,0,0,0,0,0,0,0,0,0,0,0,0,0,0,0,0,0,0,0,0,1,3,3,0,0,7
2014,"An automatic, robust, and efficient multi-user breadcrumb systemfor emergency response applications","Liu H., Xie Z., Li J., Lin S., Siu D.J., Hui P., Whitehouse K., Stankovic J.A.",15361233,IEEE Transactions on Mobile Computing,13,4,0,0,0,0,0,0,0,0,0,0,0,0,0,0,0,0,0,0,0,0,0,0,0,0,0,0,0,0,0,0,0,0,0,0,0,0,0,0,0,0,0,0,0,0,0,1,1,2,0,1,1,1,0,7
2013,Multi-modal in-person interaction monitoring using smartphone and on-body sensors,"Li Q., Chen S., Stankovic J.A.",,"2013 IEEE International Conference on Body Sensor Networks, BSN 2013",, ,0,0,0,0,0,0,0,0,0,0,0,0,0,0,0,0,0,0,0,0,0,0,0,0,0,0,0,0,0,0,0,0,0,0,0,0,0,0,0,0,0,0,0,0,0,2,4,1,0,0,0,0,0,7
2010,Roundtable: Reliability of embedded and cyber-physical systems,"Barnum S., Sastry S., Stankovic J.A.",15407993,IEEE Security and Privacy,8,5,0,0,0,0,0,0,0,0,0,0,0,0,0,0,0,0,0,0,0,0,0,0,0,0,0,0,0,0,0,0,0,0,0,0,0,0,0,0,0,0,0,0,0,0,1,0,0,1,2,1,1,1,0,7
2010,Monitoring quantity and quality of sleeping using WISPs,"Hoque E., Stankovic J.A.",,"Proceedings of the 9th ACM/IEEE International Conference on Information Processing in Sensor Networks, IPSN '10",, ,0,0,0,0,0,0,0,0,0,0,0,0,0,0,0,0,0,0,0,0,0,0,0,0,0,0,0,0,0,0,0,0,0,0,0,0,0,0,0,0,0,0,0,1,0,1,2,1,1,1,0,0,0,7
2008,Essentia: Architecting wireless sensor networks asymmetrically,"He T., Stankovic J.A., Stoleru R., Gu Y., Wu Y.",0743166X,Proceedings - IEEE INFOCOM,, ,0,0,0,0,0,0,0,0,0,0,0,0,0,0,0,0,0,0,0,0,0,0,0,0,0,0,0,0,0,0,0,0,0,0,0,0,0,0,0,0,0,4,0,1,0,2,0,0,0,0,0,0,0,7
2008,An in-field-maintenance framework for wireless sensor networks,"Cao Q., Stankovic J.A.",3029743,Lecture Notes in Computer Science (including subseries Lecture Notes in Artificial Intelligence and Lecture Notes in Bioinformatics),5067, ,0,0,0,0,0,0,0,0,0,0,0,0,0,0,0,0,0,0,0,0,0,0,0,0,0,0,0,0,0,0,0,0,0,0,0,0,0,0,0,1,0,1,0,1,1,0,1,2,0,0,0,0,0,7
2007,Wireless sensor networks,Stankovic J.A.,,Handbook of Real-Time and Embedded Systems,, ,0,0,0,0,0,0,0,0,0,0,0,0,0,0,0,0,0,0,0,0,0,0,0,0,0,0,0,0,0,0,0,0,0,0,0,0,0,0,0,1,1,0,2,1,1,0,0,0,0,0,1,0,0,7
2004,Maintaining data freshness in distributed real-time databases,"Wei Y., Son S.H., Stankovic J.A.",10683070,Proceedings - Euromicro Conference on Real-Time Systems,16, ,0,0,0,0,0,0,0,0,0,0,0,0,0,0,0,0,0,0,0,0,0,0,0,0,0,0,0,0,0,0,0,0,0,0,0,0,0,1,0,1,1,0,0,0,0,0,1,0,0,2,0,1,0,7
2002,Achieving bounded and predictable recovery using real-time logging,"Shu L.C., Stankovic J.A., Son S.H.",10801812,Real-Time Technology and Applications - Proceedings,, ,0,0,0,0,0,0,0,0,0,0,0,0,0,0,0,0,0,0,0,0,0,0,0,0,0,0,0,0,0,0,0,0,0,0,1,0,2,1,1,1,1,0,0,0,0,0,0,0,0,0,0,0,0,7
